,content,,,,,,,,,,,,,
1235,판타지 공포~ 생각보가 꽤 볼만함. 아이들 마다 서로 보이는 게 다른 공포의 연출이 볼만했다. 근데 잠자는 공주는 뚱땡이가 키스로 깨우고.. 결국 나중엔 주인공 에게로~ ㅠ.ㅠ,,,,,,,,,,,,,
1236,구니스,,,,,,,,,,,,,
1237,감각적인 영상미와 낮에 공포를 주려는 시도는 좋았지만 영화가 진행될수록 초반의 긴장이 사그라져 가며 지겨움마저 느꼈습니다.,,,,,,,,,,,,,
1238,여자가 감수성이 풍부하다는건 이론일뿐이네~ 뚱땡이 불썅~ㅠㅠ,,,,,,,,,,,,,
1239,이게 무슨 공포영화인지 아니면 어린이 성장 드라마인지 헷갈린다 ㅎㅎ,,,,,,,,,,,,,
1240,이런 폐급 영화는 몇년만에 처음 보는거 같음,,,,,,,,,,,,,
1241,광대는 조원석 닮았고 뚱땡이는 트럼프 닮았고 안경은 설국열차 여자 닮았다.,,,,,,,,,,,,,
1242,옛날 tv시리즈처럼 조잡한 느낌의 정수를 잘 살려낸 리메이크작. 어른들이 망쳐놓는 어린시절을 함께 보낸 친구들이 있지않은가,,,,,,,,,,,,,
1243,맙소사 대박 오랜만에 보는 명작 공포영화. ㅎㄷㄷ 하다.,,,,,,,,,,,,,
1244,어린배우들이 연기가 아닌 진짜로 무서워하는걸 느꼈음 이거찍기전에 정신병걸려도 소송하지말라는 각서받아냈을듯,,,,,,,,,,,,,
1245,혼자가 아닌 우리를 통해 각자의 트라우마를 극복하는 공포영화를 가장한 성장영화~개인적으로 2가 기대되는 영화,,,,,,,,,,,,,
1246,중독성있어...욥!,,,,,,,,,,,,,
1247,개인적으로 다른 어떤 호러보다도 수준이 높다고 생각한다. 각각의 호러 장치들은 과거 방식이라 관객들의 호러 면역 수준이 올라가서 유치하게 보일 수 있다. 그러나 스티븐 킹의 탄탄한 스토리가 영화를 더욱더 몰입하게 만...,,,,,,,,,,,,,
1248,이영화는 아이들이 보면 무섭고 재밌게 보겟네요..,,,,,,,,,,,,,
1249,보지마세요...보다나왔어요,,,,,,,,,,,,,
1250,초등학생용 영화... 개연성 부족함.,,,,,,,,,,,,,
1251,눈을 찌푸렷다진짜ㅡㅡ,,,,,,,,,,,,,
1252,2부가 2019년에 개봉한다구 ㅠㅠ,,,,,,,,,,,,,
1253,너무 어수선하다 기대가 너무컸다 몰입이 잘안됨,,,,,,,,,,,,,
1254,도저히 이해가 안되는 영화..,,,,,,,,,,,,,
1255,흠...파워 레이저?,,,,,,,,,,,,,
1256,시간 아까웠다.. 이렇게 유치할 수가,,,,,,,,,,,,,
1257,현대판 구니스를 본느낌 ..공포를바라고 본다면 별로겟지만 스토리나 전체적인 구성은 개인적으로는 괜찮았음 2편기대합니다.,,,,,,,,,,,,,
1258,아주재밌게본영화  무섭기도하고 청소년모험영화같기도함,,,,,,,,,,,,,
1259,다구리에 장사없다....,,,,,,,,,,,,,
1260,발암영화 삐에로아자씨 귀여워서 2점 주겠음,,,,,,,,,,,,,
1261,공포영화 맞냐? 그냥 코미디 영화 아니냐?,,,,,,,,,,,,,
1262,애나벨,,,,,,,,,,,,,
1263,이게 어디가 재밌다고 평점이 이렇게나 후한거야? 겁나 유치하다. 아동용 영화!,,,,,,,,,,,,,
1264,여러분 이거 공포물이 아니라 코믹물이네요~삐에로 나올때마다 빵터졌어요특히 부러진 팔 맞출때 ㅋㅋㅋㅋ,,,,,,,,,,,,,
1265,사탄의 인형같아요. 놀래키는 영화입니다.,,,,,,,,,,,,,
1266,어린이용 공포영화였네~ 지루하고 유치하고 기대이하네요~,,,,,,,,,,,,,
1267,세상에 다구리에 장사없다.,,,,,,,,,,,,,
1268,동생이 살았다면 7점줄생각이였음..  첫장면에 어린동생팔 잘라먹은거 진짜 개짜증  영화는 갈수록 뭘 이야기하고싶은건지? 친구들끼리뭉치면 강해진다?이거임? 알수없네진짜,,,,,,,,,,,,,
1269,페니 와이즈의 행동과 모습이 강렬,,,,,,,,,,,,,
1270,나름 괜찮았던것 같네여,,,,,,,,,,,,,
1271,깜놀해서 심장 쫄렷어요,,,,,,,,,,,,,
1272,ㅋㅋㅋ박평식님 평점댓글 개웃겨 ㅋㅋㅋ 그냥둬도 잘 큰댘ㅋㅋㅋ,,,,,,,,,,,,,
1273,잠자는숲속의공주도아니고 키스하니까 바로 깨는장면은 웃기긴했는데 광대가 다굴당할때 야씨갈겨 더쳐!!이러면서 봤다ㅋㅋㅋㅋ광대공포증 극복이네ㅋㅋ공포로만생각하면 별로고 성장영화로는 좋았닼ㅋ꿀잼이네ㅋㅋ,,,,,,,,,,,,,
1274,그것 ...사라진 아이들은 찾았지만 동생은 너무 안타까웠어요.. 스릴있고 슬펐던 영화!,,,,,,,,,,,,,
1275,근래 봤던 공포물중 아주 괜찮은 작품.아이들의 시선과 감성.우리가 어릴적 느꼇었던 공포심을 다시한번 느끼게해줬다. 엔딩크레딧이 올라갈때집에서 박수를 쳤다.,,,,,,,,,,,,,
1276,하 진짜 이빨로 물어뜯는 장면부터 아 실패다 하고 생각했다.,,,,,,,,,,,,,
1277,엄청 재밌음 ㅠ 왜 평이 낮지..?,,,,,,,,,,,,,
1278,처음보는 공포영화인데나쁘지 않았습니다,,,,,,,,,,,,,
1279,볼만했어요 완전 기대할만한 것은 아니에요,,,,,,,,,,,,,
1280,재밌쪄요!! 페니와이즈가 넘 조와요~ 이런 크리쳐물 많이 내줬으면!,,,,,,,,,,,,,
1281,걍 말이필요없다 개꿀잼,,,,,,,,,,,,,
1282,1개도 아깝습니다. 진심입니다.!!!!ㄹㅇ,,,,,,,,,,,,,
1283,재밌는 영화..무서운것이라기보다...ㅋㅋㅋ,,,,,,,,,,,,,
1284,진짜 노잼이고 뛰쳐나가고시픔 돈아까움 뭐가몬지 모르겠음,,,,,,,,,,,,,
1285,공포 영화답데 깜짝 놀라고 무섭고 또 한 두번 나온게 아니라 주기적으로 나와서 괜찮았는데 왜 어린이들로 해놨는지...보다보다 정말 몰입이 안 됨. 초딩같은 애들이 나와서 모험 헤쳐나가는데 마지막에 왜 내가 이런 애시...,,,,,,,,,,,,,
1286,그냥 보통....ㅠㅠㅠㅠ 기대한거 치고 별로였어요,,,,,,,,,,,,,
1287,결제도 바로바로 되고 만족함니다^^,,,,,,,,,,,,,
1288,별로 무섭지는 않았어요 ㅋㅋ,,,,,,,,,,,,,
1289,내용이나 그런거 충분하고 공포로서는 좀 부족한건 맞지만 재미없지는않았음 재미없다고하는인간들은 무조건 잔인하게 죽여야 재밌어하는 인간들임,,,,,,,,,,,,,
1290,졸 무섭다ㅜ3ㅜ 울어뚬....,,,,,,,,,,,,,
1291,요새 본 공포영화중 최고였네요!,,,,,,,,,,,,,
1292,전작 TV판과는 또 다르네영,,,,,,,,,,,,,
1293,아이들이 광대에게 차근차근 무서움과 두려움을 극복해 나가는 그런 영화 너무 좋습니다.마지막엔 어른들이 아이들을 외면한다는것에 좀 많이 그렀네요..ㅠㅠ 아이들도 넘 멋있어요~,,,,,,,,,,,,,
1294,아이들이 광대에게 차근차근 무서움과 두려움을 극복해 나가는 그런 영화 너무 좋습니다.마지막엔 어른들이 아이들을 외면한다는것에 좀 많이 그렀네요..ㅠㅠ 아이들도 넘 멋있어요~,,,,,,,,,,,,,
1295,긴장하며 봤는데 재밌엇어요!,,,,,,,,,,,,,
1296,스토리에 비해서 러닝타임 너무 길게 느껴지고 뜬금없는 러브스토리는 덤인가,,,,,,,,,,,,,
1297,좋아요 너무너무 좋아요,,,,,,,,,,,,,
1298,완전 완전 재미나요 진짜 완전,,,,,,,,,,,,,
1299,조용한 동네에 빨간색이 등장하면 왜인지 이질적인 느낌이 많이 들어서 영상적으로 신기한 느낌이 많이 들었어요! 그것때문에 놀래는것보다 다른 것들이 많이 놀래켜서 방심할 수가 없었던 영화!! 남자친구랑 함께 봤는데 놀라...,,,,,,,,,,,,,
1300,완전 무서움 딸랑구가 보자구해서 봤다가 헉ㅡ,,,,,,,,,,,,,
1301,완전완전 꿀잼!!!!,,,,,,,,,,,,,
1302,너무 많은 내용을 한 편에 풀어내려고 한 느낌이 듦,,,,,,,,,,,,,
1303,최고 반전 꿀잼이었던 영화,,,,,,,,,,,,,
1304,흥미진진하고 재밌었어요~!,,,,,,,,,,,,,
1305,재밌습니다 재미재미쟈미쟈미,,,,,,,,,,,,,
1306,너무 빨리 종료해서 아쉽네요,,,,,,,,,,,,,
1307,재밌게 봤습니다.^^,,,,,,,,,,,,,
1308,공포와 드라마요소가 섞임,,,,,,,,,,,,,
1309,매순간 스릴이 있고,,,,,,,,,,,,,
1310,공포영화라기보다 성장영화인듯,,,,,,,,,,,,,
1311,성장 영화같은 공포영화!,,,,,,,,,,,,,
1312,영화관에서 심장멎을뻔 기괴한연출도 좋았고 내용도 굿 다만좀 인물의 뒷배경이나 그런게 안나오고 진행되서 조금 아이러니 하기도했지만 개무섭 ㄷㄷ 당분간 광대사진음 쳐다도못볼듯..,,,,,,,,,,,,,
1313,기대이상 무서웟어요..,,,,,,,,,,,,,
1314,볼만한것인가. ㅡ.ㅡ;;,,,,,,,,,,,,,
1315,재밋다ㅈ옹망정망정낭정ㅁ,,,,,,,,,,,,,
1316,깔끔한 무서움이었다. 무서운거 잘보는데 다른공포 영화랑 다르게 많이 놀랐다.,,,,,,,,,,,,,
1317,진짜환상적인 영화입니다,,,,,,,,,,,,,
1318,생각햇던것보다좋아서놀랏당ㅋ,,,,,,,,,,,,,
1319,너무평밤했어요....,,,,,,,,,,,,,
1320,좋은영화  성공적인 원작재연,,,,,,,,,,,,,
1321,너무 재밌었습니다! 또 보러 갈까해요ㅋㅋ,,,,,,,,,,,,,
1322,이동휘가 귀여워서 10점,,,,,,,,,,,,,
1323,재밌었어요ㅎㅎㅎ놀랐어요,,,,,,,,,,,,,
1324,볼만 했습니다. 다음 편이 기대 되네요.,,,,,,,,,,,,,
1325,재밌써용 그리고 남주 잘샘김,,,,,,,,,,,,,
1326,무서워....ㅠㅠㅠ,,,,,,,,,,,,,
1327,본 영화중 최고의 공포영화,,,,,,,,,,,,,
1328,정말 올해에 본 공포 영화 중에 가장  맘에 들었당잔인하구 소름끼치고 갑툭튀 많아서 아주아주 죻았당 ㅋㅅㅋ한번 더 보고 싶당,,,,,,,,,,,,,
1329,종조오조오조오노노노농,,,,,,,,,,,,,
1330,도아뇨료룔횰ㄹ내냐야어,,,,,,,,,,,,,
1331,뭔가 삐에로 살인자가 아니라 삐에로 괴물 같은 느낌,,,,,,,,,,,,,
1332,기대했던것 보다 작품이 잘 나와서 재미있음.,,,,,,,,,,,,,
1333,공포감을 느끼기엔 너무 교훈적이며 청소년용,,,,,,,,,,,,,
1334,오랜만ㅇ 공포영화 무서웟음,,,,,,,,,,,,,
1335,생각보다별로안무섭고내용이업따,,,,,,,,,,,,,
1336,너무 기대를 했는지 그저그래요~~,,,,,,,,,,,,,
1337,뒤로갈수록 얘기가 진부해지고 이상한 흐름을 탐,,,,,,,,,,,,,
1338,유치하고유치하고또유치하고~,,,,,,,,,,,,,
1339,기대가 커서 덜 무서운 영화. 예고편을 너무 봤네,,,,,,,,,,,,,
1340,시작부분이 가장 좋았음. 중반이후로는 전형적인 스토리로 끝나서 아쉬움,,,,,,,,,,,,,
1341,제발 쉽게쉽게 영화만 보려하지 말고 책도 좀 읽고 그래요 님들아...,,,,,,,,,,,,,
1342,팬티 여러장 챙겨갔는데 모자랐네요 쉴타임도 없이 무섭습니다 15세길래 좀 무시하고 보러 간것도 있었는데 거의 귀막고 봤네요 추천추천!!!!,,,,,,,,,,,,,
1343,명작... 성장 드라마 한편 본 기분입니다,,,,,,,,,,,,,
1344,완전 재밌어용~~~~,,,,,,,,,,,,,
1345,꿀꿍꾸루루루루꾸루잼,,,,,,,,,,,,,
1346,재밌는데 ???? 혼자 움찔움찔거리면서 봤다 재밌다,,,,,,,,,,,,,
1347,미친 거 같아요 처음에 배급사 로고 뜰때부터 아 샹....!!! 싶은 생각 들었호 진짜 그때부터 후회되더라고요 처음부터 끝까지 강펀치로 때리는 기분 아 진짜,,,,,,,,,,,,,
1348,꿀잼!!! 허허허허ㅓ,,,,,,,,,,,,,
1349,스릴 있고  끝에 긴가민가 했음 잼었음,,,,,,,,,,,,,
1350,유치하기도하고 무섭기도하고 웃기기도 하고 킬링타임영화,,,,,,,,,,,,,
1351,무서웠어요.ㅠㅠㅠ 흑흑 .,,,,,,,,,,,,,
1352,어렸을땐 어리다고 생각 안하듯이,,,,,,,,,,,,,
1353,최근 공포영화중 제일 재밌었고,,,,,,,,,,,,,
1354,보다보니 옛날에 학교괴담이라는 애니에서의 한 애피소드가 생각남..것도애들에게만 나타나는 귀신이었는데..끝으로 갈수록 원작소설이 궁금해지더라..판타지영화 같은 충격적 전개를믿을수가 없어서..애기들 귀엽고 다 매력 있어...,,,,,,,,,,,,,
1355,별로 무섭눼요....,,,,,,,,,,,,,
1356,공포보단 성장영화입니당,,,,,,,,,,,,,
1357,이 영화는  단순한 공포영화가 아닌 아이들의 성장드라마...그나저나 짧게나마 미국사람들중 왜 광대공포증을 가지고 잇는지 이해하엿음,,,,,,,,,,,,,
1358,광대가 더 무서워 졌다.,,,,,,,,,,,,,
1359,삐에로는커녕 당분간 풍선도 못 쳐다보겠다,,,,,,,,,,,,,
1360,오우.. 솔직히 삐에로 나올때마다 긴장했다,,,,,,,,,,,,,
1361,재밌게 잘봤음 무섭기도 하고. 근데 영화보는 내내 베벌리 진짜 이쁘다고 생각했음ㅋㅋㅋㅋ아니 너무 예뻤다 베벌리,,,,,,,,,,,,,
1362,무서웠고 소름이 쫙 끼쳤음 ㅠㅠㅠㅠ진짜 대박임 나는 개인적으로 어릴적 내 모습같아서 공감갔음,,,,,,,,,,,,,
1363,섬뜩하게 무섭다기 보다는 잔인하게 무섭다 비주얼쇼크랄까,,,,,,,,,,,,,
1364,그냥 보통이였다 많이 무섭지는 않았다,,,,,,,,,,,,,
1365,무서워요ㅠ기대햇는데 기대이상이에요,,,,,,,,,,,,,
1366,재미있었어요~~~~,,,,,,,,,,,,,
1367,재미있어요페니와이즈가 참 인상깊네요,,,,,,,,,,,,,
1368,레전드 영화다!!!! 너무 잘 만들어서 소름!!! 모든게 적당해서 너무 좋다 ㅠㅠ 결론은 남자애 잘생겼고 적당히 백프로 꿀잼~~~,,,,,,,,,,,,,
1369,너무 잘만들어서 욕나오는 영화,,,,,,,,,,,,,
1370,성장 영화 느끼이네요~~~,,,,,,,,,,,,,
1371,난 재밌든데...하하하..,,,,,,,,,,,,,
1372,기대했던것보다는 많이 childish 했어요,,,,,,,,,,,,,
1373,완전 내 스타일 공포영화 웃기도하다가 순간 공포스러워지는.. 꿈에나올거같다 재밌다 귀엽다 무섭다 따뜻하다,,,,,,,,,,,,,
1374,이영화는 서양 문화에 익숙치못한 동양인이 보기엔 소제자체가 독특합니다. 영화를 보면서 동양 호러에선 없는 종류의 괴기스런 영상이구나 라고 머리로는 생각되지만 실제 공포를 느끼진 않은게 한국엔 클라운이 없으니 광대공포...,,,,,,,,,,,,,
1375,재밋엇어요  나름 가서볼만합니당,,,,,,,,,,,,,
1376,ㄷ  공포의 삐에로 ㅜ .ㅠ  진짜 무섭고 기괴하고,,,,,,,,,,,,,
1377,영화와 관객이 함께 성장하는 독특한 공포물,,,,,,,,,,,,,
1378,생각보다아쉬운.. 먼가아쉬웠다 ㅠ,,,,,,,,,,,,,
1379,You'll float too,,,,,,,,,,,,,
1380,무서워서 화장실도 못갈정도로 소름돋는 영화,,,,,,,,,,,,,
1381,오랜만에 보는 공포영화그냥 볼만했어용,,,,,,,,,,,,,
1382,단순 1편으론 아쉬움 시리즈가 더나와봐야할듯,,,,,,,,,,,,,
1383,완전 재밌었어요~~!,,,,,,,,,,,,,
1384,놀라는장면은 많았으나 생각보다 무섭지 않았다,,,,,,,,,,,,,
1385,첨엔 좀 쫄면서 봤는데.. 뒤로 갈수록 피식 피식; 뭔가 병맛..  영화관에서 봤는데.. 첨엔 조용하더니..뒤로갈수록 웃고 처먹고 -_-;  그래도 꿋꿋하게 뒤에서 소리 빽뺵 지르는 여자분.. 정말 더 무서웠음,,,,,,,,,,,,,
1386,아직도 페니와이즈의 웃음소리가 잊혀지질 않는다.,,,,,,,,,,,,,
1387,19금영화지만 갑툭튀지 그닥  무서운 영화는 아님 배경이 서양이고 국내는 삐에로가 흔하지 않아서 그런가,,,,,,,,,,,,,
1388,신선했다 . 그냥 광대인줄로만 알았던 그것.여친과 재밌게봤다 . 굳,,,,,,,,,,,,,
1389,원작을 안봐서 그런가? 아님 연출이 그런건가? 영화가 매끄럽지 못함. 여기저기가 비어있는 느낌이랄까? 2에서는 좀 가다듬어서 만들었으면 좋겠다.,,,,,,,,,,,,,
1390,너무 무서워서 제대로 보지 못했어요...아숩지만 그런대로 재미나게 봤어요,,,,,,,,,,,,,
1391,무서움과 진부함의 생소한 시퀀스,,,,,,,,,,,,,
1392,아무 생각 없이 보면 되는 영화,,,,,,,,,,,,,
1393,초중반 무섭게 잘가다가 갑자기 꼬마 니콜라의 여름방학됨,,,,,,,,,,,,,
1394,무섭고재밌습니다!!,,,,,,,,,,,,,
1395,전래동화 보듯 귀엽게 본 영화네요! 좀 오글오글한 부분도 없지않아 있었는데 문 세개 중 탈출 경로 결정하는 장면처럼 심리를 표현해주는 장면이 많이 있었으면ㅎㅎ후속편도 기대되요!,,,,,,,,,,,,,
1396,부모들이 아이들을 걱정하고 집에서 못나가게 한 이유가  27년전 안좋은일을 겪은게 아닐까 싶다,,,,,,,,,,,,,
1397,난놀라죽을뻔했으나 남친은하품함,,,,,,,,,,,,,
1398,무섭고 무섭고 또 무서워,,,,,,,,,,,,,
1399,다굴에는 장사없다라는 것을 보여주는 공포 영화,,,,,,,,,,,,,
1400,귀여운 어린이들이 나오는 공포영화~!,,,,,,,,,,,,,
1401,공포물이라기보다는 호러 판타지 정도의 만족. 속편에서 어린시절의 트라우마를 이겨내는 힐링스토리를 만들어주기 바란다,,,,,,,,,,,,,
1402,구니스'의 호러 버전. 매 장면마다 움찔거리며 보기를 기대한 사람이라면 좀 실망스러울 수도 있겠지만,,,,,,,,,,,,,
1403,최근에 본 영화중에 제일 취향이었음원작 자체가 탄탄하고자칫하면 엄청 부족해보일수도 있는 소재인광대랑 아이들 캐릭터도 좋음. 덤으로 웃기고 꽤 무섭기까지,,,,,,,,,,,,,
1404,깜짝깜짝 놀라는거 시르면 무서움 ㅠㅠ,,,,,,,,,,,,,
1405,그래도 볼만했음 ㅋㅋㅋ,,,,,,,,,,,,,
1406,처음부터 끝까지~영화에 반은 눈가리고 봤네요...강추입니다!!!,,,,,,,,,,,,,
1407,진짜 너무너무 잼싸요 진짜 역대급~~!!!ㅎㅎ,,,,,,,,,,,,,
1408,교훈 : 화장실 청소를 잘 하자,,,,,,,,,,,,,
1409,돈 안아까운 영화공포가 아닌 인간의공포심을 철학적으로 잘 이끈 영화,,,,,,,,,,,,,
1410,공포만이 아닌 성장스토리로 보면 괜찮은 영화.하지만 런닝타임때문에 잘랐는지 뭔가 부족하다는 느낌도 조금 있음,,,,,,,,,,,,,
1411,와 정말 무섭게 잘 봤습니다 엔딩도 마음에 들고요 2 나오면 보러 갈 생각입니다.,,,,,,,,,,,,,
1412,잔인한 몇장면만 눈가리면..아이들이 꼭 봐야할 영화인듯.용기와 우정에 관한 나름 훈훈한 공포..,,,,,,,,,,,,,
1413,그것을 극복하게 만드는 영화. 의미 있는 공포 영화.,,,,,,,,,,,,,
1414,공포영화 치고는 코믹한부분이 많아서 재미있엇어요^^!,,,,,,,,,,,,,
1415,귀신이나 원한있는 존재가 아닌 광대라서 놀래킬수 있는 요소들이 많았다 계속 놀래키고 놀래키지만 매번 놀라게됨 볼만해여,,,,,,,,,,,,,
1416,아무리 말잘하고 감동적인 시를 써도 뚱땡인 뚱땡이었다,,,,,,,,,,,,,
1417,리틀 이동휘 덕분에 재밌게봤습니다 ㅋㅋㅋ,,,,,,,,,,,,,
1418,F E A R 우리 모두는 두려워하는 무언가를 가지고 살아간다,,,,,,,,,,,,,
1419,갑툭튀의 향연ㅋㅋㅋㅋ,,,,,,,,,,,,,
1420,난 웃겄는데.. 애들한테나 무서울듯,,,,,,,,,,,,,
1421,최고의공포ㄷㄷ진짜 한순간도 긴장을 늦추지않고 봤었어요삐에로가 이렇게나 무서워질수있단 영화,,,,,,,,,,,,,
1422,한순간 한순간 긴장감을 놓칠수 없었던 영화였습니다. 원작과 병행해서 봤었는데 지루하지 않고 재미있네요.,,,,,,,,,,,,,
1423,기대하고 갔는데 청춘성장물 보고 온 느낌..,,,,,,,,,,,,,
1424,와 정말 보는 내내 심장 조리면서 봤네요....진짜 삐에로 비주얼 대박..그리고 삐에로 보다 무서운게 생겼어어요..풍선.소오름...ㅠㅠ,,,,,,,,,,,,,
1425,솔직히 좀 유치했다 뻔하고,,,,,,,,,,,,,
1426,초반에 좀 무섭긴한데 후반부 갈수록 스토리가 진부해져요  돈주고 볼 정도의 영화는 아닌거같아요. 비추,,,,,,,,,,,,,
1427,그냥저냥볼만함 속편은안볼듯,,,,,,,,,,,,,
1428,개인적으로 너무 아니였던 영화...,,,,,,,,,,,,,
1429,내용은 별로 였지만연기는 좋았던..,,,,,,,,,,,,,
1430,조아요 꼭보세요 추천추전,,,,,,,,,,,,,
1431,컨저링 정도의 공포를 생각했다면 많이 아쉽습니다그냥 저냥 보기편함니다.서양의 삐에로에 대한 공포를 이해해야 무서울듯문화차이?,,,,,,,,,,,,,
1432,호러'라기보단 '엽기'영화였다. 아이들의 틴에이지 성장드라마와 전형적인 공포물의 조화는 서로 어울린다기보단 완벽한 불협화음을 이루어 영화를 밑도끝도없는 잡탕으로 만들어버렸다. 흐지부지 ...,,,,,,,,,,,,,
1433,우와 기대하고보앗는데요정말잼있네요  무섭지도 않고추천할게요  어린이용  공포♥,,,,,,,,,,,,,
1434,리메이크 완전 잘됨! 2부도 기대됩니다,,,,,,,,,,,,,
1435,최근 나온 공포영화중에 제일 재밌어요~~돈 안아까움,,,,,,,,,,,,,
1436,재미는잇는뎈ㅋㅋ 포커싱이너무 중구난방임,,,,,,,,,,,,,
1437,애들 나오는데 무서움,,,,,,,,,,,,,
1438,초딩아이들이랑 보았는데  무섭다고 난리들...엄마인 저는 그닥. ..그러나 스토리 구성이나 긴장감...구성이 좋음,,,,,,,,,,,,,
1439,애나벨>>그것 무서움이고 볼만은한데 내용이 개판임 공포면 공포만나와야하는데 멜로에 우정에.. 에혀 그냥 볼만함 애나벨 평점9라고치면 이건 5-6,,,,,,,,,,,,,
1440,재미는 있었는데... 몽둥이로 그걸...?,,,,,,,,,,,,,
1441,오랜만에 분위기 좋은 영화 보네요,,,,,,,,,,,,,
1442,잦잘보앗습니다요ㅎㅎㅎㅎ최고,,,,,,,,,,,,,
1443,제가 봤던 공포영화 중 최고 인것 같아요!! 제 친구들이랑 보고 영화관을 나와서도 계속 영화 얘기만 주구장창하고 있었다니까요,,,,,,,,,,,,,
1444,영화는 하나도 안무서운데 집가서 무서움,,,,,,,,,,,,,
1445,돋보기 안경 시키 겁나 귀엽넼 영화도 나쁘지않앗음,,,,,,,,,,,,,
1446,어린이가 절대보면안되는 어린이공포영화...아주그냥 사람들이 질색팔색함..ㅋㅋ,,,,,,,,,,,,,
1447,모든 장르를 경험해볼수있습니다,,,,,,,,,,,,,
1448,으악 광대는 너무너무 무셔워,,,,,,,,,,,,,
1449,뭔가 유치하고 이상한데 재밌어!!!!,,,,,,,,,,,,,
1450,아주획가적아고 놀란작춤,,,,,,,,,,,,,
1451,재미있어욬 어떻게 이렇게 무서울수가이,,,,,,,,,,,,,
1452,2시간 조금 넘는 러닝타임이라 중간에 저금 지루할빤 했지만그래도 이야기를 괜찮게 풀어나가서 재미있게봤습니다후속작 기대할게요~,,,,,,,,,,,,,
1453,소설을 충실하게 잘 살렸다.  파트2가 기대된다.,,,,,,,,,,,,,
1454,그럭저럭.. 어린이 성장영화..?,,,,,,,,,,,,,
1455,80년대 후반을 추억할수 있다면 개꿀잼,,,,,,,,,,,,,
1456,스릴만점 스토리도 탄탄하고 재미있었어요~~ 2편 얼른 보고싶네요~~,,,,,,,,,,,,,
1457,역시 스티븐 킹의 느낌이 물씬 난다.,,,,,,,,,,,,,
1458,사운드가 참 알차네요ㅋㅋㅋㅋ,,,,,,,,,,,,,
1459,내시간 순삭.. 광대... 하... OO....,,,,,,,,,,,,,
1460,와.. 소름끼칠정도였다..,,,,,,,,,,,,,
1461,아이들이 귀여워서 10점,,,,,,,,,,,,,
1462,넘 귕워요 애기들 ㅠㅠㅋㅋ,,,,,,,,,,,,,
1463,애나벨 보다 훨씬낫네요 긴장 주다가 애들 나와서 드립으로 긴장 풀어주고 다시 긴장주고 이런것도 좋았어요 ㅋㅋ,,,,,,,,,,,,,
1464,야 방금 그것 보고왔는데 쫄보가 봐도 안무섭다는 놈들 뭐냐 2시간 내내 눈감고있었다ㅡㅡ그래도 무서운장먄 나오기 전에 깜빡이 켜줘서 그나마 괜찮았음,,,,,,,,,,,,,
1465,기대이상 이였어요 그리고 흠 친구들의 우정이 보기 좋았어요,,,,,,,,,,,,,
1466,어릴적 느낄 수 있던 공포를 느낀듯,,,,,,,,,,,,,
1467,시리즈였을 줄이야 2도 기대해봅니당,,,,,,,,,,,,,
1468,의도는 파악했으나 불친절한 스토리전개와 연출,,,,,,,,,,,,,
1469,갑툭튀 때문에 그렇지 딱히 무섭다는 생각은 안들었음.. 좀 유치하긴 하더라... 특히 뚱땡이 키스로 깨어나는 부분은 잠자는 숲속의 미녀인줄.. 근데 영화보고나서 돈아깝다는 생각은 안했네요. 큰기대는 하고 보지 마세요...,,,,,,,,,,,,,
1470,어린이 판타지 코미디 영화,,,,,,,,,,,,,
1471,전 솔직히 피에로가 각기하는 장면에서 혼자 뿜어서... 지루하진 않았는데 무섭지도 않았음;;;,,,,,,,,,,,,,
1472,뜬금없는 청춘로맨스..?,,,,,,,,,,,,,
1473,우리가 가장 무서워하는 대상으로 나타나는 존재,,,,,,,,,,,,,
1474,15 세 치곤 호러물이였고 cg에 감탄 솔직히 난 재밌더라 긴장감도 있고 누구나 어릴적 그렇지않냐 난 지인들보고 추천해줄만함,,,,,,,,,,,,,
1475,숨죽이고봤네요 휴..,,,,,,,,,,,,,
1476,2017.9.8 cgv영등포,,,,,,,,,,,,,
1477,무서운 영화 치고 꽤나 담으려고 한 내용들도 있어서 난 좋았다. 무작정 놀래키기 보단 정말 그 소수자들이 사회에서 느꼈을 공포를 잘 표현해 놓은 듯한 광기어린 광대의 모습에 내 자신이 저렇게 비춰질 수도있다는 공포와...,,,,,,,,,,,,,
1478,삐에로 공포증을 이렇게 신선하게 표현한 영화 하나정도는 괜찮잖아.,,,,,,,,,,,,,
1479,한국판 곡성같이 긴장감과 끝까지 생각하게 만드는 영화,,,,,,,,,,,,,
1480,마지막에 애들끼리 그건 좀 아니지 않냐? 솔직히 안무서운데 사람들이 왜 다 대박이라는 지는 모르겠네요 알바들인가.. 1점주려다가 남주애가 잘생겨서 2점 드림요,,,,,,,,,,,,,
1481,핵꿀잼ㅇㅇ 저랑 남친 둘다 재밌게 보고왔어요 굳굳ㅋㅋㅋ그냥 무섭기만한 공포영화가 아니라 애들 성장물같은데 스토리도 좋고 웃기기도하고 한편의 애니메이션 보는 기분이었어여,,,,,,,,,,,,,
1482,공포 -웃음-재미있습니다,,,,,,,,,,,,,
1483,오랜만에 재밌게봤던 !,,,,,,,,,,,,,
1484,10분까지 대작. 이후 망작. MB의 헐리우드 데뷔작이란 것에 초점을 둔다면 적은 분량에 존재감을 보여준 작품.,,,,,,,,,,,,,
1485,너무너무 재밋어요 강추 !!,,,,,,,,,,,,,
