,content,,,,,,,,,,,,,
4433,디워보다 재미 없었다.살면서 영화를 그리 많이 보지는 않았지만 지금까지 본영화중에 제일 재미없는영화,,,,,,,,,,,,,
4434,이게 왜 이렇게 평점이 좋은지 모르겠네광고만 무서운 영화임 진짜하나도 안 무섭고 유치함. 무서운 장면 나오는데 어이가 없어서 웃음이 나옴진짜 보지 마세요. 뭔 애기들이 보는 공포애니 느낌,,,,,,,,,,,,,
4435,이런걸 영ㅎ와라고 만들었나 ..지루해서 죽을뻔 공짜로봐서 다행이지,,,,,,,,,,,,,
4436,애들이너무귀여웠다.,,,,,,,,,,,,,
4437,패드립 패륜 흡연 칼질 돌팔매 소프트한 고어물 청소년여주 노출씬 등등 15세인 이유??ㅋㅋㅋㅋ개인적으로 좋아하는 요소(?)가 다 들어있어서 매우만족!!,,,,,,,,,,,,,
4438,와 이거 최고임.ㄷㄷㄷㄷ,,,,,,,,,,,,,
4439,이런 영화를 끝까지 보고 나온 내자신아 칭찬해,,,,,,,,,,,,,
4440,쓰레기영화임 돈내고보기아깝다진심,,,,,,,,,,,,,
4441,돈이아깝네여..ㅠㅠ,,,,,,,,,,,,,
4442,평점에 낚여써 봣다. 코믹이라면 10점준다. 공포라면 0점. 다들 윳느라 시끄럽더라,,,,,,,,,,,,,
4443,ㅅㅂ 알바새기들 존나많네 보지마라 돈죤나아깝다,,,,,,,,,,,,,
4444,스토리 뭔지 하나도 모르겠음  / 무슨 어린이 성장 드라마 같음 /  꼬맹이들이 괴물 물리치는 그냥 노잼,,,,,,,,,,,,,
4445,난 여태 공포영화중 최고였는데 재미없다는 사람들 쫌 이해안감~영화관에서 소리지른 여자두.있었음 졸잼꿀잼!!!애나벨보다 백배무서움,,,,,,,,,,,,,
4446,별점 1점도 아까움 이거 왜이렇게 평점이 높아 개봉 이틀째라 그런가 하 진짜 돈 아까움 말도안되게 무슨 갑자기 좀비가 튀어나오고 대낮에 길거리에서 광대 튀어나오고 진짜 말도안됌 스토리에 개연성이 1도 없음 보다 친구...,,,,,,,,,,,,,
4447,진짜 너무 무서워서 중간에 나갈뻔했어요,,,,,,,,,,,,,
4448,어린이 성장 영화,,,,,,,,,,,,,
4449,제목부터 끌리더니 영화는 더 재밌네..,,,,,,,,,,,,,
4450,지금까지 본 공포영화중에 가장 참신하고 흥미로웠어요,,,,,,,,,,,,,
4451,리지 하드캐리함ㅋㅋ꽤나 재밌었던 영화,,,,,,,,,,,,,
4452,러닝타임이 지루할틈이 없었네요,,,,,,,,,,,,,
4453,약간 8~90년대 감성이 있어 더 와닿는 기분. 시공간을 초월한 공감대형성,,,,,,,,,,,,,
4454,올해 본 공포영화중에 최고인듯,,,,,,,,,,,,,
4455,정말 참신한 스토리~!! 소설도 한번 읽어보고 싶음,,,,,,,,,,,,,
4456,초반부터눈을 확 사로잡네요. 애나벨보다 훨씬 무서운데요?,,,,,,,,,,,,,
4457,쓰래기다 시간 아깢다.... 보지마라,,,,,,,,,,,,,
4458,....정말 추천하고 싶지 않아요,,,,,,,,,,,,,
4459,드라마와 공포가 어우러지질 못함. 첫 조지가 끌려가는 장면이나 지하실에서의 광대등장은 꽤 긴장되고 공포영화다운데,,,,,,,,,,,,,
4460,애들 동화같음 집에서 vod나오면 보세요,,,,,,,,,,,,,
4461,개짜증난다진짜^^.,,,,,,,,,,,,,
4462,123456보지마셈,,,,,,,,,,,,,
4463,극장 나가고 싶었다...,,,,,,,,,,,,,
4464,끝나고도 계속 생각이나는 영화네요,,,,,,,,,,,,,
4465,정말 보는 내내 집중해서 2시간넘어도 알아채지못햇어요...삐에로 진짜 무섭네요 다들 연기 굿입니다,,,,,,,,,,,,,
4466,원작 그 이상을 보여주는 영화는 오랜만이네요,,,,,,,,,,,,,
4467,130여분이 소름끼쳐서 혼났네요ㅡㅡ,,,,,,,,,,,,,
4468,무섭고 재밌습니다만 이해가 안가는게 괴롭히는애들.. 애들 맞아?  성인같음ㅋㅋㅋ,,,,,,,,,,,,,
4469,역시 이런건 심야로 봐야지 제맛ㅎㅎ 대신 오늘 잠못자고 출근중..,,,,,,,,,,,,,
4470,코미디물 간만에 웃엇음,,,,,,,,,,,,,
4471,아ㅡ이걸 공포영화라고... 보는내내 짜증딱 초딩영화임....완전 낚임,,,,,,,,,,,,,
4472,전형적인 B급 영화 ㅇㅇ,,,,,,,,,,,,,
4473,짱구는못말려 공포버전+잠자는숲속의공주챕터원이라는데 예산딸려서 2안나올거같음,,,,,,,,,,,,,
4474,아동청춘드라마! 코미디를 원하시면 별점7정도ㅎㅎ 군인이라 6000으로봤는데 햄버거  먹을걸ㅠㅠㅠ,,,,,,,,,,,,,
4475,내 기준에서는 상당히 재밌음,,,,,,,,,,,,,
4476,이런 쓰레기같은 영화 다시는 보고싶지 않네요 괜히 틀었다가 정신만 이상해지는 기분 진심으로 더러운 영화네요,,,,,,,,,,,,,
4477,최악 최악 최악 최악 최악,,,,,,,,,,,,,
4478,뭘 이야기 하고 싶은건지 모르겠고 가면 갈수록 스토리가 산으로 가는걸 보고 한계에 달함.,,,,,,,,,,,,,
4479,보지마세요 진짜 돈 시간 날리고 의미없고 뭘 의도한건지 모르겠으며 뭘 보여주자한건지 이해안됨 베스트 댓글 보고 보지마세요 저거 다 알바에요 낚기지마세요,,,,,,,,,,,,,
4480,진짜 살면서 지이인짜 장난안치고 진짜 노잼입니다. 깜작 놀라는 부분 말고는 하나도 안무섭고 잔인하기만  하네요 어이없는 키스신과 광대가 마지막에 처맞는 부분은 진짜 안경벗고 폰만졌습니다.,,,,,,,,,,,,,
4481,여태껏 영화 300편 이상 봤지만 평점 남기는건 처음임.  공포랑 감동 둘 다 잡으려다 둘 다 놓친 영화.의식 잃은 아이를 뽀뽀로 깨워?  이건 뭐 청춘물도 아니고 공포영화도 뭣도 아님.심지어 갑툭튀도 무섭지도 않다...,,,,,,,,,,,,,
4482,26년 인생 처음으로 돈이 아깝다리얼 까지는 그래도 하 이래도 돈은 내고 봐야지했지만 이건 인생 최고로 돈이 아깝다,,,,,,,,,,,,,
4483,무서운 공포감은 유지하면서 웃기기도 하고 뭉클함도 있고 뭔가 성장통이 담겨 있어서 그런지 감정이 풍부한 영화였음 올해 좋은 영화 top3안에 듬,,,,,,,,,,,,,
4484,올해 최악의 영화. 전달하고자 하는 메세지가 있었다면 철저한 실패. 각자 따로노는 스토리와 개연성이라곤 찾아볼 수도 없고 심지어 무섭지도 않다.. 무서움을 느끼는건 각자 다를 수 있으나 어느 방면에서도 성공하지 않았...,,,,,,,,,,,,,
4485,공포영화보면서오줌안싼적처음입니다,,,,,,,,,,,,,
4486,It은 술래잡기의 술래라는 뜻인데,,,,,,,,,,,,,
4487,진짜보지마라 진심이다,,,,,,,,,,,,,
4488,생각보다 너무 안무서워서 좀 놀랐어요 그냥 약간 웃긴코메디 보는듯했어요 약간 실망감이 큰 영화였어요,,,,,,,,,,,,,
4489,나이먹고 옛날 사탄의인형보는기분갈수록 지루해지다가 끝에 짜증이나는영화이거볼돈으로 그돈으로 똥닦는걸추천,,,,,,,,,,,,,
4490,덜덜 후덜덜 무서웟쨔용,,,,,,,,,,,,,
4491,여태 본 공포영화중에 정말 최악이 다 어떻게 이정도 평점이 나오는지 모르겟다,,,,,,,,,,,,,
4492,너무 재미없어서 충격과 공포,,,,,,,,,,,,,
4493,진짜 공포는 이런 쓰레기가 속편이 나온다는거지..소설과 영화의 괴리감을 제대로 보여준 사례 중 하나,,,,,,,,,,,,,
4494,그냥 재미없게 잘못만든 영화다,,,,,,,,,,,,,
4495,댓글알바쓰냐? 진심 더럽게 재미없다. 보다가 중간중간 잤다ㅡㅡ관람객들 영화끝나자마자 돈아깝다고 욕하면서 나가더라ㅡㅡ돈버리고 시간버리고 제발 호기심에 보지마시길..,,,,,,,,,,,,,
4496,공포영화좋아하고남들욕했던 에나벨 컨저링조차 재밌게보던 내가 25년 평생 영화 보다 빡쳐서 나오긴처음,,,,,,,,,,,,,
4497,별5점이상 주는애들은 알바생들이냐?0점있으연 0점줫다 걍내용없이 촉수광대새끼보여주고 좀비새끼나오고무슨 영화가이렇게맥락이업냐 진짜 열받네ㅋㅋ진짜 내돈주고밧으면 아까워뒈질뻔..,,,,,,,,,,,,,
4498,이거보자한 친구랑 인연끊음 서양판 떡잎방범대인줄,,,,,,,,,,,,,
4499,너무 쫄아서 뇌가 다 쫀거같아...하...,,,,,,,,,,,,,
4500,원작 10프로도 못살림. 철지나 삐에로의 애들 겁주기 영화. 초딩들의 성장통!,,,,,,,,,,,,,
4501,두시간반동안 너무 지루했어요.. 공포로 승부할 자신이 없으니 놀래키는거만 잔뜩 넣고..,,,,,,,,,,,,,
4502,삐에로 나오는게 머가 무섭냐.. 애들이나 무서워할듯,,,,,,,,,,,,,
4503,예 핵노잼이구여;;;;,,,,,,,,,,,,,
4504,광대가 튀어나오는 연출이 장난 아니에요.. 식겁해서 의자 뚫고 뒤로 들어갈뻔했어요 .  단순히 무섭기만 한 영화가 아니라 아이들이 '공포''라는  감정에 맞서 싸워가는 모습이 좋았습니다.,,,,,,,,,,,,,
4505,광대 연기 지렷고요 오졌고요 몰입감 좋음,,,,,,,,,,,,,
4506,무서운 와중에 또 감동적이고 난리.. 2탄도 너무 기대된다,,,,,,,,,,,,,
4507,천조국 사람들이 왜 삐에로 공포증이 있는지 그 이유를 알수 있는 영화.,,,,,,,,,,,,,
4508,,,,,,,,,,,,,,
4509,드럽게 재미없다. 무슨 독수리5형제 수준의 영화,,,,,,,,,,,,,
4510,어린이 성장물. 주인공의 트로피를 위해 캐릭터끼리의 관계성을 가볍게 만들어 버렸다.,,,,,,,,,,,,,
4511,에라이에라이에라이에라이,,,,,,,,,,,,,
4512,난 왜 삐에로가 웃기짘ㅋ캬캬컄,,,,,,,,,,,,,
4513,피로 맺은 루저클럽의 어느 날. 공포영화라고 쓰고 성장영화라고 읽는다.,,,,,,,,,,,,,
4514,어른들의 이기심 그리고 외면. 때로는 아이들을 통해 더 많은 교훈을 얻을때가 있다.,,,,,,,,,,,,,
4515,공포에 맞서고 두려움을 이겨내는 것이 진정한 성장,,,,,,,,,,,,,
4516,그냥 둬도 잘 큰다 22 442342,,,,,,,,,,,,,
4517,신선한 내용으로 공포영화와 성장영화를 잘 버무렸다. 비주얼적으로 훌륭!,,,,,,,,,,,,,
4518,그닦 안무섭지만 재밌네요.. ㅎㅎ 후속편이 기대되네요~,,,,,,,,,,,,,
4519,개무섭다 다신안보고싶다 그러나 영화는 10점짜리라고 생각한다,,,,,,,,,,,,,
4520,별로 기대안했는데,,,,,,,,,,,,,
4521,분명 갑툭튀는 맞는데 왜안놀랐지? 나만그런가? 갑툭튀는 맞으나..놀래키는게 갑툭튀로 알고있는데 왜안놀랐지? 광대라그런가 귀신이었으면 놀랐는데,,,,,,,,,,,,,
4522,공포라는 감정이 불가항력으로부터 나오는게 큰데 그걸 이겨버리니 무섭지도 않고... 페니와이즈는 대사도 몇줄 없고... 처음 나왔을때 말을 제일 많이해...,,,,,,,,,,,,,
4523,관객이 궁금해하는것을 해소시켜 주지못하고 떡밥만 풀다 끝나네요. 하이틴 영화같은 느낌은 좋았지만 결말이 제대로 지어지지않은 느낌... 공포영화로써는 비쥬얼이 좋았다고 생각드나 많이 무섭진 않네요. 긴장감도 생각보다 ...,,,,,,,,,,,,,
4524,15세 이하 관람가로 했어야.,,,,,,,,,,,,,
4525,난 예고편보다 현아에게 속았다....,,,,,,,,,,,,,
4526,괴담 + 미국판 응답하라 1988. 다른 나라 사람이 이걸 재미있게 본 이유가 뭘까? 빠져들 추억이 없으면 지루하고 고리타분,,,,,,,,,,,,,
4527,초반에는 빵빵한 사운드와 긴장감으로 등골이 서늘했지만 후반부에 갈 수록 오히려 긴장감이 낮아졌다. 그래도 혼자 공포영화 보기엔 이만한 영화는 없다고 생각한다,,,,,,,,,,,,,
4528,긴 러닝타임이지만 집중하고 몰입해서 봤다. 15세 관람가라고 하기엔 잔인하고 19금 걸면 다소 밋밋하고 17세 관람가가 적당? 옛날 영화 보듯 추억 생각나고 좋음.,,,,,,,,,,,,,
4529,[ IMDB 7.5/10 ]  '달려온~ 어린이들~ 한자리에 모여앉아~' 어린이 명작 호러극장.,,,,,,,,,,,,,
4530,cg는 좋았으나 몰입감,,,,,,,,,,,,,
4531,너무 산만하고 잔가지가 너무 많아서 꺼버림,,,,,,,,,,,,,
4532,공포영화는 거의b급 영화들이 많았는데 간만에 a급 공포물을 본 기분이다,,,,,,,,,,,,,
4533,초반엔 기괴하고 좋았는데 갈수록 광대가 개그 인물이 된달까 그거 빼고는 다 좋음 특히 마지막쪽에 베벌리 잡헜을때 광대가 충추는게 차암 인상적이였음. 웃음밖에 안 나온다ㅋㅋ,,,,,,,,,,,,,
4534,역시 다굴에는 장사없다.,,,,,,,,,,,,,
4535,1점도 아까운 최악의 영화,,,,,,,,,,,,,
4536,진심 쓰래기 영화.... ㅡㅡ,,,,,,,,,,,,,
4537,허접국산보단 괜찮았음 중간중간 무서워떠요 기싱꿈꿀듯 ㅋㅋㅋ써놓고도 오글거림 미안요~~,,,,,,,,,,,,,
4538,이걸 극장에서 안봐서 정말 다행이다.,,,,,,,,,,,,,
4539,싫러:;()?&@“,,,,,,,,,,,,,
4540,컨저링2에 손톱때보다도 못하다.,,,,,,,,,,,,,
4541,이건 뭐 오락실가서 100원 넣고 왕깨는 오락이냐 뭔 영화가 오락같냐,,,,,,,,,,,,,
4542,스탠 바이 미? 드림캐쳐의 아이들버전? 해리포터의 보가트? 맛좋은 소스를 넣고 버무린다고 멋진 요리가 나오는건 아니다. 소피아 릴리스 그녀 하나만 건졌네...,,,,,,,,,,,,,
4543,광대를 무서워하는 아이들이 보면 잠에 잠 못잘듯~ 생각보다 잘만들었어요,,,,,,,,,,,,,
4544,볼만함 재밋음 튜튜튜코튜튜,,,,,,,,,,,,,
4545,그래픽이 너무 맘에 들었음여.. 편집이 신의한수..,,,,,,,,,,,,,
4546,그냥저냥 볼만헀던듯..,,,,,,,,,,,,,
4547,근데 미국아이들이 광대를 많이 무서워하나보죠? 아이들이 귀여워서 볼만했네요 여자아이는 너무 이쁨,,,,,,,,,,,,,
4548,공포영화가 나올때마다 다 챙겨보는뎀올만에 쫌 볼만한 공포물이였움,,,,,,,,,,,,,
4549,각자의 트라우마를 극복해 나가는 성장물.,,,,,,,,,,,,,
4550,음 좋아좋아좋아 댓글10자이상 짜증나네,,,,,,,,,,,,,
4551,좋아요..재밌게 잘 봤습니다..RPG게임의  끝판왕을 잡은 기분이네요,,,,,,,,,,,,,
4552,ㄹㅇ핵뀰잼 꼭보세여다들,,,,,,,,,,,,,
4553,너무 재밋게 잘봣습니다.,,,,,,,,,,,,,
4554,쫌 기분이 더러운 영화같았음ㅠ,,,,,,,,,,,,,
4555,퍼펙트!!! Ittt!!,,,,,,,,,,,,,
4556,딱히...딱히 돈주고 보고싶진 않은..,,,,,,,,,,,,,
4557,별로엿어요 재미없음ㅠㅠ,,,,,,,,,,,,,
4558,그냥그래요 공포영화는아니고  드라마인듯,,,,,,,,,,,,,
4559,이런 영화에 평론가들 평점이 이렇게 높은 이유를 모르겠다. 공포 디즈니 같은 영화에...,,,,,,,,,,,,,
4560,공포영화를 보면 항상 손을 얼굴에 대서 가릴 준비를 하지만,,,,,,,,,,,,,
4561,러닝타임 긴데 안 지루하고 나름 재밌었음,,,,,,,,,,,,,
4562,공포영화라기보단 판타지스러운영화,,,,,,,,,,,,,
4563,주인공들이 아담하고 내용도 충실하고 꽤 재미있게 보았다..,,,,,,,,,,,,,
4564,재미있엇어요 볼만했어요,,,,,,,,,,,,,
4565,조지 너무 귀여운데 구해주지ㅠㅠ,,,,,,,,,,,,,
4566,그냥 두면 잘 안크는데... 아이를 길러 보니까...,,,,,,,,,,,,,
4567,그냥 보통. 재미없지도 않고 잼나지도않고 정도?,,,,,,,,,,,,,
4568,노잼이였어 노잼. 그 안경 쓴 꼬마애가 좀 영화 그나마 살림,,,,,,,,,,,,,
4569,원래 공포영화 안보는데 친구가 보러가자고 해서 봤더만 무섭지도 않고 노잼이라서 시간하고 돈만 버린듯함. 중간에 화장실에서 여자애 뒤돌다 목 잡힌 것만 예상 못해서 놀라고 그 외는 너무 뻔해서... 티저 영상이 전부였...,,,,,,,,,,,,,
4570,아이들을 주인공으로 한 공포영화가 이렇게 무서울 수가 있다니..,,,,,,,,,,,,,
4571,공포 영화 보다가 잔 거는 처음이다.. 너무한거 아님..?,,,,,,,,,,,,,
4572,90년대 공포영화 시리즈인 스크림,,,,,,,,,,,,,
4573,아에이오우어아에이오우어,,,,,,,,,,,,,
4574,아이들 연기력이 좋았기떄문에 그나마 4점준다.. 이걸 보고 무서웠다 하는 사람들 길다가 낙엽떨어지는 것만 봐도 화들짝 놀랄 사람들인듯.... 진짜 무표정으로 보다 끝남,,,,,,,,,,,,,
4575,공포와성장의절묘한조화,,,,,,,,,,,,,
4576,초중반은 멋졌는데 뒤로 갈수록 아동 취향의  소년물이 되어버리네..  스티븐킹의 작품 맞는가?,,,,,,,,,,,,,
4577,삐에로 너무무셔ㅠㅠㅠ,,,,,,,,,,,,,
4578,씨네21 기자님들,,,,,,,,,,,,,
4579,무섭다기보다 놀라울 따름이다,,,,,,,,,,,,,
4580,누구나 어릴 적 한 번쯤 무서워했을 그 무언가를 이겨내는,,,,,,,,,,,,,
4581,ㅋㅋㅋㅋ돌던지기 전쟁에서 코믹영화로밖에 안보였다,,,,,,,,,,,,,
4582,왜 내가 공포물을 보면서..소피아 릴리스란 배우의 꼬마 역을 보면서 개같은 내인생이란 영화가 떠올랐는지는 모르겠으나...영화내내 굿바이마이프렌드 느낌도 들었다..그게(I T) 뭘까..,,,,,,,,,,,,,
4583,아역 배우들의 연기는 기대 이상.챕터 1,,,,,,,,,,,,,
4584,그냥 초딩용 공포영화.,,,,,,,,,,,,,
4585,공포영화는 아닙니다. 무서운 씬들이 파편화 되어서 군데군데에 들어있어요. 하지만 전반적인 흐름은 공포영화 라기 보다는 동화,,,,,,,,,,,,,
4586,하이스쿨 다니는  초딩들이  나와서  즐겁고 신나게 즐기는 개쩌는  스토리!  언제 무서워서 소리를 질러야 하는지  모르는 엇박자 스토리!님들도 질려 죽을지도~영화에 속아서  소오름~!!!두둥,,,,,,,,,,,,,
4587,괴기스러운 복장에 표정에 분장의 피에로는 어떻게 서커스와 패스트푸드의 마스코트가 되었나.,,,,,,,,,,,,,
4588,볼만한데 기대를많이해서 그런지 만족스럽진 않았습니다,,,,,,,,,,,,,
4589,전체적으로 보면 상당한 수작이다. 다만 중간 중간 청소년드라마 같은 대사와 설정이 다소 어쉽다. 하지만 이를 능가하는 충격적 패륜 스토리가 역시나 사이사이 들어가 있다. 한 마디로 천국과 지옥을 오간다고 해야 하나....,,,,,,,,,,,,,
4590,Ep1 - 어른이라는 두려운 존재. 기대되는 감독. 기대되는 시리즈.,,,,,,,,,,,,,
4591,하이틴 공포물인가?? . 무서운건지 우스운건지 헷갈림. 그래도 깜짝놀라는 장면은 몇군데있음. (예상했는데 도 놀란 장면 하나있고..),,,,,,,,,,,,,
4592,왜 삐에로여야 하는가,,,,,,,,,,,,,
4593,하 영화가 좀 이상하다 내가 생각한거랑은 딴판이네??,,,,,,,,,,,,,
4594,넘기대를했네요  가벼운 성장 영화임당,,,,,,,,,,,,,
4595,호러의 미학은 짧고 간결할 것!,,,,,,,,,,,,,
4596,영화보는 내내 놀라는거 1도 없었고 ... 엄청 지루함...노잼,,,,,,,,,,,,,
4597,ㅠ무서우면 무섭다구 얘기정도는 해줄 수 있잖아요.ㅠ글구 애기들이 귀여우면 쫌 많이 귀엽다구두 얘기해 줄 수두 있는거잖아요? 넘 아무생각 없이 봤다가 ㅠ어쨌는 이 영화는 심장에 무리가 심하게 옵니다ㅎ2편은 되도록 빨리...,,,,,,,,,,,,,
4598,아이들은 삐에로를 무서워하지 않았고,,,,,,,,,,,,,
4599,하비에르보텟인가하는 애가 광대가 아니라 빌 스카스가드가 광대인게 충격대반전;; 남자가 봐도 빌스카스가드 존잘이네 ㅎㄷㄷ 그래도 어린 꼬마애를 첨부터 팔자른것도 모자라 괴기스러운 CG로 몇번을 죽인거는 너무하다,,,,,,,,,,,,,
4600,공포에 맞서 당당해지며 성장해간다,,,,,,,,,,,,,
4601,주인공 꼬마애 볼수록 이광수 같음,,,,,,,,,,,,,
4602,그냥 소름끼치는정도 ^^?,,,,,,,,,,,,,
4603,안경 낀 애 너무 웃김 ㅋㅋ 개인적으로 어둡고 칙칙하고 기분 더럽게 보는 거 보단 차라리 기분 좋게 본 거 같아서 괜찮았음 ㅎㅎ,,,,,,,,,,,,,
4604,크리쳐들이 좋았다. 깜짝 깜짝 놀라게 하는 등장은 여느 공포 영화와 다를 바 없지만 그들의 등장이  극의 흐름을 해치지 않고 관객에게 전달되는 것은 당연하게도 연출의 힘이 아닐까 생각한다.,,,,,,,,,,,,,
4605,무섭다기 보단 징그러웠고 재미있네  제2장도 기대된다,,,,,,,,,,,,,
4606,여자애도 이쁘고 애들도 귀여워서 다보긴 했지만 보느 내내 애들 가지고 무슨짓이지 구니스 같은영화 못만드나했는데 이게 본편을 위한 프리퀄이었다니 대박 다음 기대된다,,,,,,,,,,,,,
4607,개연성 없고 딱 3류영화. 시간 아깝고 딱히 볼 이유가 없는 영화임. 친구들이랑 밤에 모여서 봤다가 욕만 실컷 하고 너무 지루해서 중간에 자는친구도 있었음;ㅋ,,,,,,,,,,,,,
4608,LOSER => LOVER,,,,,,,,,,,,,
4609,호러와 성장물의 적절한 조합. 페니와이즈도 귀여우면서 무서운게 아주 딱 좋다. 챕터2도 기대..,,,,,,,,,,,,,
4610,하늘에서 온 엽서 같은 어린시절이 담겨 있어 좋았다. 함께 하면 무섭지 않아...,,,,,,,,,,,,,
4611,분장을정말잘한것같다고생각한다,,,,,,,,,,,,,
4612,광대가 얼굴 흔드는거 너무 소름 돋는다 그리고.. 웃기다 ㅋㅋㅋ 그래도 깜짝깜짝 놀라는 장면이 많았다..,,,,,,,,,,,,,
4613,아주재미잇어요 강추합니다제계좌는 국민은행,,,,,,,,,,,,,
4614,요즘 얘들이 정말 무섭습니다. 괴물도 아이들한테 돌림빵 당합니다. 아동청소년법 폐지해야 합니다.,,,,,,,,,,,,,
4615,소설원작 일고 보면 10점을 안줄수가 없다,,,,,,,,,,,,,
4616,재미는 있다. 다만 공포영화라기보다는 10대 코미디 판타지 영화같음. 뚱땡이는 귀엽게생겨서 계속 뱃살 썰리고 리더같은 말더듬이는 지 동생이랑 지 여친 구하느라 여럿 피보게함. 2편 나온다고 하면서 끝나는데 솔직히 재...,,,,,,,,,,,,,
4617,재미지고 괜찮음.  15세관람가인 영화인데도 눈요기거리와 공포심 자극 이정도면 훌륭한듯,,,,,,,,,,,,,
4618,볼만한 장면이 계속 나와서 재밌네  광대 뚜까패서 물미치는게 아주 통쾌함,,,,,,,,,,,,,
4619,우리나라 정서상 삐애로에대한 무서움이 덜해서 그런지 몰라도 낮은 점수가 많네요 전 충분히 잘 만든 영화 같습니다. 해외는 어떤가 보니까 로튼84,,,,,,,,,,,,,
4620,굉장히 재밌게 봤음... 무섭지 않고 재밌음,,,,,,,,,,,,,
4621,감독이 뉴키즈 온더 블럭 덕후인건 확실.,,,,,,,,,,,,,
4622,지루하지않고볼거리가좋았다,,,,,,,,,,,,,
4623,공포심은 오글거림으로,,,,,,,,,,,,,
4624,어휴 ... 뭐냐 ... ㅡㅜㅠ ...,,,,,,,,,,,,,
4625,현실인지 공상인지 구분이 잘 안되다가 깨달은 것은 소설을 원작으로 한  SF영화라는 것,,,,,,,,,,,,,
4626,여자애를 키스로 깨울 수 있었던건 남자애가 여자애에게 표현하고팠던 마음을 분출함으로써 페니 와이즈의 힘을 이겨냈다는 것 같네요 넘 재밌었고 각자 가지고 있는 트라우마를 아이의 현태로 이겨낸다는 스토리가 좋았어요!,,,,,,,,,,,,,
4627,두려워하지말라'가 여기서 주는 교훈이구나..,,,,,,,,,,,,,
4628,이건 뭐지? 도대체 뭘까?,,,,,,,,,,,,,
4629,중간부분부터 약간 지루했어요,,,,,,,,,,,,,
4630,영화관에서 혼자 봤는대 하나도 안 무서웠다.,,,,,,,,,,,,,
4631,생각보다 무섭지 않았어요,,,,,,,,,,,,,
4632,보기 괜찮았습니다 ㅎㅎ,,,,,,,,,,,,,
4633,너무너무너무 잼났어요 또보고싶어요,,,,,,,,,,,,,
4634,아이들과 같이 보는건 비추~~ 무서워할듯개인적으론 너무 재미있게 봤어요.,,,,,,,,,,,,,
4635,진짜무서웠어요ㅡ삐에로 표정부터시작해서 목소리까지 짅친 소름끼치게 잘 만든것같네요.호러영화를 광대공포증을 모티비로 했다는것도 참신하고 좋네요,,,,,,,,,,,,,
4636,굿  시즌2도 빨리 보고싶다,,,,,,,,,,,,,
4637,대박재미있습니다 또보세요또,,,,,,,,,,,,,
4638,진짜 재밌었음 보세요 재밌습니다,,,,,,,,,,,,,
4639,어른 아이 공감 동화같은 공포,,,,,,,,,,,,,
4640,재밌었습니다. 볼만해요,,,,,,,,,,,,,
4641,어렸을 적 느꼈던 공포감을 다시 느낄 수 있었음,,,,,,,,,,,,,
4642,그로테스크함과 긴장의 연속,,,,,,,,,,,,,
4643,그냥 그저그럼 막 무섭지도않음,,,,,,,,,,,,,
4644,하나도 안무서웠구요. 개그프로그램인줄 솔까 안경낀애때문에 ㅋㅋㅋ 웃기만함 너무 잼났음,,,,,,,,,,,,,
4645,언능 후속편 보고싶어요,,,,,,,,,,,,,
4646,평이 안좋아 기대 안햇는데넘 잼잇게 본 공포영화~느낌이 다른 공포스릴,,,,,,,,,,,,,
4647,무서웠어요!약간 뻔한 결말인 듯 했지만 표현하려는 의미는 정확했던거 같네요,,,,,,,,,,,,,
4648,기분나쁜영화ㅠㅜ...,,,,,,,,,,,,,
4649,ㄹㅇ 이거 10점 주신 분들은 알바에요....???,,,,,,,,,,,,,
4650,결말허무...페니와이즈 나올때마다 깜짝깜짝놀라는부분ㅇ에는 그닥,,,,,,,,,,,,,
4651,재미없음  스토리도 내용없고 무섭지도않고 기괴하기만함,,,,,,,,,,,,,
4652,판의미로가 판타지 영화를 가장한 공포영화였다면 잇은 공포영화를 가장한 판타지 영화였음ㅠ 기대많이했는데 실망하긴함,,,,,,,,,,,,,
4653,힘드네요 기댜한것보다 정말 별로네요,,,,,,,,,,,,,
4654,성장영화... 인가??,,,,,,,,,,,,,
4655,공포영환데 약간 색다르고 광대라는 소재에 잘 끼워넣은것같습니다,,,,,,,,,,,,,
4656,진짜 무서웟고 팝콘 다 후두둑 떨어졋습니다,,,,,,,,,,,,,
4657,시간 가는줄 모르고는 봤어요 공포심에 대한 교훈을 주는 영화같은 ㅋㅋㅋㅋ,,,,,,,,,,,,,
4658,핵무섭..,,,,,,,,,,,,,
4659,굿 역시 킹스맨2 1보다 쬐금 못하지만,,,,,,,,,,,,,
4660,확실히 갑자기 놀래키는 장면은 없었지만 그래도 무서웠고 재밌있었다,,,,,,,,,,,,,
4661,ㅌㅋㅋㅋ카카카나ㅏ으치니니ㅏ찿ㄴㄴ,,,,,,,,,,,,,
4662,졸잼 조연들 진짜 찐따미 넘치고 귀여움,,,,,,,,,,,,,
