,content,,,,,,,,,
5106,굳굳.. 이영화 하고 흡사한 영화가 있는데 마치 그걸 보는듯한 기분 이였어요 전체적으로 영화에 나오는 등장인물들도 매치가 잘되고 잘잡혀있어서 매우 집중해서 보게 됬습니다 영화는 캐릭터에 맞는 배우가 해야 진짜 재밌는...,,,,,,,,,
5107,귀신이 잠깐나왔다 안나와서 재미없다는분들 있으신데  잠깐나와서 더 무서움. 실화라는게 팍 와닿음. 진짜 말도안되게 귀신엄청나오고 귀신얼굴로 계속 놀래키고 그랬음 실화느낌도 안나고 재미없었을듯.,,,,,,,,,
5108,무서운 장면 없는 공포영화라고 해서 어떨까 나름대로 기대 아닌 기대를 하고 갔다가 큰코다침; 공포영화 되게 좋아하고 여태껏 무섭다고 느낀 영화가 없었던 것 같은데 제일 무서웠음 처음ㅋㅋㅋ이런게 진짜 공포라고 생각함 ...,,,,,,,,,
5109,와....ㅠㅠㅠ 진짜 무섭다 ㄷㄷ,,,,,,,,,
5110,초반에는 좀 지루하다싶었는데 끝으로갈수록 긴장감때문에 눈을뗄수가 없었다. 음향,,,,,,,,,
5111,이때까지 본 공포영화 중 최고였다.,,,,,,,,,
5112,방금 보구옴ㅋㅋ머 지루하지는않았음ㅋㅋ무서운장면은 없었는데 사운드하고분위기를잘살림,,,,,,,,,
5113,존경합니다.,,,,,,,,,
5114,뭐야ㅡㅡ하나도안무섭잖아 누가이거무섭대ㅡㅡ; 잠시만요 팬티갈아입고올게요,,,,,,,,,
5115,분위기에 압도당하는 영화...,,,,,,,,,
5116,진정한 공포영화입니다 뼛속까지 깊이 남을 영화예요 ㅡㅜ 너무 무서웠어요  이시대의 진정한 공포영화입니다  최고최고!!,,,,,,,,,
5117,간만에 지렸다,,,,,,,,,
5118,에드워렌역 맡은 배우 마크 게티스 약간 닮았네요 공포영화로만족했습니다.초자연현상도 볼만 했어요 지루하지 않았고 결말도 저 나름 만족 했습니다.해피해피한게 좋잖아요?엑소시즘에 대해서 잘 배웠습니다.,,,,,,,,,
5119,보는 내내 긴장을 늦추지 못할 정도로 분위기도 음산하고 재밌었습니다! 보세요!,,,,,,,,,
5120,팬티 5번갈아입음..... 기저귀차고 보세요,,,,,,,,,
5121,그냥 보셈ㅋㅋㅋㅋㅋㅋ,,,,,,,,,
5122,간만에,,,,,,,,,
5123,때늦은 공포영화가 현재상영작 평정할듯..^^ 이전까지의 공포물은 잊어야 할듯합니다..,,,,,,,,,
5124,무섭다ㅜㅜ,,,,,,,,,
5125,무섭다ㅜㅜ,,,,,,,,,
5126,이때까지 본 공포영화 중 제일 무서웠습니다잘 만들었음!!!!,,,,,,,,,
5127,재밌네요  무섭고 잘만든거 같네요 ㅎㅎㅎ,,,,,,,,,
5128,앞으로 교회 잘다녀야지..,,,,,,,,,
5129,물어보지말고 직접봐라 죤내 무섭다,,,,,,,,,
5130,ㄱㅊ함,,,,,,,,,
5131,하나도 안무섭네 OO이네! 오늘 밤은 엄마랑 자야지^^!,,,,,,,,,
5132,30년동안 본 영화중에 젤루 무서웠씀 ㅎㄷㄷ,,,,,,,,,
5133,다 매진이라 어쩔수없이 봤는데 기대 이상,,,,,,,,,
5134,엑소시스트 영화인줄은 몰랐어요. 공포 분위기 조성이 너무 완벽했음.. 영화보고 비위 상한적은 많지 쫄은적은 없는데 액자 깨지는 장면에서 심장 멎는줄 ㅜㅜ 결말도 좋아요!,,,,,,,,,
5135,제임스 완의 귀신영화는 늘 나와는 안 맞는 듯.  쏘우같은 아이디어가 그립다.,,,,,,,,,
5136,전체적인 스토리도 갠찬고 밤낮 구분없이 일터지는것도 갠찬고 몰입도도 갠찬앗지만 솔직히 너무 오바들해서 무섭다 하는듯...진짜 단 한번도 놀란적도 없고 걍 흠짓만하고 중간중간 긴장되는 부분 빼고는 지루해서 하품이 나올...,,,,,,,,,
5137,초중반은 괜춘했느데 막판에 막 의자 뜨고 그런건 좀 오바.. 과장이 너무 심했던거같고 피를 토하고 그런건 진짜 오바다... 뭐 현재까지도 있다고 그러는데 영화에서 현재 어디서 피를 토하고 피눈물을 흘리냐.... 여느...,,,,,,,,,
5138,하나도 안무섭다 오늘은 엄마랑 자야겠다 잠깐 팬티좀 갈아입고...,,,,,,,,,
5139,최근에관상보고실망했는데이거보고 와... 최고인시디어스<파라노말<컨저링 기대아예안하고봐서그런지 진짜무섭고재밌었음ㅠ굳굳,,,,,,,,,
5140,아실지 모르겠지만. 제임스 완 감독이 컨저링을 마지막으로 공포영화 더이상 안만든다고 하네요.. 영화잡에서 봤떤..ㅠㅠ 정말 아쉽습니다. 진짜. 스토리 탄탄한 영화임.. 인시디어스 이후로 재미있게 봤네요..계속 공포영...,,,,,,,,,
5141,감히추천한당,,,,,,,,,
5142,설명필요없음그냥보세요,,,,,,,,,
5143,10점만점에10점,,,,,,,,,
5144,간만에 괜찮게 본 공포영화. 재미도 있고. 나름 오싹하고 좋았다.,,,,,,,,,
5145,걍 그저그랫음... 너무 기대해서그런가... 화이트가 더 무서웟던가같아요.. 개인적으로ㅎ,,,,,,,,,
5146,졸작,,,,,,,,,
5147,배스 OO색히,,,,,,,,,
5148,그저 그런 영화. 포제션,,,,,,,,,
5149,인시디어스랑 비슷하네요 인시디어스를 재밋게보셧다면 추천 아니면 개비추입니다,,,,,,,,,
5150,공포영화매니아입니다. 수많은 공포 영화중 오랜만에 긴장+무섭다란 느낌을 준영화..,,,,,,,,,
5151,영화는 괜찮은데 한국정서랑은 안맞다 엑소시즘같은,,,,,,,,,
5152,그냥대박,,,,,,,,,
5153,죽다살아남..영화관 네발로 기어나옴,,,,,,,,,
5154,와.. 진짜 깜짝깜짝 놀라게 되는 영화,,,,,,,,,
5155,후덜덜하네요.. 공포영화 셔터(태국)이후로 가장 무섭게 본 것 같습니다.,,,,,,,,,
5156,아  진짜 무서워서 죽는줄 알앗잖아ㅠㅠㅠ..이렇게 무서운 영화 첨 봣다.한번도 안가리고는 볼 수 없는 영화랄까.정말 공포스럽고 무섭다.하지만 마지막에 가족의소중함을 일컫게해주면서 감동을 주기도 했음ㅎㅎ..,,,,,,,,,
5157,허벌라게 무서움ㅁ,,,,,,,,,
5158,오랜만에 괜찮은 공포영화 봤네요 ㅎㅎ 얼마나 힘을 주고 봤는지ㅎㅎ 나오는 타이밍을 예측할수없어서 처음으로 영화관에서 소리지르며 봤네요ㅎㅎ 무서운거 못보시는분들은 영화관에서 보지마세요,,,,,,,,,
5159,대박이다...심야로 꼭봐야하는 공포영화,,,,,,,,,
5160,처음엔어..?무섭네 중반부부터는 전혀무섭지않음.,,,,,,,,,
5161,극장에본 최근래 공포영화 중에서는 최고다. 엑소시스트 생각이 나기도하겠지만 전혀다르다. 무서운거 못보시는 분들은 안보는게 좋을지도.,,,,,,,,,
5162,심장떨어지는줄 ㅋㅋㅋㅋ,,,,,,,,,
5163,새벽심야로 봣는데 정말 무섭다.. 옆에 대학교남학생들 앉아서 좀 든든햇지만 남자들도 비명지르더라.. 실화라니까  더 무서운 것 같기도 하고^^;;,,,,,,,,,
5164,이게공포지,,,,,,,,,
5165,파라노말 엑티비티보다 딱 4배정도 더 무섭다..처음부터 끗까지 무서운게 나오고 놀라고 긴당상태다.파라노말은 끝부분에서야 무서운데 이거는 처음부터 끝까지..,,,,,,,,,
5166,첨부터끝까지 무서운영화최고다 지금 까지본 공포영화중에,,,,,,,,,
5167,솔직히 시작하고 반까지재밋는데 예고편이 다라는게 함정. 중반부터 효과나 분장수준이 영 아니던데...보다가 웃을정도...별점도 딱 반만,,,,,,,,,
5168,저녁에 봤으면 나 죽었음 참고로 혼자 자취함,,,,,,,,,
5169,스토리도 탄탄했고 볼만했어요 ㅋㅋ재밌었음돈안아까워용,,,,,,,,,
5170,무서운 영화를 즐겨보면서 맷집이 좋아진건지 별 감흥은 없었으나,,,,,,,,,
5171,굿,,,,,,,,,
5172,중간만 깜짝 놀라고 후반부는 정말 별로...,,,,,,,,,
5173,제임스완 전작 인시디어스랑 비슷함 남자 주연까지 똑같음 ㅋㅋ 무서운장면 없다더니 대놓고 무섭게하려고 하고 그냥저냥볼만한영화 음향이 반은먹고 가는듯 아 그리고 갑자기 생각난건데 극장매너똥인놈들 패고싶음,,,,,,,,,
5174,돈 한편보는 값어치를 한다,,,,,,,,,
5175,방금 친구링 봤네요진짜 수작입니다공포 최고,,,,,,,,,
5176,이게 진짜 공포 존나 무섭,,,,,,,,,
5177,무서운장면없다메ㅋㅋㅋㅋㅋㅋㅋ극장에서 혼자욕하고 혼자놀래고ㅋㅋㅋㅋㅋ난만족스러웠음,,,,,,,,,
5178,satisfy,,,,,,,,,
5179,소름,,,,,,,,,
5180,웬만한공포영화를 다섭렵하고있는저인데 이건평점까지등록하게만들더군요..  특별한 장치가있는것도아니고 모든상황 모든사물들이무섭게느껴지고  연출이정말좋은작품이였습니다ㅠ간만에 너무좋은영화를 만나서 좋았습니다^^,,,,,,,,,
5181,팬티3장들고가세요,,,,,,,,,
5182,역시제임스완감독은 기대를저버리지않았다 자칫 B급좀비영화가되버릴수있는 소재를 퀄리티있는수작으로 탄생시켰다 스티븐킹의It에 히치콕을접목시킨듯한 새로운느낌이었다 공포영화매니아라면 꼭 관람권하고싶은 영화,,,,,,,,,
5183,진짜내가지금까지본 공포영화중에 젤무섭다 배우들연기는 말할것도없고 올해 나올 호러물중 최고일듯,,,,,,,,,
5184,최고다,,,,,,,,,
5185,평점잘안쓰는데  지린다...  ....,,,,,,,,,
5186,재밌었지만 파라노말 엑티비티와 비슷한 느낌을 받았다ㅋㅋㅋ공포영화+가족영화+종교 포교가 섞인듯ㅋㅋ,,,,,,,,,
5187,놀래서 소리질렀습니다,,,,,,,,,
5188,이건 정말 공포영화가 어떠해야하는지 말해주는 작품!!!! 심약하신분은 기저귀 차고 보기바람. 오줌 쌈 주의,,,,,,,,,
5189,한시도 긴장을 늦출 수 없는 최고의 공포였습니다,,,,,,,,,
5190,엄청기대햇던만큼은 아니지만 충분히 재밋고 공포스러웠다,,,,,,,,,
5191,진짜 최고최고 내가 새벽에 불다끄고 팔짱끼고 공포영화 보는 사람인데 이건 진짜..영화관에서 뛰쳐나오고 싶었음,,,,,,,,,
5192,개무서 최고임이런영화...,,,,,,,,,
5193,호성성님이  튀어나올것만같음,,,,,,,,,
5194,포스터 문구만큼 아주 무서운 영화는 아니지만 볼만하다 이런 호러영화 좀 많이 나왔으면,,,,,,,,,
5195,개무섭! 결말 내용이 아주약간 읭 스럽지만 충분히 무섭다 9.5주고싶은뎅... ㅎㅎㅎ,,,,,,,,,
5196,나 진짜 겁많은데 이건 생각보다 안무서웠다,,,,,,,,,
5197,야이..평점높아서 1이랑 2 둘다 봤는데 2000년대 초반 영화보는줄..이렇게 긴장감이 없어서야...공포영화 즐겨보는 사람이라면 이건 뭥미 할듯.,,,,,,,,,
5198,와 베스트댓글 말투다 존나 오글거림ㅋㅋㄱ알바티난다진짜오글거려디지겠네,,,,,,,,,
5199,귀신을 믿지 않고 어차피 영화라는 생각에 공포물은 잘 안보는데  연출도 좋고 을씨년스러운 분위기를 만들 줄 아는 감독 같아서 9점 평점 남긴다.,,,,,,,,,
5200,2~3번 정도 무서웠고 그닦... 옷장 위에서 마녀 점프신은 정말 무서웠는데 나머지는 뭐... 확실히 서양귀신은 안무섭다...,,,,,,,,,
5201,앞으로 쭉 제임스완의 공포영화는 믿고봐도 될 것 같음,,,,,,,,,
5202,이 시간에 혼자 보는데도 기대와 달리 무서운 건 전혀 없고 흥미진진했음 차라리 밤길 혼자 걷는게 더 무서울 듯,,,,,,,,,
5203,Ocn에서해주는거 지금 혼자 보고 있는데 밖에 비까지온다...졸라 무섭다,,,,,,,,,
5204,생각보다 무섭지는 않았다.ㅎㅎ,,,,,,,,,
5205,주온 엑소시스트를 잇는 최고의 레전드 공포영화. 더 말이 필요없네요.  심심할때마다 공포영화 왠만한거 다찾아보고 정말 재밌었다며 웃을정도로 공포영화 매니안데 이 영화는 웃음도 안나왔네요.. 새파랗게 질려서.,,,,,,,,,
5206,전혀 안무섭다 영화관서 봣었는데깜짝 놀라는정도에 스토리도 평범하고 그냥 킬링타임용,,,,,,,,,
5207,제임스 완 타입의 공포는 나랑 안 맞네. 안 무섭다.,,,,,,,,,
5208,그렇게 무섭지는 않던데...,,,,,,,,,
5209,그래도 주온이 최고다.,,,,,,,,,
5210,내가 공포에 면역이 있어서 그런지는 몰라도 그다지 무섭지는 않았다. 조금 놀라는 장면은 있었지만...,,,,,,,,,
5211,이나라엔 겁쟁이들 투성이군 ;;안무섭다못해 졸리더라,,,,,,,,,
5212,동생이 무섭댔는데 ㅠㅠ재미없어슈퍼내츄럴이 더 잼,,,,,,,,,
5213,극찬으로 봤으나 두번 졸았음 ...영화 여러게 짱뽕 시끼듯한 별 감흥없고,,,,,,,,,
5214,고전적공포영화ㅋㅋ뭐가무섭냐대체,,,,,,,,,
5215,하.. 이영화가 왜 15세인지 알거같다. 하긴 각자 취향이 다르니깐; 이건 귀신나오는영화 좋아하는사람이 재밌게 볼거같음. 살인사건이라길레 진짜 사람나와서 쳐죽이는건줄 알았네. 깜짝 놀래키게 장난치기만하고;; 후반부에...,,,,,,,,,
5216,스토리는 뻔하지만 무서워요 긴장감의 연속!,,,,,,,,,
5217,진짜솔직히 안무서움.혼자봤는데 놀라는장면이 다예상됬고 딱히 무섭지않았다개인적으로,,,,,,,,,
5218,난 별로던데....흠..,,,,,,,,,
5219,그냥 괜찮다.하지만 여기 거의 알바인듯 모르겠으나 진짜 무섭거나 누구말대로 식스센스에 견줄 영화는 정말 아니다.무섭다고 기대했건만 놀란적만 1번 기대를 잔득해서 그런지 사탄의 인형과 엑소시스트 짬뽕인것 같은 느낌 지...,,,,,,,,,
5220,무섭나..? 파라노말급인데.. 뻔하디뻔한 엑소시즘영화 그냥 예고편보세요,,,,,,,,,
5221,진짜 솔직히 말한다 일단 영화보지마세요 극장에서 무서운거 좋아하는사람은 진짜 보지마셈 뭐 영화가 결말이보이고 지루함 몰입이 전혀안됨 영화가 꼭 옛날 엑소시스트 따라한 느낌인데 전혀 노잼 진짜 재미없다 돈주고 봤는데 ...,,,,,,,,,
5222,무언가 말로 표현 할 수 없는 공포감,,,,,,,,,
5223,벽장에서진짜깜짝놀랏다....뒤에서박수칠때랑,,,,,,,,,
5224,귀신안나온다며..근데진짜무섭긴진짜무섭다 처음부터끝까지이렇게공포스럽다니 굿,,,,,,,,,
5225,밑에 indu 니 맞춤법이 더 불쾌감만 준다,,,,,,,,,
5226,진짜 간만에 제대로된 공포영화... 사운드 쩔어요 극장서 봐야함,,,,,,,,,
5227,그리 기대않고 봤는대 효과음 먼저 공포심을 극대화하고 그다음 혼이ㅠㅠ 엑소시스트에 나왔던 그녀보다 더 무서웠던 ..역쉬 공포는 극장에서 정말 재미지게 봤던 스토리도 전체적으로 지루하지 않았다.,,,,,,,,,
5228,정말온몸에소름돋았네요 오싹합니다 무섭긴한데 또보고싶다 강추!!!,,,,,,,,,
5229,이런 스릴을 즐기며 무서운 장면은 딱히 없는데 정말 짱짱해요! 꼭 봐야할 영화라고 저는 생각합니다. 눈을 감고 있어도 소리로도 충분히 놀랄 수 있는 공포영화입니다. 재밌는영화입니다.,,,,,,,,,
5230,별로 안무섭던데ㅋㅋㅋ 보면서 그저 지루했음,,,,,,,,,
5231,식스센스인지알았는데 엑소시스트,,,,,,,,,
5232,시바 평점 내리지마 이런영화는 여러사람들이 봐야하는거야,,,,,,,,,
5233,솔직히난 실망스러웠음 .주변말도있고해서 기대하면서본건데 내가무서운영화를 잘보는것도아닌데 솔직히 깜짝깜짝놀라긴했지만무서운건 아니였음 .갈수록더무서워진다는데 그닥... 그냥실화였다는데중점을두고볼만한영화,,,,,,,,,
5234,아놔 내방 붙박이라 다행,,,,,,,,,
5235,진짜무섭다ㅠㅠ공포영화인지도 모르고 시간딱떨어지길래봤는데똥쌀뻔했네 와,,,,,,,,,
5236,무서운 영화 잘 보는편인데. 그냥 그랬음.. 진짜 사람들 평점보고 후기 보고 와 진짜 볼만 한가보다 하고 봤는데...뭐...옆에 사람이 소리지른것 때문에 놀란거 빼곤.. 진짜 그냥 팝콘만 먹으면서 아무렇지 않게 보기...,,,,,,,,,
5237,기대엄청하고갔는데 별로 무섭지 않았어요. 아무래도 정서가 달라서인듯....,,,,,,,,,
5238,이게뭐가 무섭다는거임??? 잔뜩 기대하고 봤건만.. 여친은 보다 옆에서 코골고 자고.. 나는 언젠가는 무서운게 나올까 기대하고 봤건만.. 끝까지 무섭기는커녕 .....,,,,,,,,,
5239,엑소시즘을 다룬 다른 영화와 별 차이점이 없음. 이런류의 영화에 익숙한 사람이라면 별 감흥은 없었을듯,,,,,,,,,
5240,내가 이상한건지 모르겠는데 처음부터 무표정으로 계속 봤음 중간에 깜짝 놀라는거 뺴고는 딱히 너무 무섭다 이런 생각은 않들어서 옆친구 봤는데 귀막고 으어웋ㅎ헣 하면서 덜덜거리고있드라구...,,,,,,,,,
5241,얼마전에 꼭질보고 꼭지돌뻔했는디 이 영화는 괞찮네그랴~~~,,,,,,,,,
5242,영화자체는 안무서운거 같은데 왜 무서운걸까 ㅋㅋ인형 진짜 ㅠㅠ,,,,,,,,,
5243,잼있어요 공포영화 별루 안좋아하는데 오랜만에 공포를 느꼈네요 무서운장면을 눈뜨고 다 봐서 그런지보구나서 머리아파요ㅠㅠ 다음날 아침까지 아직도 머리가 아파요ㅠㅜ 멘탈붕괴 왔나봐요,,,,,,,,,
5244,지루할틈이없어요...이거보고 잠을 편하게 자본기억이..ㅠㅠ 친구랑울면서봤어요ㅠㅠ .다보고 .다리후들후들.,,,,,,,,,
5245,공포영화 잘안보는데보고나서도 개운하게 재밌네요,,,,,,,,,
5246,파라노말 액티비티 + 엑소시스트 짬뽕,,,,,,,,,
5247,그렇게 무섭지는 않다 실화를 소재로해 긴장감만 더하고 분위기만 무서웠을 뿐  심리적으로 그렇게 압박시키지 못한 공포영화이다. 심리적 압박을 느끼려면  그레이브 인카운털ㄹ 보는것을 추천한다,,,,,,,,,
5248,요약해드려요밤에 혼자보면 무섭지만 예고편 먼저 보고 두명이상 보면 덜무서움공포보다는 갑자기툭튀어나오는 부분이 많음 퇴마씬에서 영화 엑소시스트를 연상케 하지만 새로운 요소도 돋 보임해피엔딩으로 끝나서 뭔가 찜찜함실화인...,,,,,,,,,
5249,정말 너무뻔하고 별로무섭지도 않아요 완전실망. ..,,,,,,,,,
5250,내가 이상한건지 많은 기대한 탓에 흥미와 공포를 느끼지 못했다....ㅜㅜ,,,,,,,,,
5251,배급사 홍보력 대단하네 이런 영화를 제임스완이라는 이름으로 포장하다니,,,,,,,,,
5252,댓글알바아니고 진짜 와...말이안나오네. 무섭다고 느끼는 시각이 다르겠지만 나는 진짜 지릴뻔다.,,,,,,,,,
5253,시간을 보게 되는 뭔가가 있지만 눈을 뗄 수 없는 밀도의 공포,,,,,,,,,
5254,남자 여자 가릴 것 없이 모두 한마음으로 엄청나게 비명지름. 내 옆에 혼자 보러 왔던 여자는 보다가 중간에 집에 갔음. 내용보다도 관객들에게 공포를 주는 효과가 정말 장난아님. 그것만으로도 제대로 된 공포영화!,,,,,,,,,
5255,긴장감있고 괜찮음,,,,,,,,,
5256,풍경이 선명해지자,,,,,,,,,
5257,????그냥 그저그랬는데...뭐이래 극찬들ㅇ을 다하노..,,,,,,,,,
5258,내게 최고의 호러는  식스센스와 디아더스...,,,,,,,,,
5259,진짜무서웠다,,,,,,,,,
5260,무서운걸 원래 못봐서 무서운건 물론이고 갈수록 시도때도 없이 놀라질 않나 나중엔 아예 소리만 들었다... 마지막엔 감동적이기도 하고 무튼 난 인형이 시르다^^ 그런데 무서운 장면 없다는건 솔직히 뻥이야!,,,,,,,,,
5261,앞부분이랑 중간부분은 진짜 지루함,,,,,,,,,
5262,첫부분이 지루해서 나중부분도 그냥 놓쳐버림 재밌다는 사람들 이해안감 거의 이거때문에 해외공포영화 재미없다고 생각할정도,,,,,,,,,
5263,ㅋㅋㅋ무섭고싶다...긴장감1도없다... 심지어 보다가졸음...,,,,,,,,,
5264,학교에서 봤는데 난 놀라지도 않고  별로 안 무서웠는데.... 약간 지루하고  옷장귀신 은 무섭지도 않고  귀신 언제 나오지  라고 생각했는데  나만그런가  ?,,,,,,,,,
5265,예고편이 전부였던영화,,,,,,,,,
5266,흠... 옷장 손 말고는 딱히 무서운부분이 없음. 사람들 이용해서 광고 많이한 영화 같음  실질적인건 별로.. 무서운 장면없이 무섭지 않더군..,,,,,,,,,
5267,불법다운로드 쳐해서 코딱지만한 모니터로 이거 즐기려고 하지마라 히키코모리들아.. 진짜 영화관에서 재밌게본 공포영화,,,,,,,,,
5268,영화 엑소시스트 이후로 제일 낫다.밤에 혼자 볼륨 최대로 해서 봐야  제대로 심쿵 느낀다,,,,,,,,,
5269,무섭다고 하길래 기대하고 봤던탓일까요 무섭긴 커녕 웃음만 나옵니다  영화의결론 = 세례받으러가세요,,,,,,,,,
5270,초반은 괜찮았다 근데 이건 무서운영화가 아니라 깜짝놀라는 영화 그닥 무섭진않음 그리고 후반부부터 성경읽으면서 엑소시즘이니 뭐니하는데 한국 아침드라마보다 스토리 못짰다 하도 무섭대서 봤는데 억울하다 시간아까움,,,,,,,,,
5271,너무 지루햇어여 ㅜㅜ 지루해서 말이 안나오네여,,,,,,,,,
5272,공포영화의 수치!잘하면2저주는영화,,,,,,,,,
5273,무서운장면없이 무섭다고 난리이길래 봣더니 알바한테 낚인기분이 드네요. 결국 서양의 전형적인 엑소시스트 영화에요. 무서운장면이 없어서인지 진심 개지루합니다.잠이 와요... 참고하시길.,,,,,,,,,
5274,공포물 매니아인데 어디서 무서워 해야 되는지 모르겠다.제임스완 영화는 수준이 너무 낮아서 보기 힘들다,,,,,,,,,
5275,2분보고 광고가 허위 쓰레기라  1점 ㅄ들 무서운 장면의 근거가 뭐야??,,,,,,,,,
5276,내가본 영화중 최악 유치한 영화,,,,,,,,,
5277,방금 혼자 봤는데 내가 이상한건가 왜 안무섭지?,,,,,,,,,
5278,감독관둬라.. 제임스완 얘는 인시디어스도 그렇고 재능이 없다 ㅡㅡ 이런 삼류 미국식 공포영화가 흥행을 하는게 부끄럽네. 이딴영화말고 불신지옥이나 알포인트가 훨씬 무섭지. 미국영화로는 '무서운영화'시리즈...,,,,,,,,,
5279,결국은 무서운장면(귀신얼굴)이 티어나오고,,,,,,,,,
5280,너무 기대를 해서 그런가 무서운거는 전혀 못느꼈어요...전체적인 완성감이 3류 공포영화느낌이랄까...개인적인 취향이니 참고하세요~ 피식 웃을 수 있는 장면만이 기억에 남네요.,,,,,,,,,
5281,내가 봣을땐 사운드떔에 그럿지 가끔 움짤 할거 뿐이고 무서운거 딱히 없고 차라리 한국 공포영화가 더 무서운거 같음 본사람들말로는 물건던질수도 잇다 하고 진자 소리지르고 날리 나고 밤에 잠못잔다해서 진짜 긴장하면서 봣...,,,,,,,,,
5282,퉤니앓이 장난하냐 니리뷰보고 귀신 안나오는줄 알고 봤다가 개 놀랬쟌아,,,,,,,,,
5283,무섭지도 재밌지도 않았음...왠지 네이버영화 평점에 속은듯...ㅎㅎ,,,,,,,,,
5284,남자들 짜면서 도망침 ㅅㅂ 영화관에서 꺅꺅소리지르고 ; 물론 나도,,,,,,,,,
5285,전혀 무섭지않던데..ㅡㅡ 전형적엑소시즘영화..ㅋㅋ,,,,,,,,,
5286,이게 무서우면 밤에 잠은 어떻게 자냐 ㅡㅡ,,,,,,,,,
5287,엑소시스트를 다루는 장르의 다른영화로 피터콘웰 감독의 메디엄을 보는걸 추천. 무섭다고 느껴지는 장면은 없었음 그냥 드래그미투헬의 지저분한(?) 장면 같은것 뿐. 개인적인 평점은 6점대이나 네이버평점 알바로 상향된감이...,,,,,,,,,
5288,혼자봐도 무섭지 않다.,,,,,,,,,
5289,광고와 평점에 속아서 괜히 긴장만 잔뜩하고 봤더니  시간이 갈수록 지루해져서  내자신과 싸움하며 인내하며 봤다.,,,,,,,,,
5290,하나도 안무서움 ,,,,,,,,,
5291,난 이번에도 평점에 낚였다.무섭다고?? 어디서 무서워 해야되지?사람 날라 다니는거 보고 무섭다고 해야하나?5점짜리다.,,,,,,,,,
5292,다른분들이 다 재밌다고 해서 보러갔는데 전 하나도 안무섭던데요..그냥 팝콘만 맛있게 먹다가 돌아왔네요..무서운 장면은 없고 놀래키는정도? 옆에 초딩들도 그냥 보더만..,,,,,,,,,
5293,무서운 장면이 없다더니 끝까지 무서운 장면이 안 나오네.. 뭐지 이거?,,,,,,,,,
5294,여수밤바다가 적어도 1경배 무섭다 ㅅㅂ. 돈아까워라 아이고....,,,,,,,,,
5295,완전 기독교영화 기독교안믿으면 못사나요..저는불교인데차라리정말 엑소시스트가 나와서했다면 좋았을텐데..,,,,,,,,,
5296,호러가 아니라 코미디. 끝으로 갈수록 빵빵 터진다.,,,,,,,,,
5297,흔하디 흔한 영화,,,,,,,,,
5298,엑소시스트의 확장판? 아님 번외편이라 말 할 수 있겠다. 그나마 졸지 않고 볼 수 있게는 해준다. 딱히 새롭지도,,,,,,,,,
5299,스케일이 작아서...뭔가 답답하고 유치한느낌...30분보다 진짜 재미없어서 끄고싶었는데 돈아까워서 다본영화...,,,,,,,,,
5300,연출은 괜찮았으나 실화라고 낚아서 괘씸함에 1점 줌,,,,,,,,,
5301,노잼...지루한데 기대를너무많이햇나,,,,,,,,,
5302,진짜 공포영화못보는데...남자친구땜에 억지로봤음알바들댓글땜에 완전 겁먹어서봤는데 공포영화못보는 나도 그닥 무섭지도않고  잠잘때생각조차안남ㅋㅋ와 진짜  알바들대단타ㅋㅋ남친왈  이걸 공포영화라고만들다니 완전허무하다는,,,,,,,,,
