,content,,,,,,,,,
1693,잔인하지도 않으면서도 굉장히 무서워요.. 진짜 소름끼침.. 정말 잘만든영화!!!! 강추강추~~~~~~~~~~,,,,,,,,,
1694,재미있어요. 다른 영화보다 수준이 높고 내용구성도 튼튼합니다.,,,,,,,,,
1695,이영화보고 안무섭다고하면 쎈척하는거.....,,,,,,,,,
1696,괜찮은 공포영화입니다. 특히,,,,,,,,,
1697,컨저링,,,,,,,,,
1698,이러한 영화는 우리 영혼에 해를 입히는 영화이기는 하나 재미는 있네요 ㅋㅋ,,,,,,,,,
1699,볼땐 눈 똑바로 뜨고 잘봤는데 밤에 잠을못자요....,,,,,,,,,
1700,진짜 돈 안아까운 공포영화였다,,,,,,,,,
1701,컨저링보고 별로다 무섭지않다..... 하는사람들 귀막고 머리숙이고본사람들임 시각.청각 모두만족한공포영화였다.그랬는데.......,,,,,,,,,
1702,여자랑 함께보면 스킨쉽 굿별로 무섭진 않음 ㅋㅋㅋ,,,,,,,,,
1703,진심 엑소시스트이후로 이케무선영화첨이예요ㅠㅠ짱짱무섭고재밌음ㅋㅋㅋㅋ,,,,,,,,,
1704,우왕굳! 무서움! 몰입도최강! 흥미진진!,,,,,,,,,
1705,짱짱,,,,,,,,,
1706,역대 공포영화 저리가라다ㅋ 영화보는내내 심장조리고  내용역시좋고 보이지안는공포  ㅋ 진정한공포 인정ㅋ 돈안아까움,,,,,,,,,
1707,ㅋㅋㅋ아..엄마랑자야할듯,,,,,,,,,
1708,너무 무서워요 ㅠ.ㅠ..기대안했는데 파라노말보다 두배더 무서웡ㅠㅠ,,,,,,,,,
1709,기대한만큼 무섭네ㅋㅋㅋㅋㅋ오지다오져,,,,,,,,,
1710,말이 필요없는 영화 같네요 ㅋㅋㅋ,,,,,,,,,
1711,정말 무서웠습니다 ㅋㅋ 혼자서 보지말라는 이유를 알겠더라구요 진심 대박입니다,,,,,,,,,
1712,재밌네요 ㅋㅋ 올만에 공포다운공포느껴봄 ㅋㅋ강추요,,,,,,,,,
1713,그럭저럭 무섭게 잘 봤습니다.,,,,,,,,,
1714,막판까지 밀어붙이는 화끈한 호러,,,,,,,,,
1715,솔직히무섭다,,,,,,,,,
1716,영화 괜찮네요.. 공포영화 계속 많이 개봉하고 잘되기를 바랍니다..,,,,,,,,,
1717,아미티빌호러와 약간 비슷해서 실망 했지만,,,,,,,,,
1718,공포영화 즐겨보는대도 여태본것중 진짜무서움 공포물못보시는 분들은안보시는게 나을둣합니다...,,,,,,,,,
1719,Best,,,,,,,,,
1720,와 일단 영화스토리도 영화짜임새도 너무 몰입하게만듬 정말 무서운장면 몇없는데 몰입도때매 더 빠져들어서 무서워지는듯ㄷㄷ  진짜 공포영화 마니아면 꼭보세요! 강추,,,,,,,,,
1721,걍 최고,,,,,,,,,
1722,무서운 장면이 만힝 없었는데도 무섭고 잼있다,,,,,,,,,
1723,영화끝나자 감독 제임스 완 이라는걸 봤다.이분은 분명 인시디어스와 쏘우의 그분.....!감독 이름보자마자 역시 그래서 영화가 좋았구나 싶었다.최고다...그냥 최고.. 보는 내내 가슴졸이며 봤던영화.,,,,,,,,,
1724,지금까지 공포영화라고는 파라노말을 제일로 생각했지만,,,,,,,,,
1725,무서워요,,,,,,,,,
1726,공포영화 봐온것중에 제일무서움,,,,,,,,,
1727,내가 본 공포영화중 최고,,,,,,,,,
1728,뭐랄까...일단 결론은 내인생의 최고의 공포영화.. 너무 무서워서 정신을 못차릴정도 였고 진짜 이영화는 공포영화 레전드급으로 남을 영화일겁니다 꼭보세요 후회따윈 없어요 꼭 극장에서 봐야되는 영화 뭘상상하든 그상상 이...,,,,,,,,,
1729,오진다,,,,,,,,,
1730,계속생각나서 잠 못자고있음 ㅜㅜ,,,,,,,,,
1731,옷장위의 렝가 : 오늘밤! 사냥을나선다!,,,,,,,,,
1732,인시디어스 이후의 또다른 재미 강추,,,,,,,,,
1733,그냥무서움;;,,,,,,,,,
1734,지린다.. 지려 ㅠㅠ,,,,,,,,,
1735,말이필요없다,,,,,,,,,
1736,장난아니다내본것중 최고,,,,,,,,,
1737,예상과는 다른 공포가 있어서 재미있었던거 같아요 상상하지못한곳에서 놀래키니 많이 놀랐던거같아요,,,,,,,,,
1738,ㅎㄷㄷ,,,,,,,,,
1739,나를 들었다 놨다 들었다 놨다 하는구만,,,,,,,,,
1740,방금 막 보고왔는데 정말 강추입니다! 몰입도 장난아니고 끝났을때 안도의 한숨과 몰려오는 후폭풍 엔딩크레딧 올라갈때 나가는.관객들 보니 어떤분은 머리아프다 하시며 나가시더군요ㅋㅋ 공포영화로썬 정말정말 공포스런 영화 컨...,,,,,,,,,
1741,정~~~~말 간만에 공포영화다운 공포영화,,,,,,,,,
1742,보고나니 욕나와 넘무서워 코앞이영화관인데 넘무서워 택시타고 왔다 한동안 공포는 못볼듯,,,,,,,,,
1743,참 잘만듬진찐,,,,,,,,,
1744,최고!!  예고편볼땐 별기대도안했는데 기대이상임!!,,,,,,,,,
1745,진짜 재미잇게받어요,,,,,,,,,
1746,엑소시스트만큼 재미있는영화.. 잔인한걸로 덮어쓰는 어정쩡한 영화보다 훨씬  재밌고 무섭습니다. 극장에서 나오면서 사람들이 짱 무섭다고 웃으면서 나오는 영화입니다 꼭 보세요~ 추리할것도 없는 가볍게보기 좋은영화이고 무...,,,,,,,,,
1747,존 잼썼음ㅋㅋㅋ  공포영화 왠만해선 긴장안하는데 간만에 재밌게 봤음 공포중에 이런 종류에 약한데.. ㅎㅎ,,,,,,,,,
1748,공포영화 시시해서 안보는데 레알 꿀잼이였음. 가끔놀래켜주는데 주변반응도 재밌고ㅋㅋ 웃으면서 봄. 깔끔하고 워렌부부 진짜 멋있었다.,,,,,,,,,
1749,니야~! 니야~! 난 이소리가 잊혀지지가않더라 ㅋㅋㅋㅋ,,,,,,,,,
1750,짱무섭 ㅡㅡ,,,,,,,,,
1751,처음엔 볼만하다생각했는데 영화가 끝으로 갈수록 넘 무서워서 언제끝나나..기다렸어요ㅜㅜ  진정한공포에요..!! 비주얼로무서운게아니여서 공포영화못본다고 생각하는 사람들에게도 추천,,,,,,,,,
1752,주온이후롲ㅋ최고무스웃음ㅠ,,,,,,,,,
1753,와...진짜 스릴만점에다가 이게 실화라는게 더더더 소름끼친다..!!진짜 스토리도 탄탄하고 이 영화 대박날듯!!!!컨저링 내가 올해에 본 영화중에 단연 최고라고 뽑을수잇는 영화인듯,,,,,,,,,
1754,내가 살면서 본 공포영화중 최고인듯.,,,,,,,,,
1755,끼야,,,,,,,,,
1756,믿고보는 제임스완영화~쏘우부터이양반영화다찾아봄~인시디어스2도기대하겠어요 완씨,,,,,,,,,
1757,공포영화임 제대로된,,,,,,,,,
1758,허..오늘 기대하며 봤는데 진짜 무섭고 스토리도 갠찬고 잘 짜여져있슴 참고로 나는  공포 정말 좋아하는데 간만에 공포영화 넘 재밋는거 나와서 큰만족하고잇는중 ~ 아올~~^^,,,,,,,,,
1759,재밌다 진짜.. 귀신이 나오는 장면은 없는데 진짜 뭔가나올거같은 분위기에 소리에 웬만해선 공포영화보고 재밌단소리 안하는데 이건 진짜 볼수록 빠져들면서 재밌음,,,,,,,,,
1760,이정도면 완벽하지 뭘 더 바래,,,,,,,,,
1761,한번 보세요..진짜 영화관에서 소리지름 ㅜㅜ무서워요..정말로 ㅜㅜ,,,,,,,,,
1762,개인적으로 엑소시스트보다 무서워요 이것도 실화야 ㄷㄷ 손발떨림 ㄷㄷ,,,,,,,,,
1763,와 이건뭐 간만에 잼있게 본 공포영화다 집에 가는길이 무섭게 느껴진다. 닥치고 강추,,,,,,,,,
1764,어후 진짜 몇년만에 이런영화를 보는지,,,,,,,,,
1765,아직까지도 무섭다ㅠㅠ,,,,,,,,,
1766,너무 긴장하고봐서 보고난뒤에 힘풀려..,,,,,,,,,
1767,완전 무서웠어요... 제가 봤던 공포영화중에 가장 무서운 것이라고 할 수도 있어요....강추~~,,,,,,,,,
1768,보고OO뻔햇다 한1주동안은 혼자못잘거가틈ㅠ,,,,,,,,,
1769,무서워... ㅠㅠ 누가 안무섭데,,,,,,,,,
1770,재있다 꼬마들 넘 귀엽다ㅠㅠ 연기도잘하고,,,,,,,,,
1771,얼마만에  보는 진정한 공포영화인지 기억도 안난다몰입도 최고,,,,,,,,,
1772,짱,,,,,,,,,
1773,(박수소리) 짝 짝..,,,,,,,,,
1774,강추!! 이런 공포영화 기다리고 있었는데 굿!!,,,,,,,,,
1775,시각적공포+심리적공포 둘다 퍼펙트하다...진짜 엑소시스트랑 파라노말액티비티랑 다섞어논거같고...마지막 실화 사진은 소름이...진짜 무서운 장면의 설정이 대박이다..,,,,,,,,,
1776,ㅡㅡ아 지렷다,,,,,,,,,
1777,아이고 짱 무섭네예,,,,,,,,,
1778,대박 스릴만점 제일무섭다 심장이...,,,,,,,,,
1779,내가 지금까지본 공포영화중 최고다 제일무섭다기보단 제일공포영화다운것같다ㅠㅠ 또보고싶네...,,,,,,,,,
1780,정말정말정말무섭지만 진짜볼만한영화다아그리고갈때 속옷여벌하나챙겨가세요 저찔끔지렸음,,,,,,,,,
1781,짱,,,,,,,,,
1782,아오 진짜 개깜놀 마지막에 조용히 자막 나오는데 관중들 다 숨도안쉼 ㅋㅋㅋ  남자친구 옆에서 찍소리도못함 xx인줄,,,,,,,,,
1783,아 뒤에 남자 한숨 더럽게 많이 내뱉네 ㅋㅋ 그럴거면 그냥 보질 말던가.. 그만큼 무서웟나봄.,,,,,,,,,
1784,진짜또볼의향이있고봐도후회안하실거라장담해요!!그리고무서운거못보시는분은비추에요전오늘봤지만내일도또보러가요^^,,,,,,,,,
1785,ㅋㅋㅋ보는내내 무서웠네요ㅜㅠㅠ 친구랑보는데 진짜... 근데 앞 옆 뒤로 너무 덤덤하게 보셔서 소리도 못지르고.. 무서운장면은 그냥 쳐다도 안보고ㅋㅋㅋㅋ 소리만 들어도 그냥 무섭네요ㅠㅜ 이거진짜혼자보지 마세요ㅠㅜ 소름...,,,,,,,,,
1786,무서운장면보다는 전체적인 분위기가 압도하네요 재밌어요너무,,,,,,,,,
1787,진짜.........울면서봄,,,,,,,,,
1788,휴..간만에 보는 호러 수작..심장이 쫄깃쫄깃해짐,,,,,,,,,
1789,박수칠대 소름돋았고 사람들 비명지름 ㅠㅠ 근데 사람들 비명소리가 더 무서움 ㅋㅋ,,,,,,,,,
1790,한국 정서와는 약간 다를수있으나 확실한건 무서운영화임진짜 뮤직박스 거울뒤로 귀신 나올지말지 애간장태울때는 차마 못쳐다봄...미국사람들은 진짜 실신 할 정도로 무서울듯...잼께봤음,,,,,,,,,
1791,엑소시즘 영화의 새로운 걸작 탄생,,,,,,,,,
1792,좋음 생각보다 ㄱㅊㄱㅊ,,,,,,,,,
1793,장난아니다~아하,,,,,,,,,
1794,단언컨데...... 무섭습니다....... 간만에 심장쫀득했습니다.......,,,,,,,,,
1795,나름 괜찮은 공포영화였음,,,,,,,,,
1796,지릴뻔했어요ㅎㅎ,,,,,,,,,
1797,와우,,,,,,,,,
1798,허우 무서워욜 ..,,,,,,,,,
1799,공포영화다운 공포영화,,,,,,,,,
1800,대박대박대박 짱짱 짱입니다 그냥 무조건 보세요 ㄷㄷㄷㄷ 내용 모르고 봤는데 엑소시즘 하는 거고. 무려 실화를 바탕으로 한 영화,,,,,,,,,
1801,남친이랑 같이보세여,,,,,,,,,
1802,컨저링 무서운장면없이무서운영화라길래 기대했는데 미국에서는 피쳐바르고 이빨드러내는 생긴건무서운악령갑툭튀하는건 무서운장면이 아닌가보다 근데 옷장위귀신나오는장면빼고는 다 그저그럼 예고편이더무섭다 라는말이 이제서야 이해가감...,,,,,,,,,
1803,꼭 영화관에서 보셈ㅋ,,,,,,,,,
1804,이건 진짜다 꼭봐라 두번바라,,,,,,,,,
1805,너무무서워서눈물났어요,,,,,,,,,
1806,굳,,,,,,,,,
1807,쩌는 공포! 역대 공포영화 중 최고! 지릴 뻔했다ㅜㅜ,,,,,,,,,
1808,무섭네요ㅠㅠ,,,,,,,,,
1809,오랫만에 괜찮은 공포영화 나왔네요..  공포 영화치고 유치하지 않고 재미있고 시종일관 긴장감을 주고 뻔한 내용 같지만 재미없을 것 같은 내용을 잘만들었네요..,,,,,,,,,
1810,보는 내내 깜짝깜짝 많이 놀랐네요.. 이게 실화라는게 무섭기도 하고.,,,,,,,,,
1811,대박,,,,,,,,,
1812,영화 일단 재밌고요. 제임스 완... 낯이 익다 했더니만,,,,,,,,,
1813,실화여서 이영화가 산듯,,,,,,,,,
1814,굿,,,,,,,,,
1815,음... 엑소시스트 류의 공포물입니다.. 동양적 공포물을 좋아하는 사람이면 재미없을 수도 있겠다고 생각이 듬..,,,,,,,,,
1816,개 무서움. 초 무서움. 왠만하면 눈 꿈쩍안하는 내가 손을 꽉 잡고 봤어...,,,,,,,,,
1817,엑소시스트랑 거의 비슷한 내용이라 .... 근데 무서운장면있고 무서운영화에요 그놈의 박수씬은ㅜㅜㅜ,,,,,,,,,
1818,잔인한 장면 단 한장면 없이도,,,,,,,,,
1819,엑소시즘에 관한 무서운 영화!! 깜짝깜짝 놀라고  스릴짱이었음~~,,,,,,,,,
1820,난사실 컨저링 보고 별 재미와 무서움을 못느꼈다 하지만 연기자들의 진솔한 연기는 그 누구도 따라잡지못할 만큼 연기는 잘했다 이점에 칭찬한다.,,,,,,,,,
1821,무섭긴 무서운데내용은 참..엑소시스트랑 파라노말 짜집기같다..라는 생각은 나만 드는지..단순히 무서운거 보고싶은분들은 보세요,,,,,,,,,
1822,실화라는게 믿겨지지 않아요..,,,,,,,,,
1823,진짜 분위기조성도 너무 잘한거같구 내용도괜찮고오랫만에 무서운 영화봣네욤.. 진짜 무서워연..절대 혼자보지마세요~,,,,,,,,,
1824,기대보단 안무섭고 생각보단 내용이 괜찮고 예상밖으로 잔잔한 마무리,,,,,,,,,
1825,그냥 대박,,,,,,,,,
1826,오랜만에 나의 소름들을 불러일으키네.. 추천한다 형은,,,,,,,,,
1827,와ㅜ진짜.무섭다 ㅠㅠㅠ,,,,,,,,,
1828,진짜 제가본 영화중 최고다....,,,,,,,,,
1829,무서운 장면 없이 무서운 영화라더니!! 처음부터 끝까지 무섭잖아!!!!! c1발!!!!!!!!!!!!!!!!!!!!!!!!,,,,,,,,,
1830,얼마나 무섭냐면...남자들끼리 손잡고 봤다,,,,,,,,,
1831,지림,,,,,,,,,
1832,공포영화 그다지 좋아하지도 싫어하지도 안했지만 영화보는 동안 소름 세번정도 끼쳤네요... 공포로 처음 소름끼침이란거... 그래서 10점 드림,,,,,,,,,
1833,지린다,,,,,,,,,
1834,3시 7분이 싫다.막내가 남자라니.. 반전이 아닐 수 없다!,,,,,,,,,
1835,귀를막는 타이밍은 다르다!!!눈을감는 타이밍도 다르다!!!,,,,,,,,,
1836,무섭다 무섭다 그리고 무섭다.,,,,,,,,,
1837,진짜재밋음!!!!,,,,,,,,,
1838,아무서워ㅜㅜㅜㅜㅜㅜㅠㅜㅜㅜㅜㅡ,,,,,,,,,
1839,정말정말 정말!! 정말 재미있게 봤습니다. 더구나 귀신 나오고 막 뭐 나오고 하는것보다 엑소시스트나 폐가처럼 빙의물을 좋아하는데. 정말 제 입맛에 딱맞는 영화였고요. 개인적으로 공포영화중 제일 재미있었습니다. 최고였...,,,,,,,,,
1840,아직도 소름 돋는다. 코믹영화 만들 뻔한 영화시작하자마자 소리지르기 시작하신 대구롯데시네마 광장점 앞라인 여자분들만 빼면..,,,,,,,,,
1841,진심 개무섭다ㅡㅡ 와 진짜소름이 온몸을 휘감는건 진짜 첨이다,,,,,,,,,
1842,내가 공포영화 보면서 무서움이라는걸 느끼는건 굉장히 드문일인데 내가 지금껏 본 공포영화중 제일 잘 만든거같다,,,,,,,,,
1843,징심으로 혼자보지마세욬ㅋㅋㅋㅋㅋㅋㅋ,,,,,,,,,
1844,보는내내 재밌었다,,,,,,,,,
1845,무서워서 운적 처음이에요. 진짜 완전강추. 혼자보지마세요,,,,,,,,,
1846,추천합니당...,,,,,,,,,
1847,무서운 장르를 그다지 흥미없어하는 남자인데 궁금해서맘먹고 혼자 보러갔습니다.공포와 긴장을 함께 느낄수 있는 재미있는 영화였습니다.,,,,,,,,,
1848,극장에서 내가 제일 크게 소리지른거 같다. 소리지르고 나도 놀랬슴;; ㅋㅋㅋㅋㅋ 그담부터 입막고 봤다 ㅋㅋㅋㅋ,,,,,,,,,
1849,무서워 재미는 정말 죽임 공포를 원한다면 볼만함.,,,,,,,,,
1850,와나 아무리잔인한것도 무난하게봤는데 이건 다끝나고 화면올라갈때멍한상태..오늘 보는데추석전날이라관상타임못보고 걍 멋도모르거 이거보는커플이나가족들 많던데 장난아니라 영화관내에서 상치르느줄알았네..,,,,,,,,,
1851,와......진짜 엑소시즘.관련영화 본것중에최고임절대 혼자보지 마시길... 지금 온몸이 경직되서아파죽겠음...ㅠㅠ,,,,,,,,,
1852,기대했는데,,,,,,,,,
1853,정말 기대하고본영화  기대를 넘어섰다  즐겁고 무섭게봤다,,,,,,,,,
1854,진짜 기대없이봤는데 정말무서움ㄷㄷㄷㄷ,,,,,,,,,
1855,진짜 공포를 무엇인지 알게해주는 영화인듯.태어나서 본 공포영화중 제일 재밌게 봤습니다.여자친구랑 같이보러가시는거 추천드립니다.,,,,,,,,,
1856,말이 필요없고 정말 여태껏 본 공포영화 중에 최고로 스릴있고 돈이 아깝지 않은 영화였다. 진정한 공포를 느끼고 싶다면 이 영화를 강추 함돠!!,,,,,,,,,
1857,굿,,,,,,,,,
1858,뭐가 무섭다는 건지 모르겠다. 그래도 몰입도는 있었다,,,,,,,,,
1859,무서운 장면없이 그닥 안 무서운 영화.......사람들 마음이 약한거야..알바가 많은거야....잘뻔햇다...,,,,,,,,,
1860,저 오늘 보구 왔는데요 깜짝놀라는 부분이 많이 나와서 무섭네요 ㅠ무서운 장면 안나온다해서 봤더니.. 정말 스릴이 넘치군요!!제 친구는 보다가 눈물나왔서요~ㅋㅋ 암튼 이거 짱 재밌구용!계속보고싶은 중독성? 이 강하네요...,,,,,,,,,
1861,올해들어 개봉한 공포영화중 최고,,,,,,,,,
1862,이건 진짜 봐줘야함ㅋㅋ대박사건임ㅋㅋ,,,,,,,,,
1863,손떨리게본거같아요....,,,,,,,,,
1864,막 엄청나게 무섭거나 하지는 않고 적당히 긴장되고 분위기도 잘 잡힌거같아요 효과는 꽤 맘에 들엇고!,,,,,,,,,
1865,이것은 마치 기담+엑소시스트+사탄의인형을 방불케하는 초특급공포.... 하지만 저런것들을 합쳐놓은것만큼 엄청난공포와 사운드...  그냥.... 대   박,,,,,,,,,
1866,기대만큼...!!,,,,,,,,,
1867,공포를 느꼈다..그래서 9점.,,,,,,,,,
1868,한국 공포영화와 클라스가 다름 어제 잠자는데 무서워죽는줄...화장실도 못가겠다ㄷㄷ,,,,,,,,,
1869,연출 진짜 무섭게 잘하는듯 ㅋㅋㅋㅋ죤나무서어,,,,,,,,,
1870,재밌음,,,,,,,,,
1871,형어제심야로이거조졋는데진짜이만한공포영화가없다형이원래이런글남기지도않고하는데재밌어서 남긴다 결말이좀아쉽긴한대 재밌다개재밋자,,,,,,,,,
1872,재미있게 봤습니다. 근대 공포감은 제기대에 좀못미친것같아서 아쉽습니다 ㅠ 그래도 재미있게본것에대해서 만족하고있습니다,,,,,,,,,
1873,만약 이영화를볼때 잠이든다면 그건 행운일것이다,,,,,,,,,
1874,말이 필요 없는.. 진짜 최고!,,,,,,,,,
1875,무서운 장면안나온다면서 나오구ㅜㅜ 그렇게무섭지는않운데 큰화면과 빵빵한사운드로 보면 더 잼있게볼수있을듯!!!,,,,,,,,,
1876,무섭진않고 기분나쁜 영화. 그리고 조금 아미티빌생각났음ㅋㅋ 그영화도좋아함,,,,,,,,,
1877,난 여자아이가 침대밑에 뭐있나 찾을때가 젤무서웠음 예고편 안보고갔으면 더 재밌게 봤을듯 . 인영은 솔직히 좀웃겼음 사탄의인형 처키의신부닮아서 극장안 사람들 좀웃었음 ㅋ 그래도 시간가는줄모르고 잼있게봣다 ㅋ,,,,,,,,,
1878,무서운장면 없다더니 새빨간 거짓말..ㅡㅡ무서운장면없는건 숨바꼭질이지..,,,,,,,,,
1879,보이지 않는게 더 무서운 법,,,,,,,,,
1880,무서운거 못보는데 진짜 재밌네요 ㅋㅋ 뮤직박스? 소리가 너무 음산하고 무서움,,,,,,,,,
1881,그누가봐도 보통 이하라는 평은 안나오지 싶다 안무섭더고 쳐도 다음장면전개를 궁금해하고 기대하게되는 '재미' 가 있다 최소 대중이 영화를보는 근본적인 목적인 '오락' 은 놓치지 않았다 무섭...,,,,,,,,,
1882,그냥 잔인하기만한 무늬만 공포인 영화들을 넉다운 시키는 리얼공포..,,,,,,,,,
1883,8점정도인듯 소재는 좋은데 연출은좀부졷항듯 음악도 별로엿음 맨뒷자리서봣긴햇지만 뭔가좀몰입감이떨어지고 진부했음 집인테리어자체가 마마랑 패러노멀이랑똑같음.일어나는일도거의비슷. 헌데 긴장감은 마마가 훨씬 압도적이엇음. 놀...,,,,,,,,,
1884,적당한 공포 적당한 전개,,,,,,,,,
1885,실화여서 8점줘요 ㅋㅋㅋ아니면 6점재미있게잘봤네요 긴장감은 살인소설이더있는듯그래도 재밌게봤어요,,,,,,,,,
1886,무서운 장면 없다매? ..... 공포영화 못본 장면 반 이상 되는거 첨임.,,,,,,,,,
1887,평점많이준다해서 무조건 알바로 몰아가면안된다..최근 호러무비중 가장신선했다...전개도 매끄럽고,,,,,,,,,
1888,오랜만에 즐겨본 쫄깃한 2시간~!,,,,,,,,,
1889,많이 기대하고본거에 비해 좀 약하지만 원래ㄴ내가 이런거 잘보니 적당한듯효과음이 특히 긴장타게만들었고 악령에게 굴복하지 말라는 교훈까지 ㅋㅋ 저게 실화라니 참;; 여운은 딱히 안남은듯엑소시스트할때 악령에 저렇게까지 시...,,,,,,,,,
1890,문화적차이때문에,,,,,,,,,
1891,여태 봣던 공포영화중에 제일 끝내주네요실화라서 더 무서웟어요ㅋㅋㅋ 공포영화 잘보는데도 진짜 심장이쫄깃해짐안보신분들은 꼭봤으면 좋겠어요ㅋㅋ 밤에는 안보시는게 나을듯ㄷㄷ,,,,,,,,,
1892,공포라는 소재를 떠나서 영화 구성을 정말 잘했어요 지루할 틈없이 공포강도가 증가함 ㄷㄷㄷㄷㄷㄷ,,,,,,,,,
1893,왜 부산은 안하는거야!!!!!!! cgv 롯데시네마 이 생키들아 역시 메가박스가 최고다 관객수 3명있는 에반게리온도 상영해주고말이야 ㅋㅋ,,,,,,,,,
1894,알 수 없는 공포에다가 절망적인 공포,,,,,,,,,
1895,근래 가장 많은 사람들에게 가장 흥미롭게 얘기를 전달하는 감독 제임스완!,,,,,,,,,
1896,무서운장면은 많이 없는데 사운드로 깜짝 놀라게 만드는 영화.. 소리만 빼면 그렇게 무섭진 않음중반부부터 언제 깜놀구간이 나올지 예상가게됨,,,,,,,,,
1897,컨저링 유니버스를 가능하게 한 제임스 완 감독의 놀라운 연출력.,,,,,,,,,
1898,한줄로 요약은...너무 무서워서 똥쌀뻔했다.,,,,,,,,,
1899,평점이 왤케높지 이것보다 인시디어스가 더 음산한듯 옷장위 귀신보고 진짜 안무섭게 생겼다 생각했는데 ..,,,,,,,,,
1900,이젠 고전이 되어버린 작품,,,,,,,,,
1901,정말 말그대로 무서운 장면없는 무서움,,,,,,,,,
1902,엄청 몰입해서 봤다. 무섭고,,,,,,,,,
1903,제임스완 사기꾼. 무서운 장면이 없긴 왜 없어!,,,,,,,,,
1904,대박이다 신선하다 정말,,,,,,,,,
1905,5년만에 재감상. 깜짝 놀래키는거만 있지 스토리고 뭐고 하나도 없는 영화. 중간중간 가족이야기에 감동적인 음악 나오는건 뭐임. 제임스완 영화 단점이 뭐냐하면 바로 영화에서 산만하게 여러가지 이야기를 다룬다는점. (엑...,,,,,,,,,
1906,무서운 장면 없다더니...귀신같은 것도 나오고진짜 무서웠어요 귀막고 눈가리고 봤어요집에 와서도 계속 생각났어요 ㅠㅠㅠ,,,,,,,,,
1907,무서운 귀신영화라기보다는 스릴넘치고 박진감쩜. 정말 재밌게봤음 ㅋㅋㅋ,,,,,,,,,
1908,무서운 장면 없는 무서운 영화라고 뻥친 무서운 영화,,,,,,,,,
1909,그냥 공포영화 레전드임 이런거 다시나오기 어려움,,,,,,,,,
1910,진짜  보는내내 숨을 못쉬겠다  이제 숨셔도 되나? 했는데  문쾅쾅! 악령이 까꿍까꿍 ♡  진짜 넘나 무서운것  엑소시즘 하는 장면에서는  심장 부여잡고봄,,,,,,,,,
1911,남편은 트럭운전수로 수시로 출장중이고 말만한 딸은 다섯에  이웃집이라고는 없는 촌 동네에 난방도 제대로 안되는 집 전 재산 털어서 경매로 사고 멀쩡한 정신으로 살 수 있는 여자 있을까???,,,,,,,,,
1912,무서운 장면없이 무서운? 솔직해지자. 무서운 장면 겁나 많다. 걍 무서운영화!!,,,,,,,,,
1913,윳음며 잘 봤다나만 그런가,,,,,,,,,
1914,느릿느릿 말해서 듣는사람 속터지게 하는것처럼 연출이 너무 느려서 답답하다,,,,,,,,,
1915,정말 안무서웠음 인시디어스 시리즈 좋아하는데 3편도 그렇고 컨더링도 그렇고 기대이하임,,,,,,,,,
1916,밤에 불 다끄고 나혼자 이불 뒤집어쓰고 봤는데 난 진심 1도 안무서웠다  컨저링2는 이러지않길,,,,,,,,,
1917,예고편을 보지말고 볼걸..,,,,,,,,,
1918,2 보고 다시 봤는데 그닥ㅋ,,,,,,,,,
1919,별로 재미없어요 무지 무지 뻔한 연출,,,,,,,,,
1920,이거 장난아님...ㅎㅎ,,,,,,,,,
1921,그냥 난 그닥 안무섭던데 집에서 혼자 봣는데..,,,,,,,,,
1922,영적인 존재는 실체합니다.,,,,,,,,,
1923,별로 무섭지는 않고 그냥 스토리전개가 어찌될지 조금 궁금해지는정도? 기법이나 표현방식이 이전 공포영화에서 한번씩 봄직했던 것들... 컨저링보다 무섭다니 뭐니 엄청무섭다고 과장광고 좀 안했으면 좋겠네요,,,,,,,,,
1924,공포물을 좋아 하지 않은데. 언제 봤는지 기억도 없지만 본것중에는 손가락 안에 드는 작품인거 같다. 분명 귀신이라 칭하는 보이지 않는 존재라는게 있을것이고 과학적으로 설명이 안되는 빙의도 분명 존재 한다.  그것을 ...,,,,,,,,,
1925,귀신 없이 무섭다는 완 영화 광고가 무색할 정도로 귀신 천지,,,,,,,,,
1926,짐보는중 가족여행가고 집에서 혼자본다 난귀신잡는해병,,,,,,,,,
1927,이마트에도 팬티파나요?,,,,,,,,,
1928,영화를 끝까지 못보고 날밝은후에야 다 볼 수 있었다.... 대박 무섭다. 공포영화 원톱,,,,,,,,,
