,content,,,,,,,,,
3387,무서운 장면이 없기는 무슨.. 소위 말하는 '귀신' 나옵니다. 뭐가 안 나온다는 건지 참 원체 공포영화 안 보는데 이건 뭔가 참신한 영환가 싶어서 봤다가 깜짝 깜짝 놀라기만 했음 별반 다를 거 없는 공...,,,,,,,,,
3388,파라노말 액티비티+엑소시스트+처키싸게 잘만들었다.,,,,,,,,,
3389,처음에 지루하고 그나마 나중에 몰입이 되는데 그냥 갈수록 좀 징그럽고 중간중간에 놀래켜서 그렇지 완전 무섭고 그렇진 않더이다. 실화라는 점이 소름돋음.,,,,,,,,,
3390,BEST댓글 1위가 그냥 정답입니다.,,,,,,,,,
3391,무서운 장면 없이 무섭다더니..,,,,,,,,,
3392,와~~대박 쩝니다ㅋㅋㅋ보는 내내 숨죽이며....으악ㅋㅋㅋ여태 공포 영화와 차원이 다른 영화에용!!보셔도 후회안하실꺼에요....하지만 무서운거 진짜 못보는 분은...안보시니게 나을거같습니다!!!!두둥~~,,,,,,,,,
3393,아 다행이다 오늘 혼자자지는 않으니깐 휴,,,,,,,,,
3394,완전 대박 무서움 ㅠㅠㅠ,,,,,,,,,
3395,이런진짜.. 자취방에서혼자보는데 너무무서워서 온갖욕을다하며봤네요ㅠㅠㅠ 파라노말액티비티 비슷한영화인데요 파라노말보면서 내가본최고의공포영화였는데 컨저링은 달라요 정말 극한의 공포를 체험하고싶으면 혼자보세요!!,,,,,,,,,
3396,이정도면 볼만하다.포스터에는 낚인듯,,,,,,,,,
3397,기대이상으로 몰입감과 긴장감이 괜찮았고한층 침체중이던 공포영화장르에서 간만에선방한영화로 느껴짐,,,,,,,,,
3398,진짜 더럽게 무섭다 ..ㅋㅋ,,,,,,,,,
3399,무서운거잘보시는분들 너무무섭진않더라구요~ 재밌긴한데 중간중간 깜짝깜짝 놀라는장면은 있지만 막 무섭다까진아닌거같아요~~내용은탄탄한데 끝이약간허무함...,,,,,,,,,
3400,뻔할 수도 있는 소재를 뻔하지 않은 공포영화로 만들다.,,,,,,,,,
3401,인시디어스를  뛰어넘지 못한거 같아 아쉽다,,,,,,,,,
3402,32년 살아 생전 첨으로 평점 남깁니다.컨저링...그 공포스러움의 압도 당했습니다.진심 최고..그리고 경의스러움~~,,,,,,,,,
3403,음산함과 스산함,,,,,,,,,
3404,너무무서워서심장째질뻔...ㅜㅜ,,,,,,,,,
3405,ㅋㅋ재밋어요~~~~^^*,,,,,,,,,
3406,공짜표생겨서 봤는데 너무무서웠다ㅠㅠㅠ오펀천사의비밀도 무서웠는데 이건 몇배로 더 무셔 ㅠ실화라서 더했음,,,,,,,,,
3407,그렇게까지 무섭진않지만 실제로 일어날수있다는게 너무 무섭다.그리고 천주교신자로써 많은걸 느낄수있는 영화였음,,,,,,,,,
3408,아주 진짜 죽는줄알았네요 아후 머리아퍼 나오자마자 게보린먹었어요 보는내내 너무 힘들었어요  책임지세요 후유증 며칠갈듯.. 댄장..ㅠ,,,,,,,,,
3409,소재의 참신함이나 반전이 없어서 만점은 아니지만 가히 공포영화 중에 손에 꼽을만한 작품에는 분명하다. 영화 끝나고 자막올라갈때 대부분 자리를 못 일어날정도로 압도적이었다. 단 고어물 찾는 사람에겐 비추.,,,,,,,,,
3410,진짜 재밌게 봤습니다 제가 좋아하는 장르다 보니 GOOD~~~~,,,,,,,,,
3411,제임스 완 표 공포물 좋구나~~ 인시디어스도 그렇고 아주 좋네요,,,,,,,,,
3412,아.. 혼자자는데 무서워서못자겟다,,,,,,,,,
3413,진짜 무서웠어요ㄷㄷㄷ,,,,,,,,,
3414,마음 따듯해지는 가족영화.,,,,,,,,,
3415,개무서워완전무서워갠히봣네,,,,,,,,,
3416,무섭긴한데 파라노말 액티비티랑 엑소시스트 짬뽕한 느낌,,,,,,,,,
3417,꽤 신선한 것같지만 무서운건 별로 없었던것 같았다,,,,,,,,,
3418,공포영화라기보다 악령 퇴치 영환데....볼만해요 스토리도 괜찮고 해피엔딩이고 ㅋㅋ,,,,,,,,,
3419,와 오랜만에 공포영화 눈 감고 실눈뜨면서 봤네. 그리고 이건 극장에서 봐야 더 실감날듯 ㄷㄷ,,,,,,,,,
3420,진짜 내용 공포 둘다 우수했어,,,,,,,,,
3421,나 공포영화 디게 즐겨보고 딱히 무섭다고 느껴보지 않았었는데 이건 진짜 심장이 쿵쿵했던 부분이 많았다.. 특히 장롱위에서 귀신뛰어내릴때랑 박수칠때 등등.. 근데 결말이 좀ㅋ 절정을 치닫다가 갑자기 너무 확 끝나버림....,,,,,,,,,
3422,내가본 공포영화 중에 최고! 영화끝나고 다리떨려서 못 일어날뻔ㅋㅋ,,,,,,,,,
3423,군더더기 없이 잘 만든 장르 영화라 생각된다. 충실했고 성공적이었다,,,,,,,,,
3424,딘과샘이 생각낫던 영화ㅎ.ㅎㅋㅋ,,,,,,,,,
3425,쏘우가 우연이 아니었다. 이 감독,,,,,,,,,
3426,하나도 안무섭고 시시하다고 했던 사람 누구야,,,,,,,,,
3427,최고 내가본 공포영화중 최고,,,,,,,,,
3428,간만에  좋은 영화 굿~ 최고~,,,,,,,,,
3429,갑작스럽게 보러가게되어서 사전검색 이런 거 하나도 안하고감ㅋㅋㅋ마지막에 실제있었던일이라는 기사랑 사진들같은거보고 좀 충격받음ㅋ,,,,,,,,,
3430,정말 무서운거 안나오는데정말 무서운영화가족끼리,,,,,,,,,
3431,진짜지린다..ㅜㅜ애들도 연기를다잘함..밤에혼자보는데무서워죽는줄..마지막엔 감동이..,,,,,,,,,
3432,무서운 장면없고 재미없다면서요? 보다가 장농위에서 내려오는데 깝놀했구먼~~ 귀신도 안나온다매~!,,,,,,,,,
3433,컨저링 별로 안무섭다는 사람들이 있는데 영화로보면 나도 안무서운디 이일이 자기들한테 실제로 일어낫다 생각해봐 안그래도 이이야기가 실환데...ㄷㄷ 실제로 일어낫다생각하면 안무섭다고 말못할껄..ㄷㄷ,,,,,,,,,
3434,시도때도 없이 귀신이나 괴물이 나오는 공포영화보다 몇배 더 훨씬 더 소리와 분위기가 압도적이고 이 영화내용 자체가 실화라는게 믿겨지지 않을 정도.. 아.. 사실 저 보면서 울었어요.. 아주 조금.. 진짜로 조금.. ...,,,,,,,,,
3435,진짜 개쩐다 최고의 공포다!!!,,,,,,,,,
3436,무서운건 모르겠는데 갑툭튀ㅜㅜ,,,,,,,,,
3437,ㄷ 덜덜 무서웠음 30대 남자,,,,,,,,,
3438,한번은 볼만하네요  귀신이 시도때도없이 등장하는건 아닌데 잼네용12살동생도 몰래들갔는디 볼만햤음,,,,,,,,,
3439,무서워요!짱~bb 컨저링 대박...,,,,,,,,,
3440,무서운 장면 많은 무서울 듯 말듯 한 영화. 오락용으로는 괜찮다.,,,,,,,,,
3441,재밌음!!!오!!!,,,,,,,,,
3442,그림으로봐선그닥안무서워보였었는데 보니안그렇더군요...넘피곤한상태서보긴했는데 졸면서...그래도무서었어염..ㅎㅎ,,,,,,,,,
3443,진짜 무서웠어요..깜짝깜짝 ..ㅠ  평소에공포영화꽤 잘보는타입이라잘 안놀라는데 이건무섭네요..,,,,,,,,,
3444,와 제임스완 감독자체가 공포영화를 잘만든다!,,,,,,,,,
3445,보미랑 봣어요 무서워서 껌짝놀랫는데 보미는 안무서웟나봐요 챙피햇어요 근데 짱무서워요,,,,,,,,,
3446,효과음위주에이건뭐. .기대가커서별로안무서움.엄마근데오늘하루만저랑같이자요ㅋ,,,,,,,,,
3447,샤이닝 사일런트힐 기담 이후로 제일 재밌는영화. 너무재밌게봐서 댓글쓰러왔음 대충 댓글들을 훑어보니 정말 다 같은 심정으로 영화를 봤구나 생각됨. 공감버튼 종니눌러줘씀 왜 평점이 8점밖에 안돼지;?처음부터 끝까지 엄청...,,,,,,,,,
3448,카메라 앵글이나 동선까지 불안함을 끌어내기에 매우 훌륭한 장치가 되었다. 의도된거인지 모르지만 극장 온도도 매우 낮아 소름이 훨씬 심하더라. 청각 시각 균형감각 촉각(온도) 로 매우 과학적으로 사람의 감정을 들었다가...,,,,,,,,,
3449,시간가는줄 모르고 봤어여^^액자떨어질때 소리가 너무커서 깜짝놀랐어요,,,,,,,,,
3450,이때까지본영화중....최고라고할수있다셔터이후정말무서운반은눈가리고봤음심야영화봐서집갈때후덜덜공포물좋아하는사람꼭보길요,,,,,,,,,
3451,영화가 잔인해서 무서운게 아니라 왠지 무서운게 튀어나올거 같은 분위기를 조성해서 무서웠어요. 엑소시스트랑 파라노멀을 섞은 듯한 느낌이었어요. 간만에 고급스런 공포영화봤네요.,,,,,,,,,
3452,레알 재미있다내가본 공포영화중젤 재미있다깜짝 깜짝 놀라는것뿜,,,,,,,,,
3453,피 한방울 안나오면서 엄청 무섭다~~~~ 쵝오,,,,,,,,,
3454,보는내내 보통입니딘ㅎㅎ,,,,,,,,,
3455,잔인한 장면도 없는게 이건 진짜 더럽게 무섭다 ㅠㅠ,,,,,,,,,
3456,징그러운 영화가 아니라,,,,,,,,,
3457,귀신보다 무서운 몰입도와 긴장감.어둠속 카메라 앵글 하나만으로 엄청난 소름을 유발했다.,,,,,,,,,
3458,재밌다!!! 무서운장면 안나온다고 한건 낚시였군ㅋㅋㅋㅋ,,,,,,,,,
3459,내가본공포물중 사일런트힐과함께 최고로무섭네요ㅜ 알바아니예요ㅋ 어제신랑하고봤는데 커플들추천할게요 두시간동안계속긴장감이ㄷㄷㄷ,,,,,,,,,
3460,400석 짜리 극장에서 혼자봤다.. 발가락까지 쥐나서 죽는줄 ㅠㅠ,,,,,,,,,
3461,무서운거좋아하면ㅂㅎ셈 걍존나뮤섬,,,,,,,,,
3462,공포영화인데 고혹적이다.,,,,,,,,,
3463,요약: 가족은 사랑입니다,,,,,,,,,
3464,너무재미있어!!!!~~~~,,,,,,,,,
3465,진짜..재밌음ㅜㅜ♥,,,,,,,,,
3466,완급조절이 훌륭한듯!,,,,,,,,,
3467,누가무서운장면안나온다고하던가요..ㅠ흑흑 중반부터 졸무서움 바들바들떨면서봣음요 ㅜ,,,,,,,,,
3468,정말 잘 만든 공포영화. 대놓고 무서운 장면 없이도 영화가 무서울 수 있다는 것을 새삼 깨달았네요. 하지만 무서운 장면이 아예 없진 않네요,,,,,,,,,
3469,별로 안 무섭 진짜..정말 무서운거 못보는친구 두명도 같이 갔는데 잘봄. .안 무섭다면서 ...ㅋㅋㅋ 그리고 후반부는 그래도 괜찮은데 처음 지루함,,,,,,,,,
3470,무서운 장면 안나온다는거는 솔직히 개뻥이고,,,,,,,,,
3471,으헉 오랜만에 가슴 졸이면서 본 공포영화 첨엔 좀 지루하지만 후반 30분 가량 압권!,,,,,,,,,
3472,영화관에서 봐야 진짜다.    뭐랄까... 그런거있잖아 귀신나오고 그런영화. 그런느낌은아닌데  존나 심장두근거리고 입술이 말라가고 팝콘도안먹고..   무섭다솔직히ㅋㅋ.  결말은 뭐 공포영화에게 대단한 결말을 바랄순없...,,,,,,,,,
3473,스토리성은 다른 영화들과는 그렇게 크게 다르다곤 느끼지 않았는데 뭔가 또 다른 공포심을 느끼게 해주더군요 한번보면 오래 기억에 남는것같아요,,,,,,,,,
3474,10점 이상의 영화인듯 하다,,,,,,,,,
3475,무슨말을해?? 최고!!! 정말 무섭게재밋음,,,,,,,,,
3476,안심할틈을 주지않았다 숨쉴틈없던 공포,,,,,,,,,
3477,와 진짜 짱 재밋고 짱무서움...ㅠㅠ,,,,,,,,,
3478,무서운장면을 더살릴수있었는데아쉬웠다 영매하는 사람이 귀신들과접촉할때 강력하게나와서 접촉했으면 더멋있어보엿을듯,,,,,,,,,
3479,역시 제임스완 공포영화는 볼때랑 바로 보고난후는 별로 안무서운데 집에가서 혼자 누워서 조금씩 생각해보면 무서워지는 영화..,,,,,,,,,
3480,약간  유치한  장면들  빼고..흠.. 나름대로  재밌었음~,,,,,,,,,
3481,심장을멈친것같의 마크 무서고 또는밥이되면 악령이보이돼요 ㅠㅠ,,,,,,,,,
3482,불끄고 방에서 혼자 보다가 다 끝나가는데 집에서 뭔가 우장창 떨어지는 소리가 났어요...ㅜㅜ,,,,,,,,,
3483,제임스완이 쏘우를 뻘로만든게 아니었어 진짜 영화보는 내내 기저귀를 가지고오지않은걸 후회하게만드는 영화 정말 브금하나로 쫄게만듬,,,,,,,,,
3484,킬링타임용. 나름 신선했다,,,,,,,,,
3485,진정한 공포ㅠㅠ그냥 공포영화라고 하면 귀신나오고 그러는대 이건 귀신 4번? 나오나진심 귀신나오는 것보다 더 무서움ㅠㅠ,,,,,,,,,
3486,방식은 달라도 파라노말1의 탄탄함과 3의 아이디어가 잘 조화된 듯 한? 다른 영화들의 장점도 적절히 조화,,,,,,,,,
3487,결말은 짠한,,,,,,,,,
3488,볼만했음~ 뭔가 반전이 있을것 같았지만.. 실화로 제작된 거니까,,,,,,,,,
3489,예고편에 극장반응 나와서 사람들 완전 겁먹길래 기대하고 봤더구만 별거 아니네...,,,,,,,,,
3490,무서워도 너무 무서워~>.<,,,,,,,,,
3491,제임스 완의 색다른  선물,,,,,,,,,
3492,자꾸 깜짝깜짝 놀래켜서 영화관에서 비명 질렀던 기억이 나네요..ㅋㅋ실화라서 더 재밌었어요~~10점짜리는 아닌데..울나라 공포영화에 비하면 10점짜리라서 10점 드립니다~,,,,,,,,,
3493,실화라서 더 긴장하면서 봤슴 대에박!,,,,,,,,,
3494,이영화가 만약 관상정도 개봉관 점유율이었다면 지금쯤 천만은 쉽게 넘겼을듯. 입소문타고 점점 관객수 느는거봐라나 진심 이영화보다 지렸다!  내 인생 최고의 공포영화!제임스완감독 팬되부렀다!,,,,,,,,,
3495,귀신 수도없이 나오는구만 귀신이 안나온데,,,,,,,,,
3496,무섭다기 보다는.... 음.. 깜짝깜짝 놀라는?ㅋㅋ 한기가 느껴졌었던건 확실한듯ㅋ 더위를 날리고 싶다면? 지금 당장  컨저링 보러 ㄱㄱ씽~,,,,,,,,,
3497,재미있어요!! 다른 영화들은 귀신만 출연해서 바쁜데 컨저링은 귀신없이 무섭고 놀라고 재미있으니까 더 새롭고 좋은것같아요. 정말 잘 나온것 같아요 이영화 적극 추천합니다!(참고로 이 영화는 보는사람에 따라 다르다는거 ...,,,,,,,,,
3498,놀라기만 하는 영화가 공포영화인가? 이게 진짜지..,,,,,,,,,
3499,재미재미재미재미재미,,,,,,,,,
3500,포스터만 보고 티켓 예매했던 날 죽이고 싶었다,,,,,,,,,
3501,개인적으로 깜놀류갑... ㅋ,,,,,,,,,
3502,요즘 나오는 공포물은 워낙 잔인하여서 싫었는데  제대로 공포를 느낄수 있는가족영화라 보고난후에도 후회되지 않네요,,,,,,,,,
3503,진짜 공포영화를 간만에보내요,,,,,,,,,
3504,솔직히,,,,,,,,,
3505,거짓말마요 무서운거 안나온다면서요 귀신 겁나튀어나옴 ㅎㅎ,,,,,,,,,
3506,내가 겁이 없는건지 심야로 혼자 봤는데 하나도 안무서움... 그러나 잘만든 영화인것같음,,,,,,,,,
3507,나만 유독 소리 질러대서 영화관서 죄송했습니다...끝이 훈훈해서좋았슴,,,,,,,,,
3508,호러의 룰을 그대로 따라갔고 나름 스릴있었고 재밌었어요,,,,,,,,,
3509,새벽 두시에 롯시에서 칭구들ㅇ이랑 보러갓는데  보면서  지릴뼌..,,,,,,,,,
3510,최고다. 꼭 봐라 이거보면서 진짜  아우 ㅎ,,,,,,,,,
3511,무서운거 나오고 귀신도 나오는데 왜 안나온다고 광고를하지?,,,,,,,,,
3512,평점보고놀랬네..8.12??장난하나??10점줘도모자라네..공포영화좋아하는데이건엑소시스트와좀비슷하지만서도몰입하게되네요...근데..무서운장면없이무서운영화??장난??죄다무섭구만,,,,,,,,,
3513,공포 영화하면 잔인하고 피범벅에 흉찍한 괴물출현.. 야한장면..그런 고정 관념없이 신선하게 무서웠고 스릴 넘쳤다.,,,,,,,,,
3514,"2시간이 이렇게나 길줄이야.... 아 언제 끝나 언제 끝나 ~ ㅠ_ㅠ""",,,,,,,,,
3515,아 죽는줄....ㅠㅠㅠ,,,,,,,,,
3516,이렇게 진부적인 소재로,,,,,,,,,
3517,물론 개인차가 있겠지만.... 전 그다지 '정말 무서웠다'라는 생각은 안들었던것같네요.,,,,,,,,,
3518,진짜 보는 내내 사운드의 공포에 시달려야했다. 술래잡기를 할때 짝짝거리는 손뼉치는 소리를 들을 때마다 등줄기로 소름이 내달렸다.,,,,,,,,,
3519,무섭다기보다 깜짝 놀라는 장면이 두세군데 있었음,,,,,,,,,
3520,이거 보고 계속 혼자있을떄 주위둘러봄ㄷㄷㄷ...,,,,,,,,,
3521,학교 동아리에서 봤는데 생각보단 별로. 무서운것도 그냥 무섭다무섭다 하니까 무서운 것 같고,,,,,,,,,
3522,무서워요....실눈뜨고 봤네요..ㅋㅋㅋ진짜공포영화입니다ㅜ.ㅜ,,,,,,,,,
3523,기대이하. 넘 기대 많이햇엉,,,,,,,,,
3524,메켄지 나왔으니 10점임 다른 이유는 필요없음,,,,,,,,,
3525,콘스탄틴 본담에 바로봤는데... 액션영화같음... 진짜임ㅋㅋ 님들이 한번 봐보세요,,,,,,,,,
3526,막.. 끄어어억!!! 할 정도는 아니고.. 그냥.. 오~제법;;.. 할정도임..잔잔하니 연인 끼리 손잡고 보기 좋은 영화임..,,,,,,,,,
3527,글쎄..분위기만으로 공포를 연출했다고? 귀신이 안나오는것도 아니고...애매함,,,,,,,,,
3528,형 공포영화 내 인생 다 걸고 최초로 소리 두번 질렀다 ㅅㅂ,,,,,,,,,
3529,포스터가 가장 무섭네요무서운장면없는 무서운영화라니뻥치긴 ㅋㅋ영화관에서 보고 정말 지릴번했습니다여자 앞이러 쌘척 했지만 심장이 계속 두근대 ..포스터로 사람낚은거에서 0.5점 감점에귀신 퀄리티.. 좀 뻔해서 0.5점 ...,,,,,,,,,
3530,많이본 배경... 스토리....고로 내게는 공포스럽지 않다는거,,,,,,,,,
3531,다른말 필요없다. 지렸다,,,,,,,,,
3532,너무무섭다 소름끼쳤어 보면서이게실화라니ㅜㅜ,,,,,,,,,
3533,무섭진않았지만 스릴있는부분이 좀있더군요 영화재밌게봣네요.팬티좀갈아입어야겠어요.,,,,,,,,,
3534,개무거워..ㅡㅡ 쩌러!,,,,,,,,,
3535,평일 조조로 봤었는데 극장에 아무도 없고 저 혼자서....와.... 강심장 인데실눈 뜨고 보긴 첨 이네요... 오랜만의 심장을 쫄깃하게 해주는 영화 였습니다!!,,,,,,,,,
3536,공포영화다운 영화였음~ 긴장하게 만드는~~ 짱!!!!,,,,,,,,,
3537,너무너무 무서웠어!!! 남자 셋이서 허우적 거리면서 봤음 ㅋㅋ,,,,,,,,,
3538,긴장감 있어서  좋긴한데... 약간 밋밋한듯...그리고 아무것도 안나오는데 소리들은 왜 지르는건지...,,,,,,,,,
3539,31살.. 내 인생 최고의 공포영화라고 해도 과언이 아니다...,,,,,,,,,
3540,무서운영화못보는데 이영화봐서 이제 모든 무서운영화 다볼자신있어짐....영화끝나고도 온몸에 소름이 안가심...,,,,,,,,,
3541,진짜 무섭고 진짜 재밌습니다.,,,,,,,,,
3542,정말 간만에 돈안아깝게본 영화인듯 ^_^,,,,,,,,,
3543,귀신나오는데 왜 안나온다고 뻥침?-ㅁ-? 그것은 귀신이 아니고 영혼인거임?ㅎㅎ별로 안무섭,,,,,,,,,
3544,잔인한장면없이...이정도면 훌륭하다  제작비도 얼마안들었을듯...,,,,,,,,,
3545,실화라서 더 무섭고,,,,,,,,,
3546,엑소시스트 이후로 제대로 된 공포영화를 봤네요. 엑소시스트류의 공포영화를 좋아하신다면 꼭 보라고 추천합니다.,,,,,,,,,
3547,간만에 괜찮은 공포영화 잘봤다응~지극히 개인적으로 완죤 무섭진 않았응~담에 집에서 볼꺼놓고 혼자 다시 함 봐야징~ㅋㅋㅋ,,,,,,,,,
3548,진짜 공포영화답게 재밌게잘봄.재밌다는게 웃기게재밌다는게 아니라 말그대로공포영화라는느낌을 줌.나는 무섭다라는 느낌보단 긴장탄다고해야하나?자꾸 나올듯안나올듯하고ㅋㅋㅋ무조건귀신이아닌 적당히 사람놀래키면서..안보신분들은 보...,,,,,,,,,
3549,싫은 놀이기구가 끝나지 않는 느낌;내 몸에 안좋은 영향을 끼치는 듯한 느낌;보고나선 그냥 너무 찜찜했어서괜히봤다 싶었는데,,,,,,,,,
3550,지금까지본 공포영화중에서 제일무서웠다..진짜..ㅠㅠ심장이오그라드는구만,,,,,,,,,
3551,여자혼자 금요일날 9시 10분에 봤다 맨구석 자리에서 마구다 커플 사이에서 난 혼자봐따 ...  식스센스를 엎을만햇다 . 혼자 보지 말라햇는데.... 진정한 공포란 컨저링이 답이다.,,,,,,,,,
3552,아 모야 지워졌네 ㅋㅋ 암튼 기대 안했는데 무섭게 봤음 특히 사운드가 +_+ㅎㅎ글구 외국인들은 호기심이 많은듯..이상한 소리 나면 가질 말아야지,,,,,,,,,
3553,알바 개많어32132131232131,,,,,,,,,
3554,동양적 공포를 서양적으로 표현한 영화라고 할까나.. 무서운거 튀어나올것 알면서도 튀어나오면 무서워서 욕하게하는 영화 ㅋㅋ 지하실박수씬이 대박ㅋㅋ 박수가 싫어졌다고나할까 ㅋㅋ,,,,,,,,,
3555,이정도 공포영화는 보질 못했음,,,,,,,,,
3556,말이 필요 없다!!! 주온이나 링도 시시했는데 이건 정말 무섭다 ㅠㅠ,,,,,,,,,
3557,영화보고 집에가려고 차에타는데 어디선가 썩은냄새가 났다.,,,,,,,,,
3558,장화홍련이후로 공포영화중에 돈안아까웠다,,,,,,,,,
3559,이거 안무섭고 재미없다는사람 너무많아서 기대안했는데 영화시작하자마자 쫄아서 영화끝날때까지 긴장했음 완전무서웠음 ㅠㅠ 근데 남는건없음,,,,,,,,,
3560,솔직히 그다지 내용은 무섭진않았지만 분위기만큼은 잘잡은것 같다.,,,,,,,,,
3561,당신이 영화보는동안 단 한번도 깜짝놀라지 않았다면 거짓말입니다. 순간 움찔이라도 합니다!! 주위사람이 소리질러서라도 놀랍니다.직접보세욤~ㅎㅎ,,,,,,,,,
3562,기대 이하의 영화...,,,,,,,,,
3563,다 재밌고 아역배우들도 너무 귀엽고~ 하지만 개인적으로는 마지막이 조금 너무 좋게 끝나서... 물론 실화를 바탕으로 각색했다고 하니 너무 결말을 바꿔도 안되지만... 아무래도 감독이 같아서 '인시디어스'...,,,,,,,,,
3564,공포영화가 완성도 있다는 건 불가능하므로타 공포영화와 비교해서 점수 십점 드립니다.영화관에서 소리 질러본적 별로 없는데 놀래서 인지 무서워서 인지 몇번 소리 질렀네요..ㅎㅎ... 민폐짓 했구요.. 공포스러웠음..,,,,,,,,,
3565,재미있어여. 무섭운 장면없이 무서운 영화라고 해서 봤는데. 무서운 장면 있음. ㅎㅎㅎ,,,,,,,,,
3566,무서운장면없다해서 갔는데..속았다..엄청 무서웠음!,,,,,,,,,
3567,무서운 장면 안나오긴 개뿔 ㅠ 후달달,,,,,,,,,
3568,여름에 나왔으면 대히트 감인 영화 ㅋㅋ팝콘 내가 들고있었으면 쏟을뻔했던 영화 너무 무섭다 진짜 영화 다 보고 나와서도 한동안 덜덜 거렸다는.. 공포 스릴러 엑소시즘 까지 한데모아서 볼수있는 영화 진짜 잘만든듯.,,,,,,,,,
3569,초반에는 겁좀 먹다나 엑소시즘 본격적으로 들어가고 나서는 딱히.. 공포스럽진 않네요. 막판은 훈훈한 가족영화.,,,,,,,,,
3570,진짜 오랜만에 제대로 무서운영화 공포영화 봤네요,,,,,,,,,
3571,두번봤는데도 무서움..ㄷㄷ,,,,,,,,,
3572,완벽한 공포다. 하지만 인시디어스가 더 무섭다던데.,,,,,,,,,
3573,저주에 관한 영화소재로써 엑소시스트 현대판을 보는 듯 실감났다.공포영화에 빠질 수 없는 사운드에 긴장감은 백배오랜만에 손에 땀을 쥐고 관람한 영화였다.,,,,,,,,,
3574,막! 으악~!!이럴정도로 무서운 귀신이 나오거나..괴물이 나오는건 아님..근데..사람심리를 잘다루는...긴장최고조로 올리고 퐉!! 그냥..쓰러짐 ㅋ,,,,,,,,,
3575,무서운 장면 없이 무서운 영화/무서운 장면 이. 무서운 영화.   다른건 별로....,,,,,,,,,
3576,긴장감도  있구..근데 왜 자꾸들 귀신이 안나온다고 할까 충분히 나오더만 무섭다고 눈감고 보니 안보일수 밖에 충분히 나왔음. 진정한 공포? . 무서운건 잘 모르겠궁...보는동안 깜짝 놀란적이 한번도 없다. OOO 담...,,,,,,,,,
3577,진짜 제대로 된 공포 영화인듯... 막 죽이고 그런 류의 공포가 아니라 다음 상황을 예측하기 힘들게 하는게 심리적으로 더 무섭게 하는 그런 영화임. 무튼 굿~,,,,,,,,,
3578,..무서워요ㅣ...대박...,,,,,,,,,
3579,긴장감 장난아닙니다ㅜ,,,,,,,,,
3580,박수칠때 소리지르고 영화 중간에 나옴,,,,,,,,,
3581,내가 공포영화보면 깜짝깜짝 놀란적은 자주있는데,,,,,,,,,
3582,무서웠다는사람이 많아서 놀랬음ㄷㄷ 초반부는 좀 지루하게 흘러감 그 이후에 좀  깜딱깜딱 놀랄 장면 나오고  그냥 무식하게 잔인한 영화보다는 괜찮은 영화,,,,,,,,,
3583,죄성들하지만 여느 공포영화와 똑같습니다.... 실화에 픽션을 너무 많이 가미했네요.. 웃김ㅋㅋ,,,,,,,,,
3584,무서웠습니다. 잘 봤어요.,,,,,,,,,
3585,진정성 있는 공포영화다. 실화라서 더더욱 그렇다. 꼭 봐라.,,,,,,,,,
3586,최고!!!!  정말 무섭고 재밌었어요!!!,,,,,,,,,
3587,완전 재밌어요,,,,,,,,,
3588,무서움. 보고온날 혼자 못잤음...,,,,,,,,,
3589,1점 주는애들이 알바생인듯... 난 정말 무섭게 봤는데... 심리적으로 엄청 다가오는 무서움이 미침...,,,,,,,,,
3590,홍삼파워홍삼파워헛개수!,,,,,,,,,
3591,엑소시스트,,,,,,,,,
3592,기대하고 봤는데.. 엑소시스트랑 비슷함.. 실망 했다는..,,,,,,,,,
3593,스토린재미잇었지민그렇게무섭진않음,,,,,,,,,
3594,무서운 장면 안나온다며....안나온다며 ..안나온다며..!,,,,,,,,,
3595,이런 공포 영화 많이 나오면 좋겠네용~!,,,,,,,,,
3596,미국판 엑소시스트ㅠㅠ집에서 보면 괜찮을듯,,,,,,,,,
