,Word
81,우리 우리나라 나라 민 민식 식 배우 자랑 민 민식 
82,식 최익현 자체 범죄 전쟁 2 마지막 장면 총알 총 
83,하정 하정우 우 검거 최 최민식이 민 식이 말 내 
84,이기 나 마 마동석 동석 여기 타짜 이후 개성 캐릭터 
85,국내 국내영화 영화 범죄 전쟁 주연 김 균 마 마동석 
86,동석 김 김응수 응수 곽 곽도원 도원 조연 민 입 
87,연기 최 5 5년전 년 전 영화 하정 하정우 우 
88,몸 몸보고 보고 라 생각 진짜 현 현실적 실적 깡패 
89,깡패몸 민 민식 식 연기 최고 여 영화 생각 쏼 
90,이것 천만 천만돌파 돌파 나 의문 영화 풍문 당시 조연 
91,지금 대스타 남배우 최익현 캐릭터 한국 한국사회 사회 치가 데 
92,뭐 하면 경주 경주최씨 최 씨 혈연 지연 거 검사 
93,윗 윗대가리 대가리 시대상 캐릭터 갱 갱스터무비 스터 무비 러닝 
94,러닝타임 타임 전체 명 명장면 장면 희대 명작 편안 노후 
95,익현이 좌충우돌 연대기 한국 한국느와르물 느와 르 물 끝판 끝판왕 
96,왕 시나리오 시나리오개 개 배우 연기 ㅎ ㅎㄷㄷ ㄷ 대사 
97,입 붙음 ㅈ 열 열번 번 이상 때 장르 구분 
98,조폭 영화 한국식 느와 느와르라 르 라 사람 격 설명 
99,듯 엔딩 순간 긴장 다짐 영화 영화랄 랄 ㅈ 꿀 
100,꿀잼 잼 외국 대부 우리 우리나라 나라 영화 별기 별기대안 
101,대안 하정 하정우 우 개 영화 신세계 한국판 갱 갱스터 
102,스터 영화 투 투탑 탑 누 누군 군 임 임마 
103,마 깡패 깡패수사 수사 줄 이것 한국 한국영화 영화 넘버원 
104,최고 역대 역대급 급 번 때 배우 속 배경 시대 
105,표현 연기 삼천포 삼천포땜 땜 됬 데 최 최민 민 
106,단언 최고 깡패 깡패영화 영화 정도 수록 대작 강한 강한자가 
107,자가 강 법 배우 민 민식 식 연기 감탄 대한 
108,대한민국 민국 최고 깡패 깡패이야기 이야기 보기 어폐 우리네 아버지 
109,집안 때문 어머니 고통 하정 하정우 우 최 최민식이 민 
110,식이 영화 최민식인 식인 알거가틈 민 민식 식 연기 소름 
111,50 50번 번 영화 이것 깡 깡패지 패지 요즘 건달 
112,건달물 물 영화 미화 지 이익 개싸움 생각 최 최민식 
113,민 식 연기 개 개오지 오지 감동 영화 감 동 
114,지수 보통 연기 연기지수 100 100점 점 조연 연기력 소름 
115,연기실력 실력 타짜 초록 초록물고기 물고기 정도 함 마지막 소리 
116,환청 실제 전자 평생 불안 삶 후자 불행 청 청불 
117,불 영화 478 478만명 만 명 천만 천만관객이상 관객 이상 
118,명작 봄 사실 장점 감탄 시나리오 배우 연기 민 민식 
119,식 연기 ㄷ ㄷ하정우도 하정 우도 조진웅 찐빼이 작 수 
120,영화 배우 연기 수 나 겐 김 균 균님 님 
121,하정 하정우 우 최고 컷 람마 궤 궤쉑기 쉑 기 
122,배우 생각 웃음 개인적 신 신세계 세계 유일한 느와르같습니 거 
123,아까 일은 일은예 예 제가 번 사과 놈 위 표현 
124,영화 완전 처음 끝 부분 하나 조연 주연 누 대사 
125,케릭터 조폭 영화 영화중 중 이것 최고 갑 듯 민 
126,우리 우리나라 나라 영화 영화보고 보고 조진웅 배우 한국 중 
127,부산 사투리 맛깔 디테일 손동작 연기 최고 동석 의외 놀람 
128,최익현 대사 내가 이 이깃 깃 19 19번 번 봣 
129,최 최민식 민 식 영화 초반 야망 눈빛 매혹 켯 
130,사람 교과서 수 민 민식이 식이 80 80년대 년대 한국 
131,갱 갱스토무비 스토 무비 김 균 무서움 디시 영화 장치 
132,놈 모이는 장소 일본 일본스타일 스타일 등장 일제 일제시대 시대 
133,군복 군복사진 사진 일본식 일본식정원 정원 다다 다다미방 미방 사시미 
134,회 등 당시 떻 떻것 주류 주류사회 사회 진입 무 
135,범죄 영화 최고 최고봉 봉 영화 수 충렬 충렬공파35대손 공파 
136,35 대손 현자 현자돌림 돌림 번 여 영화 생각 이번 
137,시간 폰 넷플릭스 몰입 끝 우리 우리나라 나라 사람 사람만이 
138,만이 이해 수 하정 하정우씨 우 씨 ㅅ ㅅㅂ ㅂ 
139,형배 형배씨 민 민식 식 꼰대 연기 천 천상급 상급 
140,대한 대한민국 민국 영화 수 연출 연 연기 기 부족 
141,티비 티비채널 채널 무의식 나 번 때 민 민식 식 
142,하정 하정우 우 곽 곽도원 도원 조진 조진웅 웅 김 
143,균 마 마동석 동석 응수 응수좌 좌 ㄷ ㄷㄷ 라인업 
144,배우 연기 대사 시대적 분위기 연출 완벽 느와르 코미디 장면 
145,8 8년 년 현재 도 패러디 사실 작품 임팩트 증명 
146,영화 배우 연기 뿐 시대적 배경 묘사 번 수작 한국 
147,한국영화중 영화 중 필요 오락 재미 한국사 한국사회의 회의 특수성 
148,시대상 연출 배우 명연기 마성 매력 영화 생각 올드 올드보이 
149,보이 신세계 조폭 조폭물 물 3 작품 한국 조폭 영화 
150,중 최고 최고봉 봉 10 10점 점 수 영화 편집장 
151,어디 있노 내 네이버 평점 메가 메가박스 박스 마 해쓰 
152,우리 우리나라 나라 시대 맛깔 시대극 민 민식 식 연기 
153,하정 하정우 우 지 번 윤 이정 스토리 연기력 8 
154,대 듯 범죄 범죄물 물 수작 이번 처음 감상 지금 
155,한국 한국영화 영화 중 최고 개인적 결말 맘 곽도 곽도원 
156,원 형사 연기 영화 자체 우리 우리나라 우리나라식 나라 식 
157,느와 느와르 르 재미 정도 한때 유행 유행어 때 이것 
158,여기 난리 진짜 조폭 조폭영화 영화 마약 마약영화 타짜 보고 
159,개 개강추 강추 이것 한국 한국영화 영화 정수 민 민식 
160,식 연기 배우 개성 한국식 느와르 정석 명대사 제조 제조영화 
161,영화 최익현 공무원 출신 민 민식 식 배우 연기력 최익현 
162,자체 씹캐 씹캐리 리 영화 영화속 속 인간 군상 자체 
163,사람 악인 선인 모두 입장 이해 상황 가슴 공감 민 
164,민식 식 최익현 연기 80 80프로 프로 신세계 한국 느와르 
165,명작 중 하나 말 씹명작 수십 수십번 번 행배 행배씨 
166,씨 감독 윤 기억 지금 민 민식 식 연기 연기중 
167,중 최고 80 80년대 년대 조폭 조폭시대 시대 묘사 표현 
168,연기 재미 봄 최 최민식 민 식 나이 개인적 한국 
169,한국영화중 영화 중 탑 시대 범죄 전쟁 조폭 재물 척 
170,놈 의 전성시대 계속 있음 한국 느와르 마스터 마스터피스 피스 
171,연기 연기구멍 구멍 내용 대사 정도 ㅎ ㄹ ㄹㅇ ㅇ 
172,명작 명작중 중 지금 영화 2012 2012년당시 년 당시 남자애 
173,영화하정우연기 하정 우 연기 존 잔인 거지 스토리 스토리전개 전개 
174,마지막 마지막장면 장면 일품 부산 부산사투리 사투리 볼거리 영화인 동시 
175,홍콩느와르 이색적 장면 수작 독트 연출 배우 연기 감독 최고 
176,사람 자 라 번 봄 때 영화 경상도 시대적 배경 
177,스토리 캐릭터 연기 뭐 하나 나이 서장 서장남천동살제 남천 남천동 
178,동 살제 씨 하정 하정우가 우가 민 민식 식 개 
179,개존멋 존 멋 대사 배우 연기 당시 시대상 조폭 세계 
180,영화 잔인 장면 현 현실적 실적 이야기 면 최고 영상미 
181,레트 최강 최강스토리 스토리 와우 와우연기력 연기력 대박 대박사투리 사투리 
182,완전 놀람 강추 비트 친구 범죄 전쟁 내 인생 인생명작 
183,명작 모든 대사 민 민식배우연기 식 배우 연기 감탄 입도 
184,최고 총알 총 실력 지위 1980 1980년대 년대 인맥 아첨 
185,최익현 이야기 이때 하정 희소성 지금 다작 배우 아쉬움 섹시 
186,결국 승자 최익현 자식 잘됬으 최 곽 곽도원 최민식하정 민 
187,도원 식 하정 우 김 균 균조진웅 조진 웅 출연작 
188,말 국내 범죄 영화 영화중 중 최고 한국형 갱 갱스터 
189,스터 무비 전설 촐 촐라 라 잼 영화 개인적 하정 
190,하정우씨 우 씨 멋 멋짐 짐 리얼 한국형 조직 폭력배 
191,영화 채널 있음 영화 대체 번 거 마약 마약왕 왕 
192,범죄 전쟁 10 10점 점 영화 요즘 한국 한국영화 노 
193,노잼 잼 민 민식 식 연기 사람 하정 하정우 우 
194,대한 대한민국 민국 연기파 향연 수 몰입 영화 연기력 최고 
195,주연급 인물 조연 중 민 민식과 식과 하정 하정우의 우의 
196,연기 추석 추석영화 영화 코믹 민 민식 식 연기 청탁 
197,배신 배신음모 음모 깡패 영화 우리 주변 폭력 욕설 뿐 
198,돈 돈앞 앞 의리 가족 대부분 사람 하정 하정우 우 
199,놈 세상 세 긴말 최 최형배개간지 형배 개간지 극중 민 
200,민식 식 배역 총알 권총 비유 학연 학연지연혈연 지연 혈연 
201,대한 대한민국 민국 사회 80 90 90년 년 아버지 일반적 
202,성향 타짜 이후 명대사 영화 생각 윤 작품 남자 자존심 
203,찌 찌질 질 맛깔 표현 년 년대 대 고증 영화 
204,생각 스토리 흠 동안 메세지 연기 일품 만족 한마디 수 
205,명 명장면 장면 명대사 대잔치 배우 연기 기가 느와 느와르 
206,르 장르 혁명 다운 분위기 영화 전개 식상 수 최 
207,최민식 민 식 코믹 연기 긴장 수축 이완 지속 서스펜스 
208,소름 결말 완벽 가장 아버지 이야기 시선 영화 절대 범죄 
209,범죄느와르 느와 르 이것 능가 한국 범죄 영화 현대사 송곳 
210,명작 뭐 연기 연기전쟁 전쟁 정 정도로 도로 배우 머리 
211,분위기 압도 극 극사실주의 사실 주의 사투리 영화 번째 감사 
212,윤 윤종 종 감독 캐릭터 구축 듯 조폭 조폭영화 영화 
213,중 제일 현 현실적 실적 듯 의리 느와 느와르 르 
214,식 표현 봄 행배 위 불한 등등 캐릭터 대사 번 
215,영화 민 민식과 식과 송 송강호 강호 한국 한국영화 영화 
216,보배 진리 연기 당시 시대 시대상황 상황 영화 영화제목 제목 
217,범죄 전쟁 결국 건달 경찰 검사 없엇 현실 끝 민 
218,20 때 영화관 처음 영화 수록 명작 생각 극중 민 
219,민식이 식이 반달 기생충 삶 리얼 표현 박 박평 평 
220,인간 꼬라지 보소 개 날 개싸움 평론 평론간지 간지 의심 
221,비판 평점 뭐 갑 갑지ㅡ 지ㅡ 나이 재밋는것 감동 수도 
222,최고 최고예 예 연기 후 ㄷ ㄷ닛ㄴ 닛 ㄴ 이거 
223,천만 터 평점 최고 진짜 시대 개 현 현실를 실를 
224,반영 소름 영화 신세계 쌍벽 조폭 조폭영화 영화 최고 최고봉 
225,봉 건 한국 최고 영화 장면 하나하나 말 필요 메 
226,메이드 이드 영화 당시 저랬구 생각 영화 시간 줄 최익현 
227,극 연기 하정 하정우 우 주연 조연 배우 연기 압권 
228,감동 울 나라 최고 최고작 작 마지막 민 민식이 식이 
229,아들 넥타이 장면 하정 하정우 우 민 민식 식 연기 
230,발군 족보 부산 아재 뽕 뽕팔 팔 범죄자 혈연 한국적 
231,밥 진짜 개꿀 개꿀잼 잼 노래 영화 영화임 임 진짜 
232,10 10점 점 만점 배우 연기 맛 맛집 집 등록 
233,끝 내가 깄으 겼으 캬 함도 사람 위악 척 하나 
234,전개 이사 때 트럭 장면 기분 진짜 대박 장가 회장 
235,기대 배우 연기력 때문 몰입 몰입감 감 장면 하정 하정우 
236,우 ㅜ 용서 자 영화 천재 듯 처세술 자가 인물 
237,최익현 모두 그 결국 손 배우 라인업 후 이게 영화 
238,1000 1000만 만 돌파 눈 요기 느와르 작품 격 수 
239,부족 시대상 캐릭터 장점 정도 작품 국내 류 영화 중 
240,영리 최고 듯 종 종빈아 빈아 아재 용돈 한국 뿌리 
241,찌 찌질 질 면모 영화 느와 느와르 르 끝판 끝판왕 
242,왕 갱 갱스터무비 스터 무비 시대극 조화 영화 철저 오락 
243,오락영화 영화 위화감 교훈 장치 이해 감상 문제 일본인 마약 
244,운운 거래 장면 감독 센스 깡패 미화 영화 비열 비굴 
245,놈 생각 영화 배우 영화 번 영화 명작 ㅋ 번 
246,민 민식 식 하정 하정우 우 곽 곽도원 도원 메 
247,메소드 소드 연기 항연 잼 근래 영화 영화중 중 분위기 
248,연기 주연 조연 완벽 리얼 눈 이거 치료 최고 영화 
249,라 최고 말 오락 오락영화 영화 사투리 사투리연기 연기 ㅠ 
250,ㅠ대사 대사 하나하나 타짜 타짜이후 이후 처음 최고 틈 연기력 
251,ㅎ ㅎㄷㄷ ㄷ 상영 영화 신세계 산맥 최고 영화 조폭 
252,조폭영화 영화 꺼 뭐 관객 관객수 수 19 19금 금 
253,영화 수 성인 성인영화중 중 제일 거 민 민식 식 
254,연기 대박 스토리 연출 구성 최고 제가 한국 느와 느와르물 
255,르 물 영화 중 최고 민 민식 식 명연기 리 
256,벌 외 하정 하정우 우 부분 부족 몸 연기 배우 
257,멋 진짜 민 민식 식 일품 소재 완성도 작품 명작 
258,누 뭐래 대작 한마디 열연 향연 연기 배우 작품 감독 
259,감독중 중 편인 윤 미래 나중 하정 하정우 우 가보 
260,가보길 길 영화 이상 자세 설명 생략 애 키 평점 
261,전문가 분석 개 개오지 오지 계란 계란노른자 노른자 새 새키 
262,타짜 등등 대사 하나하나 영화 ㅇ ㅇㅇ 연기 마 우주 
263,별 별점 점 영화 때 시작 채널 수 ㅋ 이거 
264,5 5번째 번째 한국 한국배경 배경 가능 최고 느와 느와르임 
265,르 임 주연 원래 첨 때 곽 곽도원김 도원 김 
266,균 신선 충격 결국 인간 인간군상 군상 욕심 끝 현실 
267,명작 명작중명작 중 다시 오랜만 장면 하나 대사 하나 정말 
268,연기 영화 이래 윤 디테일 연출 나 홍진 국내 최고 
269,다크 거장 말 배우 만 영화 민 민식 식 하정 
270,하정우 우 투 투톱 톱 조진 조진웅 웅 곽 곽도원 
271,도원 마 마동석 동석 김 균 ㄷ ㄷㄷ 명작 내 
272,인생 영화 3 3중 중 하나 신세계 한국 한국영화계 영화계 
273,명작 중 명작 평점 꿀 생각 꿀잼 잼 재미 말 
274,말하나 하나 최 최민식하정 민 식 하정 우 연기 신의 
275,수의 캐스팅 배우 개 연기 이것 영화 캬 거장 윤 
276,윤종 종 감독 수작 이야기 명작 인맥 달인 최익현 최고 
277,카리스마 형배 때 대박 오 오메 메 냥 말 말필요 
278,필요 답 듯 여자 저 영화 굿 최고 영화 전체 
279,명 명장면 장면 요약 명작 연 연기도 기도 총알 총 
280,이 저 최익현 내 인생 최고 영화 20 20번 번 
281,진짜 10 10점 점 최고 민 민식 식 하정 하정우의 
282,우의 미 두말 100 100점 점 조합 하정 하정우 우 
283,이것 신 신세계 세계 비교 영 영알 알 뮤 ㄷ 
284,ㄷㄷ 범 전은 역대 역대급 급 영화 장르 한국 조폭 
285,주제 느와 느와르 르 장르 획 작품 민 연기 맛깔 
286,몰입 수준 최익현 내가 이 이깃 깃 최고 신세계 말 
287,일당백 현실감 몰입 몰입감 감 느와 느와르 르 잼 민 
288,민식 식 성 연기 평점 9 9점이상 점 이상 천만 
289,천만이상 관객 영화 시대 기회 기회주의자 주의자 문제점 연기 소화 
290,명작 더빙 가능 수준 영화 캐릭터 후회 최 최민식과 민 
291,식과 하정 하정우영화 우 영화 개봉 예의 예의임 임 서장 
292,강서 강서장 장 데 니 줄 군 남천 남천동 동 
293,살제 내 임 임마 마 밥 이 들 말 배우 
294,라인업 후 민 민식 식 하정 하정우 우 연기 세계 
295,최고급 듯 모든 조연 최고 이순신 장군님 초 초찌질 찌 
296,질 모습 소화 말 전설 민 올드 올드보이 보이 작품 
297,신세계 한국 최고 범죄 범죄걸작 걸작 조폭 조폭영화 영화 신물 
298,누 보라 추천 봄 정치 정치풍자극 풍자극 한국 학연 학연지연혈연 
299,지연 혈연 중 정의 정의사회 사회 현실 경주 경주최 최 
300,부분 왓 더킹 영화 짭이었구 물론 배우 연기 스토리 상징 
301,연출 면 비교 안됨 한국 한국영화 이정 여한 아수라 영화 
302,생각 시대 최익현 조폭 조폭물 물 여 캐릭터 하나하나 생명력 
303,부여 개성 작품 스토리 배우 한국 한국사회 사회 부분 등등 
304,영화 영화 500 500만도 만도 돌파 ㅌ 내부자 동급 영화 
305,시대상 캐릭터 완벽 완벽하다 하다 민 민식 식 하정 하정우가 
306,우가 캐릭터 살림 연기력 진짜 진짜최고 최고 수록 새 지금 
307,영화 중 최고 내평 내평점보 점보 긴장 마지막 소름 사람 
308,맘 말 필요 최고 배우 연기 감독 연출력 이 영화 
309,관객 관객수가 수가 500 500만이 만이 안 최익현 수 혈연 
310,혈연지연 지연 위 위선자 선자 정치 정치사회 사회 자신 이익 
311,이익출세 출세 검사 모습 모습때 때 범죄 영화 수작 필요 
312,이상 욕설 한국 한국영화 고질적 병폐 듯 예 지금 조폭 
313,조폭새끼 새끼 악 축 축쓰레기 쓰레기 인간 인간취급 취급 바퀴 
314,바퀴벌레 바퀴벌레만도 벌레 만도 앞 의리 리 리거리 거리 뒤 
315,배신 인생 인생패배집단새끼 패배 집단 배우 연기력 갑 한국 느와 
316,느와르영화 르 영화 정점 영화 승리자 서장 민 민식님 식 
317,님 부산 부산사투리연기 사투리 연기 부산출신 출신 내가 부산아재 아재 
318,서울 서울출생 출생 시 시라니 라니 잼 깡패 기어 개미 
319,뿐 정 정우형 우형 사랑 영화 어 작품 한국 흥미 
320,봄 한국판 한국판느와르 느와 르 최 최민식하정 민 식 하정 
321,우 우연기 연기 2 2번째 번째 요즘 다섯 이상 판국 
322,한국 수 대부 친구 예전 명작 한국판 대부 8 90 
323,90년대 년대 한국 한국사회 사회 단면 명 명량 량 이순신 
324,장군 해석 실망 최 최배 배 인정 현실 인간 모습 
325,영화 최고 영화 말 필요 필요있음 있음 영화 최 최민식 
326,민 식 한국 어벤 어벤저스팀 저 스팀 캐릭터 배우 명연기 
327,진짜 조폭 조폭영화 영화 영화 스토리 배우 연기 맛 맛집 
328,집 배우 말 마디 전부 명언 영화 번째 수록 명작 
329,지금 30 30번 번 주옥 명대사 명 명장면 장면 최고 
330,영화 최근 번 연기 연출 쟁 쟁쟁 조연 한국 대표 
331,영화 최소한 시절 수 듯 민 민식이오빠연기 식이 오빠 연기 
332,굿 굿ㅜ ㅜ 수작 영화 한국 느와르 시작 을 영화 
333,깡패 깡패영화 영화 중 최고 최고봉 봉 믿거 믿거봄 봄 
334,민 민식 식 하정 하정우 우 곽 곽도원 도원 신세계 
335,필수 영화 왜 틀 틀딱이 딱이 수 이것 부산 배우 
336,미세 연기력 수 때 감탄 번 민 민식 식 모자 
337,양아치 연기 최고 조폭 조폭영화 영화 오늘 대한 대한민국 민국 
338,서사 들어가있어 연기력 누구 하나 하정 하정우 우 완전 멋 
339,멋있음대부 있음 대부 영화 나중 10 10번 번 매력 캐릭터 
340,식상 나간 연출 마이 노래 신의 한수 한국 느와 느와르 
341,르 영화 중 원탑 단 한시 틈 메 메이드영화 이드 
342,영화 민 민식 식 인생 생각 남자 명분 지킴 민 
343,민식 식 명 명불허전 불허 전 라 조폭 옹호 최익현 
344,진자 개 상 욕 80 80년대 년대 기분 명작 스토리 
345,재미 대사 캐릭터 하나하나 인 매 인생 한국 한국느와르 느와 
346,르 편중 하나 친구 범죄 전쟁 한국식 갱 갱스터 스터 
347,무비 정점 지리 내가 임 임마 마 서장 으 내가 
348,이 이깃으 깃 으 최 최민식 민 식 연기 대박 
349,대체 대체불가 불가 때 영화 그때 제가 마 확신 지도 
350,됫 됫고 고 해 햇엇 놈 줄 랏 데이 영화 
351,안본 안본사람 사람 최고 작품 순간 눈 수 시대상 표현 
352,최고 민 민식이 식이 형님 하정 하정우 우 민 민식 
353,식 내 인생 명작 극장가 영화 최 오늘 조서 첨 
354,여 12 12년도 년도 보고 10 10점 점 만 점수 
355,만큼 수준 수준이하 이하 한국 영화 이랑 비교 이것 8 
356,8점대 점 대 10 10점 점 영화 라 장면 하나하나 
357,뇌리 명작 2 2시간 시간 13 13분 분 의 활용 
358,수 영화 와우 오랜만 재 재밋 밋 영화 박수 최익현 
359,글자 조폭 세계 간접 간접경험 경험 하정 하정우 우 섹시 
360,연기 ㅠ ㅠ영화 영화 최익현 의미론 악마 장 장경철 경철 
361,데 시간 줄 역시나 꿀 꿀잼 잼 굿 진심 인생 
362,인생영화 영화 배우 연기 대박 2019 2019년 년 새해 날 
363,기념 남자 수 영화 사랑 범죄 전쟁 내 최고 자랑 
364,자랑거리 거리 작년 공작 시사회 훈 황 황정민 정민 윤 
365,감독 이랑 1 1초 초 대화 악수 모든 모든것 완벽 
366,영화 영화 예전 배우 연기 나이 고 현재 현재실화 실화 
367,솨롸 한편 암울 가정 중함 명품 연기자 명품연기 연기 솰 
368,나 서장 으 으이 이 어제 밥 깡패 깡패영화 영화 
369,주연 조연 배우 연기력 수 장면 눈빛 표정 추임새 연기 
370,최고 최고라 라 80 80년대 년대 조폭 생활상 맛 채널 
371,명화 직 하정 하정우 우 목 목소리 소리 대부 연기 
372,앞 느와르 1000 영화 짝 소방차 멤버 중 명이 배우 
373,권 하정 하정우 우 중국집 씬 씬보고 보고 나도 소주 
374,입 굿 영화 시대 여행 갔가 느낌 한국 한국영화 영화 
375,그림 정우 민 민식 식 하정 말 조진 조진웅곽도원 웅 
376,곽 도원 김 균 발견 영화 수확 깡패 현실 영화 
377,완벽 엔딩 소름 한국 영화 영화중 중 스토리 전개 전개속도 
378,속도 액션 캐릭터 개성 결말 완벽 사람 욕심 끝 주변 
379,눈 하정 하정우가 우가 새끼 때 오금 배우 연기 솰 
380,설명 필요 10 10번 번 영화 영화 귀 민 민식 
381,식 연기 번째 대사 지경 명작 이건 하정 하정우 우 
382,민 민식 식 뿐 배우 연기 스토리 최고 대박 번 
383,굿 굿굿 십 십점 점 신세계 한국식 느와르 획 최고 
384,작품 하정 하정우 우 민 민식 식 조합 기대 나도 
385,경주 경주최 최 오 압도 압도적인 적인 몰입 몰입감 감 
386,민 민식 식 하정 하정우 우 연기 배신 영화 서장 
387,남천 남천동 남천동살제 동 살제 배우 연기 연출 스토리 최고 
388,하정 하정우 우 엔딩 엔딩소름 소름 최 김 김판호랑 판 
389,호랑 거 내 얘기 누 누군 군 깡패 수사 줄 
390,명작 주 주연 연 조연 연기력 감독 연출 완벽 영화 
391,영화 주제 배경 주인공 모습 캐릭터 명배우 캐릭터 몰입 민 
392,민식 식 하정 하정우 우 조합 이상 말 마지막 대부 
393,속편 건 민 민식 식 하정 하정후 후 최고 연출 
394,배우 연기 기대 만큼 후회 수작 별 11 11개 개 
395,우리 우리나라 나라 최고 정점 느와 느와르 르 완벽 ㅠㅓ 
396,ㅠㅓㅏ ㅏ 진짜 리얼 자연 단점 영화 수 어른 세계 
397,민 민식 식 벌레 벌레연기일품 연기 일품 하정 하정우 우 
398,은근 은근코믹연기최고 코믹 최고 한국 영화 발전 발전가능성 가능성 개인적 
399,범죄 드라마 말 필요 필요하대유 하대 유 재 재미지쥬 미지 
400,쥬 진짜 한시 긴장감 수 틈 우리 우리나라 나라 조폭 
401,조폭영화중 영화 중 1 1위 위 배우 맛 작품 민 
402,민식하정우 식 하정 우 두말 필요 곽 곽도원 도원 김 
403,균 조진 조진웅 웅 마 마동석 동석 한마디 잼 영화 
404,하정 하정우 우 민 민식 식 끝 몰입 수 영화 
405,기대 이상 연기 화 끝 생각 저희 아버지 정의 신분 
406,저 말씀 성공 놈 놈들보 들보 시게 제목 놈 전성시대 
407,수작 연기 배우 연기 플러스 플러스요점 요점 이야기 민 민식 
408,식 배우 꼴 질 연기력 최고 혓바닥 부 처세술 소름 
409,명작 조폭 조폭물 물 가장 남자 사랑 사랑이야기 이야기 검사 
410,아들 최익현 골계 80 80년대 년대 표현 와중 박 박평 
411,평 평점 평점6점 6 점 개 날 개싸움 이것 영화 
412,영화평론가 평론가 평론 평론임 임 사람 사람임 어저께 서장 밥 
413,안질 극장 명절 명절특선 특선 암 티 티비 비 다섯 
414,다섯번 번 듯 크킄 대사 ㅎ 적 한국 한국청불영화 청 
415,불 영화 3 3안 안 서장 파트 최소 10 10번 
416,번 인생 영화 명작 500 500만 만 나 줄 조폭 
417,조폭영화중 영화 중 사람 한명 후반부 형배 전화벨 전화벨소리 소리 
418,전 최익현 내가 바보 느낌 완벽 쓰레기 연기 민 민식이 
419,식이 사투리 어색 어색하다 하다 평 때문 9 9점 점 
420,생각 평점 낮 한국 영화 영화중 중 사회 풍자 풍자물 
421,물 으뜸 민 인간 욕심 의지 배신 하정 하정우 우 
422,민 민식 식 조합 유행어 남자 재미 사람 듯 오 
423,최 최민식 민 식 연기 나 부산 부산사람 사람 원어 
424,원어민수준 수준 사투리 연기력 캬 인생 영화 감독 79 79년생 
425,년생 소름 김 김혜은 혜 은 빨강 빨강팬티팬티 팬티 스타킹 
426,감독 등 등장 장 인물 명 존함 최 순 실 
