,Word
49,액션영화 영화 만족 수 10 10년 년 최근 쓰레기 쓰레기영화 
50,영화 100 100배 배 액션 영화 영화이기 이기 링 타임 
51,볼만 맥 맥어보이의 어보 이의 연기 제임스 맥 맥어보이 어보이 
52,연기 여기 스토리 스토리타령 타령 명작 평론 자격 때 함 
53,극치 영화 당장 뭐 가슴 그놈 평론가 사람 흠 평점 
54,보고 하나 개막 개막장 장 3 3류 류 영화 은근 
55,재 재밌 밌 리 왜케 살이 비현 비현실적 실적 내용 
56,액션 액션만큼 만큼 류 액션 영화 누군가 사람 나 삶 
57,타인 거울 연출 의미 크리스 프랫 스타 스타로드 로드 때 
58,마지막 맥 맥어보이의 어보 이의 대사 대 벙찜 동시 뭐 
59,열정 솓 솓구 구 일상 사회 행동 본인 본인임 임 
60,경고 엔딩 맥 맥어보이 어보이 형 존 제임스 맥 맥어보이의 
61,어보 이의 연기 최고 명작 요새 요새영화 영화 2 질문 
62,10 10년 년 액션 액션영화중 영화 중 넘버 넘버5안 5 
63,안 다크나이트 내 생의 번째 액션 액션영화 영화 말 10 
64,10년전 년 전 영화 액션 영화 현실적 현 실적 공감 
65,수 액션 누 현실 바람 사람 노 노답임 답 임 
66,건 맛 원 원티드 티드 이것 재미 재미없으 없으 집 
67,톰 제리 시 시청해 청해 액션 스토리 전부 듯 ㄷ 
68,ㄷㄷ꿀잼 꿀 잼 내가 액션 액션영화중 영화 중 최고 액션신 
69,신 거기 교훈 남자 누구 영화 나름 반전 총알 인상 
70,거기 여 여전사 전사 느낌 안 안젤리 젤리 졸 매력 
71,액션 영화 예술 도 수 정도 예술적 장면 원작 스타일 
72,스타일리쉬 리 쉬 구현 액션 액션영화 영화 자체 현실성 기대 
73,원 원티 티 때문 몰입 몰입감이 감이 부족 치 볼거리 
74,액션 액션영화 영화 이것 수 연기 연기대박 대박 졸 언니 
75,졸리 리 비주얼 비주얼대박 스토리 스토리대박 액션 기차 안 사람 
76,죄 전 세월 명작 리 마지막 원형 자신 머리 통과 
77,스스로 조직 약속 부분 장면 대체 2 2편 편 제작 
78,킹스 킹스맨 맨 이전 원 원티 티 있었다 요즘 구경 
79,수 주 주인공 인공 아빠 그전 내가 아빠다라 다라 말 
80,아들 때 때라도 라도 죽기 죽기직전 직전 안 베리 크리 
81,크리스프랫 스프 랫 버전 진짜 줄 리 말 섹시 판타지 
82,액션 물 30 30대 대 후반 나 사람 누군가 인생 
83,영화 신 신개념 개념 총질 액션 스토리 나름 반전 마지막 
84,이 질문 베리 크리스프랫이었다 오 피터 퀼 말 필요 7 
85,7번 번 결말 마음 멕 멕어보 어보 미안 자네 매력 
86,아이 아이이임 이임 오리 이이 사람 꺼 스타일 스타일리시한 리 
87,시한 액션 액션만큼 만큼 최고 스토리 개연성 명작 영화 하나 
88,예술 나태 나 자신 동기 동기부여 부여 감동 자체 오랜만 
89,최고 액션 액션영화 영화 곡선 곡선궤도 궤도 총알 피 피슝피슝 
90,슝 영화 지금 지금봣지 봣 지 결말 완벽 내 생 
91,탑 탑5영화 5 영화 졸 졸리 리 배우 주인공 맥 
92,맥어보이 어보이 하 개 총알 곡사 말 맥 맥어보이 어보이 
93,상사 크리스 프랫 오 의 스타 스타로드 로드 연기 배우 
94,전 명작 7 7년 년 허구 액션 스트레스 재밋구 좋야 
95,스파이 스파이더맨 더 맨 총싸움 총싸움버젼 버젼 스타일 스타일리쉬 리 
96,쉬 감독 관객 바 영화 아드레날린 특급 특급열차 열차 액션 
97,전설 액션 젤리 리 영화 맥 맥어보이도 어보 이도 스릴 
98,통쾌 대리 대리만족 만족 동시 스타일 스타일리쉬 리 쉬 액션 
99,액션씬 씬 10 10점만점 점 만점 20 20점 아빠 아빠눈 
100,눈 때 2 2편 편 마지막 눈 수 영화 적 
101,처음 스토리 액션 최고 자취 꾸르 꾸르잼 잼 오랜만 영화 
102,오랜만 재 재밌댱 밌댱 끝 액션 스토리 한데 개연성 부족 
103,정도 영화 완전 강추 진짜 액션 액션영화 영화 사람 한번 
104,영화 원 원티 티 티비 때 채널 액션 스릴 영화 
105,주더만 봐보 맥 맥어보이 어보이 젤리 리 하나 거 재평가 
106,걸작 걸작액션영화 액션 영화 2 2편 편 정도 정도임 임 
107,크리스 프렛 맛 본분 추천 개 개재미 재미 제임스 맥 
108,맥어보이 어보이 영화 중 중3때 3 때 때 지네 후 
109,성인 전 전1 1 니 안 안제리 제리 액션 굿 
110,바람 친구 스타 스타로드 로드 꿀 꿀잼 잼 인생 인생작개인적 
111,작 개인적 갓 갓졸 졸 작품 작품중 중 당시 경쟁 
112,경쟁작 테이 ㅎ ㅎㄷㄷ ㄷ 덕 행복 ㅠ 제임스 맥 
113,맥어보이 어보이 짱 마지막 대사 총알 2008 2008년영화 년 영화 
114,글 2008년 년 아이언 아이언맨 맨 다크나이트 해 급식 ㅅ 
115,ㅅ퀴 퀴 평론가 애 평점 지가 머 줄 암 3 
116,7 사이 사이여 여 한 9 주면 거 크리 크리스프랫 
117,스프 랫 쿠퀔 쿠퀔카ㅏ카 카 ㅏ 완벽 명작 영화관 재개봉 
118,투 니꽈 존 존잼 잼 조 나 간지 영화 영화오락영화 
119,오락 무 보라 액션 영화 거 킹스 킹스맨 맨 의 
120,고전 고전버전 버전 감독인 감독인쥴 쥴 액션 코미디 도살자 돼지 
121,아저씨 액션 액션씬 씬 최고 끝맺음 평점 요즘 액션 액션영화 
122,영화 3 3분 분 1 가도 명작 촬영 촬영감독 감독 
123,슬로우 슬로우모션 모션 흥분 영화 영화슬로우모션 10 10년전 년 전 
124,영화 스타 스타일리시 일리 시 역시나 졸 졸리 리 실망 
125,나 세가 억지 만화가 원작 그것 능가 액션 스토리 속편 
126,마크 밀러 작품 뭐 랄 킹스맨 모태 영화 매력 10 
127,10년 년 곳 개명 개명작 작 이것 10 10년전 년 
128,전 옛날 극장 생각 오늘 티비 최근 액션 최고 스토리 
129,굿 요즘 영화 뜸 거 완전 이것 단순 액션 액션오락 
130,오락 영화 생각 오산 지금 20 20번 번 자판 찌 
131,얼굴 때 재미 재미짐 짐 망각 행복 보고 내가 총 
132,영화 중 최고 극중 명 명장면 장면 지금 도 최고 
133,명작 영화 정도 액션 액션씬 씬 나 지금 무엇 영화 
134,듯 액션 신화 원 원티 티 장난 액션 요즘 액션 
135,원 원티드 티드 반 이거 별 별점 점 나 마지막 
136,대사 원 원티드 티드 액션 배 배우 우 모두 연기 
137,대박 충격 공포 대박 10 10점만점 점 만점 100 100만점 
138,반 반전이 전이 어중간 어중간하다 하다 생각 찰나 뒤통수 제임스 
139,제임스맥어보 맥 어보 완전 몰입 내가 영화 영화중 중 1 
140,1위 위 이것 하 말 스토리 직선 엑스 엑스맨 맨 
141,맥어보이 어톤먼트 맥 맥어보이 어보이 페넬로피 맥어보이와 어보 이와 그 
142,매력 어디 처음 찌 찌질 질 스토리 전개 섹시 섹시해지 
143,해지 액션 완성도 황 스토리 중반 중반이후 이후 2008 2008년 
144,년 영화 허무 허무반전 반전 듯 미 이터 이터2 2 
145,레 매트릭스 아바 원 원티 티 열차 열차씬 씬 킬러 
146,사명 무고 수백 수백명 명 영화 설정 요 처음 끝 
147,액션 대박 2008 2008년도 년도 영화 때 번 현실 불가능 
148,초능력 액션 이루 이루저가 저가 살인 살인병기킬러 병기 킬러 스토리 
149,영화 나 무엇 거지 이것 2008 2008년 년 영화 영화라니 
150,라니 지금 개봉 중독성 삶이 때 영화 안 안젤리나졸리 젤리 
151,나졸 리 졸 졸리 류 의 영화 해당 명작 명작중 
152,중 하나 액션 졸 매력 최고 10 10년 년 꿀 
153,꿀잼 잼 액션 액션명작 명작 10 10년 년 봄 마지막 
154,대사 물음 순간 때 티비 신성 액션 충격 후 번 
155,저 인생 명작 생각 고증 바 보장 재미 액션 영화 
156,제임스 맥 맥어보이 어보이 개 명작 2 2편 편 마 
157,이것 액션 맥어보이 졸 환상적 퍼포먼스 눈 황홀 지금 오 
158,과 쥬라기 쥬라기월드 월드 리웃 슈퍼스타 크리스 프랫 찌 역할 
159,흥미 볼거리 드라마 액션 액션영화 영화 인생 고민 수 모범 
160,영화 재평가 왜ㅜ요즘 정도 퀄리티 때 해 액션 물론 스타일 
161,스타일리쉬 리 쉬 영상 매력 매력적인 적인 안 안젤리 젤리 
162,리 오랜만 원 원티드 티드 잼 젤리 젤리나졸 나졸 한참 
163,때 모습 맥 말 예전 가오겔 스타 스타로드 로드 출세 
164,연기 일품 흑 흑역사 역사 생각 마지막 쌍권총 장면 최고 
165,총알 때 총 배경 배경음악 음악 명 명장면임 임 10 
166,10년만 년 만 봣는데 최고 시간 제임스 제임스맥어보이 맥 어보이 
167,모건 모건프리 프리 안 안젤리나졸 젤리 나졸 고등학생 고등학생때 때 
168,다운 영화 한국 한국영화액션 액션 비교 1 안 안젤리나졸 젤리 
169,나졸 매력 ㅠ ㅠ스토리 스토리 액션 갓 갓원티드2 원 티드 
170,2 편 어른 말로 거짓말 할거 정도 십만 십만원 원 
171,주고 영화 자리 백만 백만원 번째 이것 데 내 처음 
172,때 말 생각 팬티 부족 이것 최고 최고최고 최 최최고 
173,최근 한국 영화 10 10년 년 연기 액션 각본 연출 
174,전부 킬러 킬러육성복수영화 육성 복수 영화 중 타고 주인공 장면 
175,이후 후 액션 마지막 성에 잠입 비현 비현실적 실적 하나 
176,개성 매력적 개봉 당시 거 액션 재미 가지 때문 평범 
177,평범햐진 햐 진 명작 수 영화 운명 간만 영화 화살 
178,우리 우리나라 나라 거 모방 느낌 스타일 스타일리쉬 리 쉬 
179,액션 액션영화 영화 최고 최고봉 봉 학생 학생때 때 사회 
180,사회초년생 초년생 통쾌 졸 누님 섹시 총알 설정 설정멋 멋 
181,폭발 액션 액션씬 씬 액션영화 영화 엔딩 유치 세련 시원 
182,메시지 멋 안 안젤리나졸 젤리 나졸 개오 개오짐 짐 20 
183,20번 번 바 짱 짱돌 돌 구 10 10점 점 
184,만점 임 약 영화 액션 기억 영화 꿀 꿀잼 잼 
185,명작 액션 액션영화중 영화 중 거 명작 반전 거 초반 
186,초반총격 총격 추격 추격신 신 신경 누 액션 액션영화 영화 
187,최고 슛 회사원 히어로 탄생 진행 액션 일품 차 차추격신이 
188,추격 신이 간만 평점 액션 결말 프로페 친구 훗날 스타 
189,스타로드 로드 줄 누 주름 섹시 완벽 포스 영화 처음 
190,당시 보고 8 8년 년 나 동안 이거 액션 액션영화 
191,유 유쾌상쾌 쾌상 쾌 평론가 의견 의견보고 이질감 참고 내 
192,최고 최고영화중 중 하나 영화 처음 때 충격적 기억 남 
193,티비 때 오늘 후회 후회중 중 최고 개그 개그액션영화 액션 
194,영화 액션 액션영화 영화 전설 남 스토리 강추 번 디 
195,디비디 비 화제 화제거리 거리 영화 단순 생각 그것 1 
196,이해 지금 당신 모습 나 최근 우리 대신 바 영화 
197,스토리 생각 액션 기기 딱이 8 8년 년 전 영화 
198,주 주구장창 구장 창 연출 양산 양산형 형 일반 액션 
199,액션영화 영화 때 액션연출 눈 피로 정석 잔인 한데 ㅅ 
200,ㅅ홬신 홬 신 순간 눈 오 거 거임 임 총격 
201,총격씬 씬 때 영화 정도 영화 만족 이거 잼 왤 
202,평점 거 기분 9 9점대 점 대 영화 2 2편 
203,편 기대 무산 아 액션 액션영화 영화 완전 완전집중 집중 
204,개인적 특별 특별하다 하다 스토리 제임스 맥어보이 젤리 졸 덕분 
205,눈 눈호강 호강 스타일 스타일리쉬 리 쉬 액션 씬 시선 
206,영화 이거 짱 단순 링 타임 설 설특선 특선 편집 
207,필름 극장 감동 자동차 회전 회전씬 씬 라운딩 총알 총알씬 
208,인상 인상적임 적임 정도 속 액션 액션영화 영화 ㅎ 총알 
209,황 액션 여 여전사 전사 안 안젤리 젤리 졸 졸리 
210,리 개연성 영화 명작 거지 연출 ㅇ ㅇㅈ ㅈ 액션 
211,연기 모두 10 10점 점 요즘 영화 원 원티드 티드 
212,반 액션 내용 엉망 안 안젤리 젤리 리 완벽 삶 
213,우리 모두 사람 개 개통쾌 통쾌 액션 영화 현실성 약간 
214,허 매력 쥐 죄 맥어보이 완전 민폐 넘 사람 죽일려 
215,기차 일반인 해골 거 번째 명작 안 안젤리 젤리 졸 
216,시간 줄 액션 연출 영상 연기 등 존 존잼 잼 
217,비현 비현실적 실적 첩보 보편 특별 연출 액션 액션영화 영화 
218,ㅎ 명작 번 얂 시간 순삭 리 좐 좐잼 잼 
219,요즘 액션 액션영화 영화 이때 미 미쳤엌 쳤엌 15 15년 
220,년 잼 13 13년 년 명작 이것 8 08년도 년도 
221,영화 영화임 임 하나 말 맥 맥어보이 어보이 액션 액션 
222,액션영화죠 영 화죠 잠시 눈 수 영화 집중 옆 남자 
223,남자친구 친구 말 줄 진짜 꾸울 꾸울잼 잼 영화 지금 
224,니 최근 개봉 정도 핵 핵잼 잼 12 12년 년 
225,나 하 이 영화 제임스 제임스맥어보이 맥어보이 영화개꿀잼 개꿀 잼 
226,생각 액션 액션영화 영화 권총 액션 액션영화 영화 반전 액션 
227,액션스릴 스릴 메세지 명작 2020 2020년 년 핵 핵꿀잼 꿀 
228,잼 최고 내 인생 진정 나의 개연성 미흡 면 정도 
229,스토리 구상 각본가 연출 박수 10 10년 년 전 액션 
230,실화 나름 반전 결말 최고 영화 보시 후회 최고 내 
231,영상 연출 긴장감 액션 연기 배우 할리우드 버전 발리 발리우드 
232,우드 액션 화려 리메이크 후속 후속작 작 ㅠ 킹스 킹스맨 
233,맨 만큼 시간 완전 몰입 최고 액션 액션영화 영화 마지막 
234,명대사 당신 지금 무엇 최고 액션 액션영화 영화 ㄷ ㄷㄷ 
235,웨슬리 친구 스타 개봉 개봉쯤 쯤 최근 요즘 요즘영화 영화 
236,기술 화 화끈 끈 액션 심장 반전 예전 데 점 
237,점드리고 드리고 가요 예정 디 디언즈오브 언 즈 오브 갤럭시가나오다 
238,영화 개 꿀 꿀잼 잼 엔딩 나이스 번 명작 2 
239,기대 1 1점 점 속편 액션 액션영화중 영화 중 하나 
240,액션 자체 영화 리 완전 섹시 이때 문화 예술 예술작품 
241,작품 때 장인 장인정신 정신 예술혼 혼 요즘 공장 단순 
242,액션 영화 고지 크리 크리스프랫 스프 랫 형 거기 주인공 
243,인생 사스 인줄 ㄷ ㄷㄷ 워 이것 반 반전 전 
244,스토리 액션 액션신꿀잼 신 꿀 잼 ㅇ ㅇㅇ 오늘 진심 
245,매력 영화 별 별감흥 감흥 이것 맥 맥어보이 어보이 액션 
246,시대 시대감안하면 감안 하면 최고 최고수준임 수준 임 스토리 나름 
247,9 9점 점 정도 점수 10 10점 볼만 링 링타임영화 
248,타임 영화 명작 안 링 타임 생각 위 스타 스타로드 
249,로드 요즘 사람 명작 나 영화 제임스 감독 줄 액션 
250,비현 비현실적 실적 맛 있음 마지막 돈 나 속편 이유 
251,2 2편 편 편 혹평 이것 ㅋ 액션 내가 니 
252,아비 장면 수리공 총알 영화 기억 왓 ㅠ ㅠㅍ돈래잍 ㅍ 
253,돈 래잍 리 영화 액션 액션영화중 중 인생 인생작ㅠ 작 
254,ㅠ 번 액션 액션영화중 영화 중 명작 카리스마 안 안젤리 
255,젤리 영화 스토리 액션 연출 배우 연기 완벽 자체 액션 
256,스토리 연기 삼박자 굿 총알 총알뿐 뿐 쥐 ㅠ 액션 
257,인생 교훈 삼위일체 영화 몰입 액션 연출 우리 액션 액션명작 
258,명작 속 액션 액션씬 씬 화려 대리 대리만족 만족 제대 
259,속편 편 영상미 전개 액션 액션영화 영화 총알 테크닉 액션 
260,상상 요즘 영화 인도 인도영화 영화 비현 비현실적 실적 인생 
261,액션 액션영화 영화 10 스토리 기 엔딩 엔딩곡 곡 중 
262,주인공 임 당신 6 6주안 주 안 변화 수 각두 
263,각두늣 늣 소다 노 8 8점 점 후 후반대 반대 
264,영화 오늘 역작 유치 액션 내용 듯 느낌 액션 액션영화 
265,영화 2 8 8점 점 반대 10 10점 후반 오랜만 
266,스토리 팝콘 팝콘영화 영화 액션 액션씬 씬 최고 매트릭스 충격 
267,액션 액션 로 로언 언 놈 줄 니 아빠 언니 
268,최고 액션 액션영화 영화 젤리 젤리나졸 나졸 거 오락 오락영화 
269,영화 틈 이 감독 나이트 나이트워 워 데 치 때 
270,약 여기 장 폭발 킬러 판타지 액션 영화 극장 나 
271,승자 그때 그때당시 당시 신선 액션 스토리 액션 영화 이것 
272,액션 사람 추천 액션 예술 액션 액션영화 영화 감동 처음 
273,씨 영화 나 청 줄 잔인 대부분 실눈 맥 맥어보이 
274,어보이 때문 언니 쉬 ㄷ ㄷㄷ 액션 졸 졸리 리 
275,연출 연출편집영상음악 편집 영상 음악 등 완벽 자체 평론가 평론가놈 
276,놈 꼴 척 액션 액션하난 하난 선 악 구분 희열감 
277,부족 커브 커브곡선 곡선 스마트 총알 액션 임 유어 파 
278,한번 영화 안 안젤리 젤리 이때 제일 매 매카 카 
279,짱 ㅠ 존 존잼 잼 뭐 ㄹ래 머리 전 찰스 
280,스토리 개연성 미흡 액션 액션영화 영화 역할 완벽 완벽헀 헀 
281,파이트 파이트클럽 클럽 액션 예술 경지 영화 고 고딩때 딩 
282,때 오늘 현실 반영 블랙 블랙코미디 코미디 요소 액션 액션신 
283,신 요즘 영화 이야기 시작 중간 액션 설계 마지막 아쉬움 
284,안 안젤리 젤리 졸 때문 졸리 리 영화 내용 내용자체 
285,자체 어거지 ㅡ 공간 사람 총 총앞 앞 우왕좌왕 최고 
286,관통력 총알 6 6개월만 개월 만 장면 실소 몰입 몰입감 
287,감 봄 액션 액션부분 부분 8 8점 점 요즘 신 
288,신박 박 소재 스타일 스타일리쉬 리 쉬 액션 나름 스토리 
289,히 땅 총알 총알영화 영화 첨 당 액션 영화 명작 
290,독특 독특하다 하다 말 말밖 밖 직장인 과대 과대망상 망상 
291,삶 거부 천생 살인자 이야기 스타워즈 빰치 반전 화려 액션 
292,액션씬 씬 통쾌 현실성 사실 특유 총 액션 나름 매력적 
293,스토리 흥미 주제 주제의식 의식 설득력 사무실 상사 세무사 삶 
294,할리우드 영화 영웅 킬러 배 스릴 가치 결국 일탈 함정 
295,거 꿀 꿀잼 잼 앞 액션 액션영화 영화 때 말 
296,만큼 리 여신 안 안젤리 젤리 졸 매력 제임스 맥 
297,맥어보이의 어보 이의 함도 압권 액션 영화 스토리 속 반전 
298,볼거리 제임스 맥 맥어보이 어보이 왜캐 훈 훈남 남 엿 
299,개설 개설렛다 렛 다 액션 액션신 신 스토리 음 절벽 
300,사람 찍찍이 지네 지네ㅠ ㅠ 베스트 베스트5안 5 안 액션 
301,민폐 액션 스토리 뭐 구로 액션 연출 10 10년 년 
302,전 작품 웨슬리 조직 세뇌 과정 진실 스토리 라인 유치 
303,약 건 제임스 맥어보이 졸 연기 커버 흥분 윤리 개연성 
304,총알 방 좌 21 새끼 리뷰 일관성 영화 안 안젤리나졸 
305,젤리 나졸 차로 남자 거 거간지 간지 콘스탄틴 영화 제임스 
306,맥 맥어보이 어보이 날 싸이코 병 병맛 맛 반전 스토리 
307,맥어보이의 어보 이의 멋 멋짐 짐 겸비 연기력 이거 처음 
308,제임스 때 뭐 찌 찌질 질 주인공 생각 마지막 팬 
309,시원 화통 영화 액션 영화 이정 시나리오 연출 갑 요소 
310,가능 개연성 수 한가지 흠 당시 제임스 맥어보이 듣보잡 수준 
311,흥미 반감 지금 엑스 엑스맨 맨 후반부 개 초반 초반부도 
312,부도 나름 대박 대박시전 시전 영화 맥 맥어보 어보 찬양 
313,엑스 재탕 정도 스릴 자신 무엇 나 생각 영화 안 
314,안젤리나졸리 젤리 나졸 리 볼거리 화려 건 장점 스토리 중 
315,중2병 2 병 흑 흑염룡 염 룡 원래 원 원티 
316,티 영화 영화자체 자체 스토리 스토리중심 중심 통쾌 악당 맛 
317,건 스토리드립 드립 병 뭐 2000 2000년대 년대 액션 액션영화 
318,영화 다섯 다섯손가락 손가락 정도 명작 링 생각 볼만 영화 
319,재 재밋 밋 저 때 때당시 당시 내가 10 생각 
320,지금 맥 맥어보이 어보이 머리 영화 군더더기 총질 액션 레 
321,레알 알 매 명작 이유 법 과학적 법칙 윈 흥미 
322,이것 초 초6때 6 때 엄마 다운 26 26살인 살인 
323,영화 줜 섹 섹1시 1 시 3 3원티 원 티 
324,게임 잼 영화 대박 숨 명작 멱살 감동 총알 씬 
325,수미 수미상관도 상관도 굿 존 존잼ㅋ 잼 ㅋ 개 총알 
326,거지 이것 액션 액션영화 영화 비주얼 영화 뻔 평점 7.8 
327,맥 맥어보이 어보이 매력 이것 난 행운아 누구 한번쯤 남 
328,나의 모습 건 꿈 현실 속 개 개존잼존 존 잼 
329,멋 졸 졸리 리 밖 킹스맨 원조 원조격 격 대박 
330,스토리 엉망 이상 링 링타임 타임 제격 집 티비 티비채널 
331,채널 영화 영화채널 때 안성맞춤 이 반전 경험 경험해본 해본 
332,이번 처음 번 꿀 꿀잼 잼 졸 누나 사랑 유치 
333,ㅈ 린 찌 찌질 질 직장인 대리 대리만족 만족 내 
334,인생 최고 영화 액션 최고 스토리 결말 총알 총알액션물 액션물 
335,새 장르 진심 진심최고 최고 양심 졸 누님 라 스토리 
336,특유 액션 후반부 몰입 영화 티무르 감독 인생 인생작품 작품 
337,중딩때 년 년만 만 처음 개꿀 개꿀잼 잼 영화 요즘 
338,거 거본지 본지 생각 나 평점 액션 액션만큼 만큼 지 
339,지잼 잼 인생 역전 홈런 느낌 하나 볼만 액션 액션영화 
340,영화 액션 ㅎ ㅎㄷㄷ ㄷ 임 리 흥미로웠다 병 병맛 
341,맛 나중 나름 링 링타임 타임 총알 장면 제일 인상 
342,영화 평점 진심 진심강추 강추 잼 꿀 꿀잼 졸 졸리 
343,리 결혼 10 10점줄랫 점 줄 랫 데 생각 총질 
344,영화 액션 액션영화 영화 수작 여러모 빵 ㄱ ㅐ 영화 
345,처음 장면 때 후반부 결말 하다 반복 일상 속 사람 
346,액션 액션영화 영화 기대 너 지금 식 질문 수미 수미쌍관 
347,쌍관 결말 허망 허망핟 핟 씬 중반 잔인 데 제임스 
348,매 매카보이 카보이 미모 커버 가능 가능ㅋ ㅋ 거 꾸르 
349,잼 꿀 꿀꾸ㅜ 꾸ㅜ 군더더기 액션 최고 영화 끝 예측 
350,수 없엇 스토리 독특 잼 이것 8.21 장난 장난하나 하나 
351,호랑이 새끼 타짜 아들 최종 최종병기 병기 곡사 재 재밋숨 
352,밋 숨 내 내스탈 스탈 댐 액션 액션신 신 맛깔 
353,주인공 젤리 리 제임스 맥 맥어보 어보 이것 2008 2008년 
354,년 영화 꿀 꿀잼 잼 젤리 방금 채널 와우 액션 
355,장난 장난아 아 마지막 모건 모건프리 프리 이 장면 인상적 
356,액션 스토리 스토리 링 링타임몫 타임 몫 내가 이것 폭스 
357,액션 스토리 야 졸 졸리 리 영화 기본 듯 전 
358,스토리 ㅋ 굿 굿굿굿굿 빈약 스토리 감각적 액션 링 링타임 
359,타임 액션 볼만 스토리 ㅄ 액션 개 영화 교도 안 
360,정 정도로 도로 졸 누님 액션 캐쩔었 캐쩔었찌롱 찌 롱 
361,스릴 스릴감이 감이 최고 최고였제 였제 링 링타임 타임 주목적 
362,오락 오락영화 영화 정도 최 최정점 정점 의미 이상 거 
363,스토리 소재 신선 잼 영화 듯 굿 생각 내용 액션 
364,환상적 30 30분 분 몰입 결국 끝 봄 아버지 못 
365,약체 아들 아들인 인 웃기 결론 볼만 액션 액션신 신 
366,개인적 내용 완벽 완벽하다 하다 링 링타임 타임 영화 ㄹ 
367,ㄹㅇ ㅇ 할리우드 할리우드판 판 쿵푸 쿵푸허 허 임 밑 
368,님 눈 영화 몰입 반전 액션 진짜 기가 최고 기존 
369,느낌 액션 눈요기 반전 반전영화임 영화 임 애초 쇼 쇼킹 
370,킹 거 아쉬움 전반적 액션 나 영화 한번 내용 전체적 
371,이해 마지막 마지막반전 반전 젤리 졸 문신 제임스 제임스맥어보이 맥어보이 
372,기대 기대안 안 완전 완전몰입 몰입 최고 반전 시나리오 예술 
373,잼 잼있음 있음 반전 액션 작품 쥐 영화 어디 후반부 
374,액션 얼탱 시간 때 때우기용 우 기용 재미 재미있슴 있슴 
375,액션 영화 처음 현실 불가능 설정 설정등 등 가미 별 
376,하나 스토리 중구난방 총점 총점8점 8 점 데 이것 십 
377,십구금 구 금 피에타 평점 10 10점 점 말 당신 
378,무엇 말 재 재밋 밋 기기 최고 짱 시간 줄 
379,봄 쵝 쵝오 오 수작 액션 스토리 액션 진짜 젤리 
380,남성 터프 총알 주심 액션 결말 액션영화 영화 맛 진짜 
381,안 안젤리나졸 젤리 나졸 듯 예전 번 본 본작품 작품 
382,게임 여 맞추기 맞추기식 식 액션 빈약 이야기 무엇 영화 
383,자 도 개연성 수 눈요기 눈요기거리 거리 뿐 눈요기 인정 
384,재 재밋 밋 기차 기차사고 사고 낭떠러지 거기 총질 총질소리때메 
385,소리 때 메 라 라구 구 섬유 섬유조직 조직 머 
386,거 암 영화래 잖 잖오 오 쒸 당신 대체 무엇 
387,감독 실수 평생 역작 그 필모그라피 유일 자랑거리 듯 관객 
388,혼 현란 액션 시간 추 8 8점 점 정도 볼만 
389,여운 여운따위 따위 건 눈 영화 감독 연출력 안 안젤리 
390,젤리 리 최고 간만 수작 액션 액션영화 영화 액션 제외 
391,8 8점 점 통쾌 액션 짜임새 줄거리 나 연기력 뭐 
392,흠 수 당 당신인 신인 발 지금 화려 박력 액션 
