,Word
294,인생영화 영화 이상 말 이거 세기말 혼자 행복 건 평점 
295,알바 명작 영화 장난질 처 넘 재밋어 윌 윌스미스 스미스 
296,좀비 영화 하기 이상 감동 7 7점대 점 대 영화 
297,평점 리 리뷰 뷰 번 잼 영화 말 긴장 수 
298,방 방금 금 티비 나 이거 소장 있음 감독 감독판 
299,판 전개 결말 메이킹 필름 건 무조건 소장임 임 감동 
300,최고 좀비 영화 갓 갓윌스미스 윌 스미스 요 평점 운동 
301,합 꿀 꿀잼 잼 평 어이 최소 8 8점대 점 
302,대 적 9 9점대 개재 개재밋음 밋 음 평점 평점올 
303,올 좀비 영화 영화중 중 정도 상 영화 평점 고 
304,평점 거지 영화관 보고 티비 봄 좀비 좀비영화 영화 잼 
305,입도 짱 좀비 혼자 진짜 레 스릴 스릴영화 영화 비 
306,유일한 가족 가족이자 이자 친구 샘 때 죄책감 주인공 심정 
307,마음 인간 혼자 수 생물 진짜 평점 9 9점 점 
308,우 폐렴 때문 전세계 비상 현재 넷플릭스 나 전설 시청 
309,영화 공감 공포감 샘 때 진심 듯 평점 거 올리고 
310,갑 2020 2020년 년 미래 전설 이거 엔딩 2 마지막 
311,때 진짜 소설 작품 윌 윌스미스 스미스 연기력 포스트 포 
312,포칼 칼 립스 표현 재 재밋 밋 데 ㅈ ㅈ금바 
313,금 바 진부 좀비 좀비물 물 2 2편 편 좀비 
314,영화 7 07년 년 원작 반전 확인 감독 결말 영화 
315,의미 기존 엔딩 5 5점 점 감독판 판 8 8점 
316,점 윌 윌스미스 스미스 입 입덕 덕 영화 물 이것저것 
317,생각 좀비 좀비영화 영화 상황 대처 압박감 절망감 희망 등등 
318,퇴화 윌 윌스미스 스미스 변종 변종인류 인류 지능 사랑 걸 
319,깨 나 고독 거구 영화 홀 수 인간 내면 고독 
320,공포 나 좀비 좀비물 물 영화 말 레 레전 전 
321,전설 영화 인생 최고 영화 영화중 중 하나 좀비 좀비영화중 
322,영화 중 최고 최고봉 봉 재미 기 윌 윌스미스 스미스 
323,혼자 개 러닝 러닝타임 타임 연기력 연출 지구의 인류 인류중 
324,중 나 상상 진짜 평점 왜캐 재밋숴 ㄹ ㄹㅇ ㅇ 
325,번 번정도 정도 지금 열 열번 번 듯 나 영화 
326,작품 메시 메시지도 지도 홀대 외로움 감정 고찰 좀비 좀비물 
327,물 영화 최고 영화 수작 이것 좀비 영화 인간 혼자 
328,수 스파이 스파이더맨 더 맨 능력 비 극한 외로움 현 
329,현실적 실적 문제 직면 이야기 전설 3 3번 번 최고 
330,최고 영화 영화중 중 한편 인정 기억 조음 평점 마네킹 
331,과의 대화 나 좀비 중학생 시절 좀비 기대 재미 성인 
332,영화 명작 역대 역대좀비영화제 좀비 영화제 재미 스릴 영화 스피드 
333,지능 대장 비가 실험 실험대상 대상 마누라 마누라좀비 좀비 모습 
334,당시 충격 듯이 삭막 적막 도시 안 개 단둘 윌 
335,윌스미스 스미스 연기 공포감 극대화 윌 윌스미스 스미스 연기 최고 
336,명작 야 이것 평점 7 7점대 점 대 비 비팬 
337,팬 평점 이래 허 원작 사 영화 영화자체 자체 평가 
338,생각 10 10점ㅋ 점 ㅋ 번 윌 스미스 고독 사람 
339,혼자 살수 강 강철창문 철창문 2 2중잠금장치 중 잠금 잠금장치 
340,장치 때 공포감 평점 10 10점 점 이건 7 7점대 
341,대 영화 영화 평점 7.6 7.6임 임 개명 개명작 작 
342,평점 가우리 가우리나라 나라 개 영화 8 8점대 점 대 
343,당시 극장 때 충격 전율 몸서리 가시 가시지가 지가 가지 
344,생각 작품 윌 윌스미스 스미스 연기 좀비 좀비물 물 가장 
345,휴먼 휴먼드라마 드라마 인생 최대 걸작 임 연 연기 기 
346,압권 진짜 평점 ㅠ 10 10점 점 우울증 치료 영화 
347,명작 7 7점대야 점 대야 이해 수 작품 왤캐 평점 
348,굿 굿굿굿 강추 10 10년도 년도 때 영화 샘 윌 
349,윌스미스 스미스 콤비 감동적 감동적임 임 개가 강아지 샘 때 
350,이 자신 속 울 집 비행기 위 혼자 골프 이건 
351,장르 좀비 좀비영화 영화 듯 윌 윌스미스 스미스 세상 혼자 
352,남 메 메소드연기 소드 연기 역대 역대급 급 54 54년 
353,년 원작 원작소설 소설 명작 명작영화 십 십여년 여 년 
354,윌 윌스미스 스미스 이것 스릴 좀비 좀비물 물 기대 실망 
355,수 예전 영화 이것 비 비물 물 기보 생각 영화 
356,영화강추 강추 꿀 꿀잼 잼 영화 평점 윌 윌스미스 스미스 
357,영화 재밋다면 7 7점 점 새끼 무엇 10 10점 점 
358,데 점수 이모 이모냥 냥 이것 7 7점대 점 대 
359,2240640110870585024 1532347298693 이명 이명작중 작중 명작 7점대임 대임 최고 리메이크 
360,리메이크작품 작품 처음 평점 영화 영화이자 이자 영화여 여 번 
361,영화 개 개꾸루르르 꾸루 르 잼 이것 영화관 안타 움 
362,진심 줜 나 기자 평 대작 정말 인간 고뇌 작품 
363,최고 긴장감 재 재밋음 밋 음 평균 이상 거 비판 
364,인간 소시 패스 패스임 임 오락 영화 ㅈ 삶 때 
365,한번 꺼 영화 마지막 비 티 티스트 스트 결말 소름 
366,최고 윌 스미스 스미스릐 릐 연기 구라 구라안 안 6 
367,6번봄 번 봄 속편 속편개봉 개봉 듯 좀비 개연성 부족 
368,상관 수 영화 여자 윌 윌스미스말 스미스 말 나 집 
369,해피엔딩 을 을것 암 암걸리 걸리 최고 뭐 말 좀비 
370,좀비물 물 세상 혼자 표현 10 10년 년 나 이상 
371,최고 작품 좀비 외로움 싸움 극장 결말 완벽 거 9 
372,9점 점 7 7점대 대 8 8점 중반 영화 평론가 
373,별 별점 점 평론가 5 5점 점 만점 명작 7 
374,7점대 점 대 어이 급 영화 나라 무엇 이거 평점 
375,7 7점대지 점 대지 전설 영화 좀비 영화 하나 드라마 
376,진짜 추천 엔딩 버전 2 2개 개 있음 둘 내 
377,인생 윌 윌스미스 스미스 연기 연 연기지 기지 샘 죽음 
378,인간 자 의 외로움 무서움 수작 중반 이후 좀비 영화 
379,리 리셰 셰 모음 결말 별 내가 이거 좀비 좀비영화 
380,영화 홀 홀릭함 릭 함 지금 도 역대 역대급임 급 
381,임 평점 평점실환가 실 환가 영화 전설 생각 평가 평점 
382,끝 심장 깃 감동 스푼 평점 뭐 좀비 영화 영화중 
383,중 몰입 좀비 영화 전설 시작 윌 윌스미스 스미스 연기 
384,절정 재 재밋게 밋 게 결말 종류 인터넷 감상 감상평 
385,평 처음 영화 스토리 연기 나한 나한터 터 완벽 생존 
386,때 유익 잼 10 10년 년 역대 역대최고 최고 좀비 
387,좀비영화 영화 완전 상황 스토리 7 10 10연 연 8 
388,10연기 기 최고 마지막 결말 두개 나 인간 괴물 수작 
389,2 2번본 번 본 영화 명작 개 가지 엔딩 엔딩버전중 
390,버전 중 주인공 희생 감동적 듯 때 볼만 영화 윌 
391,윌스미스 스미스 눈빛 하 결말 가지 버전 극장 극장판 판 
392,제목 의미 원작 퇴색 6 6점 점 감독 감독판 8 
393,8점 총점 7 7점 우울 윌 윌스미스 스미스 연기 코 
394,코시국 시국 영화 코로나 코로나19 19 일 수 생각 고독 
395,영화 개 오열 윌 윌스미스 스미스 연기 압권 압권임 임 
396,평점 조정 14 14년 년 전 영화 정도 명작 평점 
397,가요 당시 지금 평가 번 여운 영화 가지 결말 스토리 
398,대화 가능 그 감독 감독판 판 엔딩 여운 지금 가슴 
399,장면 정도 연기 연출 여운 영화 하드 하드캐리 캐리 후반부 
400,종교적 내용 결말 좀비 좀비물중 물 중 최고 감동적 전설 
401,전설속 속 괴물 추억 공포감 고독 삶 시간 모습 레 
402,레전 전 강아지 전 주인 대성 대성통곡 통곡 좀비 좀비물중 
403,물 중 영화 연출 세련미 옛날 지금 결말 스토리 좀비 
404,좀비영화 영화 탑 탑3 3 안 생각 번째 연기 결말 
405,해피엔딩 이것 7 7점 점 최 최소 소 8.8 8.8점 
406,물이 장르 상승 전설 영화 이것 2007 2007년영화라니 년 영화 
407,라니 레 레전 전 개꿀 개꿀잼 잼 중학교 2 2학년때 
408,학년 때 구들 이거 영화 개 엇네 던 ㅋ 중학생 
409,중학생때 때 영화관 신의 수 좀비 좀비물 물 볼만 볼만하다 
410,하다 결말 본 버전 영화 자체 윌 연기 내용 등 
411,좀비 분장 뿐 레지던트 12 나 전설 월드 월드워 워 
412,내가 좀비 좀비영화 영화 좋인 계기 중간 워킹 워킹대드도 대 
413,드도 오늘 검색 생각 평점 샘 때 존윅 제외 강아지 
414,유일한 명작 메 메이드 이드 영화 굿 눈 7 7점 
415,점 이해 10 10점 요즘 영화 수준 은 절대 7 
416,7점대 점 대 안됨 엔딩 엔딩장면 장면 부분 연출 연기 
417,완벽 고 역대 좀비 좀비물 물 영화중 중 유형 수작 
418,수 나 단언 전설 때 긴장 눈물 수작 연기 연기최고 
419,최고 스릴 외로워 좀비 케이블 때 추 추천 천 재미 
420,재미있음 있음 보삼 평론가 거지 평점 이유 최고 영화 때 
421,영화 혼자 이것 옛날 영화관 번 번봄 봄 방 생각 
422,나 평점 감 뭐 말 필요 꿀 꿀잼 잼 미 
423,미쳣 쳣 윌 윌스미스 스미스 인생 영화 인간 사회적 사회적동물 
424,동물 평점 한국 관객 수준 정도 번 오늘 간만 기분 
425,영화 영화평점 평점 연출 연출짱 짱 남 주인공 책임감 영화 
426,평점 낮 윌 윌스미스 스미스 연기 좀비 좀비영화물 영화 물 
427,중 동 동시대 시대 비교 최고 듯 감동 감동미 미 
428,영화 뭐 윌 윌스미스 스미스 결말 2 2개 개 단순 
429,좀비 영화 삶 철학 평점 기억 남 생존 영화 영화중 
430,중 하나 재 재밌땅 밌 땅 윌 윌스미스 스미스 짱 
431,7 7번 번 거 윌 윌스미스 스미스 시절 인생 인생작 
432,작 ㅅ ㅅㅂ ㅂ 리뷰 스포 최고 최고최고 대 대탈출2 
433,탈출 2 이거 거 모자 모자핵 핵 위치 발각 발각안됫으 
434,안 됫으 수 스릴 무서움 잼 말리 ㅅ ㅅㅂ ㅂ 
435,애새끼 말 2 2년 년 생각 나 영화 이것 진짜 
436,평점 좀비 좀비영화 영화 스토리 연기 함축적 함축적의미 의미 생각 
437,좀비 사람 번 영화 비 이상한 나지 이 때 영화관 
438,엄마 단순 좀비 좀비영화 영화 연출 심장 장면 엔딩 엔딩보고 
439,보고 생각 최고 김 또볼려구 좀비 좀비영화 영화 개인적 감독 
440,감독판 판 엔딩 저 해피엔딩 좀비 공포 그 외로움 감동 
441,나 전설 제목 물 유명 건 이유 거기 스미스 연기 
442,이것 7 7점 점 이거 명작 개인적 영화 번 5 
443,5번 번 거 때 영화 채널 채널씨지비 씨 지 비 
444,오늘 처음 2007 2007년 년 12 12년전 전 그래픽 어색 
445,영상미 스토리 구조 윌 윌스미스 스미스 연기 나위 엔딩 개 
446,데 나머지 하 생각 영화 좀비 좀비영화중 영화 중 최고 
447,듯 오랜만 잼 존 존잼 잼 참고 엔딩 2 2개 
448,개 티비 때 수작 시대 기술 기술발전 발전 영화 지금 
449,운 처음 2 2부 부 광고 중 2019 2019년 년 
450,지금 영화 비교 정 정도로 도로 작품 남 영화 시간 
451,가면 영화 개명 개명작 작 진 영화 평점 이해 못 
452,년 나도 영화 12 12년 년 지금 티비 명작 영화 
453,액션 좀비 가장 외로움 마네킹 대화 장면 넘 번째 중 
454,평점 윌 윌스미스 스미스 평점 요즘 기 한국 한국영화 영화 
455,기본 8 8점 점 한편 하 샘 샘죽 죽 나도 
456,고지 윌 윌스미스 스미스 고독 싸움 때 새 느낌 완전 
457,몰입 갑자 그동안 주인공 일 뻘 뻘짓 짓 허탈감 좀비 
458,인간성 사람 뇌 퇴화 비 모 인간 인간관점 관점 오만 
459,좀비 좀비물 물 중 최고 윌 윌스미스 스미스 새벽 새벽전투신 
460,전 투신 거 화면 보임 글래 글래디에이터 디에이 터 인생 
461,인생영화 영화 샘 결말 2 2개 개 때 전설 영화 
462,인간 소통 수 존재 좀비 수 명작 명작영화 영화 규 
463,규ㅑ야쟤 ㅑ 야 쟤 배 배바ㅓ유 바 ㅓ 유 두더ㅑ 
464,두더ㅑㄱ ㄱ 별 별점 점 7 7점 점 대인 ㅇ 
465,영화 결말 허무 오 오학년 학년 때 영화 영화보고 보고 
466,잠 기억 극 극ㄷㅋㆍ느느느 ㄷ ㅋㆍ느느느 스릴러 가자 마지막 마지막쯤 
467,쯤 생존자 신 결말 이상 긴장감 영화 인간 얼굴 지금 
468,남자 남자중 중 영화 한국 한국사람 사람 좀비 좀비물 물 
469,윌 윌스미스 스미스 연기 혀 레 타인 평점 영화 뿌슝빠슝 
470,뿌슝빠슝삐슝 삐 슝 이해 안가 평론가 평론가등평점 등 평점 당시 
471,비판자 만 괜 괜찮으 찮으 ㄴ ㄴ영화 영화 낮 극장 
472,때 허무 느낌 티브이 티브이채널 채널 본 본이후 이후 영화 
473,영화채널 때 옛날 본건 짓 9 9점대 점 대 영화 
474,이해 안가 7.5 명작 명작중 중 9 9점 점 내 
475,인생 처ㅡ고 좀비 10 10년 년 나도 최고 좀비 재미 
476,재미있음 있음 어어어어으으으ㄷ최 10 10점 점 때 생각 영화 때 
477,기억 100 100번 번 영화 번째 번째지 지 긴장감 장난 
478,장난아 아 곳 인간 종말 영화 굿잡 스스슷 스스슷자ㅏㄱ 자 
479,ㅏ ㄱ 섹 평 이해 내가 이상 때 영화 영화중 
480,중 하나 현재 평점 영화 최소 8.5 이상 이것 7 
481,7점 점 10 10자적으라 자적 으 라 스토리 좀비 영화 
482,급 인류 인류멸망 멸망 장르 10 10점 점 윌 윌스미스 
483,스미스 연기 갑 좀비 외로움 심장 스릴 평점 이해 영화 
484,본영 감동 도시 일상 주인공 속마음 대비 고독감 사색 정도 
485,오락 오락영화 영화 윌 스미스 연기력 콘 콘스탄 스탄 감독 
486,특유 영상미 고 윌 윌스미스 스미스 전설 영화 분위기 8.5 
487,8.5정도 정도 영화 인생 무엇 영화 강아지 말자 쒸익쒸 굳굳굳 
488,주인공 고독 표현 자신 마지막 버팀목 개 죽음 지독 나락 
489,끝 좀비 듯 변해 그 인간 모습 7 7점대지 점 
490,대지 영화 내 인생 인생중 중 중독 결말 두개 두개라 
491,라 때 연 연기력 기력 갑 이것 8.5 8.5이상 이상 
492,데 평점 10 10점 점 12 12년 년 최고 엔딩 
493,두개 말 최고 영화 재미쓰 요즘 돔 돔비영화 비 영화 
494,닺 이거 영화 평점 낮 조절 하자 좀비 좀비영화중 영화 
495,중 저급 개 개잼꿀 잼 꿀 평점 듯 평점 왤 
496,나 이거 4 4번 번 ㅅ ㅅㅂ ㅂ 이거 영화 
497,근래 캅스 악 악경 경 동석 거 수위 좀비 좀비물 
498,물 새 차원 해석 샘 읠스미스 의 울음 울음ㅠ ㅠ 
499,감독 결말 여운 그 윌 윌스미스 스미스 괴물 괴물이자 이자 
0,액션 스케일 갓 갓밀러 밀러 감독 믿보 역대 역대급 급 
1,명작 터 터미 미 이터 이터2 2 능가 수 완벽 
2,이터3 3 카 론 형님 28 28년만 년 만 미 
3,이터 이터3 3 라 수 각 복제 능력 입 입틀 
4,틀 자체 레 쎈케 만남 만남임 임 끝판 끝판왕임 왕 
5,한국형 페미니즘 사라 사라코너 코너 걸 쉬 미 이터 배우 
6,오늘 팬 제임스 카 론 데드 팀 밀러 감독 합작 
7,이 조합 차 차각 각 그레이스 언냐 존 존멋 멋 
8,ㅡ ㅡ6 6 아이맥스 보세 보세여 여 액션 평점 테러 
9,예상 미 이터 대박 나 2 3 제작 힘 스토리 
10,마무리 형 죽기 죽기전 전 이번 놀드 형 시리즈 작별 
11,ㅜ 린 린다해밀턴 다 해밀턴 크러 크러쉬 쉬 캬 근래 
12,조커 감동 터 터미 미 이터 제대 3 3편 편 
13,기분 흥행 형 애정 레 레전 전 의 귀환 1.2 
14,1.2편 편 팬 미 이터 이것 터미 터미네이터지 네이터지 나 
15,제대 이것 터미 터미네이터지 네이터지 진짜 3 3편 편 생각 
16,조커 미 이터 영화지김지영 비교 영화 노장 귀환 반가 줄 
17,사라 사라코너 코너 누님 고속 고속도로 도로 처음 등장 때 
18,소름 사랑 에드워드 펄롱 인가 거지 우리 우리나이 나이 마흔 
19,터 이것 평가 행위 미 이터 이터2 2 대 모독 
20,스토리 거 언급 내 초 초딩시절 딩 시절 열 열번 
21,번 비디오 터 터미 후속 후속작 작 린 누나 놀드 
22,형 모습 세월 여의도 시사회 요즈음 외화 스토리 미 이터 
23,1 2 향수 윌 윌비백 비 백 두 두둥 둥 
24,두 두둥 제니시스 이거 제임스 카 론 형님 유무 차이 
25,미 이터 세계 시작 중학생 때 친구 단성사 1 1편 
26,편 군바리 여 여친 친 서울 서울극장 극장 2 2편 
27,오늘 나이 50 대 구 구여 현 현아내 아내 3 
28,3편 플롯 개연성 무엇 파이 히 워즈 백 ㅠ 꿀 
29,꿀잼 잼 액션 입 아이맥스 례 례정 정 세상 세상사람 
30,사람 다크 다크페이트 페이트 보세 스테이크 장면 때 중간 광고 
31,줄 아웃 아웃백스테이크 백 스테이크 협찬 줄 2 세이 세이션에 
32,션에 아놀드 린다 컴백 가치 작품 최근 10 10년간 년 
33,간 개인적 의미 영화 액션 연기 두말 스토리 어제 고용 
34,고용노동부 노동부 복지 복지이벤트 이벤트 기존 터 터미 미 이터 
35,2 배우 추억 추억팔 팔 정도 영화 생각 별 기대 
36,개봉 사람 혹평 만큼 스토리 사라 코너 그레이스 모스 이것 
37,걸 쉬 라 미 이터 시리즈 사골 감독 영화 액션 
38,액션신 신 눈 눈호강 호강 그레이스 사라 사라코너 코너 걸 
39,멋 멋짐 짐 뿜뿜입니 관람객 82 82년생 년생 김 김지영 
40,지영 100 100만배 만 배 잼 람보 놀드 형님 만수무 
41,만수무강 강 1 1과 과 2 바 계보 역작 카 
42,론 프로듀싱 참여 동안 짝 아류 화면 힘 자체 린 
43,린다 다 해밀턴 여사 걸 이지 후 그레이스 최고 시리즈 
44,최초 히스 히스패닉계 패 닉 계 악역 논란 거 몰입 
45,정도 9 역 소화 미래 미래전쟁 전쟁 관 독자적 시작 
46,시작편 편 2 2이후 이후 영화 미 미네이 네이 진짜 
47,알바 2 이후 후속 후속작중 작중 최고 12 12편 편 
48,추격 스릴 스릴감 감 간만 나름 감동 듯 그때 처절 
49,느낌 제대 터 터미 미 이터 팬 기대 시리즈 영화 
50,진짜 할리우드 국산 거 생각 이상 정치적 사회적 선동 선동선전 
51,선전 린 린다 다 해밀턴 출연 신의 한수 사라 코너 
52,등장 등장씬 씬 온몸 전율 ㄷ ㄷㄷ 예전 터 터미 
53,미 이터 12 열광 올드 팬 공감 스토리 기계 배우 
54,연출 안보 병 항공 폭파얙션씬 약간 미션 미션임파 임파 이 
55,개봉 영화 영화속 속 최고 최고액션씬 액션 씬 해의 대표적 
56,액션씬 이번 터 터미 미 9 독 넘 2 2의 
57,의 성 수 중 속 스트레스 방 스릴 왕 왕재미 
58,재미 그레이스 걸 시 쭤렀 쒸익 넘 잼 나 다음 
59,다음편 편 그레이스 날 ㅠ 어제 용 시사회 미 이터 
60,시리즈 이것 진정 3 3편 편 꺼 후속 후속작 작 
61,기대 이상 올해 영화 최고 말 말잇 잇 상영 온몸 
62,긴장 그레이스 남자 남자신인 신인 줄 언니 ㅜ 또볼랍니 그레이스 
63,쇠사슬 공격 때 멋 멋탱 탱 걸 자체 번 의향 
64,있음 마블 마블액션 액션 비교 자기 희생 장면 2 2편 
65,편 이후 감독 감독판 판 엔딩 사라 사라코너 코너 대사 
66,중 만약 기계 생명 가치 수 대 물음 궁금증 해결 
67,스토리 계보 영화 존 형님 누님 ㅋ ㅋ터미 터 미 
68,이터 향수 영화 2 최고 그레이스 존 존멋 멋 반 
69,영화 볼만 기대 안 기대이상 이상 액션 나 평안 잠 
70,만큼 이것 진짜 전작 터 터미 미 이터 제니시스 실망 
71,호불호 순간 최악 데 이번 다크 페이트 2 감탄 거 
72,초반 액션 값 초반 얼굴 걸 뉴 뉴페이스 페이스 대만족 
73,여자 뭐 미 이터 영화 시리즈 시리즈물의 물의 예 그레이스 
74,뚱 음악 때 액션 진짜 시간 정도 ㅎ ㄹ ㄹㅇ 
75,ㅇ 존 존잼탱 잼 탱 놀드 놀드옹 옹 345 345편 
76,편 흑 흑역사 역사 취급 12 12편 명작 진정 터 
77,터미 미 이터 3 거 미래 인공 인공지능 지능 리 
78,리전 전 2042 2042년 년 2020 2020년 라 라모스 모스 
79,제거 제거하라 하라 그 서 끝 예고편 저 실수 스토리 
80,물론 일초 눈 액션 액션씬 씬 미 이터 시리즈 중 
81,명작 부족 전형적 할리우드 스타일 재미 있음 터 터미네이터 미 
82,네이 터 사라 사라코너 코너 세월 격세지감 느낌 배우 황혼 
83,연기 연기투혼 투혼 높이 높이삼 삼 초반 존 존코너 코너 
84,사라 사라코너 옛날 옛날모습 모습 거 컴퓨터 그래픽 그래픽임 임 
85,초반 30 30분 분 정도 전개 액션 나머지 액션신은 신은 
86,1 1시간 시간 여기 이동 무한 무한반복 반복 터 터미 
87,미 이터 가족 가족애도 애도 이상 기 액션 액션영화 영화 
88,오랜만 몰입 영화 똥 상태 사이 주인공 정도 정도ㅠ ㅠ 
89,벤져스 개봉 혹평 혹평때문 때문 걱정 명작 보 보셈 셈 
90,할리우드 최고 감독 제임스 카 론 데드 데드풀 풀 로 
91,팀 팀밀러 밀러 조합 이상 말 필요 돈 하나 영화 
92,그레이스 존 존멋 멋 10 10점드림 점 드림 이것 터미 
93,터미네이터지 네이터지 34 저 시스 미 이터 수 그레이스 이마 
94,거북목 우 터 터미2 미 2 이후 외전 제대 시 
95,시퀄 퀄 오지 ㄷ ㄷㄷ 이번 이번편 편 20 20년전 
96,년 전 터 터미 미 이터 팬 위 선물 생각 
97,캐릭터 개성 전편 미 이터 특유 손 땀 서 서스팬 
98,스팬 생각 무엇 음악 음악감독 감독 정 정키 키 영입 
99,신의 한수 느낌 스타워즈 시리즈 졸작 3 3류 류 급 
100,급영화 영화 터 터미 미 이터 마라 중세 중세시대 시대 
101,존 존코너 코너 조상 넘 영화 거 저지 이 인류 
102,인류종말 종말 미래 결국 인간과 기계간 갈등 갈등구도 구도 수 
103,필연적 10 10월 월 29 29일 일 용 시사회 터 
104,터미 미 이터 2 이후 이번 신작 제외 그동안 터 
105,터미 시리즈 3 3편 편 5 5편 편 실망 오늘 
106,개봉 시대 움 변주 올드 앤 영 무게 무게중심 중심 
107,단편적 스토리 스토리일수 일수 상쇄 군더더기 액션 신발끈 터 터미 
108,미 이터 새 시리즈 아놀드 린 린다해밀턴 다 해밀턴 만 
109,행복 코너 속이 제임스 카 론 론일 일 팀 밀러 
110,거 진짜 개 터 터미 미 이터 탄생 이번 이번주 
111,주 1 1일 일 미로 차 근래 것중 중 마니 
112,잼 마지막 놀드 대사 액션 평점 2 스토리 액션 굿 
113,과거 감동 재미 수 역대 최고 최고임 임 영화 아저 
114,아저씨 씨 사라 사라코너아줌마 코너 아줌마 좋앗어 사라코너 내 몸 
115,할아버지 모습 죽 음 혼자 오늘 조조 세월 무 무조건 
116,조건 보세 여성 여성액션 액션 최고 2 2편이후 편 이후 
117,시리즈 이것 진짜 2 1 다크 다크페이트 페이트 라 생각 
118,그레이스 세상 액션 전투 전투장면 장면 진심 감동 성공 트릴 
119,트릴로지 로지 가자 진짜 역대 역대급 급 끝 소름 미 
120,이터 영화 처음 데드 데드풀 풀 감독 액션 완전 퀄리티 
121,장난 아 거 내용 단순 재미 캐릭터 연출 아우 아우라가 
122,라가 영상 질감 음악 진지 비장 터 오래간만 속편 전 
123,관람객 진부 내용 나름 중 중박이상은 박이 상은 할거 500 
124,500만쯤조커 만 쯤 조커 터 터미 미 이터 이터3 3 
125,인생 인생작 작 기분 기분82년생 82 년생 책 보세 남자 
126,초반 몰입 몰입감 감 강추 다음 다음편 편 미 이터 
127,세계관 자체 진짜 사기 사기임 임 개꿀 개꿀잼 잼 ㅠ 
128,맥 맥켄지 켄 지 걸 쉬 뿜뿜 사라 코너 포스 
129,미 이터 팬 수 영화 요즘 발전 5 세대 두려움 
130,엄습 액션 추억 공존 꿀 꿀잼 잼 강추 여자 여자주인공3명 
131,주인공 3 명 완전 사이다 사이다액션 액션 여자액션영화 영화 맥 
132,맥켄지 켄 지 데이 데이비스 비스 사랑 ㅠ 9 입장 
133,마지막 존 온몸 소름 강추 미 이터 2 후광 기대 
134,작품 거 리부트 야 늙었다는게 마음 뿐 액션 말 말잇 
135,잇 그레이스 사랑 긴말 긴말안 안 액션 저 번 미 
136,이터 마지막 작품 끝맺음 린 린다해밀턴 다 해밀턴 사랑 그레이스 
137,그레이스언니 언니 날 심장 거 내가 여자 미 이터 레 
138,레전드로 전 드로 라 식 앞 앞시리즈 시리즈 긴장감 스릴 
139,백배 간만 액션 액션영화 영화 스크린 스토리 스토리부분 부분 0 
140,0점 점 스카이 스카이넷 넷 지시 터 터미 미 이터 
141,가정의 아빠 이것 말 방구 이것 미 이터 이터이지 이지 
142,눈물 국민학생 시절 터 터미 미 이터 1 1탄부 탄부 
143,아재 속 생각 오늘 사라 사라코너 코너 바 바추카포로 추 
144,카 포로 장면 진심 기립 기립박수 박수 미 이터 이터2 
145,2 이후 시리즈 이번 예외 이전 주인공 조연 코너 모자 
146,핵심 이것 여배우 둘 하나 몰입 그레이스 진정 2 후속 
147,345 12 없애버 없애버리 리 미 이터 인생 최고 명작 
148,중 하나 원작 감독 제임스 제임스카 카 론 린 놀드 
149,출연 말 명작예고 예고 스토리 연출 전반적 2 2편 편 
