,content,,,,,,,,,,,,,
9429,후아 아직도 영화를 본 여운이 남는다. 우리나라의 이유없는 코믹이나 스릴러에는 비할수 없는 우주라는 공허한 공간에 대한 그 공포감 정말 몰입도가 최고 였다 평균 평점이 8.27점이라니 일부러깍나? 영화는 앞좌석에서 ...,,,,,,,,,,,,,
9430,절대 평점 8점대 영화가 아닌데 가슴 아프다. 간만에 극장가서 후회하지 않은 명작이다. 최고의 영상미,,,,,,,,,,,,,
9431,이 영화에 외계인이 등장하길 바란 것도 아니고,,,,,,,,,,,,,
9432,전문가 평점이 네티즌 평점보다 높은 몇 안되는 영화,,,,,,,,,,,,,
9433,진짜 최고인듯. 마지막 깨달음을 주는 여운과 함께 박수가 절로 나왔던 영화.,,,,,,,,,,,,,
9434,정말 뺄 장면이 없는 영화. 한 번 더 보면 소재 하나하나가 새롭게 보인다.,,,,,,,,,,,,,
9435,빽투더퓨처 쇼생크탈출이후 최고작품이다,,,,,,,,,,,,,
9436,솔직하게 내가 이 영화 보면서 주변에서 들렸던 말들 말해보겠다. 영화 끝나고 주변에서 지루하다,,,,,,,,,,,,,
9437,진짜 최고다... 이거보고 지루하다는사람은 진짜 취향이 의문스러울뿐...,,,,,,,,,,,,,
9438,아무말 필요없고 걍 재밌다.,,,,,,,,,,,,,
9439,이게 왜 평점이 낮은거지??,,,,,,,,,,,,,
9440,아.. 마지막 장면에서..감동 받아서 울컥..,,,,,,,,,,,,,
9441,좋다고 해야하나..   그저그렇다고 해야하나..각본은 잘모르겠고 인정할건 산드라블록의연기.3D로  봤으나,,,,,,,,,,,,,
9442,엄청난 우주공간의 압박으로 숨이 턱턱 막힙니다. 아름다운 그 모습에 경외심을 느끼기도 하지만,,,,,,,,,,,,,
9443,아닌강 아닌강 이게... 당신의 이름인가요? 아닌강? 워프워프 아오~ 베이비네여 아 베이비 ㅜㅜ (개폭풍감동오열했음 미친휴머니즘까지ㅜㅜ),,,,,,,,,,,,,
9444,리얼리티 대박!!!!무조건 봐야되는 영화에요  정말 이게 진짜로 눈앞에서 일어나는것처럼!!,,,,,,,,,,,,,
9445,일단 내용이졸라튼튼하고 배우가 연기도졸라잘해요쵝오에요,,,,,,,,,,,,,
9446,엄청나게 다이나믹하지 않았지만 계속되는 불행에 안타까움을 더하면서 애타게 만들었던 영화.  조용히 보기 좋은 영화다,,,,,,,,,,,,,
9447,진짜 최고였음... 시간 가는줄 모르고 봤네요,,,,,,,,,,,,,
9448,웰메이드 단순하고 심플하지만 소름돋는 강렬한 메세지,,,,,,,,,,,,,
9449,1.중간중간 먹먹해져서 눈물날뻔했다.2.127시간이후 이렇게 벅차오르는 엔딩보는게 얼마나반갑던지3.수작도졸작으로 만드는 평점의힘이란,,,,,,,,,,,,,
9450,돈내고봤던영화중아깝지않는영화다 중간중간 날울컥하게만든영화 우주의광활함과 그곳에서인간이느끼는극도의외로움,,,,,,,,,,,,,
9451,감히 내가 이 영화를 평가할수가 없다. 내가 본 영화중 최고의 영화!!이 영화를 보고느끼기만한 사람은 답답하고 재미 없을지도 모른다. 하지만 알폰소 쿠아론은 '자아성찰'의 대가이다! 이 영화를 제대로 ...,,,,,,,,,,,,,
9452,넘. 잼따 그냥 최고의 영화인것 같다 !!!,,,,,,,,,,,,,
9453,억지감동없는 진짜 재난영화,,,,,,,,,,,,,
9454,영상미는 있으나 관객을 끌 요소가 없다,,,,,,,,,,,,,
9455,진짜 돈이 아깝지 않은 최고의 영화다. 영화 본지 한시간이 지난 지금도 그 가슴떨림이 여전하다! '이 영화는 미쳤다!!!',,,,,,,,,,,,,
9456,영화보면서토할뻔 진짜영상대박,,,,,,,,,,,,,
9457,좋은 영화에 찬사를 보내는건 알겠는데 한국영화를 비난한다고 당신들 의견에 없던 정당성이 생기는건 아닙니다. 헐리웃영화에서도 깡패 나오고 졸작 많습니다. 한국영화 탓하기전에 당신들 수준부터 되돌아봅시다,,,,,,,,,,,,,
9458,산드라블록제3의전성기다 와..,,,,,,,,,,,,,
9459,와진짜...영화보는내내 암벽탄기분...ㅜㅜ긴장도 긴장도 이런긴장이ㅜㅜ,,,,,,,,,,,,,
9460,내용 모르고 봤는데 대박 재밋었다!!!,,,,,,,,,,,,,
9461,꼭봐라 두번봐라 계속봐라,,,,,,,,,,,,,
9462,어렸을 적 영화를 보고  생각이 많아져 잠 못 이루던 그 시절을 다시 일깨워 주는 그런 영화 였다. 정말 최고다,,,,,,,,,,,,,
9463,결론:러시아가 잘못했네,,,,,,,,,,,,,
9464,1점주는 사람은 알바아님 관종인듯...,,,,,,,,,,,,,
9465,하...부장님이 재미없다고 말렸을때 들었어야했는데..영상미는 나쁘지않은데 우주공간에 사람 딱 둘....개 답답합니다 진짜 ㅡㅡ대화만 주구장창이어지고 재미도없고 감동도없고,,,,,,,,,,,,,
9466,이런게 진짜 영화다. 한국은 뻔한 스토리에도 OO이 만드는 반면 해외는 감동적이고 스릴있게 만든다,,,,,,,,,,,,,
9467,평점왜이러지? 개인적으로 올해 본 영화중  가장 잼있었음,,,,,,,,,,,,,
9468,알바생들이많은가?? 직접가서 보면 알게될것이다. 반전에자극을 요한건 아니지만 그냥 텅빈느낌 지루한느낌,,,,,,,,,,,,,
9469,평점 높은게 아르바이트 덕분이라고? 전미 박스오피스 1위,,,,,,,,,,,,,
9470,괜찮네.. 넓고 큰 화면으로 보면 멋있음,,,,,,,,,,,,,
9471,완전 재밌음ㅋㅋㅋㅋ!,,,,,,,,,,,,,
9472,꼭 봐라. 두 번 봐라. 아니 세 번 봐라.,,,,,,,,,,,,,
9473,꼭 보세요... 인생 최고의 영화입니다,,,,,,,,,,,,,
9474,이 영화는 10점 이상이다. 평점 평균이 8점대인게 맘에 안들정도로...,,,,,,,,,,,,,
9475,나오면서 아..재밋다정말..이런것보단 아..최고다..이런 감정을느끼게하는영화.,,,,,,,,,,,,,
9476,최고다 보는내내 숨막힘,,,,,,,,,,,,,
9477,멋모르는 친구들은 재미없다지만 이영화가 넘신기하다 무중력상태를 어떻게 영화로찍었을지 너무신기한것같다,,,,,,,,,,,,,
9478,와... 생각했던 것 보다 너무 재미있다... 왜이렇게 평점이 낮은지 모르겟네요 ㅜㅜ정말 최근 본 영화중에 쵝오!! 무한 추천!!,,,,,,,,,,,,,
9479,와 정말 내가여태껏봤던 영화들과는정말 차원이다르다.... 주인공에 감정이입이정말 잘되고 진짜 분위기부터 연기력연출력이 정말그냥 빠져들게만든다...확실한건 정말여태까지의 영화와다름,,,,,,,,,,,,,
9480,SF로 느끼는 순수문학이랄까 역대 최고의 반열에 올라도 손색이 없을 것이다,,,,,,,,,,,,,
9481,정말 잘 만든 영화내요! 정말 시간 가는줄 모르고 봤어요 다보고 벌써 끝났나 할정도였습니다. 한가지 좀 그랬던건 영화 보는 내내 여자주인공 때문에 깝깝한거였내요 숨쉬는거 하며.. 아우 속터져 하지만 이게 감독이 설정...,,,,,,,,,,,,,
9482,타이타닉 이후로 영화끝나고 소름끼친건 처음..이영화 어떻게 찍었을까 대박..,,,,,,,,,,,,,
9483,진짜 보는내내 긴장하면서 보고 시간가는줄 모르고 봤네요 최고!!,,,,,,,,,,,,,
9484,3d 아이맥스 영화의 진수. 훗날 다운받아보고 후회하지 말자.,,,,,,,,,,,,,
9485,이영화를 보고 꿈을꾸게 되었다 꿈을 현실로 채워가겠다는 꿈,,,,,,,,,,,,,
9486,잘만들었는지 못만들었는지 나로선 판단이 안된다. 단지 영화를 보고 나설때 마치 내가 우주를 돌다 방금 빠져나온 것 같았다. 몰입도는 최강,,,,,,,,,,,,,
9487,넓다는 말로 다 할 수 없는 우주에서 발붙일 곳이 있다는 것이 얼마나 대단한 일인지.,,,,,,,,,,,,,
9488,내생애 이렇게 대단한 작품은 반지의 제왕이래 정말 오랜만이다...,,,,,,,,,,,,,
9489,모든 매력을 갖춘 영화다,,,,,,,,,,,,,
9490,제발 가슴이 시키는대로 평점줍시다/...평점이 왜이리 낮아ㅋㅋㅋ,,,,,,,,,,,,,
9491,몰입도 최강,,,,,,,,,,,,,
9492,이건 진짜 세기의 명작이다,,,,,,,,,,,,,
9493,깔만한 요소가 없네요. 상당히 인상깊게 본 영화가 되었습니다. 시간 가는 줄도 몰랐구요.. 이런 영화가 많이 나와주었으면 좋겠네요.,,,,,,,,,,,,,
9494,우리나라에도 이런영화 나왔으면,,,,,,,,,,,,,
9495,주제 : 주인공의 생존 의지?배경 : 고요한 우주아무런 감흥도 여운도 재미도 없었네요.,,,,,,,,,,,,,
9496,3D IMAX 로 관람했음,,,,,,,,,,,,,
9497,이 영화 평점이 9점후반대가 아니란것에 알바들에 대한 혐오감을 느낀다.,,,,,,,,,,,,,
9498,우주여행을 한 시간 반 만에 할 수 있는 방법.,,,,,,,,,,,,,
9499,3D로 봤는데 정말 감당하기 힘들정도로 좋았습니다. 순간 SF가 아니라 공포영화인 줄 알았습니다. 한번 보세요.,,,,,,,,,,,,,
9500,3D로 보세요,,,,,,,,,,,,,
9501,아이맥스 쓰리디로 한번 포디엑스 쓰리디로 한번 두번보고왔습니다. 살아생전에 이런영화를 본게 영광이에요,,,,,,,,,,,,,
9502,이 영화를 보면서 정말 한국 영화계가 부끄럽께 느껴지는군요! 추석때 상영했으면ㅁ스파이 같은 쓰레기 영화 안 봤을 텐데!,,,,,,,,,,,,,
9503,무조건 3D로! 여우주연상은 따놓은당상,,,,,,,,,,,,,
9504,단1초도 눈을 돌릴수 없다라는 흔한 광고글 이런 영화라면 쓰셔도 됩니다,,,,,,,,,,,,,
9505,안보면 후회 밑져봤자 본전!!,,,,,,,,,,,,,
9506,올해 본 영화 중 베스트였다ㅎㅎ,,,,,,,,,,,,,
9507,역시 알폰소 쿠아론 감독. 연출이 신이 작정하고 만든 영상과 음향의 극치미,,,,,,,,,,,,,
9508,음향그래픽모두뛰어난작품 그외내용줄거리는그다지ㅠ우주라는걸 호기심을자극한작품이롤세,,,,,,,,,,,,,
9509,꼭 보셔야 할 영화!  오늘 한번 더 봤어요.그 감동 그대로 입니다.,,,,,,,,,,,,,
9510,인간사이에 중력이 우리가 삶을 지탱할수있는 이유.,,,,,,,,,,,,,
9511,난 sf 영화 안좋아한다... 근데 이 영화는 sf 스릴러다.. 고요한 우주 가 순식간에 지옥이 되버린다. 숨이 턱턱 막힌다. 10점 만점에 10점 만점 주고 싶다!!,,,,,,,,,,,,,
9512,팍!! 올라갔다가 팍!! 내리갔다가   고마 쎄리 10점만점에 10점,,,,,,,,,,,,,
9513,기대 많이 하고 봤는데..   재미 없었다 ㅠㅠ,,,,,,,,,,,,,
9514,입을 벌리고 봤다. 유치한 광고에나 써있는 말인줄알았는데 정말로 입을 벌리고 보는 경험을 하다니.,,,,,,,,,,,,,
9515,10점도 모자르다 내 인생 최초로 평점 남긴다 ㄱ,,,,,,,,,,,,,
9516,역대 사상 최대의 작품!!,,,,,,,,,,,,,
9517,이런영화만보고싶다. 보고나서 계속 소름이 안가심ㅜㅜ,,,,,,,,,,,,,
9518,영화가 끝난후 난 주변의 봉,,,,,,,,,,,,,
9519,guswlsdudrhwlsdudrh,,,,,,,,,,,,,
9520,짱ㅋㅋㅋ다시보고싶은영화,,,,,,,,,,,,,
9521,어차피 죽기전에 할수없는 우주여행을 하게 해주는 유일한  수단,,,,,,,,,,,,,
9522,3D 아이맥스 로 봐서 그랬는지 보고 나서  놀이기구 탄듯한 느낌이 났다. 내생에 최고의 다큐멘터리 한편을 본듯한 느낌이였다.,,,,,,,,,,,,,
9523,난 우주가 싫어 이 대사 한줄로 표현 가능하다. 내생에 심장박동수가 젤 높아진 영화.,,,,,,,,,,,,,
9524,정말 잘 봤습니다. 꼭두새벽부터 가서 봤는데,,,,,,,,,,,,,
9525,난 2D로 봤는데도 몸에 힘이 들어가는 것을 느낄 수 있었는데.... 아이맥스는 어떨까.... 상상이 안간다.... 한가지 확실한 건 이 영화는 역대급이라는 것이다.,,,,,,,,,,,,,
9526,4D로 이 영화를 본다면 정말 씨네21의 모기자의 말 처럼 이건 관람이 아니라 체험이었다. 우주에서 바라보는 지구의 모습,,,,,,,,,,,,,
9527,다시 태어난기분우주가 아름다운건 둘째 치고조금만 긴장의 무게를 빼고 돌아보면내 인생이 얼마나 아름다운건지 행복한지,,,,,,,,,,,,,
9528,너무 멀리 가버린,,,,,,,,,,,,,
9529,영화보는 내내 숨막히는 느낌~ 몰입도 짱입니다!!!,,,,,,,,,,,,,
9530,진짜 볼만합니다 아 또 볼꺼에요,,,,,,,,,,,,,
9531,숨이 탁 막히는 영화. 빠져들 수 밖에 없는 우주의 아름다움과 고요. 그 틈에서 성장하는 라이언의 모습은 숨이 막힐만큼 멋지고 떨렸다.,,,,,,,,,,,,,
9532,일단 소재에서 먹고들어가고...  스토리와 산드라블록의 감정전달이 포인트+볼거리와 우주에서 보는 지구의 영상미는 옵션. 빵빵터지는 재난영화를 기대하는 사람이라면 지루할수도,,,,,,,,,,,,,
9533,이유 없이 눈물이 흐른다. 영화관에서 보게 되어 너무 영광이다,,,,,,,,,,,,,
9534,단언컨대올해최고영화 몰입도쩔고 1시간 반동안 우주여행 하고온듯 함 .  단순 SF영화 그 이상의 감동까지.우주대자연 앞에서 먼지만한 인간ㅜㅜ,,,,,,,,,,,,,
9535,평론가평점이 네티즌평점보다 더높아 ㅋㅋㅋ; 이런경우도 있구나,,,,,,,,,,,,,
9536,진짜 영화에대해서는 잘모르지만 정말영화계의혁명이아닌가싶네요 포디로봣는데정말 내가우주에갓다온느낌 !!그 적막함이 그대로느껴졌고 어떻게 배우두명으로 이멋진영화를만든건지 ㅠ진짜 살기힘든각박한세상에 열심히살아야겟다고,,,,,,,,,,,,,
9537,진짜  개쩜개쩜개쩜  개쩜,,,,,,,,,,,,,
9538,쓰리디보는데 내가주인공인줄,,,,,,,,,,,,,
9539,방금 영등포L시네마에서 3D로 보고왔습니다. 그냥 최고입니다. SF영화중에 이렇게 극도의 긴장감과 황홀함은 최초인듯 합니다. 배우의 산소잔량에 맞춰 영화보면서 숨쉬는것조차 힘든 정말 최고의 영화!!!,,,,,,,,,,,,,
9540,그래비티 아이맥스3d로 안본놈들은 리뷰 쓸 자격이 없도다,,,,,,,,,,,,,
9541,감동,,,,,,,,,,,,,
9542,딱 몇마디...모든게 비관적이고 불평많은 후배놈이랑 봤는데 보고나서 술자리 내내 이 영화 얘기뿐..그리고 와이프랑 꼭 다시 볼꺼라고...,,,,,,,,,,,,,
9543,정말재밌는영화입니다꼭연인끼리 보시기바랍니다,,,,,,,,,,,,,
9544,OO 너무 재밌다.. 너무 재밌어서 눈물이 난다... 근 몇년동안 본것중 최고인듯..ㅋ,,,,,,,,,,,,,
9545,그래비티는 아이맥스가 옳다,,,,,,,,,,,,,
9546,이 영화는 감동이고 나발이고 스토리고 뭐고 없다. 다만 영화성(SF성) 모조리 상실한 리얼 다큐멘터리와 같다고 보면 된다 1초 1초흘러간다. 리얼하다. 이 영화는 관객을 강제적으로 영화속으로 빨아들인다. 20분 정도...,,,,,,,,,,,,,
9547,경이로움 그자체입니다. 주인공의 열연도 돋보이네요감동이 아직까지 느껴지네요,,,,,,,,,,,,,
9548,이게 진짜 숨막히는영화다 진짜 무조건보란거다 이런건,,,,,,,,,,,,,
9549,보는  내내 심장 떨리고.. 이제 안심할라 싶으면 또 뭔일 터지고..ㅠㅠ 스릴감 만점에  감동도 있고  시각효과도 작살나네요,,,,,,,,,,,,,
9550,좋았어요..다시한번 힘을내서 살아야겠어요..,,,,,,,,,,,,,
9551,손에 땀나며 긴장하며 영화 봤네요.. 3D 강추,,,,,,,,,,,,,
9552,한순간도 지루할 틈이 없었다....,,,,,,,,,,,,,
9553,정말 내 35년생에 최고의 영화!,,,,,,,,,,,,,
9554,제가본영화중에 최고!!보길잘한거같아용!!,,,,,,,,,,,,,
9555,우주에 혼자떠내려간다 생각하면 진짜무섭더라 암튼 꼭봐요 4d로 보세요,,,,,,,,,,,,,
9556,최고.. 자잘한 가지들을 빼고 줄기로 승부본,,,,,,,,,,,,,
9557,3D로 볼 시 멀미 심하고 내용도 재미는 없음. 영상은 처음 볼 때는 볼만한데 보다 보면 그것도 그다지 임.,,,,,,,,,,,,,
9558,긴박성과 사실적 영상미에 경애를...,,,,,,,,,,,,,
9559,내스탈은아님 ㅜ그낭 보통,,,,,,,,,,,,,
9560,같이 본 내남자친구는 보는내내 날 죽일듯이 노려보앗지만 눈 한번 안돌리고 처음부터 끝까지 몰입하게만들었던 영화 보고나서 호불호가 갈릴거란 생각이 깊게 들었다 레미제라블이 그랬던것처럼 취향의 차이지만 재미가 있던 없던...,,,,,,,,,,,,,
9561,관람이 아닌 체험이란 말에 무척 공감하며 극장에서 나왔다,,,,,,,,,,,,,
9562,아이맥스랑 포디 둘다 봤는데 아이맥스가 낫더라,,,,,,,,,,,,,
9563,개인적으로는 다크나이트 뛰어넘는 영화,,,,,,,,,,,,,
9564,이 영화가 왜 8점대인지 이해를 할수가없다 전무후무한 대작인데.. 내가본 영화중 이렇게 돈이 안아까운 영화는 처음이었다.,,,,,,,,,,,,,
9565,우주영화중 최고 IMAX 추천,,,,,,,,,,,,,
9566,최고 한번더보고싶다.소름돋는더,,,,,,,,,,,,,
9567,평론따윈 절대쓰지않으리라 생각했었습니다. 살다보니 이런 영활 다보네요.?꼭 보셔야만합니다. 진심^^,,,,,,,,,,,,,
9568,진짜 오랜만에 영화다운 영화를 봤네요~!우주에서 홀로 사투하는 연기와 스토리,,,,,,,,,,,,,
9569,무조건 아이맥스 가서 봐 별점 낮은애덜 알바거나 2D 작은걸로 본거다 게을러서 2D  볼거면 아예 보지마라,,,,,,,,,,,,,
9570,대박 ㅠㅠ산드라블록 연기쩔어,,,,,,,,,,,,,
9571,완벽한 영화 입니다  더 이상 말이 필요없네요,,,,,,,,,,,,,
9572,이렇게 전율이 흐르는 영화 처음입니다.고요할수록 긴장감이 넘치고 우주항공분들께 박수를 보내드려야 하네요 ㅊㅊ 영화보고 1시간이 지나도 몸의 떨림이 멈추지 못할꺼같아요,,,,,,,,,,,,,
9573,가갸거겨고교구규그기,,,,,,,,,,,,,
9574,영상미는잇는대 보고나서 허전햇음  딱히 재미도별루구,,,,,,,,,,,,,
9575,굿 꼭 보세요 멋있는 영화 입니다,,,,,,,,,,,,,
9576,정말..최고입니다.,,,,,,,,,,,,,
9577,마지막  5분이 영화의 전부를 새롭게 전환한다.,,,,,,,,,,,,,
9578,영화에서의 새로운 경험이라고 하자. 진짜 3D,,,,,,,,,,,,,
9579,그간의 SF를 보고 너무 기대를 해서인가.. 스토리가 너무 없고 지루함.,,,,,,,,,,,,,
9580,재미없다 잠온다 레알ㅇ,,,,,,,,,,,,,
9581,쩐다는 말로도 표현안됩니다. 하아 두번봐야지,,,,,,,,,,,,,
9582,영화가 밀땅을 제대로함. 나를 기쁘게햇다 울렷다 황홀하게 햇다 가지고 노는데 그 매력에서 빠져나오기싫더군요 러닝타임이 더길엇으면 이라고 생각햇던 영화는 이영화가처음이었습니다.,,,,,,,,,,,,,
9583,ㄷㄷ그래비티10000,,,,,,,,,,,,,
9584,말이 필요 없다 어서 보시오,,,,,,,,,,,,,
9585,2D로 봐서 그런지 너무 지루하고 하품 나왔네요.  3D는 어떨지 모르겠지만 2D는 진짜 비추입니다.,,,,,,,,,,,,,
9586,최고다 그냥 !!! 보는 내내 몰입이 너무 되서 ㅠㅠ,,,,,,,,,,,,,
9587,우리가 우주에 떠있다는걸 인식하며 살아가는 사람이 있을까?,,,,,,,,,,,,,
9588,와...아이맥스3디로 보고나왔습니다....영화?보는내내 소름30번은 돋은것같네요ㅋㅋ 작품성영상미?어느것 하나빠지지않네요 간만에좋은작품보게되서 흥분이가라앉지않는다는ㅋㅋ다들꼭보세요!!!!,,,,,,,,,,,,,
9589,걸작 최고였다 ....,,,,,,,,,,,,,
9590,진짜 우리가 평소에 간과하던 항상 있던것들의 소중함을 다시금 일깨워주는 영화 였네요... 처음엔 볼만한 영화가 없어서 봤는데.. 기대 없이 봐서 그런지 정말 최고의 영화였습니다. 단 두명의 배우로 이런 대작을 만들다...,,,,,,,,,,,,,
9591,영화를 보고나니 달이 자세히 보인다,,,,,,,,,,,,,
9592,시작해서 엔딩 타이틀 올라갈 때까지 숨 한 번 제대로 못 쉼. 이 영화는 미쳤다.,,,,,,,,,,,,,
9593,극장에서 3D로 또보고싶다,,,,,,,,,,,,,
9594,솔직히 너무 기대하고 봤기때문일수도잇지만 저는 8점을드렸습니다.영화 광해가 9점이라면 그래비티는 8점 제생각은 ㅎㅎ,,,,,,,,,,,,,
9595,IMAX 3D 가 아니면 평가 할 자격이 없다고 본다.  오랫만에 수작을 만났다.  지루하다는 사람들 인생을 다시 돌아보라...,,,,,,,,,,,,,
9596,놀라운기술력.한편의우주모노드라마를본듯한신선한느낌.오랜만에본산드라블록의훌륭한연기와삶에대한철학적메세지는좋았으나스토리의빈약함이조금은아쉬웠던영화.,,,,,,,,,,,,,
9597,보는 내내 긴장감때문에 호흡곤란 올 뻔 짱이에요 추천합니다,,,,,,,,,,,,,
9598,최고 최고! 경의롭다 감독의 독특한 화면처리에 다 눈을 떼지 못했다,,,,,,,,,,,,,
9599,대단함 그자체... 올해본영화중에서 가장좋은듯....우리나라 영화는 언제까지 조잡하게만 만들것인지,,,,,,,,,,,,,
9600,와....진짜 완전스릴넘침 보는동안내내 두근두근했음,,,,,,,,,,,,,
9601,3d로 말고 디지털로 보세요,,,,,,,,,,,,,
9602,4D로 봤는데 많이 지루함.,,,,,,,,,,,,,
9603,하 말이 필요없다...,,,,,,,,,,,,,
9604,잘만든 영화임은 틀림없다. 그렇다고 스토리가 있다는 의미는 아니다.,,,,,,,,,,,,,
9605,보는 내내 답답하다.  초반은 민패에 중반부 까지 정신 못차리는 여주인공 그나마 후반부 정신차리고볼만해지는데 그게 20분도 안되는거 같다.,,,,,,,,,,,,,
9606,역시. 매일매일 평점이 떨어지는 중..호불호가 갈린다고는 하지만. 좀. 지나치게 평점이 높게 책정되어 있다.같이 보러 가자고 말한 내가 미안해졌다.. 흠.90분 영화라 얼마나 다행인지. 더 길었으면... 버티기 어려...,,,,,,,,,,,,,
9607,뭐랄까.. 이때껏의 영화들과는 다른 맛이 있달까?영화가 끝나고나서도 여운이 굉장히 강하게 남는 그런작품이었다,,,,,,,,,,,,,
9608,이런 영화는 태어나서 처음 본다,,,,,,,,,,,,,
9609,재미없을것같다 어쩌구 하시는분들 그냥 조용히 아이맥스3D 예매하셔서 보고 오세요.. 다보고 왔을쯤에는 여기다 별점 10점 때리고 존나 재밌어유흐어헣읗 거리고 있을거다,,,,,,,,,,,,,
9610,보는 내내 어지러움 그냥 그랬어요,,,,,,,,,,,,,
9611,제임스 카메론 감독이괜히 추천한 영화가 아님!정말 제대로 만든 우주 재난 영화강추!!,,,,,,,,,,,,,
9612,이영화는 이전에 sf영화와는 차원이다르다 sf만의 억지스러움을 벗어나 ?실제로 우주에있는 느낌을받았다 이전에나온 sf영화가 부끄러울정도다,,,,,,,,,,,,,
9613,나는 살아있음에 감사를 느낀다.  21세기 최고의 영화,,,,,,,,,,,,,
9614,계속되는 긴장감에 재밌게 봤네요,,,,,,,,,,,,,
9615,최고입니다카메라기술도신기하지만산드라블록의 연기도 압권입니다,,,,,,,,,,,,,
9616,최고의 영화였다. 강추,,,,,,,,,,,,,
9617,만점 영화 3D 아이맥스로봤지만 4D로 한번 더 볼꺼라능,,,,,,,,,,,,,
9618,오우 재밌네요 완전 몰입. 새로운 느낌의 영화네요,,,,,,,,,,,,,
9619,선샤인같은 영화를 기대했는데 한편의 다큐를 본기분이네요,,,,,,,,,,,,,
9620,생존을 향한 고독한 90분의 러닝타임,,,,,,,,,,,,,
9621,진짜 이 영화 지루하다 재미없다 하시는분 그냥 천둥의신 토르 헝거게임 이런 영화보세요 . 스펙타클한 장면이 부족한 감은 있지만 그래비티 영상으로 충분히 보상 받고 남습니다. 언제 이런 영화 다시 보실수 있다고 생각하...,,,,,,,,,,,,,
9622,이건 무조건무조건 3D로 !!!역시 SF는 미국이 강자인가봉가~보는내내 긴장의 끈을 놓칠수가 없어요...진짜 진짜 대작이다. 스토리부터 영상미까지 대박!,,,,,,,,,,,,,
9623,호불호갈리는것같아요 제친구들은 재미없었데요... 저는 엄청 재밌었는데ㅠㅠ!!!,,,,,,,,,,,,,
9624,내가 살아 있기에,,,,,,,,,,,,,
9625,모르겠다 ,,,,,,,,,,,,,
9626,와 이런영화가 또 나올수 있을까요..?울면서 봤네요,,,,,,,,,,,,,
9627,영상미,,,,,,,,,,,,,
9628,정말 최고네요 지금껏본영화중 3D최고였어요!!!!다시보고싶은 영화네요,,,,,,,,,,,,,
9629,멋진 경험이었다. 엄청난 볼거리의 우주 영화 이면서도 중심은  '중력',,,,,,,,,,,,,
9630,시도는참좋았다. 다만 지루했다 90분은 꽤나 너무길다,,,,,,,,,,,,,
9631,4DX로 안봤으면 지루해서 잠들뻔...,,,,,,,,,,,,,
9632,감사합니다. 살아있는 고마움을 느끼게 해줘서,,,,,,,,,,,,,
9633,정말 잘만들었다 부자지간이 만든영화라 역시틀리구나두배우의 안정된연기 완벽한 연출 감독의 상상력흠잡을데가없다,,,,,,,,,,,,,
9634,컷'에 익숙한 사람들에겐 불편하고 지루할 영화가 될 수도 있을 듯 하지만... 이제 아마겟돈은 잊어도 될 수 있을만 한 우주영화의 탄생 같습니다. 그냥 몸을 맡기면 되는 영화..,,,,,,,,,,,,,
9635,아바타 이후에 이런느낌은 처음입니다. 말이필요없는듯,,,,,,,,,,,,,
9636,마치 내가 우주 한가운데 떨어진 듯한 몰입감..내 온 진심을 담아 추천하고픈 영화..우주 영화의 새로운 기준..산드라블록의 명연기..단연 21세기 최고의 영화.,,,,,,,,,,,,,
9637,방금 보고나왔다. 사람마다 차이는 있겠으나,,,,,,,,,,,,,
9638,너무 몰입이 되서 멀미나는 줄 알았습니다. 광장합니다,,,,,,,,,,,,,
9639,환상적인 카메라 워크 희망을 놓지 않고 끝까지 버티는 ~ 나를 돌아보게 하는 영화,,,,,,,,,,,,,
9640,보는맛은 확실히 끝내주는영화인건 분명한데 생각했던만큼 그렇게 재밌지도 않았고 보는내내 먼가 답답한느낌? 평이 왜이렇게 좋은지 잘모르겠다,,,,,,,,,,,,,
9641,cg의 정교함과 여주인공의 연기와 몸매는 정말 볼만하다,,,,,,,,,,,,,
