,content,,,,,,,,,,,,,
10875,나쁘지않음 그래픽이 정말좋다  이것도그렇게 미국에선 좋은그래픽아니라는데,,,,,,,,,,,,,
10876,진짜 재밌어요. 지루한면도 있지만 굿,,,,,,,,,,,,,
10877,어떻게 만들었을까...,,,,,,,,,,,,,
10878,이영화를 기준으로 영화들의 우주공간에 대한 표현이 바뀌어져야겠지. 이전에 나온영화들은 다행이지.. 스타트랙... 등등등,,,,,,,,,,,,,
10879,이야...이걸보고 지루하다 재미없다고하는 사람들은 사람이 덜 된사람들이다.,,,,,,,,,,,,,
10880,와  정말 이런게 진짜 영화지 오락성만 추구하는 영화랑은 차원이 다름/ 재미로 보려는 사람은 그냥 보지 마세요ㅎ ps.나도 죽기전에 정말 죽을고비에서 혼자 살아남는 그런 경험을 하고 싶다///,,,,,,,,,,,,,
10881,아맥삼디로 봤는데 처음에 롱테이크씬에서 정말 우주 온 것 같았음.,,,,,,,,,,,,,
10882,멋진 풍경과 훈훈한 결말,,,,,,,,,,,,,
10883,중력이...중력 차이가 너무 빠르게 나가지고...,,,,,,,,,,,,,
10884,그냥 쩌러 ㄷㄷ....,,,,,,,,,,,,,
10885,와 이영화 한번보기 존낸아깝다두번봐라 세번봐라 누구나 이평점 쓰게될거다 존나쩐다,,,,,,,,,,,,,
10886,경이롭고 무서운 우주체험-부감 쇼트는 경이롭고 1인칭 시점은 숨막힐 듯 무섭다. 우주를 유영하는 듯한 카메라 워킹과 음향효과는 사실감을 더해주고 각본과 연출또한 뛰어난 진정한 걸작,,,,,,,,,,,,,
10887,3D 안경 밑으로 흐르는 눈물은 어떻게 닦나요?,,,,,,,,,,,,,
10888,아바타 이후 가장 아름다운 영상의 영화였습니다,,,,,,,,,,,,,
10889,반드시 I-MAX 3D로 관람하길 바란다. 스토리가 강한 영화는 아니기때문에 일반 상영관에서 상영시에는 그 감동과 체험이 절반으로 줄 것 같다.,,,,,,,,,,,,,
10890,오랜만에 꾸밈없는 감동을 봤습니다,,,,,,,,,,,,,
10891,더 말 할 것 없고 절대 아이맥스 3D로 봐야됨. 완전 ㄷㄷ,,,,,,,,,,,,,
10892,대박!!!! 오금이 저리는 짜릿한 우주체험!!!아이맥스 3d나 4d 로 꼭 봐야할 영화!!!,,,,,,,,,,,,,
10893,감히 내 주제에 잣대를 논 할 수가 없다,,,,,,,,,,,,,
10894,3d 영화의 극대화인듯,,,,,,,,,,,,,
10895,영화보던 중간 시계를 한번 봣는데 들던 생각은 30분밖에 안남았네 였습니다.,,,,,,,,,,,,,
10896,야..진짜....잘만든거 같아요...전 3D아이맥스로 봤는데 4D로 봐도 잼날꺼 같아요,,,,,,,,,,,,,
10897,제대로'된 90분짜리 어트랙션을 탄 느낌!!,,,,,,,,,,,,,
10898,주인공 시점 처리나 사운드 영상미 삼박자기 잘맞아떨어진다,,,,,,,,,,,,,
10899,아주  재미지게 봤습니다^^,,,,,,,,,,,,,
10900,8.5정도가 적당한듯!  영상미랑 몰입감 좋음. 근래에 개봉한 영화 중 이게 제일 나음,,,,,,,,,,,,,
10901,새로운 공포를 맛봤네요,,,,,,,,,,,,,
10902,소위 지린다는 말이 정말 어울리는 대단한 작품이다.,,,,,,,,,,,,,
10903,별점이 퐉 올라가기만하네 ^^,,,,,,,,,,,,,
10904,두 말 필요없다. 당장 영화관에 가라!,,,,,,,,,,,,,
10905,여러번 볼 영화다 진짜...,,,,,,,,,,,,,
10906,4DX 봤는대  영화  몰입도가...상상초월 이네요  특정 3장면은 정말 감명 깊게 봤습니다...,,,,,,,,,,,,,
10907,청담씨네시티 4DX로 보고왔다. 최고다. 관람하는 영화가 아닌 체험하는 영화다.,,,,,,,,,,,,,
10908,생소한 우주에 대해 관심을 갖게 만든 영화! 우주보다 지구에 사는게 다행이라는 느낌을 준 영화!! 시간 가는줄 모르고 본 끝내주는 영화!!! IMAX 3D 로 보시길 강추! 가능한 가운데 자리에서!!!,,,,,,,,,,,,,
10909,우주공간의 환상적인 비주얼만으로도 충분한 가치가 있지만,,,,,,,,,,,,,
10910,아는만큼만 보인다. 주위 것들이 부서지는데 왜 음향 효과가 없지? 라고 당신이 생각한다면 낮은 평점을 줄 수밖에 없게된다.,,,,,,,,,,,,,
10911,꼭보세요 말이 필요없음,,,,,,,,,,,,,
10912,약간은 지루하고 약간은 뻥같고 언제나 주인공에게 유리하게 돌아가는 환경.  하지만...멋진 영상이 모든 것을 용서해 준다.,,,,,,,,,,,,,
10913,가희 경의롭다,,,,,,,,,,,,,
10914,예술작품을 본듯합니다 눈이 호강했어요,,,,,,,,,,,,,
10915,신선하고 신기한 영화. 한번도 경험해본적없는 영화. 그런데 완벽에 가까운 리얼한 영화. 영화인생 20년 정말 오랜만에 큰 충격 먹음.이 영화는 재미를 논하기엔 너무 커보인다.,,,,,,,,,,,,,
10916,스페이스 오디세이는 동시대에 본 영화가 아니라 비교불가지만,,,,,,,,,,,,,
10917,기대하고 봤는데 솔직히 그 기대를 넘어서버렸다.. 어떻게 이런 영화를 만들 수 있을까..마지막엔 내가 우주여행을 마치고 돌아온 기분이었다.,,,,,,,,,,,,,
10918,1인칭 3인칭을 자유자재로 넘나드는 완벽한 영화!,,,,,,,,,,,,,
10919,미친듯이 몰입해서 봤어요..,,,,,,,,,,,,,
10920,진짜 딴말할꺼 없이 재밌음,,,,,,,,,,,,,
10921,세상이 빙글빙글... 완전 실감난다.,,,,,,,,,,,,,
10922,말이 필요 없음. 숨막힘. 너무 빨리 끝나는 느낌. 이런 느낌 오랜만이야.,,,,,,,,,,,,,
10923,영상의 미학~ 꼭 봐야안다~,,,,,,,,,,,,,
10924,진정으로 걸작이다. 이러한 기술력으로 이러한 영화를 만들 수 있는 할리우드가 다시금 부러워진다. 진정으로 그래비티를 느끼시려면 반드시 IMAX3D로 보시길.,,,,,,,,,,,,,
10925,그래비티는 쿨한영화다 스토리도,,,,,,,,,,,,,
10926,다른 평론가는 몰라도 동진이형이 10점주는건 보자,,,,,,,,,,,,,
10927,사운드,,,,,,,,,,,,,
10928,걍 보세요!!@#$@$%#%&%^*,,,,,,,,,,,,,
10929,이건 아이맥스로 봐야되..아바타 다크나이트 이후로 많은 아이맥스 상영작에실망을 하고 있던 중..이건 정말 경이 롭습니다!!상영이 끝나고 한동안자리에서 일어나지 못했다.. 최고다!!,,,,,,,,,,,,,
10930,긴말 필요없다.우주여행 갔다왔다고 생각하면되는..꼭 아이맥스 3d로 봐야함!,,,,,,,,,,,,,
10931,영화관을 가게 만드는 그런 영화,,,,,,,,,,,,,
10932,영화보고 평점 남기는거 태어나서 첨인데남길만하다 꼭봐라 두번봐라,,,,,,,,,,,,,
10933,산드라 블록 졸귀~ ㅋㅋ 그리고 마지막 장면은 압권~,,,,,,,,,,,,,
10934,4DX에 최적화 아니 신적화!! 된 영화! 어설픈 3D도 안돼!!!! 주인공과 함께 런닝타임 내내~ 우주를 유영한 기분! 중력과 진동,,,,,,,,,,,,,
10935,와 하정우도  알바같은거  푸냐....  상남자인척  오지게  하더만  좀  실망이네..,,,,,,,,,,,,,
10936,심야보고 왔는데 그럭저럭 정신없는 영화보다 조용하고 좋은 감상이 되었네요. 약간 짧은 런닝타임이 문제지만 영상미가 좋네요. 이런영화는 조용히 감상하는게 좋습니다. 혼자들 가서 보세요 +_+,,,,,,,,,,,,,
10937,3d로 다시보고 싶은 영화이면서!! 소름돋는 영화!,,,,,,,,,,,,,
10938,볼만은한데 미친듯이 잼있는정도는 아니다 글구 3디로 안보면 허전할듯..,,,,,,,,,,,,,
10939,와우~기술력과 스토리의 만남  배우 연기 또한 최고다,,,,,,,,,,,,,
10940,3D는 그  안경을 들고 일어난 하나의혁명이야~! 내가 그러니까 3천원을더 낼수 밖에 없잖아!,,,,,,,,,,,,,
10941,우리나라 감독들은  이 영화를 보면서  좀 배운란 말입니다.맨날 조폭영화만 만들지 말고요. 새로운장르  개성있는 영화. 발전하는 영화를보여주세요.,,,,,,,,,,,,,
10942,방금 봤는데 솔직히 소름돋더라 스토리는뻔하지만 cg는 진짜 ㅎㄷㄷ꼭 봐라,,,,,,,,,,,,,
10943,걍 최고 할말이 없다.10자채우기,,,,,,,,,,,,,
10944,쥬라기 공원급으로 혁명입니다,,,,,,,,,,,,,
10945,뭔가 묘한 매력이 있는 영화. 줄거리도  뻔하고  출연자도 달랑 2명에  학 당기는 화끈힌 액션도 없는데 스크린에서 눈을 뗄수가 없네... 지구의 아름다운 모습 때문인가?  우주에서 홀로  남겨진다는   점 때문인가...,,,,,,,,,,,,,
10946,영화관에서 보면서 지린 영화는 다크나이트,,,,,,,,,,,,,
10947,삶과 죽음의 경계 그 속에서 발견한 삶으로의 의지와 욕구,,,,,,,,,,,,,
10948,팍 올라갔다가 화악 내려갔다가  중력의 힘을 느끼는거야,,,,,,,,,,,,,
10949,빤스한장씩 꼭 챙겨가시길...,,,,,,,,,,,,,
10950,연기도 좋고 내용도 괜찮네요,,,,,,,,,,,,,
10951,역시 신선합니다. 우주에서 이런 조난이 올꺼란 생각도 못했는데13세가 보기에도 괜 찮습니다.,,,,,,,,,,,,,
10952,멋진 우주 쇼를 본 느낌! 인간이 감히 넘볼 수 었는 우주란 공간 속에서 펼쳐진 인간 승리?ㅋ 재미납니다^^,,,,,,,,,,,,,
10953,말이 필요없내 개쩐당와,,,,,,,,,,,,,
10954,우주jokka...,,,,,,,,,,,,,
10955,눈물이 막 가슴이 벅차면서 나네요,,,,,,,,,,,,,
10956,조조로 3d보고 안되겠다싶어 4dx로 보려고 대전까지 간 1인으로서 3d도 볼만하지만 4dx가 정말 우주에서 표류한느낌이 나네요 조금 울렁거리긴하지만..^^; 여튼 영상미,,,,,,,,,,,,,
10957,너무 현실적이엇음. 가끔비현실적이게 극적인 맛이잇엇다면 좋앗겟지만 오히려 현실적으로 긴장감을 이렇게 줄 수 있엇기 때문에 재미도잇엇다고 생각함. 조금은 다큐느낌이 강할 수도있지만 그게매력.,,,,,,,,,,,,,
10958,우와 잼나네  돈이 안 아까움,,,,,,,,,,,,,
10959,의외로 감정적 만족도가 높았어요. 기술적으로 최고인 건 기본!,,,,,,,,,,,,,
10960,압도적인 영상혁명... 보길 잘했어...,,,,,,,,,,,,,
10961,3d 아이맥스로 봤습니다. SF영화에 획을 그었다. 무조건 봐라 두 번 봐라.,,,,,,,,,,,,,
10962,무조건 봐야하는 영화. 올해 최고의 영화다. 필감!!!,,,,,,,,,,,,,
10963,영화관 전체 140석중에 5석만 관람한영화.그런데  은근 괜찮은 영화라고 생각한다.친구끼리 보러가서 보긴 봤는데 다른영화들과 달리 90분밖에안해서 안타깝다.,,,,,,,,,,,,,
10964,우주...그곳은 무서운곳...,,,,,,,,,,,,,
10965,쬐끔 지루하긴 한데 정말 웰메이드 영화입니다. 동선,,,,,,,,,,,,,
10966,무중력 씬을 어떻게 촬영했을까 궁금했음.,,,,,,,,,,,,,
10967,이 영화는 꼭 3D로 보시라 2D로 보면 이 영화를 50% 밖에 못 즐긴 것이다.  평소 3D 영화에 부정적인 나지만 근래의 '라이프 오브 파이'나 이 영화를 보자면 3D영화의 미래는 밝은 것 같다. ...,,,,,,,,,,,,,
10968,4D X 3D 로 봤습니다. 음.. 영화기도 한데 약간 우주 체험이라고 하나??? 그런게 좀 있어요. 100분이라는 running time을 우주밖에 소재가 없는 공간에서 아주 절실하게 잘 표현했던거같네요.,,,,,,,,,,,,,
10969,쩐다. 새로운 영화를 보았다. 진심 짱!,,,,,,,,,,,,,
10970,Red Planet'보다 괜찮은 영화가 나왔어!,,,,,,,,,,,,,
10971,좋네 봐야지 오늘 본다 헉,,,,,,,,,,,,,
10972,방금 조조로 보고 왔다... 단언컨데 올해 최고의 영화.,,,,,,,,,,,,,
10973,왕십리 아이맥스 관람. 영화끝나고 계속 감동의 도가니. 숨소리 하나 안 들리는 극장. 최고입니다.,,,,,,,,,,,,,
10974,이전까지의 모든 우주영화를 허접으로만들어버리는 엄청난 영화,,,,,,,,,,,,,
10975,두시간 남짓 떠나는 감동과 스릴있는 우주여행,,,,,,,,,,,,,
10976,올해 최고의 영화에요 !!,,,,,,,,,,,,,
10977,보는내내 사람 오줌지리게만듬.. 영상미는 물론 진짜 현실감넘쳐서 말이 필요없을정도.. 와 대박입니다.. 단순한 sf장르라고 생각하시면 큰코다침..,,,,,,,,,,,,,
10978,말이 필요없다 강력한 삶의 의지는 그 무엇도 이겨낼수 있다,,,,,,,,,,,,,
10979,흐미,,,,,,,,,,,,,
10980,혼자있고 싶을 때 보고 혼자있고 싶지 않게 되는 영화?ㅋ,,,,,,,,,,,,,
10981,보는내내 압도적인 영상에 감탄했습니다. 작용과 반작용 원리를머릿속에 떠올렸습니다ㅋ,,,,,,,,,,,,,
10982,이것은 그야말로 대서사시,,,,,,,,,,,,,
10983,10점이 안 아까운 영화,,,,,,,,,,,,,
10984,11,,,,,,,,,,,,,
10985,정말 지린다...엄마이자 여성이자 그리고 인간으로서 생의 여행,,,,,,,,,,,,,
10986,올해 최고의 영화. 누가봐도 다 전율할 그럴정도의 영화다. 적어도 3D 될수있으면 4DX로 봐라. 두번봐라.,,,,,,,,,,,,,
10987,2001 스페이스 오디세이를 잇는 대 우주극.감독이 약빤게 분명해.,,,,,,,,,,,,,
10988,하.... 진짜 대박이다...,,,,,,,,,,,,,
10989,평점이 너무높네~~ 그래서 10점,,,,,,,,,,,,,
10990,보다가 오줌지림.. 3D로 보실분은 팬티 챙겨가세요~,,,,,,,,,,,,,
10991,보는 내내 소름이 돋았다,,,,,,,,,,,,,
10992,결국에 여자 하나 때문에 다 죽는 영화임..그리고 혼자 살아 남아서 뭐가 좋다고 실실쪼개다 영화 끝남 ㅋㅋ처음에 캡틴이 1초라도 안 된다 작업 중단하라고 해도,,,,,,,,,,,,,
10993,,,,,,,,,,,,,,
10994,등장인물은 딱 두명이에요. 좀 지루할 수 있어요. 사실 우주라는 우리가 접해보지 못한 공간에서 일어나는 일이라 생소하지만 어느정도 긴장감은 있었습니다. 하지만 전 그저그랬어요.,,,,,,,,,,,,,
10995,감정과잉,,,,,,,,,,,,,
10996,제대로 몰입시킨다. 고독 공포 사투에 내가 빠진 듯. 에일리언,,,,,,,,,,,,,
10997,극장에서 안본게 후회된다. 우주를 체험한 기분. 마지막에 주인공은 어떻게 되는지도 궁금하다.,,,,,,,,,,,,,
10998,별 10개도 모자르다 개인적으로 인터스텔라보다 감명깊게 봤습니다,,,,,,,,,,,,,
10999,아 진짜 감동적이다 ㅠㅡㅠ 흙흙,,,,,,,,,,,,,
11000,내가 본것 중 등장인물이 가장 적게 나오는 영화,,,,,,,,,,,,,
11001,마션 먼저보고 봤는데 오리지날이 그래피티였구나 마션이 유치하게 여겨지네요 끝 부분부터 봤는데 엔딩까지 명작이네요 마션은 끝부분이 엉성했어요,,,,,,,,,,,,,
11002,뭐 솔직히 재밌긴했음 근데 여주가 너무답답함,,,,,,,,,,,,,
11003,어라?이거본지꾀됬는내평점등록안했엇나? 하긴 영화보고평점안남긴게 30개작품은되니이제와서등록하지만 이작품은상당히지루하고피곤하며 앞에 30분어간보고 바로나온작품,,,,,,,,,,,,,
11004,대형스크린으로 보는 지구 야경의 숨막히는 아름다움만으로도 이 영화는 볼 가치가 있다.,,,,,,,,,,,,,
11005,박평식이 8점이나 준영화.,,,,,,,,,,,,,
11006,살아서 돌아가야한다는 이야기. 하지만 뒤바꾸면? 살아가야한다는 이야기. 더이상 드라이브는 없다. 그대로 살아갈뿐.,,,,,,,,,,,,,
11007,이토록 절절한 sf물은 처음...,,,,,,,,,,,,,
11008,수년 만에 처음으로 평점.,,,,,,,,,,,,,
11009,내 주관적인 생각인데 이거 예고편이 그냥 예고편이 아니라 걍 영화 요약본인줄;; 예고편만보고도 아 남자 죽고 여자가 살겠구나 딱 보여줌,,,,,,,,,,,,,
11010,중력이 없는 곳에서의 생존사투,,,,,,,,,,,,,
11011,정말로 험난한 우주여행을 하다온 기분,,,,,,,,,,,,,
11012,아니 박평식이 8점이나?! 왜 태클을 안 걸고?,,,,,,,,,,,,,
11013,영화초반 2명에서 1명만 나오는데 집중도 잘되고 개꿀잼,,,,,,,,,,,,,
11014,상당히 재미 있었다. 시간이 짧아서 아쉽,,,,,,,,,,,,,
11015,우주를 담은 걸작이고 뭐고,,,,,,,,,,,,,
11016,평점이나 후기 보고 매우기대하며 새벽에 혼자 숨죽이고 본 영화 몰입도는 있었지만 그렇게 매우 역대급으로 재밌진 않았음,,,,,,,,,,,,,
11017,영화 나쁘지 않다ㅡ  그런데 3D효과 영상미 극찬할 정도는 아니다. 이것보다 훨씬 3D좋은 영화도 많고 영상미좋은 영화도 많은데,,,,,,,,,,,,,
11018,씨2바존나졸리네 ㅡㅡ,,,,,,,,,,,,,
11019,여주인공이 헉헉헥헉 할때 좀 짜증났지만 어쨋든 최고의 영화,,,,,,,,,,,,,
11020,명작이다 꼭 봐야한다 찬양하길래 기대 하면서 봤는데 전 생각보다 그냥 그랬네요 숨 못쉬고 보긴 했고 영상미도 뛰어났지만 영화 자체는 음..여운은 남아요 3D로 극장에서 봤으면 달랐을거 같아서 그건 아쉽습니다 솔직히 ...,,,,,,,,,,,,,
11021,그냥  보세요 이건 진심 짱,,,,,,,,,,,,,
11022,그많은 영화를보면서 처음으로 전율과땀을나게한 스릴러 감독의센스도많이 돋보였고 음악또한 예술. 아주좋은영화였다. 무엇보다 교훈은 역시 저직업뿐아니라 위험하고 냉정함과 이성적임이 필요한곳엔 여자는쓰면안된다.,,,,,,,,,,,,,
11023,주인공이 망원경 수리하다가 러시아떔에 다 폭팔하고 이잇 난 살아야겠어 하고 살고 끝남.,,,,,,,,,,,,,
11024,뻔하디 뻔한 스토리 뻔한 감동 초반엔 흥미로웠지만 갈수록 보이는 스토리 노노,,,,,,,,,,,,,
11025,할말이없다. 이게 그렇게 칭찬할 영화냐.,,,,,,,,,,,,,
11026,역시 계집들이 일하는데 문제야 계집들이 꼭사고를 친다니까,,,,,,,,,,,,,
11027,다들평이좋아서너무기대를많이했나보다~생각보다스토리가 약했고 우주라는 한 공간서만 내용이이루어져 지루한감도있었다.,,,,,,,,,,,,,
11028,대단한 영화다. 삶이 힘들때 이 영화가 자주 생각날 것 같다,,,,,,,,,,,,,
11029,이런 영화는 앞으로 3년간도 나오기 힘들 것,,,,,,,,,,,,,
11030,4점이 적당 3류 재난탈출 영화랑  스토리가 비슷해서  우주물치고는 재미없게봤네  단지 우주라는것때문에 사람들이 혹한듯해서 별점이 높은것뿐  사실 중반부터 심하게재미없어서 빨리돌려봄,,,,,,,,,,,,,
11031,정말 이렇게 심장을 울리는 영화는 처음이다 온몸에 전율이돋았다 많은것을 생각하게 하는 영화였다 아직도 여운이 가시지 않는다 별 10개도 모자란 영화같다,,,,,,,,,,,,,
11032,순간 순간 살아숨쉬며 살아있다는거에 감사함을 느끼게끔 해주는 영화,,,,,,,,,,,,,
11033,촬영기법의 혁신이다. 영상보는 재미에 시간가는줄 몰랐어,,,,,,,,,,,,,
11034,이 작품을 보면서 재미를 논하는것은 말이안된다; 우리나라 학생들은 재미가없다며 돈이 아깝단다 ㅋㅋㅋ; 그래비티는 그냥 한마디로 명작이다,,,,,,,,,,,,,
11035,감독이 절제의 정도를 잘 알고 만든 영화. 최고,,,,,,,,,,,,,
11036,쩐다 무서워긴장감의연속,,,,,,,,,,,,,
11037,볼륨 활용의 최상급 교과서,,,,,,,,,,,,,
11038,인간은 얼마나 작은 존재인가.. 바다속심해도 무인도 섬도 우주에비하면 아무것도 아니다..  당신에게 체험하게 해준다.. 심장이 뛰는 소리가 들린다.,,,,,,,,,,,,,
11039,보면서 이만큼 몸에 힘들어간 영화가 있었던가? 영화를 보고 올려다보는 하늘이 색다르게 보인다.,,,,,,,,,,,,,
11040,내 걱정거리는  좃밥이엇구나 영화보며 깨달음,,,,,,,,,,,,,
11041,이거재미없단놈들은 뭐,,,,,,,,,,,,,
11042,"이동진평점이 그대로다. 어떤 영화는 ""관람""이 아니라 ""체험""된다 놀라운 체험이었다",,,,,,,,,,,,,
11043,산드라 블록이 죽다 살아나는 이야기,,,,,,,,,,,,,
11044,소재가 신선했음.. 다소 억지의 설정이 있지만 미국식의 어쩔 수 없는 선택!! 4d로 보면 훨씬 더 색다르고 재미 있었을  영화,,,,,,,,,,,,,
11045,메가이수- 몇천,,,,,,,,,,,,,
11046,생각하기 싫으면 보지마라 평점 좀 떨어트리지 말고;;,,,,,,,,,,,,,
11047,소재가 신선했을뿐...정말 지루했음...과대평가에 낚였네요..,,,,,,,,,,,,,
11048,그리 재밌진않지만 우주에서 지구를 본모습과 - 교훈이 담겨있다는 점에서 한번쯤 봐도 괜찮은 영화다 라는생각이 들엇네요,,,,,,,,,,,,,
11049,솔직히 다들 재밌다고 하길래 평점도 높길래 봤습니다... 영화 잘 모르고 재미로 보는 저로서는 글쎄요.... 지루했습니다.. 3d로 티켓 사서 들어갔는데.. 그닥 3D효과가 많이 보이지 않더라구요... 실망입니다,,,,,,,,,,,,,
11050,최고다 무시무시하다 시간 가는 줄 몰랐ㄷ,,,,,,,,,,,,,
11051,긴장감과 스릴 우주에서 지구를 볼수있는색다른 영화  베스트,,,,,,,,,,,,,
11052,이런영화는 처음이지만 정말대단하다.. 인생에 남을 영화..,,,,,,,,,,,,,
11053,아무것도 소리조차 없는 미지의 곳에서 인간이 혼자남아 느낄 감정은 그냥 평소에 우리가 말하던 공포그 이상.. 차원이 다르다 심장터지는줄 최고의영화,,,,,,,,,,,,,
11054,이것은 몇년에 한번 나올까말까한 명작인듯.... 손에 땀나서 흐를뻔함평론가도 인정한 영화다 꼭봐라 노잼드립하지말고^^,,,,,,,,,,,,,
11055,아이맥스로 봤는데 사이드 끝이라는 최악의 자리에서 봤음에도,,,,,,,,,,,,,
11056,그래 대단하다 그리고 또 뭐;;3D 아니면 뭘 내세울거지?,,,,,,,,,,,,,
11057,볼거많고 느낄꺼 많겠지만....난 이런영화 별로다 ㅠㅠ 잔득기대하고 들어가선 하품만 하고 나온영화...평식이 형은 항상 이런 지루한것만 좋아하더라...,,,,,,,,,,,,,
11058,이건 꼭 4d로 봐야된다. 3d는 감상이지만 4d로 보면 체험이다.,,,,,,,,,,,,,
11059,잘 만들기는 했는데,,,,,,,,,,,,,
11060,역대급 재난영화다 ㄷㄷ,,,,,,,,,,,,,
11061,굉장히 기대하고 봤는데도 우와...이 영화를 보게 해준 알폰소 쿠아론 감독에게 감사를~!,,,,,,,,,,,,,
11062,감동이 묵직하게 오고.. OST도 묵직하내.,,,,,,,,,,,,,
11063,이 영화 보고나면,,,,,,,,,,,,,
11064,어렵고... 어렵고.... 어렵다.... 철학서적을 보면서 우주의신비 다큐도 함께보는 기분... 왜 재미있는지 모르겠습니다.,,,,,,,,,,,,,
11065,이 영화 정말 최고임...,,,,,,,,,,,,,
11066,최고다 정말. 소장하고 싶다.,,,,,,,,,,,,,
11067,이 영화는 미쳤다..2,,,,,,,,,,,,,
11068,산드라 블록과 키아누리브스의 스피드가 아련하게 떠오르는 영화,,,,,,,,,,,,,
11069,몰입도 최고에요! 디지털로 본게 아까워서 4D로 다시 봐야하나 고민중,,,,,,,,,,,,,
11070,이제껏 다른명작들을 보고나왔을때랑 전혀다른느낌 이건 혁명이다 다시이런영화가나올수있을까? 재미없다고말하는 사람들 진심불쌍하다 영화를 단순재미로 보는시대는 갔다,,,,,,,,,,,,,
11071,2013 내게 최고의 영화,,,,,,,,,,,,,
11072,초반에는 블록 누님 숨소리가 몰입에 방해됐지만,,,,,,,,,,,,,
11073,원맨쑈....입니다,,,,,,,,,,,,,
11074,저도 10점! 만점입니다.,,,,,,,,,,,,,
11075,이건 극장에서 봐야해!!지구가 얼마나 아름다운 별인지..,,,,,,,,,,,,,
11076,이게 뭔영환지  곰곰히 생각해보는 영화... 그냥  뭐랄까 산으로 가는영화  흐메돈아까운 내돈 18000원..하..,,,,,,,,,,,,,
11077,그닥. 하도 잘만들었다해서 4dx로 봤는데,,,,,,,,,,,,,
11078,솔직히 말해서 별로다..,,,,,,,,,,,,,
11079,영상미와 삶의 철학을 동시에 설파한다.cg 를 이제 단순한 볼거리가 아닌 또다른 연출 구현수단으로 쓰고 있고,,,,,,,,,,,,,
11080,이영화에서 우주는 너무도 서글프게 아름다웠지만 한편으로 너무 무서웠다...,,,,,,,,,,,,,
11081,우리가 상상한것 이상.,,,,,,,,,,,,,
11082,영화보면 재미있어서 시간가는줄 모르고 보면 재미있는 영화라고 생각하는데 그래비티는 언제 끝나나 하고 시간만 보구 있었음~!!!,,,,,,,,,,,,,
11083,오씨엔에서 보여줘도 볼까말까...정말 비추. 하지만 영화가 담은 메세지는 뭐 괜춘ㅋ올만에 하품 엄청했던ㅋ 평점왜이리 높은지 모르겟다 정말,,,,,,,,,,,,,
11084,4d아니었으면 보다가 잤을거같은뎅... 왜이렇게 평점높지,,,,,,,,,,,,,
11085,재미를떠나서정말영화잘만들었다진짜대단했다ㅜㅜ어찌만들엇을까이영화연말에아카데미상휩쓸듯,,,,,,,,,,,,,
11086,강추ㅋㅋㅋ 완전 재밌네요,,,,,,,,,,,,,
11087,지루하대서 고민했는데 안봤으면  후회할 뻔 했다. 이게 바로 영화지! 전율,,,,,,,,,,,,,
11088,보는 내내 우주에 있는 기분이었다. 개인마다 취향이 달라서 보라고 강추는 못하겠지만 나한텐 짱짱,,,,,,,,,,,,,
11089,일단 영화를 잘볼지 모르는 일반분들이나 스케일쩔고스릴넘치고 괴물나오는 sf영화로 보고 본다면 심하게실망하실듯... 재미는없었지만 그래도 느낌점이많음,,,,,,,,,,,,,
11090,초반에 굉장히 지루,,,,,,,,,,,,,
11091,연기와 연출 긴장감은 좋지만...이런 허무하고 허무한 스토리... 이런걸 영화로 볼 필요가 있을까??,,,,,,,,,,,,,
11092,그냥 볼만함. 지루하지 않고 재미없지 않고 정말 재미 있지 않은데 보다 보니 시간이 가버렸네요.,,,,,,,,,,,,,
11093,놀이동산 같은데에 우주선 모형타면 움직이면서 화면으로 우주체험하는거 있는데 딱 그거라고 보면 됨. 좀 난건 영상미,,,,,,,,,,,,,
11094,이런 영화 만들라면 돈이 얼마나 들어가는줄 알고 하는  소리입니까? 못해도 몇 천억 단위 입니다. 우리나라 시장에서 이런 영화를 만들면  천만이상이 든다고해도 손해보는 거라는 말입니다. 멀 알고나 말씀하셔야지 쯔쯔....,,,,,,,,,,,,,
11095,산드라블록 태아처럼 웅크리고 있는 그 씬 소름돋았다... 진짜...,,,,,,,,,,,,,
