,content,,,,,,,,,,,,,
7702,영상. 촬영.연기. 음향. 각본..뭐하나 나무랄것이 없는 최고 수작! 인간 내면에 대한 성찰까지..감동의 물결,,,,,,,,,,,,,
7703,발가락이랑 허벅지에 힘 존나 주고 봤다,,,,,,,,,,,,,
7704,라이프 오브 파이 3d추천해서 봤던 기억이 나네요.그래비티에 비하변 그 영화는 그냥 2d였어요...그래비티는 완벽한 연출에다가 주인공들의 넘치지 않은 분량과 디테일이 이 영화를 완벽하게 만든 것 같이요,,,,,,,,,,,,,
7705,장르는 SF이지만 중간에 그 넓은 우주에서 혼자가 된 장면을 볼 때는 눈물이 터져 나왔습니다 ㅜㅜ 영상미도 최고에요 보는내내 감탄하면서 봤습니다,,,,,,,,,,,,,
7706,최고 스릴러^^  안보면후회함꼭 에어콘 앞에서 보시길 4D느낌!!!!,,,,,,,,,,,,,
7707,스토리 뭐고 다 떠나서 솔직히 개재밌던데?후 폭풍이 쩜,,,,,,,,,,,,,
7708,우주의 냄새까지 상상하게 하는 고밀도 체험 우주 현장!,,,,,,,,,,,,,
7709,영화는 예술이다 좋아요ㅎㅎ,,,,,,,,,,,,,
7710,정말아바타이후이런영상미는첨보는듯,,,,,,,,,,,,,
7711,3d로 봤어요 경이롭네요....,,,,,,,,,,,,,
7712,너무 만족해요. 내용도 신선하고 근데 특히 그 두사람이 너무 불쌍합니다.(스포주의),,,,,,,,,,,,,
7713,전율 감동그자체 10자.,,,,,,,,,,,,,
7714,아바타처럼 스크린으로 꼭 봐야 그 전율이 느껴지는 영화,,,,,,,,,,,,,
7715,2001 스페이스 오딧세이 보고 졸리다면 이영화도 보지 않는게 좋을것 같다.. 스페이스 오딧세이급의 영화다. 두영화 다 엄청난 롱테이크 씬을 가지고 있지만 영상을 볼줄 모르는 사람은 글쎄;; 우주를 체험하게 해주는 ...,,,,,,,,,,,,,
7716,충격과 공포 그 자체.  보는 동안 관람석에서 숨소리 내는 사람조차 없었음..별5개로는 부족하고 별10개를 줄 수 있다면 이 영화에 주고 싶음.이왕이면  IMAX 3D로 보기를 강추함.,,,,,,,,,,,,,
7717,눈이 즐거운영화. 3D로봤는데 나는 너무화려해서 시간가는줄모르고 봤는데 남자친구는 조금보다 바로 뻗더라. 너무재미없고 지루했다고. 개인의 취향인듯~,,,,,,,,,,,,,
7718,"제가 영화관에서 목격한것을 말씀드릴께요 10명이상 잠을 잤습니다. 영화가 끝난 뒤 사람들 나오는데 ""정말 재미없다"" 바께 안들렸어요.",,,,,,,,,,,,,
7719,쓰리디나 포디로 보세요.,,,,,,,,,,,,,
7720,이 영화를 보고 아무것도 느끼지 못하고 지루함을 느낀다는 것 자체를 이해 할 수없다. 감성이 메마르고 인생 참 편하게 살아왔나보다.,,,,,,,,,,,,,
7721,사건이 전개되면서 영화 끝날 때까지 긴장을 놓치지 않게 하는 영화입니다.조지클루니와의 장면에서 너무 감동을 받아 아직도 벅차오르네요.정말 몰입하게 만드는 영화고,,,,,,,,,,,,,
7722,내 인생애게 미안함을 느끼게 해준 영화.,,,,,,,,,,,,,
7723,짱이에염 ㅋㅋ 영화관에서 보길 잘한듯,,,,,,,,,,,,,
7724,영화기술의 발전은 이렇게 쓰여저야 한다,,,,,,,,,,,,,
7725,굳굳대박뭘자꾸길게쓰래짱임,,,,,,,,,,,,,
7726,하여간 이거 지루하고 쓰레기라하면서 1점주는애들 감기 ,,,,,,,,,,,,,
7727,간만에 헐리우드수작~,,,,,,,,,,,,,
7728,ㄱ감동의 도가니다ㅠㅠㅠ굳굳,,,,,,,,,,,,,
7729,너무재밌었어요 기대이상,,,,,,,,,,,,,
7730,내 마음대로 할수 있다는 소중함,,,,,,,,,,,,,
7731,뭐 더 할말이 있나? 진짜영화,,,,,,,,,,,,,
7732,자장가 비스무리한거 불러주는장면에서 내생애 처음으로 극장에서 졸았다.. 이걸 몰입했다고 봐야하나... 무튼 좀 루즈한면이 없지않아있지만 그렇다고해서 이 영화의 완성도를 폄하할수는 없는거같음 수작.,,,,,,,,,,,,,
7733,아바타 이후로 이영화를 아이맥스 3D로 안본다는것은 당신 영화관 인생의 오점. 충격적이고 당신의 손을 땀범벅으로 만들기 충분하다,,,,,,,,,,,,,
7734,체험영화고 던지고 있는 메시지도 명확하다. 의미부여야 개인적 차원에서 가능하겠지만 심오한 영화 아니다. 근데 이걸 2D로 본 사람도 있나? 그럴거면 그 돈 불우이웃이나 돕지. 스토리가 없는거나 마찬가지인 영화를 2D...,,,,,,,,,,,,,
7735,이건 큰 화면으로 꼭 봐야 됨!,,,,,,,,,,,,,
7736,모든게 완벽하게 조화된 영환듯 개쩜.. 우주라는 소재를 정말 잘 살린영화다 안보면후회함,,,,,,,,,,,,,
7737,...so boring,,,,,,,,,,,,,
7738,영상미는 최고였다. 개인의 차이가 큰지 몰라도 처음에 몰입은 잘 되었는데 너무 서론없이 계속 절정만 달리는 기분이었다. 솔직히 영화보면서 힘들었다. 쉴 타이밍도 감미할 타이밍도 없는 영화였다는 느낌이다.,,,,,,,,,,,,,
7739,말이안나옵니다 단순한 스토리로 이정도 메세지를 가진 영화라니영상보단  사운드에서 감탄을 많이느꼈습니다오락영화생각하시면 보지마세요,,,,,,,,,,,,,
7740,3D로보니깐입체감아주멋있었음  4D볼껄아쉬움,,,,,,,,,,,,,
7741,이런 영화 처음...다시 볼 영화,,,,,,,,,,,,,
7742,세상에....이런 영화는 정말 처음본다내가 우주에 있는줄 알았음....진짜 눈물 엄청 흘린듯어느 주간지에서 말할 그대로 앞으로의 우주영화는 그래비티 전과 후로 나뉠것이다,,,,,,,,,,,,,
7743,평점 보고 영화 선택했다. 망했음~지루하고 재미없고~,,,,,,,,,,,,,
7744,손에땀을쥐는ㅎ최고다!,,,,,,,,,,,,,
7745,말이 필요 없다....,,,,,,,,,,,,,
7746,보다가 오줌쌀뻔했다. 잘만들었다.,,,,,,,,,,,,,
7747,이 시점 현재 기술로,,,,,,,,,,,,,
7748,우주에서 지구구경 5분즐거웠고 속터져미쳐불것같은 전개와 누구나 생각하는 결말 하 내돈ㅜㅜ,,,,,,,,,,,,,
7749,다른 말 필요없다. 압도적인 영상미.,,,,,,,,,,,,,
7750,내가 이정도로 스릴을 느낀건 프리퀀시 이후로 처음이다. 수작.,,,,,,,,,,,,,
7751,보는 내내 손에 땀을 쥐게 만드네요 그리고 우주에서 바라본 해돋이 장면 영상이 정말 아름다웠습니다.제 친구는 지루하다는데 전 지루함도 못느끼겠더라구요 꼭보시길,,,,,,,,,,,,,
7752,숨막히도록 아름답고 경이로운 영화.,,,,,,,,,,,,,
7753,내 생의 최고의 영화다.. 우주를 여행하고 온 기분이다. 타이타닉 이후 제대로 된 영화를 보았다. 디지털로 봤는데 이건 필수 3D로 봐야 할 것 같다.,,,,,,,,,,,,,
7754,깊은 카타르시스를 주는 명작. 아는만큼 보인다. 할 말을 잃게 많드는 명작. 길이 남을 명작.,,,,,,,,,,,,,
7755,안 볼 수 없는영화. 내가 첫 평점과 댓글을 달게 만드는 영화.깊은 깨달음을 주는 영화.,,,,,,,,,,,,,
7756,무조건 4D로 봐야함!!,,,,,,,,,,,,,
7757,평점올려야겠다 이런 대작이 8점대라니..,,,,,,,,,,,,,
7758,간접경험이 직접경험처럼 느껴지는 순간이었다,,,,,,,,,,,,,
7759,만약 3D로 봤으면 초반에 우주멀미하고 마지막에 기립박수 쳤을거 같다.,,,,,,,,,,,,,
7760,제발 4D로 꼭 보세요 진짜 후회안하고 놓치면 평생 못봅니다 4D를 위해 태어난 영화에요 놀이공원갔다가 온 느낌입니다 아바타만큼 충격이었어요,,,,,,,,,,,,,
7761,한정된 시간,,,,,,,,,,,,,
7762,어떻게 이렇게 리얼한 영상미가 나올수 있죠? 너무 리얼해서 우주 가서 찍고온줄 알았네요...3d도 이렇게 경이로운데 4d는 어떨까요..영화관에서 우주 갔다올듯.,,,,,,,,,,,,,
7763,아닌강땜에 2점주려다 참음,,,,,,,,,,,,,
7764,재밌게 봤내요 ㅎㅎ 인간의 상상력이란 ....,,,,,,,,,,,,,
7765,3D로 봤는데요. 되게 멋있었어요. 신비롭고. 근데 뭔가 지루한 감이 없지 않아 있었는데 돈 아깝다는 생각은 안들었었고. 음 재미로 볼 영화는 아닌듯,,,,,,,,,,,,,
7766,영화에 대한 지능이 낮아서 그런지 개인적으로 별로네요..  약간 따분하기도 하고요..  저예산으로 성공한것 같습니다..,,,,,,,,,,,,,
7767,정말 설명조차 필요없게 만드는 영화네요...흡입력이 대단합니다,,,,,,,,,,,,,
7768,말이 안나와.... 숨이 안쉬어져... 내가 딛고 있는 지구에 감사한다,,,,,,,,,,,,,
7769,가슴속이 뜨거워지는 감동을 느낌!!! 짱짱,,,,,,,,,,,,,
7770,와...방금 3d로 보고왔는데 영화 보고 나서 이렇게 온 몸에 전율 돋은 적은 처음이다...,,,,,,,,,,,,,
7771,어릴때 태어나서 처음으로 영화관에서타잔을 봤을때의 전율과 감동을 이 영화보면서 다시 느꼈다..정말 최고다,,,,,,,,,,,,,
7772,전율이 느껴진다. 말이 필요한 영화가아냐 .,,,,,,,,,,,,,
7773,영상미도 영상미지만 영화보는 내내 속으로 '살아.살아.살 수 있어.'를 외쳤네요.오랜만에 본 영화인데 정말 큰 감동을 느꼈습니다.,,,,,,,,,,,,,
7774,와...정말 말이안나온다,,,,,,,,,,,,,
7775,연기도 완벽하고 스토리도 정말 좋은거같아요ㅠㅠ배경이 우주인만큼,,,,,,,,,,,,,
7776,처음에는 솔직히 지루했는데 보다보니 시간가는줄 몰랐음ㅎㅎ 근데 3D로 봤으면 더 재밌었을듯,,,,,,,,,,,,,
7777,순백의 공포감과 삶에대한 의지를 불어넣어준,,,,,,,,,,,,,
7778,대박.!!!대박이네,,,,,,,,,,,,,
7779,아이맥스3D로 보면 최고인 것 같다..처음엔 조금 지루했지만 후반부로 갈수록 영화 정말 잘 만든것같다는 생각이들었다..,,,,,,,,,,,,,
7780,그래비티가  보여준 영상하나하나에 담겨진 의미가 보는사람들의 저마다 다른 시각속에 해석될수 있는데 개인적으로 삶과 죽음,,,,,,,,,,,,,
7781,한번더 보고싶은영화...정말대단하다...21/02/18  3회차,,,,,,,,,,,,,
7782,최고다 신선한소제속에서 감독의 연출력이 영화를 수십억배 더 재밌게 만들어준 영화다 다른 재난영화에비해 답답함이 없고 진정한 공포가 느껴진다,,,,,,,,,,,,,
7783,짱이야 짱 대박이야 와 영상이,,,,,,,,,,,,,
7784,엔딩까지 숨을 쉴 수가 없었어요 정말 최고였습니다,,,,,,,,,,,,,
7785,올해 최고의 영화 갓라비티,,,,,,,,,,,,,
7786,손에힘이 안풀리고 계속 땀이났네 . 지존,,,,,,,,,,,,,
7787,3D로 보고왔습니다. 틈틈히 영화평점을 남겨왔습니다. 하지만 오늘 이때까지의 내 모든 영화평점들이 허무해지는 기분을 느꼈습니다. 영화본지 2시간이 넘어가지만 아직도 그 생생했던 느낌들이 몸에서 떠나질 않아 오늘은 술...,,,,,,,,,,,,,
7788,땅을 밟고 있는 내가 행복하더라. 보고 나서는 감탄사 밖에 안나옴.,,,,,,,,,,,,,
7789,: ) 정말 추천할만한 영화입니다 !,,,,,,,,,,,,,
7790,올해본영화중최고  끝나고 아무말없이크레딧만멍하니쳐다봤다,,,,,,,,,,,,,
7791,제 인생의 최고의 영화였던것 같습니다 10만원을 주고 봐도 전혀 아깝지가 않습니다... 정말 최고입니다 대신에 꼭 영화관에서 보시길 바랍니다,,,,,,,,,,,,,
7792,처음엔 뭔가 싶었다. 하지만 이 영화를 계속 보니 깨달은 것이 있었다.그점이 이 영화가 내 마음에 강렬하게 남는 계기가 되었다.참 멋있는 영화다.,,,,,,,,,,,,,
7793,굿굿굿굿 짱짱짱짱 굿짱,,,,,,,,,,,,,
7794,3d 입체감 쩐다. 완전 재밌어요,,,,,,,,,,,,,
7795,재미 있네요 재미요.재미,,,,,,,,,,,,,
7796,1시간30분 내내 낭떠러지에 매달려서 삶과 죽음/유한과 무한을 통찰하는 영화,,,,,,,,,,,,,
7797,개인적으로 완성도나 여러가지 정말 잘 만든 영화라고 생각하는데 의외로 우리나라 취향에 잘 안맞는지 나쁜 평들이 좀 있네요...ㅠㅠ,,,,,,,,,,,,,
7798,한마디로 이영화 쩐다... 갠적으로 아이맥스나 4dx로 보는걸 추천함. 진짜 우주에 와 있는것 같았음.,,,,,,,,,,,,,
7799,영상으로 전율을 느끼고 싶다면..,,,,,,,,,,,,,
7800,한국에선 나올수없는...,,,,,,,,,,,,,
7801,우리나라 깡패영화 10개 만들 돈으로차라리 이런영화 1개를 만들지그래?살인,,,,,,,,,,,,,
7802,정말 멋진 영화. 영화 선샤인을 보고 감동 받은 이 라면 이것을 보고 반하지 않을수가 없다.,,,,,,,,,,,,,
7803,제대로 집중하고 봤네요. 감탄스럽기도 하고 벅차오르기도 했어요.,,,,,,,,,,,,,
7804,찌질한 한국영화에 찌든 머리속 답답함을 날려주었다. 돈아깝다고 투덜거리는 놈은 찌질한 한국영화에 만성이 된 놈들이다.,,,,,,,,,,,,,
7805,최고다!  꼭 보세요!!!,,,,,,,,,,,,,
7806,다른 사람들에게도 추천해주고 싶은 영화 교훈이 담겨있는듯,,,,,,,,,,,,,
7807,지금까지 나온 영화중에 우주의 분위기를 가장 잘 표현한 영화인듯. 심리묘사도 매우 뛰어남. 숨쉴틈없는 긴박한 액션을 기대했다면 중간중간 좀 루즈한 느낌을 받을 순 있음.,,,,,,,,,,,,,
7808,정말 감동이었어요!!!! imax 3d 강추요!!,,,,,,,,,,,,,
7809,진짜짱이였음..내가우주에절ㆍㅎ,,,,,,,,,,,,,
7810,이 영화가 지루하다? 끝 없이 긴장을 놓지 못하고 봤다. 숨을 멈추고 넋 놓고 영상을 바라본 것은 이번이 처음이다.,,,,,,,,,,,,,
7811,이 느낌을 말로 글로 설명할 수가 없네..-_-,,,,,,,,,,,,,
7812,혁명! 황홀한 영화처음으로 평점 남기게 하는 영화,,,,,,,,,,,,,
7813,나같으면 눈물 콧물 흘리면서 꺼이꺼이 울고 패닉와서 아무것도 못할거 같은데... -_- 산드라블룩 젊었을때보다 나이먹고 팡팡 터지네요~ 여우주연상도 타고 이런영화에도 출연하고~,,,,,,,,,,,,,
7814,오랜만에 긴장감쩌는 영화죽인다...,,,,,,,,,,,,,
7815,이런영화를 어떻게 만들수 있을까?^^ 놀랍다,,,,,,,,,,,,,
7816,이영화보고 깜짝놀랐습니다... 배우들 연기도 그렇지만 정말 어떻게 이걸 만들었을까 하는 놀라움이 컸습니다 ;;   이건 관람이라는 표현보다 진짜 새로운 영화를 체험한다고 생각돼네요  전 10점줍니다;,,,,,,,,,,,,,
7817,남자주인공 정말정말 넘 멋짐,,,,,,,,,,,,,
7818,집에 아이맥스 스크린을 설치하자. 오직 이 영화를 위해서.,,,,,,,,,,,,,
7819,배우들이 숨을 못쉬니. 나도 못쉬었다.. '몰입도' 말 다했다.,,,,,,,,,,,,,
7820,뉴턴역학을 이해하고 있다면 별30개이해 못했더라도 10개,,,,,,,,,,,,,
7821,용산 아이맥스3D 진짜 쩔어 진심 강추 올해 본 영화 중 최고 산드라블록 섹시햏,,,,,,,,,,,,,
7822,오늘제대로깨닳았다.할리우드의영화제작기술은단언컨대세계최강이라고...넘사벽이야이건...그래비티는영상미도돋보였지만그보다실감나는사운드가진~~~짜대박이다!,,,,,,,,,,,,,
7823,이 영화를 감상할 수 있게 해준 알폰소 쿠아론 감독에게 경의를 표한다,,,,,,,,,,,,,
7824,내 인생 '최고의 영화'로 정했다,,,,,,,,,,,,,
7825,우주에 다녀온 느낌 ㅠㅠ,,,,,,,,,,,,,
7826,여자주인공이 부딪힐 때마다 같이 숨이 턱턱 막혔음 진짜 몰입짱,,,,,,,,,,,,,
7827,진짜 너무 재밌었다.. 어떻게 우주를 이렇게 완벽하게 그려냈을까.. 배우들의 신들린 연기력과 완전 지리는 사운드.. 대박!!!,,,,,,,,,,,,,
7828,아름다운영화였다. .,,,,,,,,,,,,,
7829,와 진짜 보는 내내 집중 확!!! 시간가는줄도 몰랐어여,,,,,,,,,,,,,
7830,정말 잘만든 영화....b,,,,,,,,,,,,,
7831,고요한 가운데 심장이 미칠듯이 바운스 바운스!,,,,,,,,,,,,,
7832,정말 재밌었던 영화이다.,,,,,,,,,,,,,
7833,아임 히얼 위드 마이 케인,,,,,,,,,,,,,
7834,올해 내가 본 모든 영화를 통틀어서  Top 5에 든다!! 닥추!,,,,,,,,,,,,,
7835,4dx로 봤는데.. 18,,,,,,,,,,,,,
7836,진 짜최고의영화 정말.. 울컥했다,,,,,,,,,,,,,
7837,이건 정말 대작이다...,,,,,,,,,,,,,
7838,안보면 후회합니다 스타워즈이후 최고의 역작 ㅎㅎ,,,,,,,,,,,,,
7839,대박 영화....!!,,,,,,,,,,,,,
7840,내가 진짜 외국영화 별로 그리 좋아하지는 않는데 이거 보고 뿅감 엔딩이 좀 허무하긴 했지만 이만큼 재밌는 영화도 없는듯.한마디로 이영화 짱짱! 이거 진짜 보러가야한다. 처음에진짜 처음에 따분할수도 있는데 갈수록 와 ...,,,,,,,,,,,,,
7841,굿 말이 필요없는 작품 굿!,,,,,,,,,,,,,
7842,영화를 보고 경이로운 체험을 한다는 느낌을 갖게하는 영화가 얼마나 될까.,,,,,,,,,,,,,
7843,영화 그 이상을 경험할 수 있다,,,,,,,,,,,,,
7844,올해본것중에 최고의영화였다 신선한소재에 영상기법도좋았음 굳,,,,,,,,,,,,,
7845,우주여행 후 펼쳐지는 라이언의 정글의법칙ㅋㅋ,,,,,,,,,,,,,
7846,굳굳.. 괜찮게 보았습니다.,,,,,,,,,,,,,
7847,이전에 봤었던 영화들은 생각이 안나네요~진정한 영화.작품이다 싶었어요^-^,,,,,,,,,,,,,
7848,완벽한 영상미,,,,,,,,,,,,,
7849,살아야 할 희망을,,,,,,,,,,,,,
7850,정말 재밌는 영화입니다 ^^,,,,,,,,,,,,,
7851,영화가 줄 수 있는 또다른 종류의 감동.. 전율은 이런 영화를 위해 존재한다.,,,,,,,,,,,,,
7852,단언컨데 십점짜리영화. 근래 봤던영화중최고,,,,,,,,,,,,,
7853,뒤에 cg며 연출이며 최고다,,,,,,,,,,,,,
7854,그래픽이 압도적이고 스토리가 너무 좋았다,,,,,,,,,,,,,
7855,벌써 끝이야? 라는 느낌이 들 정도로 ...,,,,,,,,,,,,,
7856,정말 최고... 어떻게 만들었을까... 영화보면서 하도 힘을 줘서 힘듬.,,,,,,,,,,,,,
7857,말할것 없어요 그냥 보세요,,,,,,,,,,,,,
7858,예술적인 영화 그리고 정말 완성도가 높은 영화였습니다.,,,,,,,,,,,,,
7859,평일에 영화관서 디지털로 봤는데 오늘 3D로 또 보러 갈 예정이에요 그만큼 돈 아깝지 않는 신선한  영화인 것 같아요 진짜 우주에 갇힌 것처럼 심장이 벌렁벌렁 했네요 ㅎㅎ,,,,,,,,,,,,,
7860,4d나 아이맥스3d로 보세요!,,,,,,,,,,,,,
7861,사람마다 다르겠지만 나는 재밌게 봤다.한 사람이 살아남으려고 애쓰는 그 과정이 감동이었다.개인적으로 자극적인 소재가 없는게 정말 좋았다. 영상미도 좋고 기억에 많이 남을 영화.,,,,,,,,,,,,,
7862,중력의 영향을 받으며 두발로 서서 살아 숨쉬고 있다는게 얼마나 큰의미인지를 깨닫게 해주는 올해 본 최고의 영화,,,,,,,,,,,,,
7863,올해 더이상의 영화는 없을 듯...,,,,,,,,,,,,,
7864,4디로못본게한이된다,,,,,,,,,,,,,
7865,경이롭다 괜히 헐리웃이 아니여,,,,,,,,,,,,,
7866,끝을 알 수 없는 칠흙같은 우주 공간,,,,,,,,,,,,,
7867,오랜만에 티켓값이 아깝지 않았다.. 이런말 하기는 뭐하지만 한쿡에서는 볼 수 없는 영상미와 연출,,,,,,,,,,,,,
7868,스토리 + 연출 + 배우의 연기까지 완벽한 영화!,,,,,,,,,,,,,
7869,2013년을 장식하는 영화가 되는건 아닐지 걱정된다 ㄷㄷ 이걸 뛰어넘는게 올해 나오려나;; 정말 대단하다 마지막에 파편 쫙 펼쳐지는장면이 압권 ㄷㄷ,,,,,,,,,,,,,
7870,90분이 너무 짧았습니다. 새로운 장르의 영화! 정말 강추,,,,,,,,,,,,,
7871,스토리와 영상이 틀을 이루고 음향이 완성한 영화. 광활한 우주 속에서 폐쇠공포증을 불러일으키는 독특한 영화였어요,,,,,,,,,,,,,
7872,영화관에서 개봉중일때봐라 다운받아보면 그 느낌 안올거다,,,,,,,,,,,,,
7873,보는 내내 웅장한 영화분위기에 취해 집중하며 봤다.최고의 영화였다.,,,,,,,,,,,,,
7874,다빈이랑 봣는데 정말 재밋엇어요,,,,,,,,,,,,,
7875,이거보면서 진심 심장떨려 디지는줄알았음,,,,,,,,,,,,,
7876,다 보고 영화관 불이 딱 들어오는데 내가 지구에 있는게 그렇게 다행일 수가 없음... 무서운데 잘 만들어서 더 무서워...,,,,,,,,,,,,,
7877,4 D를 위한 영화... 엄청나게 집중해서 봤다 결말이 먹먹했던 건 왠지....,,,,,,,,,,,,,
7878,수능볼때보다 더떨면서 봄보면서 고추가 쪼글아들어서 지리지도 못할 정도,,,,,,,,,,,,,
7879,마지막에 눈물날뻔ㅜ그런데 생각하는 영화를 싫어하거나 액션영화를 좋아하는 사람들에겐 별로일듯 여튼 저한테는 짱이었어요ㅠㅠ4dx3d로보길 추천!,,,,,,,,,,,,,
7880,말이 필요없다 영상미부터 긴장감까지 어느 것 하나놓칠게 없다,,,,,,,,,,,,,
7881,그냥 경이롭다..평소에 이런 류 영화 싫어 하시는 분은 보지말자.취향 정말 많이 타는 영화,,,,,,,,,,,,,
7882,감탄에 감탄. 꼭 3D로 보세요!,,,,,,,,,,,,,
7883,best of best,,,,,,,,,,,,,
7884,심지어 괴물이나 귀신조차도 없는 완전한 무에서 극한의 공포를 창출한 대작. 아름다움과공포의 자연스러운 공존.90분이 짧지만 강렬했다!!,,,,,,,,,,,,,
7885,정말 내가 우주에 있는줄 알았네....,,,,,,,,,,,,,
7886,별로 기대 안하고 갔다. 근데 이건뭐... 할말이 없다. 꼭봐라. 극장에서 꼭봐라. 나중에 다운받아서 보면 후회한다. 광대한 우주를 느끼려면 극장화면도 작다,,,,,,,,,,,,,
7887,내인생 최고 충격의 영화이다....엄청난 걸작 숨이 막힌다,,,,,,,,,,,,,
7888,결말은 경이롭기까지 하다,,,,,,,,,,,,,
7889,정말 참신하다! 우주 공간에서 이뤄지는 주제가 정말 볼만하다!,,,,,,,,,,,,,
7890,영화에 압도당했다는 느낌을 받기는 처음. 몰입할 수 밖에 없었다. 너무 멍해서 영화가 끝난 뒤에도 한동안 움직이지 못했다. 극장에서 다시 보고 싶다고 생각한 몇 안 되는 영화 중 하나!,,,,,,,,,,,,,
7891,경이롭다. 영상미도 뛰어나다. 저 높은 미지의 세계가 이렇게 공포로 와닿을줄 몰랐다.,,,,,,,,,,,,,
7892,정말 오랜만에 영화다운 영화 본거 같네요 ㅎㅎ,,,,,,,,,,,,,
7893,하..3d나4d로 봤어야 됐는데 ㅜㅜ좀 일찍 볼껄 .. 진짜 간만에 영화같은 영화봤음,,,,,,,,,,,,,
7894,집중력이 필요한 영화! 올해 최고의 영화인 것 같다.집중력 떨어지는 분들에겐 비추~,,,,,,,,,,,,,
7895,몰입도,,,,,,,,,,,,,
7896,잘만들은거같아용 제카톡꼬릿말이 완전 그래비티에용 ㅋㅋㅋ,,,,,,,,,,,,,
7897,이 영화의 제목이 중력인 이유는 영화가 끝날 때 쯤에 온몸으로 느낄 수 있다. 영화제목 한 번 기똥차게 잘 뽑아냈다!,,,,,,,,,,,,,
7898,중력이 있음에 감사..  한번더 쓰리디로 봐야겠다ㅠㅠ,,,,,,,,,,,,,
7899,진짜 짱.엄마랑 영화같이봤는데 나도 재밌게 봤고 감동했지만 엄마는 몇주가 지난 지금도 영화 진짜 재밌다고 아직도 생생히 기억난다고하심 진짜 영상미대박 배경음도..내가 아이맥스로 못본게 한이다 진짜ㅠ,,,,,,,,,,,,,
7900,정말 잘본영화 우와아아어,,,,,,,,,,,,,
7901,올해 본 영화중에 최고다,,,,,,,,,,,,,
7902,뭐라 말할 것 없이 딱 추천 요 두 글자만.,,,,,,,,,,,,,
7903,조지 클루니 사랑합니다.,,,,,,,,,,,,,
7904,이런 영화를 볼수있어서 영광입니다,,,,,,,,,,,,,
7905,오랜만에 좋은 영화봤습니다.여러가지 생각할 거리와 교훈을 주는 영화.영상미도 있고 현실적인 영화!좋네요 ^^,,,,,,,,,,,,,
7906,영화본 후 TV에서 사실과 다르다는 그래비티 옥의티라는 방송분을 봤었는데 영화는 영화니까요. 우주의 광활함,,,,,,,,,,,,,
7907,쿠아론 감독의 이름을 알게해준 영화많은 것을 생각하고 내삶을 반성하게 된다,,,,,,,,,,,,,
7908,정말최고다 팝콘들고가서 그대로 그냥나왔다 팝콘먹을새도없는영화 ㅠㅠ! 아까워!,,,,,,,,,,,,,
7909,엄마는 포기하지않아 살아있기때문에 버리지 않았던 희망의 끈,,,,,,,,,,,,,
7910,아아... 우주 무사 탈출 축하드려요....다큐멘터리 잘봤습니다...,,,,,,,,,,,,,
7911,괜찮았다 영화관에서 봐야한다,,,,,,,,,,,,,
7912,완전 잘만들었어요... !!!!  90분동안 긴장을 멈추지 않았고 끝나고 소름돋은 영화!!!,,,,,,,,,,,,,
7913,영상미가 얼마나 대단한지 보러갔더니,,,,,,,,,,,,,
7914,간만에 볼만한 영화 나왔다. 기대만큼이나 재미있던 영화...물론 결과는 뻔하지만,,,,,,,,,,,,,
7915,저는 한번도 지루한 틈 없이 손 꽉 쥐면서 긴장감있게 봤구요 무엇보다도 너무너무 감동적이었음..느낀점도 많고ㅜ원래 영화에 감동 잘 안느끼는 편인데 이상하게 이 영화보면서 너무 울컥함ㅜㅜ난 이게 내 생애 최고의 영화로...,,,,,,,,,,,,,
7916,올해 영화중 최고였다... 부족한점을 찾을 수 없었고 혁명적인 연출이엇다,,,,,,,,,,,,,
7917,10년에 하나 나올까말까한 최고의 영화다.절대적으로 극장관람용! 영화보면서 이런 긴장감 몰입도 작품성....정말 오랜만이다...,,,,,,,,,,,,,
7918,와우 재미와 스릴 만점^^,,,,,,,,,,,,,
7919,우리나라는 언제 이런영화찍어요..?,,,,,,,,,,,,,
7920,웰메이드 영화 입체감있는 3d 강추아이들과보는 것도 강추,,,,,,,,,,,,,
7921,진짜 재밋게봄 3D로 못봐서 아쉽..,,,,,,,,,,,,,
7922,고요함속에서 내 자신을 한번더 돌아볼수있는 그런 영화. 나의 존재를 알게해준영화 너무 감동적이여서 눈물이 벅차오른영화. 그야말로 최고다.,,,,,,,,,,,,,
7923,꼭  3d로 보시길 바래요!,,,,,,,,,,,,,
