,content,,,,,,,,,,,
1,다시봐도 엄청난영화.... 2편보다는 못하지만 솔직히 7점대 나올영화는 아니다 ;;,,,,,,,,,,,
2,때론 길을잃을 때가있다.틀린길도 가봐야 비로소 옳은길도 갈수있는거 아닐까?,,,,,,,,,,,
3,토비 맥과이어의 스파이더맨이 그립다.,,,,,,,,,,,
4,나 마블중 스파이더맨 시리즈가 제일 잼있음. 특히 이 3편 스파이더맨이 심비오트 벗고 여친 구하러 가는 장면에서 미국 국기에 착지에서 달려가는 그 장면을 잊을 수가 없어요.정말 감동적임.ㅠㅠㅠ 8점대 후반은 나와야함...,,,,,,,,,,,
5,영웅의 내면에도 악은 존재한다. 선과 악 사이에서 고뇌하는 스파이더맨의 모습이 잘 보여진 영화. 적들의 매력이 다 보여지지 못해 아쉬움이 남는다,,,,,,,,,,,
6,역시 최고ㅜ 마지막 슬프다ㅠ,,,,,,,,,,,
7,개인적으로 저평가 받은 영화라고 생각함,,,,,,,,,,,
8,엔드류 가필드 갖다 치워라 나한테 스파이더맨은 토비 맥과이어 하나다. 실제로 어메이징 뭐시기부턴 보지도 않음,,,,,,,,,,,
9,베놈이 좀 아쉽지만 악으로 잠깐 변했던 스파이더맨의 피터가 인상적이였음.... 그리고 토비... 잘생겼더라....ㄷㄷ,,,,,,,,,,,
10,이 영화 평점이 왜 7점대죠?! 솔직히 못해도 8점대 후반 정도는 나와야 된다고 생각합니다...,,,,,,,,,,,
11,토비 블랙스파이더맨화 되면서 성격 변할때,,,,,,,,,,,
12,가장 못 만들었다는 3가 어메이징 스파이더맨보다는 낫다..,,,,,,,,,,,
13,스파이더맨 시리즈 중 가장 안타깝고 불쌍했던 캐릭터 해리 ... 그냥 다 잃고 기꺼이 친구위해 죽는구나..어휴,,,,,,,,,,,
14,피터와 해리가 협심해서 엠제이 구하는 장면은 지금봐도 짠하다,,,,,,,,,,,
15,영화에서 액션이나 화려함보다는 도덕적이고 철학적인 좀더 성숙한 히어로물이 아닌가 싶다. 선과 악에서 갈등하고 공과 사에서 갈등에서 이뤄지는 인간적인 스토리가 이 영화의 장점이 아닐까 싶다.,,,,,,,,,,,
16,난 이 영화의 평점이 이해가 안된다. 베놈이라는 악당의 새로운 구도를 열었고 샌드맨 역시 새로운 흥미거리를 던져주었는데 뭘 먹을지 몰라서 고민하다가 그냥 질색해버리는 대한민국 관객들의 수준이 7점이다.,,,,,,,,,,,
17,피터의 타락을 너무 맛깔나게 잘 표현했음,,,,,,,,,,,
18,이게 7점대라니...말도안된다,,,,,,,,,,,
19,이게 오리지널이지. 음악연출 진짜 갑이지 갑. 그리고 대사 하나하나가 교훈글이다.,,,,,,,,,,,
20,어메이징스파이더맨 2를 극장에서 본 후에,,,,,,,,,,,
21,말로는 쉽게 설명하기가 어렵다. 인간관계를 절묘하게 잘 표현 했다. 단순한 히어로물을 떠나서 사람과 사람간의 갈등과 슬픔을 표현했다. 2편도 마찬가지다. 사랑하는 이에게 수없이 많은 상처를 주고 그것을 해결 나가는 ...,,,,,,,,,,,
22,재미있었다. 피터파커가 춤추는 장면에서,,,,,,,,,,,
23,내가 본 영화 평점중 제일 이해 안가네.. 8점 이상은 받아야 생각합니다,,,,,,,,,,,
24,나의 영원한 스파이더맨은 토비 맥과이어,,,,,,,,,,,
25,왜 7점대지?? 지금 봐도 엄청 재밌는데... 명불허전 스파이더맨,,,,,,,,,,,
26,나는  3편이 제일  재밌다.,,,,,,,,,,,
27,많은 적을  한 영화에 담아내려 하다보니 약간은 몰입도가 떨어지지만 내면의 적이 가장 두려움을 잘 표현한 영화,,,,,,,,,,,
28,감독은 훌륭하기 그지없다. 감독이 보이고자 한 부분들은 3편에서도 여지 없이 훌륭하다.하지만 3편에서 비판받는 부분들은 모두가 샘 감독이 반대하던 것을 소니 등 제작사에서 억지로 강요하여 하게 된 것임을 감안하면 감...,,,,,,,,,,,
29,너무 재미 있다 어메이징은 비교도 안됨,,,,,,,,,,,
30,점수 너무 야박하다. 오리지널이 그립다.,,,,,,,,,,,
31,베댓말처럼 7점대는 아닌영화..  4편도 기대해봄,,,,,,,,,,,
32,초반에 피터의 착한이미지를 과하게 부곽시켰던것이 다크스파이더맨의 대비를 위한것이였나. 여러가지 캐릭터들의 추가가 돋보였던 3편이지만,,,,,,,,,,,
33,3편이 명작인 이유는 '용서',,,,,,,,,,,
34,토비가 역시 스파이더맨이지무슨 말이 필요해,,,,,,,,,,,
35,스파이더맨 시리즈중 최고. 어메이징 보고 오리지널이 그리워졌다,,,,,,,,,,,
36,많은 이야기를 짧은 시간동안 보여주려고 하다보니 조금 과해지긴 했지만,,,,,,,,,,,
37,1.2.3  정말  재미있게 봤는데 맨자지막 제일 가장친하던 친구가 죽던날,,,,,,,,,,,
38,평점이 어메이징2 보다 낮다니 미친거 아닌가...?,,,,,,,,,,,
39,저는 이 3가 개봉하는 당시에도 혹평하는 평점들을 보며 이해가 가지 않았었는데..오랜만에 노웨이홈을 보고 토비 스파1,,,,,,,,,,,
40,전작들에 비해 조금 부족하지만 어찌 이게 7점대 영화냐?? 쓰레기들!,,,,,,,,,,,
41,스파이더맨4 제작이 무산되면서 아이언맨이 떴는데,,,,,,,,,,,
42,배트맨은 크리스찬베일 아이언맨은 로다쥬 스파이더맨은 토비임.,,,,,,,,,,,
43,마블 스파이더맨보다 이게 더 좋음,,,,,,,,,,,
44,재밌다 갈등하는 모습이 감동적임,,,,,,,,,,,
45,토니스타크만 찾아대는 요즘 스파이더맨 보다 훨씬 멋있었다,,,,,,,,,,,
46,평점이 왜이리낮지 솔직이7점대는 아니다,,,,,,,,,,,
47,여전히 4편 보고싶다.,,,,,,,,,,,
48,지금봐도 최고인 영화 평점이 낮은 이유를 모르겟다,,,,,,,,,,,
49,7점대 평점은 진짜 아니다...오늘 다시 봤는데 정말 재밌게 봤습니다.,,,,,,,,,,,
50,재밌긴하지만 해리가 너무 불쌍해요ㅠㅠ 스파이더맨이 더 나빠보여요,,,,,,,,,,,
51,나이를 먹어도 다시보면다시볼수록 또다른재미가있다.. 어릴때 단순한 판타지액션신만보았다면.. 오늘본 스파이더맨은 우정..사랑..등 많은드라마를 더많이보았다.. 아름답고슬프다..,,,,,,,,,,,
52,시간이 지나도 명작임. 어둠의 댄서는 잊을수가없다,,,,,,,,,,,
53,개막장스러운 소니 요구를 다 들어주고도 이정도 퀄리티를 뽑아낸 셈 레이미 감독에게 경의를...,,,,,,,,,,,
54,나름 볼만 했고 더 이상 토비 맥과이어가 주인공이 아니란게아쉽다. ㅠ,,,,,,,,,,,
55,흑흑 친구가 불쌍해ㅠㅠㅠ,,,,,,,,,,,
56,본격 스파이더맨 트롤 영화 ㄹㅇ 스파이더맨  내 옆에 있었음 주먹으로 얼굴 내려쳣음쿠키영상 두개임,,,,,,,,,,,
57,7점은 아니다....3편의 강점은 친구와 애인사이,,,,,,,,,,,
58,1,,,,,,,,,,,
59,왜 7점대 인지..모르겟다,,,,,,,,,,,
60,평점이 너무 박해서 그게 아쉽지 영화는 아쉽지 않음... 개인적으로 토비버전이 제일 좋음~스파이더맨 4가 나오지 않아 너무 아쉬움~~토비표 4는 이제는 욕심인건가?ㅎㅎ,,,,,,,,,,,
61,정말 재밌어요. 스무번도 넘게 봤는데 계속 봐도 잼나요,,,,,,,,,,,
62,1,,,,,,,,,,,
63,충분히 10점을 받을만 하다..,,,,,,,,,,,
64,내 스파이더맨은 토비에서 끝났다,,,,,,,,,,,
65,이거 4편 해주세요 토비 스파이더맨 그립다,,,,,,,,,,,
66,솔직히 시간이 지나도 토비의 스파이더맨을 넘길수 있는 스파이더맨 시리즈는 더이상 나오지 않을것이다.,,,,,,,,,,,
67,홈커밍 까지 나왔지만 역시 스파이더맨은 토비 맥과이어,,,,,,,,,,,
68,내가 영화보면서 처음 눈물 흘리고 본게 스파이더맨3다.나는 어메이징,,,,,,,,,,,
69,오랜만에 봤는데 재밌게봄,,,,,,,,,,,
70,다시 보면,,,,,,,,,,,
71,레전드 어메이징 ㄲㅈ 진짜 왜 평점이래,,,,,,,,,,,
72,4가 안나와서 안타깝다 ㅜㅠ,,,,,,,,,,,
73,역시 나의 베스트 무비 스파이더맨! 잊지 않을게요!,,,,,,,,,,,
74,진짜 이 때 스파이더맨의 감성 이 뉴욕의 감성이 너무 그립고 좋다.. 6살때 아빠가 사왔던 스파이더맨2를 보고 느낀 감정이 되살아난다.,,,,,,,,,,,
75,1편: 히어로가 되었다/ 2편: 히어로로 사는게 맞을까?/ 3편: 히어로인 나는 주변 사람들에게 어떤 존재인걸까? // 제작사의 개입으로 베놈이 추가되었고,,,,,,,,,,,
76,노웨이홈 때문에 스파이더맨 1,,,,,,,,,,,
77,토비맥과이어의 스파이더맨이 최고,,,,,,,,,,,
78,제작사에 입김때문에 대본이 여러번 바꿘게 아쉽습니다..감독이  원래대로 제작했더라면 더 훌륭한 명작이 나왔을텐데 외부입김으로  중구난방 영화가 되어버렸네요..악플다신 분들은 이런 속사정을 모르시는듯..그럼에도 불구하...,,,,,,,,,,,
79,너무 저평가 받은 작품이네요 스파이더맨 시리즈중 2이후 정말 재밌게 봤던 작품 입니다,,,,,,,,,,,
80,난 이게 왜 7.42밖에 안됐는지 이해가 하나도 안된다..,,,,,,,,,,,
81,히어로 영화중에 가장 교훈을 주는 영화 아닐까,,,,,,,,,,,
82,솔직히 전 편보다 별로인 건 맞지만 충분히 명작이라고 생각합니다ㅠㅠ 7점대인 게 이해가 전혀 안 가는 영화!!,,,,,,,,,,,
83,좋은데ㅋㅋㅋㅋ빌런들이 너무 많이 나와서 그렇지..흑화 진짜 웃겨죽어..,,,,,,,,,,,
84,한 편에 빌런이 너무 많다보니 스토리가 좀 중구난방이 되긴 했음ㅠ 소니의 압력이 셌다고 하더니... 그럼에도 불구하고 이렇게 완성한 감독이 참 대단하네... 1,,,,,,,,,,,
85,스파이더맨 3를 졸작 취급해도 어스파 시리즈에 비하면 마스터피스다,,,,,,,,,,,
86,아이언맨의 후임으로서 스파이더맨은 톰보단 토비가점 더 어울리는듯.,,,,,,,,,,,
87,춤이 오글거리긴 하지만 어메이징 시리즈보다는 백만배 재밌음,,,,,,,,,,,
88,진정한 스파이더맨은 토비 맥과이어,,,,,,,,,,,
89,이게 7점대? 그러면서 토르 가오갤 파프롬홈이 9점대라고? 이영화한편이 윗3개보다 훨낫다,,,,,,,,,,,
90,이 명작이 도대체 왜 7점대냐개연성,,,,,,,,,,,
91,이 편도 정말 좋았다. 마블 스파이더맨이 지금 9.0을 그냥 넘고 있는데 이게 7점대라고? 하여간 마블 돈많은건 알아줘야되~~,,,,,,,,,,,
92,파프롬홈 개노잼이라 오랜만에 이거봤따,,,,,,,,,,,
93,다시 봐도 꿀잼♡ 스파이더맨 쵝오,,,,,,,,,,,
94,뭐 하나 빠진거 같지만 명작,,,,,,,,,,,
95,재평가 받아야됨 토비의 스파이더맨 다시봐도 향수가 강하게 느껴진다 진정한 스파이더맨 파이팅,,,,,,,,,,,
96,재밌었음  평점 8.5는 받아야됨,,,,,,,,,,,
97,노 웨이 홈에서 어둠의 춤사위를 보고 싶다,,,,,,,,,,,
98,이건 샘 레이미 감독도 스파이더맨도 아닌 '소니'의 영화. 하지만 7점대는 아니다,,,,,,,,,,,
99,제작사의 간섭에도 불구하고 이정도 완성도를 뽑은 샘 레이미에게 찬사를...마블에서 제2의 전성기를 펼칠수 있기를 열렬히 기원합니다,,,,,,,,,,,
100,스파이더맨은 사랑을 많이 받았다는걸 느끼는 영화..,,,,,,,,,,,
101,진정한 서민의 히어로 영화,,,,,,,,,,,
102,애인 두고 입술 남발하는 신세대들의 모습 보기 흐뭇하네요..ㅅㅂ   진짜 빌런들은 여자 친구들 같은데? ㅋㅋㅋ,,,,,,,,,,,
103,개연성은 개나 줘버렸는데 재미는 있음.,,,,,,,,,,,
104,전작보다 뛰어나지 못하면 무조건 망작이라는 미개한 마인드는 버려야한다 3탄도 충분히 잘만든 수작이다,,,,,,,,,,,
105,이거왜 7점대야...?요즘 히어로물 다재미없는데 이거보다,,,,,,,,,,,
106,토비 맥과이어는 내 마음속 스파이더맨이다,,,,,,,,,,,
107,스파이더맨은 단연 토비.그가 아니고서야 누가 스파이더맨 역할을 완벽히 해낼수 있겠는가...,,,,,,,,,,,
108,여주야.. 꼭 그렇게 여러남자 갈아탔어야 했니,,,,,,,,,,,
109,홈커밍? 진짜 별루다. 내가 10살이라면 재미있었다싶다.스파이더맨 1.2.3 음악만으로도 너무 좋다  홈커밍 상대도 안된다. 거리를 날라다니는 씬도 너무 그립다... 토비...,,,,,,,,,,,
110,토비맥과이어..돌아와ㅜㅜㅜ,,,,,,,,,,,
111,스파이더맨3가 아무리 망작이라 해도 어메이징스파이더맨보다는 100배 나음..어메이징 스파이더맨은 진부하고 어이없는 스토리전개..,,,,,,,,,,,
112,재밋게봣는데 평점이 왜이렇지..,,,,,,,,,,,
113,7점대는 좀 아닌듯...네이버 평점 못믿겠다 ㅋ,,,,,,,,,,,
114,저평가된 작품이라고 생각함… 후에 나온 스파이더맨 시리즈에 비해 퀄리티가 더 높은 작품,,,,,,,,,,,
115,다시 점수 올려야한다7점때가 말이되냐,,,,,,,,,,,
116,굉장히 저평가 받음. 재밌게 봄. 특히 처음 외계생물체 베놈을 보면 낯설 수 있지만 베놈을 조금 알고보면 더 재밌음.,,,,,,,,,,,
117,노 웨이 홈 보고 다시 보니 또 재밌다..,,,,,,,,,,,
118,1,,,,,,,,,,,
119,해리는 진짜 멋있는듯...,,,,,,,,,,,
120,샌드맨으로 피폭되는 장면은 진짜 슬프고 예술 그 자체,,,,,,,,,,,
121,이야 이게 왜 7점대지??,,,,,,,,,,,
122,이게 왜  7점대 영화인가 솔까 볼만했던영화아닌가?,,,,,,,,,,,
123,소니 씨발 좀 감독한테 간섭좀 그만하자...요번에 베놈도 그렇고 좀 간섭만 안하면 좋은작품성하고 흥행 둘다 하는데 그 돈좀 벌어보겠다고 그러냐... 샘 레이미 감독의 작품들을 보면 스파이더맨 3편을 계속 아쉬워하는 ...,,,,,,,,,,,
124,‘나 존나쌔다’ 하는 요즘 마블도 재미는 있지만 두고두고 기억되는 마블 영웅은 맥과이어의 스파이더맨 뿐이네,,,,,,,,,,,
125,톰홀랜드는 맥과이어 선배 한테 스파이더맨 연기가 뭔지 똑바로 배워라~,,,,,,,,,,,
126,이게 진짜 내가 아는 스파이더맨 시리즈지 어떤 배우가 이 역할을 맡는다해도 토비 맥과이러 미만잡인것같다,,,,,,,,,,,
127,이게 왜 평점7점대지? 적어도 8점 중후반은 되야하는것같은데.. 요즘 스파이더맨은 어벤져스 따라 맞춘다고 유치하기 짝이없다. 선이미치는영향 악이미치는영향.... 샘레이미의 스파이더맨은 한걸음씩 성장해나가는 영웅의 고...,,,,,,,,,,,
128,이게 왜 7이야 ㅠ 어메이징보다 훨 나은데,,,,,,,,,,,
129,1,,,,,,,,,,,
130,소니의 개입만 없었다면 전작들과 함께 분명 명작이었을 영화… 7편 까지 계획이 있었다는데 무산되서 너무 아쉬웠음… 너무 많은걸 집어넣어서 내용이 산만했지만 그럼에도 불구하고 액션씬이나 스케일은 지금 스파이더맨보다 훨...,,,,,,,,,,,
131,노웨이홈 보고 생각나서 다시 1편부터 몰아 봤어요.1,,,,,,,,,,,
132,현재 상업성만 쫒아 양산형 영웅들만 지속적으로 생산중인 마블에게 싸대기를 날리기에 충분한 원조 스파이더맨 그리고 토비 맥과이어 ☆,,,,,,,,,,,
133,현재의 스파이더맨을 있게 해준 작품,,,,,,,,,,,
134,전작에 비해 개연성이나 스토리는 떨어지지만 액션,,,,,,,,,,,
135,왤케 평점이 낮지 최고였다고 생각했는덕,,,,,,,,,,,
136,청소년 스파이더 맨 보단 청년 스파이더 맨이 낫지ㅋㅋ,,,,,,,,,,,
137,이게 진정한 스파이더맨이지. 토비의 스파이더맨은 영화를 100% 몰입할 수 있게 해주었다,,,,,,,,,,,
138,2편이 너무 좋아서 그런거지 7점대 받을 영화가 절대 아닌데..,,,,,,,,,,,
139,평점 낮은 이유 알겠다ㅋ우리나라 색이들은 소심하고 부끄럼잘타서 별것도 아닌거 오그라들어서 몬본다 이ㅈㄹ하는데 그거 때문이네ㅋㅋ참나ㅋ영화에서 멋있다는 설정인데 몰입 안되게 오그라들면 그건 이해하는데 영화상의 연출도 여...,,,,,,,,,,,
140,스파이더맨은 토비 맥과이어가 진리,,,,,,,,,,,
141,갓 해리 당신은 대체... 명작이네 1,,,,,,,,,,,
142,토비 맥과이어 스파이더맨 4까지는 나왔어야 했다.,,,,,,,,,,,
143,진짜 토비맥과이어 때 첨 봐서 그런가..이때가 젤 재밌어요ㅠ어메이징 부터는 보지도 않았어요..,,,,,,,,,,,
144,평점 왜이리 낮은가 봤더니 1점대 쓴것들 평봐라..베놈 죽였다고 징징거리고 별 시답지않은 이유로 까네 1점대 주면서 평을 쓸거면 제대로 좀 써라,,,,,,,,,,,
145,아무리 생각해도 아쉽다. 샌드맨과 해리와의 서사에만 집중했었다면 더 완벽한 작품이 나왔을텐데... 소니의 과욕이 부른 아쉬운 작품.,,,,,,,,,,,
146,이거 왜 7점대인가요? 저는 잘 이해가 안되네요 마지막에 정말 끝내주는데,,,,,,,,,,,
147,이게 10점이라는건 말도 안되는거지 진짜마지막 장면이 난 너무 슬펐음,,,,,,,,,,,
148,이게 왜 7점대?? 이해가 안 되네ㅋㅋㅋ,,,,,,,,,,,
149,나는 오리지널이 좋다....,,,,,,,,,,,
150,스파이더맨은 역시 토비맥과이어지.1,,,,,,,,,,,
151,토비맥과이어 스파이더맨한게 없지..지금 스파이더맨은..애들 장난같아..,,,,,,,,,,,
152,스파이더맨1,,,,,,,,,,,
153,어딘가 부족해보이는 토비 스파이더맨이 더 좋았다 ㅠ,,,,,,,,,,,
154,3이 별로라는 사람은 왜 그런건지.. 정말 재미있게 봤습니다.,,,,,,,,,,,
155,이거 왜 7점대임?ㅋㅋㅋ,,,,,,,,,,,
156,토비 스파이더 이후로는 다 노잼...그립다,,,,,,,,,,,
157,3편이 내 생각엔 가장 재미있는데... 왜 7점밖에 안줌?,,,,,,,,,,,
158,어메이징을 보고났더니...이게 얼마나 잘만든 작품인지 알겠다...최소 이게 볼거리가 더 많다~,,,,,,,,,,,
159,원조 스파이더맨이 그립다..,,,,,,,,,,,
160,아.. 안타깝다 제인과 피터에 다음 이야기가 궁금한대 속편이 없다니 ㅠㅠ..,,,,,,,,,,,
161,소니의 욕심이 망친 명작시리즈.,,,,,,,,,,,
162,3편까지 가다보니 블록버스터 적인 측면만 고려한 나머지 밸런스가 잘 맞진 않지만. 8점 이상은 나와야 할 영화.,,,,,,,,,,,
163,벌써 15년이 다되어 가는데 이것을 보고 평점달 여유도 없었나보네요. 마블과 DC매니아 로서 8점이상은 충분히 받을 영화였습니다. 평점 조절차 10점 갑니다. 비록 마블코믹스가 힘들어 저작권을 소니에 넘겼졌고,,,,,,,,,,,
164,샘레이미가 만들고 싶은거 못만들고 등떠밀려서 자본주의에 굴복하면서 본인의 고뇌가 함축되어있는느낌 찍으면서 본인이 감독이지만 울었을꺼같다. 영화자체는재밌는데 감독본인이 의도한바가 아니란걸 1,,,,,,,,,,,
165,완전 개그 ㅋㅋㅋ개웃김,,,,,,,,,,,
166,재밌다.완전 재밌다.진짜진짜 재밌다,,,,,,,,,,,
167,샘레이미의 마지막 스파이더맨. 그 당시 영화관에서 볼때도 정말 재밌었는데 십몇년이 지나 다시 봐도 여전히 재밌다. 빌런이 3명이나 있지만 나름 잘 풀어준거같다. 아쉬운 수작..,,,,,,,,,,,
168,전편까지는 스파이더맨을 보면 쾌감이 전해졌는데,,,,,,,,,,,
169,토비맥콰이어의 스파이더맨은 그자체.,,,,,,,,,,,
170,베놈은 도대체 왜 나왔을까요?,,,,,,,,,,,
171,샘 레이미 말을 들었더라면,,,,,,,,,,,
172,최고의 스파이더맨 - 토비 맥과이어,,,,,,,,,,,
173,스파이더맨 안좋아하는데 시간이 비어서 공짜로봤는데 겁나재밋네요.1,,,,,,,,,,,
174,7점줄영화는아니다 정말로,,,,,,,,,,,
175,이게 왜 7점대야 이해가 안되네,,,,,,,,,,,
176,이런 명작이 왜 7점대임?,,,,,,,,,,,
177,베놈은 엄청났다 아직까지도 잊혀지지않는영화,,,,,,,,,,,
178,마지막에 해리가 누워잇을때 나 정말 펑펑울엇다 .ㅠㅠ,,,,,,,,,,,
179,복잡한 스토리가 뭉쳐져 만들어진 애매한 결말,,,,,,,,,,,
180,이야기들이 많아서 붕붕 뜨고 캐릭터들 감정선 때문에 몰입도 안됨.근데 재밌다..,,,,,,,,,,,
181,2편이 워낙 명작이어서 그렇지 망작은 아닌듯. 홀랜드랑 가필드 스파이더맨보다는 재밌음...ㅋㅋ맥과이어의 무거운 맛이 없어,,,,,,,,,,,
182,무조건 토비 맥과이어가 스파이더맨이다 복합적 감정이 담긴 고뇌. 잘생기고 완벽한 지금 애보다 낫다,,,,,,,,,,,
183,영원한 스파이더맨 토비 맥과이어ㅠㅠ,,,,,,,,,,,
184,토비의 스파이더맨 시리즈는 인간의 모든 본성을  내면부터 표현력이 너무 좋았다.. 시간따라. 또는 우연찮게 보게될 때마다 ,,,,,,,,,,,
185,피터 파커가 또 성장했다,,,,,,,,,,,
186,평점이  너무 낮습니다 말이 안돼,,,,,,,,,,,
187,스파이더맨은 토비맥과이어 미만잡 ㅠㅠㅠ,,,,,,,,,,,
188,이상하다.. 다시보니 3편이 제일 재밌는것 같애. 3억불의 말도 안되는 제작비 덕인진 몰라도..1,,,,,,,,,,,
189,스파이더맨 영화중 가장 재미있는영화  이게왜 7점인지 게이버들 수준..,,,,,,,,,,,
190,7점대인게이해가안가넫ㄷ,,,,,,,,,,,
191,솔직히 스파이더맨하면 제일 생각나는게 이 3편인것같음 재밌었고 꼭 어린애들이 지금 스파이더맨이 더 낫다고하지..,,,,,,,,,,,
192,진짜 완벽한영화...,,,,,,,,,,,
193,시리즈 영화 중에 걸작으로 남는 영화!!,,,,,,,,,,,
194,가장 철학적인 히어로물.  액션만 볼줄알았는데 교훈도 얻었다,,,,,,,,,,,
195,춤추는 거 진짜 최악이네...,,,,,,,,,,,
196,빌런 등장이 워낙 많아서 이것저것 다루느라 약간 어수선 분위기이긴 해도 진짜 셈 레이미 감독의 스토리를 풀어내는 그 능력은 정말이지 명장으로써 면모를 보여주는 듯. 베놈 극성팬들이 베놈이 너무 가볍게 소모된 것에 앙...,,,,,,,,,,,
197,너무 재밌어요 ㅜㅜ 이번에 노 웨이 홈 보기전에 다시봤는데 다시봐도 너무 좋더라고요,,,,,,,,,,,
198,재밌었다. 이건 10점도 모자라다.,,,,,,,,,,,
199,어수선하지만 샘스파의 화려한 마무리.,,,,,,,,,,,
200,나빠지려 애쓰는 범생이 피터 귀여움 ㅎ 퇴폐미는 해리가 있어서^^ 왜이리 평점이 낮은지 이상하다. 재미도 있고 잘만든 영화인데. 히어로물을 괜히 낮추어 보기도 하는데  잘 못만들었으면서 괜히 눈물 쥐어 짜내려 애쓰는...,,,,,,,,,,,
201,우려스러운 압박 속에서도 뽑아낸 샘 레이미의 재능,,,,,,,,,,,
202,어둠의 댄서.. 그의 데뷔 무대,,,,,,,,,,,
203,최소9점 받을 영화죠 리부트100번을해도  토비의 스파이더맨 시리즈를 넘을순 없을겁니다,,,,,,,,,,,
204,그냥 토비가 연기도 잘하고 더 나은것 같다돌아왔으면 좋겠다...,,,,,,,,,,,
205,이게 왜 7점대 영화?!!!,,,,,,,,,,,
206,샘레이미의 스파이더맨 시리즈는 명작 반열에 올라야한다고 본다 단순 오락영화 이상으로 교훈과 메세지도 포함하며 연출력이 상당하다,,,,,,,,,,,
207,요즘시대에는 볼수 없는 영화인것같다.우선초반부터 앰제이와의 감정이 얽히는 모습부터 스퍼이더맨과의 사이가 어떨게 세세하게 갈라지기 시작하는지 아주 잘 설명되고 가장 친했던 친구와도 풀리지 않는 오해로 인해 힘들어하는 ...,,,,,,,,,,,
208,난 이 영화 덕에 마블에 첫 입문했다,,,,,,,,,,,
209,12년전 어릴때 보고싶었던 영화,,,,,,,,,,,
210,불화가 있었다는 게 믿기지 않을 정도의 퀄리티에 그나마 다행.,,,,,,,,,,,
211,최고의 스파이더맨 시리즈 마지막영화,,,,,,,,,,,
212,재밌어요 정말로 재밌어요 다시봐도 재밌어요,,,,,,,,,,,
213,오리지널 스파이더맨~,,,,,,,,,,,
214,가장 스파이더맨 다운 스파이더맨,,,,,,,,,,,
215,그립다 토비맥과이어만의 그 찌질하고 모자란...그래서 더 좋아했던...,,,,,,,,,,,
216,위에서 압박줘서 빌런들 우겨넣어도 이정도로 만들면 대단한거 아닌가,,,,,,,,,,,
217,해리 오스본의 진정한 우정. 영웅은 홀로 되는 것이 아니다.,,,,,,,,,,,
218,토비가 그립다ㅠ 스파이더맨과 제일 잘 어울린다,,,,,,,,,,,
219,그리운 토비 스파이디ㅠㅠ,,,,,,,,,,,
220,베놈이 좀 아쉽긴한데 그래도 여전히 명작,,,,,,,,,,,
221,액션 로맨스 우정 10점!!,,,,,,,,,,,
222,별 1개 준 사람들 보니 내용도 없네. 단순히 소니가 싫었던 것인가?어벤져스3까지 봐 왔던 사람 중 한 사람으로서,,,,,,,,,,,
223,베놈은 여기서 끝냈어야했어.. 이 명작은 따라오기 힘들다,,,,,,,,,,,
224,이게7점대라니.어처구니가없다,,,,,,,,,,,
225,이 영화가 악평을 받은 이유는 딱하나 베놈때문이다 베놈은...베놈은 진짜 그 포스가 어마어마하고 스파이더맨 팬들도 베놈의 포스를 엄청 좋아한다..근데.. 스파이더맨 최고의 포스의 주적인 그 베놈을....무튼 그외엔 ...,,,,,,,,,,,
226,샘 레이미와 토비 맥과이어의 스파이더맨을 보는 것만으로도...,,,,,,,,,,,
227,피터의 MJ,,,,,,,,,,,
228,7점대? 말이안됨 ㅋㅋ,,,,,,,,,,,
229,이때 스파이더맨 이 더 재밋음,,,,,,,,,,,
230,샘 레이미 감독의 스파이더맨이 지금도 최고다 토비 맥과이어 당신은 영원한 나의 스파이더맨,,,,,,,,,,,
231,돌아와요...  스파이더맨!,,,,,,,,,,,
232,솔로 스파이더맨중 가장 괜찮다  스파이더맨2가 역대 최고였지고 그후속편인 스파이더맨3는 약간 아쉬웠지만 그래도 평점 7점대는 이해가 안간다  국민 평점 8.4 라고 생각한다!! 마지막 정신차리고 국민들을 구하러 가는...,,,,,,,,,,,
