,content,,,,,,,,,,,,,,,,
8202,저는 이런장르 영화를 좋아해서 그런지 재밌게봤어요긴장감있고 재밌게 봤습니다,,,,,,,,,,,,,,,,
8203,에이리언보다 무서운 A.I에 대한 이야기. 아쉬운건 프로메테우스에서 던진 물음에대해 조금의 진전도 없어보인다 창조주에대한 깊이있는 이야기가 나올것으로 기대했지만...애초에 답이없기에 못내놓는것 같다 비쥬얼은 좋았지만...,,,,,,,,,,,,,,,,
8204,에어리언과 데이빗의 알듯모를듯한 사랑?!,,,,,,,,,,,,,,,,
8205,재밌게 잘 관람했습니다 굿,,,,,,,,,,,,,,,,
8206,나는 그냥 그저그래도 스콧옹의 비주얼적 연출만 보아도 그냥 10점을 줄 수밖에 없다. 숨이 턱턱 막히거든.(좋은 뜻으로.),,,,,,,,,,,,,,,,
8207,짐심 개 지루하고 조올라게 재미없다. 에일리언 시리즈 중에 제일 재미없어. 평점 쓰레기네. 로봇이 그OO 하는게 말이 되냐?,,,,,,,,,,,,,,,,
8208,오랜만에 제가 진짜 에어리언이라고 느끼던 초창기를 떠올리게 해주네요!!,,,,,,,,,,,,,,,,
8209,에이리언의 탄생에 대한 이해 도움~,,,,,,,,,,,,,,,,
8210,2류 에일리언 공포영화. 프로메테우스는 모험심과 스릴감이 있었는데 이 영화는 다른 감독이 만든줄 알았음. 마치 본아이덴티티2와 3 의 차이같이 수준이 다름.,,,,,,,,,,,,,,,,
8211,에일리언보다도 인공지능이 걱정이다.,,,,,,,,,,,,,,,,
8212,재밋게봤어요 또 만들어주세요,,,,,,,,,,,,,,,,
8213,전작들의 비해선 좀 떨어지네요1인 2역 하난 끝내주네요,,,,,,,,,,,,,,,,
8214,그럭저럭 볼만. 리들리 스콧이 감독이라 고민 안하고 봄. 15세 관람가 아님ㅋ 우리가 진짜 걱정해야 될게 무엇인지 메시지를 던지는 영화!!!,,,,,,,,,,,,,,,,
8215,여주가 규현이랑 넘 닮아서 집중이 덜 됐당.;;;,,,,,,,,,,,,,,,,
8216,계속 졸았다..넘 지루해..,,,,,,,,,,,,,,,,
8217,인물들의 행동 판단력이 이야기를 너무 뻔하게 흘러가게했다. 진짜 재미없었다...,,,,,,,,,,,,,,,,
8218,외계인보다 무서운 AI,,,,,,,,,,,,,,,,
8219,역시 에이리언은 시고니 위버가 나와야 제맛인데.. 프로메테우스와의 연결고리도 괜찮았고 그리 나쁘지 않게 보았지만 웬지 무언가 아쉬운 기분이고 개인적으로는 영화에 등장하는 고전적인 에이리언 보다 처음에 나왔던 하얀 에...,,,,,,,,,,,,,,,,
8220,리들리 스콧의 새로운 에일리언 시리즈를 보고 있는 것 만으로도 설렘,,,,,,,,,,,,,,,,
8221,딴건 모르겠고 중요한 프로젝트에 거의 부부아님 커플로 우주선을 태워 보낸다??무슨 60년대 공포영화도 아니고..,,,,,,,,,,,,,,,,
8222,프로메테우스 보고나서 보라길래 보고갔드만 연관성있는게 대체 머가 있는거지? 그냥 프로메테우스의 떡밥 다 팽개치고 에일리언 시리즈 리부트하는 영화로밖에는 안보임. 그리고 솔직히 반전은 너무나 예상가능했음.,,,,,,,,,,,,,,,,
8223,도찐개찐 .  만약 창조자가 있다면 . 그러니까 창조자는 없다는 것.,,,,,,,,,,,,,,,,
8224,대작소재망침.부랴부랴프로메테우스찾아본사람들한테나신선할거고..감독님나이가이젠..시종일관오라면와 가라면가 만져보라면만져..스토리는 혹시?그건가?하면그게맞음.처음감염씬부터 수송선폭발까지 내인생암유발.회사에선무슨저따위사람들...,,,,,,,,,,,,,,,,
8225,변태인 너네들에게 말한다.(이건 나도 의도적은 아니였다.) 후반부에 목욕신 나오면서 에일리언도 나와서 그 놈을 먹어치웠잖아. 여기서 목욕할 때 잘 보면 두유가 보여!!!!이게 어떻게 15세야!!!!,,,,,,,,,,,,,,,,
8226,이렇게 또 한편의 후속작을 기다린다..,,,,,,,,,,,,,,,,
8227,에이리언 시리즈 처음 본 사람입니다. 다른 시리즈도 찾아봐야겠습니다.,,,,,,,,,,,,,,,,
8228,실망. 1.2.3.4까지는 좋았어 프로메테우스 이번꺼...항상 느끼는 건대 ai로봇을 인간처럼 만들면서 왜...외계 행성에 들어갈때 a.i로봇을 먼저 보내 탐사하지 않는건지. 터미네이터 같은 로봇만들어 100대만 뿌...,,,,,,,,,,,,,,,,
8229,액션씬도없고...쓸데없이 말하는장면이 너무많아..,,,,,,,,,,,,,,,,
8230,로봇이 몸속에 뭔가를 품고있을수있다는게 이해불가했음,,,,,,,,,,,,,,,,
8231,에일리언은 우리에게 친숙한 동물. 잼있었음,,,,,,,,,,,,,,,,
8232,프로메테우스의 여운이 강하게 남아 커버넌트에 너무 기대를 건  것이 좌절로 돌아왔다. 사소한 부분 하나부터 결정적 순간까지 머리를 갸우뚱하게 만드는 설정과 상황에서 나를 전혀 배려 안하고 있다는 생각이 들정도. 다만...,,,,,,,,,,,,,,,,
8233,엔지니어의 존재와 인간을 창조하고 없애려는 이유가 알고싶어서 봤는데 에일리언 탄생 스토리만 나오네 프로메테우스의 기대를 져버린 영화,,,,,,,,,,,,,,,,
8234,데이빗 ㅆ입쓰엑기 영화 거기에 잔인함은 어마어마 15세 관람가는 아님 19세 관람가임,,,,,,,,,,,,,,,,
8235,프로메테우스 까지만 하지 그랬어....,,,,,,,,,,,,,,,,
8236,미지의 행성에 가면서 질병 감염이나 미생물 검사도 없이,,,,,,,,,,,,,,,,
8237,기다린보람이있네요 완전 잼있음^^짱짱,,,,,,,,,,,,,,,,
8238,지루하다. 개똥철학 뿌리 집어치우고 재밋게좀 만들지,,,,,,,,,,,,,,,,
8239,수준 이하. 등장인물 설정이 전부 OO이네. 쯧,,,,,,,,,,,,,,,,
8240,승무원들은 기본적인 교육도 안받은건가? 승무원들 하는 행동이 너무 어설퍼. 안타깝지만 이미 나온지 30여년이 지난 에일리언 1,,,,,,,,,,,,,,,,
8241,터미네이트,,,,,,,,,,,,,,,,
8242,액션볼만 줄거리도 볼만 근데 왜 케릭터들이 하나같이 발암물질이냐,,,,,,,,,,,,,,,,
8243,프로메테우스1 만큼 신비한 느낌은 없음. 전편에 던져놨던 수많은 떡밥들 너무 시시하게 대충 풀어놔버리고 그냥 에이리언에만 집중한 느낌,,,,,,,,,,,,,,,,
8244,엔지니어 살려내 엔지니어 얘기 듣고 싶었단말야,,,,,,,,,,,,,,,,
8245,정말 재밌었어요!! 다음 작이 기대되네요ㅎㅎ,,,,,,,,,,,,,,,,
8246,정말 스케일 끝내준다~에일리언 시리즈 다 봐야지 세계관이 아주 그냥 끝내주네..ㅎㅎ,,,,,,,,,,,,,,,,
8247,실망시키지 않는 에일리언 시리즈!,,,,,,,,,,,,,,,,
8248,이건..데이빗의 내면을 알아야 완벽히 이해가 될 듯.. 프로메테우스+보너스 영상까지 보시면 되겠네요. 여튼간에.. 정말 재밌네요. 커버넌트 보니 다시 예전 에일리언1부터 보고 싶어졌어요. 이럼 완벽한거 아닌가 .ㅋㅋ...,,,,,,,,,,,,,,,,
8249,인간의 창조주 도 우리가 깨닫고 진화하게 만들었다. 그  진화가 웰터냐,,,,,,,,,,,,,,,,
8250,프로메테우스보다 배가된 영화적 재미. 빠른 속편 요망,,,,,,,,,,,,,,,,
8251,이게 15세라니.. 38세인 나도 심장이 벌컥벌컥하는구만..,,,,,,,,,,,,,,,,
8252,1편에서 승무원을 사지로 끌고간 AI가 이번엔 악의 근원으로 업그레이드,,,,,,,,,,,,,,,,
8253,인류가 결국 이렇게 망하는 구나..리들리 스콧..정말 엄청나다. 투 썸즈 업이다..,,,,,,,,,,,,,,,,
8254,그냥 이런 단순 스토리 로 sf물 찍을거면 프로메테우스 의 엔지니어 창조론 같은 떡밥은 왜 깔았는지... 참..,,,,,,,,,,,,,,,,
8255,전편의 기대를 시원하게 말아먹어주시네요.,,,,,,,,,,,,,,,,
8256,물량보단 분위기,,,,,,,,,,,,,,,,
8257,뭔가 억지로 끼워맞춰가는 것 같은 느낌적인 느낌. 그래도 신작 나오는 자체가 감사하다.,,,,,,,,,,,,,,,,
8258,오리지널 1,,,,,,,,,,,,,,,,
8259,이래서 여자들은 징징거리기만하고 도움되는 일은 하나도 못한다니깐 패리스 죽여버리고 싶었다,,,,,,,,,,,,,,,,
8260,이거보고 에이리언1 보니까 당시에 얼마나 대단한 영화였는지 알겠다 당시 사람들은 얼마나 충격적이었을까 개봉연도 79년 실화냐,,,,,,,,,,,,,,,,
8261,허술한 대본과 시대적으로 전혀 타당성 없는 설정과 등장인물들의 연속..최악이다,,,,,,,,,,,,,,,,
8262,3편까지하고 끝네는게 딱 좋았는데..20년만에 다시 나온 에일리언이 그전보다 못하다는거에 개실망~ 영원한 쎅시여신 시고니위버누님이 없는 에일리언은 에일리언이 아니다...ㅡ,,,,,,,,,,,,,,,,
8263,재미있기도 하고 스릴도 넘쳤어요,,,,,,,,,,,,,,,,
8264,으와우 대단하다진짜... 단순한 괴수영화라고 생각했는데 세계관이 이렇다니.. 여운이 길다,,,,,,,,,,,,,,,,
8265,많이 실망했다. 기대보단 훨씬 못뽑아냈고 후속작마저 기대가 안될수준.,,,,,,,,,,,,,,,,
8266,에일리언 시리즈라고 하기보단 프로머테우스2 가 맞는것같고 너무큰기대보단 1편내용의 연장선선상에있기때문에 궁금하신분들은 볼만합니다,,,,,,,,,,,,,,,,
8267,조금지루해요10자10자,,,,,,,,,,,,,,,,
8268,기대에 비해 실망.. 프로메테우스보다 더 재미없었던듯. 스토리 너무 유치하고 주인공들은 왜이렇게 부주의한지...,,,,,,,,,,,,,,,,
8269,재미잇어요 뻔한데 잼남,,,,,,,,,,,,,,,,
8270,추천합니다 재미있었엉ㅅ,,,,,,,,,,,,,,,,
8271,에일리언  후속작 기대  됩니다,,,,,,,,,,,,,,,,
8272,예측가능한 반전에 큰 내용도 없다. 하지만 리들리 스콧이라는 브랜드에 걸맞게 분위기가 참 고급지긴 하다.,,,,,,,,,,,,,,,,
8273,에이리언팬으로서 기념비적인영화♡,,,,,,,,,,,,,,,,
8274,AI의 위험성에 대한 또다른 시각. 에일리언의 모든 궁금증을 해소 해주는 사이다. 다음편이 기대된다 ^^,,,,,,,,,,,,,,,,
8275,하하하하  잼나게 봤내여  ㅎㅎㅎㅎ,,,,,,,,,,,,,,,,
8276,팬들이 궁금해하는건 프로메테우스의 프리퀄이지. 그 다음 얘기가 아니지 않나? 거장도 나이 드니까 안일하게 바뀌는듯. 스토리 뻔합니다. 에이리언의 재연,,,,,,,,,,,,,,,,
8277,감동의 사진 이야기 인걸 같아서 추천,,,,,,,,,,,,,,,,
8278,15세였구나....,,,,,,,,,,,,,,,,
8279,리들리스콧 감독 명성 어디 안가네,,,,,,,,,,,,,,,,
8280,그래픽은 좋으나 진부한 전개,,,,,,,,,,,,,,,,
8281,개인적으로는 프로메테가 더 잼났음,,,,,,,,,,,,,,,,
8282,에어리언의 기원이 흥미로웠고 영상미는 최강이었는데 끝이 좀 암울하긴 해요 ㅎ,,,,,,,,,,,,,,,,
8283,적당히 좋음 기대치가 높아서가 아니라..좀더 보고싶은데 마무리되는 느낌,,,,,,,,,,,,,,,,
8284,발암녀가 개연성에서 좀 애매했던 것을 빼면 존잼!!,,,,,,,,,,,,,,,,
8285,별로 생각보다는 ...,,,,,,,,,,,,,,,,
8286,프로메테우스 뒤를 잊는 띵작!,,,,,,,,,,,,,,,,
8287,거장이 만든 수준이 다른 프리퀄,,,,,,,,,,,,,,,,
8288,젠장  에어리언 시리즈라기 보단  프로메테우스 시리즈   두영화를  연결 짓지 말앗았으면 하는 심정 에어리언 명작에대한 모독!!,,,,,,,,,,,,,,,,
8289,역시 에얼리언은 파격적이네요. 아주 잘 봤어요,,,,,,,,,,,,,,,,
8290,정말 재미있었어요 개인적으로 에이리언 시리즈를 보고 나서 보니 훨씬 더 몰입감 있는듯,,,,,,,,,,,,,,,,
8291,예상하지 못한 결말로 재밌었습니다,,,,,,,,,,,,,,,,
8292,볼만했다 추천합니다 보세요,,,,,,,,,,,,,,,,
8293,재밌었습니다 프로메테우스 보고 봐야 이해가더 좋을듯,,,,,,,,,,,,,,,,
8294,뭔가 좀 아쉬운 영화인 것 같다.,,,,,,,,,,,,,,,,
8295,손에 땀을쥐고 봤네요 15세가 아닌거같아요 ㅠㅠㅠ,,,,,,,,,,,,,,,,
8296,넘나 재밌고 후속작이 기대됨,,,,,,,,,,,,,,,,
8297,아무래도 전작들의 충격에 비하면 좀 약하네요역시 에일리언은 시고니 위버의 1.2.3,,,,,,,,,,,,,,,,
8298,에이리언 펜심 으로 상타침,,,,,,,,,,,,,,,,
8299,볼만하지만 기대햇던 매용은 아니엿다는...,,,,,,,,,,,,,,,,
8300,프로메테우스에 비하면 그저 그런영화...전개가 조금 아쉬웠음,,,,,,,,,,,,,,,,
8301,에어리언 팬이라면 꼭 봐야할 영화,,,,,,,,,,,,,,,,
8302,전작을 안보고 갔는데도 내용이 이해가 잘 되었고 몰입도도 상당했습니다.,,,,,,,,,,,,,,,,
8303,매우 만족!! 다음편이 기다려집니다!!!,,,,,,,,,,,,,,,,
8304,역시 거장 실망시키지않는군요 긴장감있게 잘봤습니다,,,,,,,,,,,,,,,,
8305,역시 명품은 시대가 지나도 명품,,,,,,,,,,,,,,,,
8306,신들의 발할라 입장' 인간의 하루중 가장 이성적이고 집중된 미미한 시간들을 쌓아 문명을 이룩했다. 감정없이 온 순간이 이성적인 Ai를 꼭 만들어야하는가? 우리는 생물학적인 뿌리를 두지 않은 다음 지구...,,,,,,,,,,,,,,,,
8307,프로메테우스가 보고싶어지는 영화,,,,,,,,,,,,,,,,
8308,에일리언들을 제압할 수 있는 건 마블 히어로들 밖에 없네요. 프레데터랑 싸우기보다 울버린 정도가 적절할 듯,,,,,,,,,,,,,,,,
8309,프로메테우스와의 연결고리 및 기원에 대한 이야기는 싸그리 날려버리고 에이리언1부터 이어지는 괴물 등장 - 동료죽음 - 주인공이 잡음 패턴이 반복...딱 에이리언4 수준의 재미와 볼거리라고 생각하면 틀림없음...,,,,,,,,,,,,,,,,
8310,어서 다음편이 나오길...마블 시리즈보다 더 기대되는 작품이다.,,,,,,,,,,,,,,,,
8311,추억으로 본 영화..그 이상의 의미는 찾기 힘들었습니다.,,,,,,,,,,,,,,,,
8312,솔직히 재미없었습니다.극장에서 돈내고 보는건 비추임;;;,,,,,,,,,,,,,,,,
8313,스캇에 또 낚인듯. 창의성도 없고 cg는 예전거 배껴쓰고...영화가 뭔 연속극이냐?,,,,,,,,,,,,,,,,
8314,프로메테우스1보다는 낫다는 느낌이라 다행. 조사도 안되어있는 처음가보는 행성에 아마존 탐험대 복장으로 다녀오니 문제가 안생길까? 그들에게 3M방진마스크라도 추천하고 싶다. 입으로 알 낳는 닭드로이드... 얘네들 떠드...,,,,,,,,,,,,,,,,
8315,재미있어요 반전도있고 굿,,,,,,,,,,,,,,,,
8316,역시 스콧 ㅋㅋㅈㄴ잼있네ㅋㅋㅋㅋ 프로메테우스는 흥미로웠다면 이번 에이리언은 뭔가 속시원함..솔직히 15세는 아닌데 이거보고 무섭고 징그러워서 별로라는 것들은 뭘까 에이리언이 뭔지 모르냐;;,,,,,,,,,,,,,,,,
8317,인간의 피조물이 인간의 창조주를 몰살시킨다,,,,,,,,,,,,,,,,
8318,기대를 너무 많이해서 9점.프로메테우스랑 연결해서 생각 정리중. 아직 얼떨떨함,,,,,,,,,,,,,,,,
8319,일요일 오후 진짠 안되네  ㅡㅡ 아놔,,,,,,,,,,,,,,,,
8320,앞전 시리즈에 비하면 그리썩 흥미롬이 덜합니다,,,,,,,,,,,,,,,,
8321,영화 재밌게 잘봤어요 ㅋㅋ,,,,,,,,,,,,,,,,
8322,역시 에이리언은 리들리 스콧이 하셔야 하나보다 싶었음. 다각도로 해석될 여지를 남겨 관람 후에 더 적극적으로 영화를 즐기게 됨.,,,,,,,,,,,,,,,,
8323,역시 외계생명체 중에 제노모프 만한게 없엉,,,,,,,,,,,,,,,,
8324,에이리언을 중심으로 한 게 아니라 미래에 인류에게 위협이 될 수도 있는 인공지능 개발의 위험성을 알려 준 영화 ^^ 너무 재밌게 봄~ 그냥 우주 영화 미래 영화~ 에이리언은 그저 거들뿐,,,,,,,,,,,,,,,,
8325,액션씬이야 화려해졌다지만 영화내내 그냥  이야기를 맘대로 진행한다. 석연찮은 구석이 너무많다.요새 유행하는 말로 아무말 대잔치 이런느낌이다.,,,,,,,,,,,,,,,,
8326,새로운 우주 식민지 탐사에 나서는 대원들의 안이한 방호 장구에 경악을 금할 수 없었음 뻔한 전개까지는 아니지만 이야기 흐름을 만들기 위해 허술한 당위를 집어 넣었다고 생각되네요,,,,,,,,,,,,,,,,
8327,초반에 지루하다가 중반부터 재밌습니다.,,,,,,,,,,,,,,,,
8328,그냥 외계인나오는 영화인줄 알았는데 이런 심오한 철학을 가진 영화로 재탄생 할줄.. 1979년엔 알았을까??,,,,,,,,,,,,,,,,
8329,그냥저냥 볼만한것같은영화,,,,,,,,,,,,,,,,
8330,완전 내 스타일인 드라마네요,,,,,,,,,,,,,,,,
8331,잘 봤습니다기대만큼은 아닙니다,,,,,,,,,,,,,,,,
8332,보고나니 기분이 더티해짐을 느낀다 잘만들긴 잘만들었다,,,,,,,,,,,,,,,,
8333,글쎄요. 창조물을 사랑으로써 대했다면,,,,,,,,,,,,,,,,
8334,역시 기대한 만큼 소름이 쫘악,,,,,,,,,,,,,,,,
8335,좀볼만하네요그냥볼만,,,,,,,,,,,,,,,,
8336,재밋게 잘봤습니다 ㅎ예상 했던 내용이라 반전은 크게 없었지만요~~,,,,,,,,,,,,,,,,
8337,솔직히 전편같은거 생각 안하고 딱 영화만 보면 꽤 재밌게 잘만들었다. 믿고보는 에일리언,,,,,,,,,,,,,,,,
8338,재밌어요 마지막 반전 설마설마 했는데 ㅋㅋㅋ,,,,,,,,,,,,,,,,
8339,보고 나니까 너무 우울하다...,,,,,,,,,,,,,,,,
8340,시리즈몰 역시 짱입니다. 이전작도 굿굿,,,,,,,,,,,,,,,,
8341,시리즈물이지만 볼만합니다.,,,,,,,,,,,,,,,,
8342,썩 별로임감독의 명성에 비해 노잼,,,,,,,,,,,,,,,,
8343,전편보다 못한 속편 잔인함은 한수위,,,,,,,,,,,,,,,,
8344,미세먼지가 이렇게 무섭습니다,,,,,,,,,,,,,,,,
8345,재미있어요~ 흥미진진하고 프로메테우스 안봐도  큰 문제 없어요,,,,,,,,,,,,,,,,
8346,세세한 설정에 개연성이 부여되었으면.,,,,,,,,,,,,,,,,
8347,전작보다는별로인것같다,,,,,,,,,,,,,,,,
8348,인공지능이 예수를 시기하다,,,,,,,,,,,,,,,,
8349,누가 재미 없다고 했는가. 정말 재미있다.,,,,,,,,,,,,,,,,
8350,에일리언은 일단 보자 인류의 미래는 알파고다,,,,,,,,,,,,,,,,
8351,재미있습니다. 개연성이 부족하다는 사람들은 눈감고 귓등으로 들었는지... 프로메테우스는 꼭 보고 가세요. 프로메테우스의 10년 뒤 이야기입니다. 감독이 에일리언 프리퀄 3부작으로 낸다고 했습니다. 다음편이 기다려지네...,,,,,,,,,,,,,,,,
8352,에이리언이 어떻게 만들어졌는지 알 수 있는 영화!,,,,,,,,,,,,,,,,
8353,2017.05.13 cgv영등포 스타리움관,,,,,,,,,,,,,,,,
8354,아나아ㅡ으크킁ㅇ아크크크크킄너무잼ㄱ온어잉,,,,,,,,,,,,,,,,
8355,리들리 장수해서 에일리언 많이 만들어주세요,,,,,,,,,,,,,,,,
8356,미친듯이 홀리다 나왔네요~ 리들리옹 찡^^,,,,,,,,,,,,,,,,
8357,에일리언 시리즈를  좋아한다면 볼만한 영화사전 정보도  꼭 필요하다고 봅니다,,,,,,,,,,,,,,,,
8358,영화넘재밋잇을거같네요,,,,,,,,,,,,,,,,
8359,프로메테우스에 비해서는 좀 아쉽지만..  혹시나 했지만 역시나네요. 최고. ㅎㅎ,,,,,,,,,,,,,,,,
8360,최고입니다.재밋낫음,,,,,,,,,,,,,,,,
8361,기대보다 많이 아쉬운 영화 뻔한 스토리와 우주선 CG장면 날개 펴지는 장면이 장난감 갖은 느낌에일리언 시리즈를 좋아하는 기대가 컸던만큼 많이 아쉽네요내용이 AI와 인간과의 창조를 한다는 ...키스 장면은혐오스러움,,,,,,,,,,,,,,,,
8362,단순히 킬링타임일 줄 알았는데 너무 재밌고 잘만들었습니다.,,,,,,,,,,,,,,,,
8363,리들리 스콧 감독님 후속작도 만들어주세요!,,,,,,,,,,,,,,,,
8364,시고니위버가 그립구나... ㅠ.ㅜ,,,,,,,,,,,,,,,,
8365,에이리언 1을 계승하는 명작. 데이빗  안돼~~~~,,,,,,,,,,,,,,,,
8366,AI의 반전 인류는 엔지니어에의해 AI는 인류에 의해  엔지니어는 AI에 의해,,,,,,,,,,,,,,,,
8367,스릴 넘치고 재밋었어요!특히 반전이!!!최고였어요,,,,,,,,,,,,,,,,
8368,기대한영화  그리고 기대이상 기억남는영화,,,,,,,,,,,,,,,,
8369,역시 꿀잼이다...2시간이 빠르게 지나갔다,,,,,,,,,,,,,,,,
8370,진짜 재밌어요 소름ㄷㄷ,,,,,,,,,,,,,,,,
8371,시리즈 안보고 봣는데 재밋네요~,,,,,,,,,,,,,,,,
8372,데이빗좀죽어라제발좀,,,,,,,,,,,,,,,,
8373,... 기대를 너무 많이한건지 조금은 실망... ㅋ,,,,,,,,,,,,,,,,
8374,재미있는 부분도 많지만 영화를 다 보고 나면 아쉬움만 남는다,,,,,,,,,,,,,,,,
8375,그냥그런....영화..,,,,,,,,,,,,,,,,
8376,많은 내용을 담고있고 매끄러웠으나 마지막 살짝아쉽.. 마지막 여자랑 대화하면서 엿맥일때 더놀라운 엿맥임을줫으면 충격도 2배였을낀데,,,,,,,,,,,,,,,,
8377,에일리언을 극장에서보다니 감동입니다.,,,,,,,,,,,,,,,,
8378,프로메테우스를 보지않은 사람은 보기전에 꼭 보고갈것! 참고로 개연성도 좋고 역시 믿고보는 리들리 스콧이다! 데이빗 녀석 아주 칭찬해ㅋㅋㄲ,,,,,,,,,,,,,,,,
8379,새로운 재미가 너무없고 그래픽도 비슷하고 돈만원주고 볼께 못되더라 목아지 구녕보고 약간의반전도 개 씹노쟁이더라. 스토리도 노잼 기대감도 노잼 씹노잼.!,,,,,,,,,,,,,,,,
8380,볼만하네요 하지만 먼가 빤한결말,,,,,,,,,,,,,,,,
8381,생각보다 잔인함 내용도 ....,,,,,,,,,,,,,,,,
8382,노잼이었다 후반되서 뜬금 여전사 빙의로 떡밥도 풀리면서 재미있어짐 엔지니어의 목적만 더 풀리면 될듯 프로메테우스 삭제분 보면 피터 웨일런드가 돌아이고 그래서 미친 데이빗을 만들었고 이 난리가 난거내,,,,,,,,,,,,,,,,
8383,에일리언 시리즈에 누가됨...그냥 집에서 봐도 될 퀄리티,,,,,,,,,,,,,,,,
8384,간만에 재미있는 SF공포물 좋았어요~,,,,,,,,,,,,,,,,
8385,리들리 스콧 감독의 연출력은 나이가 들어도 식을줄 모르는구나,,,,,,,,,,,,,,,,
8386,전작 프로메테우스처럼 공포스럽다,,,,,,,,,,,,,,,,
8387,에어리언의  탄생비화를  볼수있는 영화입니다,,,,,,,,,,,,,,,,
8388,무서웠지만 재밌었어요 후속편도 꼭 볼 거에요!!,,,,,,,,,,,,,,,,
8389,기대하고 기다린만큼 재밌게봤습니다. 에일리언1,,,,,,,,,,,,,,,,
8390,재미지게본영화입니다,,,,,,,,,,,,,,,,
8391,재밋엇지만 끝이약간 부실햇던느낌,,,,,,,,,,,,,,,,
8392,시고니 위버 없는 에이리언 = 제다이 없는 스타워즈,,,,,,,,,,,,,,,,
8393,... 앞에 아버님... 중고딩딸애들하고 같이 왔드만.. 손으로 애들 눈가려주시네요. 15세치곤..수위가 ㅎㄷㄷ 암튼 졸리지도 않고 잼나게 잘봤습니다.이게 이어져서 에일리언 1이 되는지 중간에 또 작품하나 나올지 궁...,,,,,,,,,,,,,,,,
8394,인간 근원에 대한 고찰...인간은 외계AI가 만들었고 인간은 다시 AI를 만들고...그러면 신은 누구이며 무엇인가?,,,,,,,,,,,,,,,,
8395,처음에는 살짝 지루한감이 잇엇지만 볼만햇음!무서운거 못보는데 넘 징그러워,,,,,,,,,,,,,,,,
8396,기원을 찾아 떠났지만,,,,,,,,,,,,,,,,
8397,최고의영화 입니다 강추,,,,,,,,,,,,,,,,
8398,징그러웡 ㅜㅜ 근데 재밌댜ㅜ,,,,,,,,,,,,,,,,
8399,너무재밌게잘봤습니다^^,,,,,,,,,,,,,,,,
8400,전작에비해박진감이 떨어진다,,,,,,,,,,,,,,,,
8401,단점은 없지만 뭔가 아쉽다 떡볶이가 매우면서 맛있는게 좋은 떡볶이라면 이영화는 그냥 맵기만 한 떡볶이라는 생각이 들었다.,,,,,,,,,,,,,,,,
8402,에일리언시리즈랑 프로메테우스 다 좋았는데 이건 기대이하..,,,,,,,,,,,,,,,,
8403,너무 징그러웠어요 .. 15세이상이라니.. 거의 19세인줄 알았어요 재밌긴해요!!!,,,,,,,,,,,,,,,,
8404,처음에좀졸았음.. 후반부갈수록 그냥그럭저럭,,,,,,,,,,,,,,,,
8405,재밋어요 재밋어요 재밋,,,,,,,,,,,,,,,,
8406,과하게 잘 만든 영화 징그러운거 싫어하시는 분들은 보기에 많이 힘듬,,,,,,,,,,,,,,,,
8407,와... 사상 최악 최강의 에일리언.... 그와중에 12사도 상징... ㄷㄷ,,,,,,,,,,,,,,,,
8408,프로메테우스 마지막 여주가 엔지니어에게 꼭 물어봐야 한다고날아갔는데..먼가 쏙 빠진 느낌이..그런데 폰 중독자 색휘들은 제발 영화 쳐 보지마!! 중간 중간 폰 쳐보고...폰 화면 어둡게 하면 주위에서 안볼일것 같냐!...,,,,,,,,,,,,,,,,
8409,재밌다재밌네요진짜요,,,,,,,,,,,,,,,,
8410,에일리언을 되돌아보게 되는 영화네요..,,,,,,,,,,,,,,,,
8411,잼있네요흥미진진햇음ㅋㅋ,,,,,,,,,,,,,,,,
8412,젖나오고 몸 터지는데 15세 ㅋㅋ 내용은 뻔해서 그래도 몰입도는 굳,,,,,,,,,,,,,,,,
8413,Goog 잼.... 재미,,,,,,,,,,,,,,,,
8414,재밌어요 즐거워요 하하하,,,,,,,,,,,,,,,,
8415,재미있었어요!!!!,,,,,,,,,,,,,,,,
8416,끝났지만 뭔가 찝찝한 느낌이 남았다.,,,,,,,,,,,,,,,,
8417,신선하고 흥미있는 내용이었음,,,,,,,,,,,,,,,,
8418,에이리언  커버넌트 잘봤습니다,,,,,,,,,,,,,,,,
8419,끝이 나지 않겠군.,,,,,,,,,,,,,,,,
8420,주위의 우려에도 불구하고 전 넘 재밋게봤어요,,,,,,,,,,,,,,,,
8421,잼있기만하고만.. 누가 잼없다그랬어..,,,,,,,,,,,,,,,,
8422,에일리언 골수팬이었는데 이번에도 정말 재밌게 보고 왔습니다. 강추!,,,,,,,,,,,,,,,,
8423,에이리언 세기 생성 굿프레데터 연대기도..,,,,,,,,,,,,,,,,
8424,데이빗...또보고싶다,,,,,,,,,,,,,,,,
8425,정말 좋았네요 스토리 영상은 물론 다 보고나서 드는 철학적의문까지 좋았어요,,,,,,,,,,,,,,,,
8426,이 영화 보려고 몇년을 기다린거냐 대체.... 다음작 기대한다.... 말이 필요없는 대작 100살에 가까워진 감독에게 박수를 !,,,,,,,,,,,,,,,,
