,content,,,,,,,,,,,,,,,,
2643,펜도럼이랑 분위기가 비슷하게 흘러가는것같다...프로메테우스와 에일리언 시리즈 중간의 연결고리를 적절하게 이어준것같다..기대보단 뭔가좀 부족하지만 수작임 에일리언 메니아로서는 약간 아쉽다.,,,,,,,,,,,,,,,,
2644,디테일 까지 어마어마한 영화 한시도 눈을 뗄 수 없었다,,,,,,,,,,,,,,,,
2645,에일리언 좋아한다면 재밌게 볼수있다프로메테우스를 보지 않았다면 재미가 반감될수도..,,,,,,,,,,,,,,,,
2646,다음 프리퀄 속편이 너무나도 기대됩니다,,,,,,,,,,,,,,,,
2647,이거 3D로도 나왔나요??,,,,,,,,,,,,,,,,
2648,구성도 치밀했고 긴장감도 좋았고ㅋㅋㅋ 이정도면 sf 스릴러 영화 즐길만하다,,,,,,,,,,,,,,,,
2649,진짜로 AI가 세상을 위협하는 날이 오지 않을까..,,,,,,,,,,,,,,,,
2650,볼만한 가치가 충분한 영화.,,,,,,,,,,,,,,,,
2651,딱 이정도. 프로메테우스 확장판으로 봐야 이해되구요. 바그너 음악 선곡은 신의 한 수. 영화의 역사관과 바그너의 음악 선곡 배경은 너무나도 잘 어울린다. 처음와 마지막으로 치밀한 음악구성능력은 최고. 재미지게 봤어요...,,,,,,,,,,,,,,,,
2652,에일리언 탄생 비화를 볼수 있어서 더 좋은 것 같아요,,,,,,,,,,,,,,,,
2653,진짜..대박이다 한번 더 보고싶게 만드는 영화다 진짜 할말을 잃었다.. 평점 등록을 왠만하면 잘 안하는데지루할 틈이없다 다음편이 꼭 나오면 좋겠다,,,,,,,,,,,,,,,,
2654,적당히 재밌고 적당히 무서웠음 ㅠㅠ,,,,,,,,,,,,,,,,
2655,전반적으로는 지루한 느낌입니다. 액션에 비해서 대사도 많기도 하고요 에이리언탄생과정을 봤다는데 의미를 두고 싶습니다.,,,,,,,,,,,,,,,,
2656,존잼 짱잼 개잼 취향저격 영화♥,,,,,,,,,,,,,,,,
2657,마이클 패스벤더 팬이긴하지만 이번 연기는 진짜 최고였다. 와 지금 생각해도 소름돋아..,,,,,,,,,,,,,,,,
2658,프로메테우스는 2093년 12월 21일. 커버넌트는 11년후인 2104년이 배경. 전편인 프로메테우스 삭제 부분과,,,,,,,,,,,,,,,,
2659,프로메테우스? 이 영화를 보고 가시면 더욱 더 재미있을거같네요,,,,,,,,,,,,,,,,
2660,개꿀잼이다 진짜 무조건봐라,,,,,,,,,,,,,,,,
2661,역시 느낌이무서워~그놈일줄알았지. <<>>,,,,,,,,,,,,,,,,
2662,대박.. 이런 영화를 볼 수 있다니,,,,,,,,,,,,,,,,
2663,에일리언의 기원을 상세히 풀어줘서 너무 재밌었다. 데이빗 나쁜녀석 ㅠㅠ,,,,,,,,,,,,,,,,
2664,2017.05.09,,,,,,,,,,,,,,,,
2665,믿고보는 리들리스콧감독!,,,,,,,,,,,,,,,,
2666,정말 흥미진진했습니다,,,,,,,,,,,,,,,,
2667,3편은 바로나오는거죠? 5년걸리는거 아니죠?,,,,,,,,,,,,,,,,
2668,스콧 감독님 다음편도 꼭 만들어주세요,,,,,,,,,,,,,,,,
2669,비극 스릴러.. 마지막까지 긴장감을 놓치지 않고 볼 수 있었음,,,,,,,,,,,,,,,,
2670,전편 모르고 봤는데도 재밌는데요?,,,,,,,,,,,,,,,,
2671,뻔할줄 알았는데 전혀ㅋㅋ 솔까 점수 9점 이상은 받아야함,,,,,,,,,,,,,,,,
2672,작품성은 전작보다 훨씬 좋았던거 같습니다,,,,,,,,,,,,,,,,
2673,재밌음,,,,,,,,,,,,,,,,
2674,진짜 기다린 보람이 있다.... 이게 진짜 에이리언이지,,,,,,,,,,,,,,,,
2675,고전 sf 스릴러의 귀환!! 리들리 스콧은 명불허전이다!!,,,,,,,,,,,,,,,,
2676,에이리언 시리즈는 실망한 적이 없다..,,,,,,,,,,,,,,,,
2677,완전재밌어용 ㅋㅋㅋ 잔인한거싫어하면 보면안됨,,,,,,,,,,,,,,,,
2678,기대이상으로 완전 잼씀ㅋㅋ헐리웃 영화 들은 이래서 봐야함,,,,,,,,,,,,,,,,
2679,에일리언2 이후로 에일리언은 무섭지도 않은 그냥 식상한 괴물로만 보였는데 이번엔 시리즈 첫작 처럼 에이리언에대한 공포를 다시금 느낄 수 있어서 좋았음,,,,,,,,,,,,,,,,
2680,전반적으로 즐기기엔 충분한 영화였습니다.,,,,,,,,,,,,,,,,
2681,예상 가능한 스토리였는데도 불구하고 재밌게 봤어요 반전 쩝니다,,,,,,,,,,,,,,,,
2682,영원히 남을 전설의 괴물....,,,,,,,,,,,,,,,,
2683,에일리언 역시나 잼납니다^^ 하지만 충분히 반전을 예상할수 있는 ㅎㅎ,,,,,,,,,,,,,,,,
2684,누가 지루하다고했냐? 역시 킹스콧이다! 노인네가 어떻게 이런 영화를 만들수있는게냐 영화계의 세익스피어임! 강츄,,,,,,,,,,,,,,,,
2685,프로메테우스를 먼저 꼭 봐야 스토리 이해가 더 쉬울듯...에이리언은 자연 태생인 줄 알았는데...생명의 근원은 어디...리들리스콧  감독의 역량이 빛난다,,,,,,,,,,,,,,,,
2686,데이빗과 윌터 두 AI를 연기한 마이클 패스벤더.. 왜그렇게 사람들이 좋아하는지 알겠더라,,,,,,,,,,,,,,,,
2687,반전도 있고 괜찮은 영화였습니다.,,,,,,,,,,,,,,,,
2688,거장의 필모그래피 순위를 뒤엎은 역대급 마스터피스.,,,,,,,,,,,,,,,,
2689,공포스럽긴해도 확실히 재밌더라.. 눈가리면서 볼건 다봄,,,,,,,,,,,,,,,,
2690,전편인 프로메테우스보다 훨 재밌어요,,,,,,,,,,,,,,,,
2691,캐서린워터스턴의 색다른 연기변신 좋았어요,,,,,,,,,,,,,,,,
2692,에이리언1편이 있는데 반전을 생각하는것들은 뭐야,,,,,,,,,,,,,,,,
2693,단순한 오락영화를 뛰어넘은 작품,,,,,,,,,,,,,,,,
2694,호불호가 놔누어질 수 있는 영화.  이야기에 몸을 앃고 따라가면 이 시대의 고전 영화를 볼 수 있다.   보편적인 SF공포 영화에서는 도저히 볼 수 없는 장면들이 나온다. 더 없이 무섭고 끔직하며 잔인할 수 있다. ...,,,,,,,,,,,,,,,,
2695,스토리가 날이 갈수록 발전하네요 ㅎㅎ,,,,,,,,,,,,,,,,
2696,그다지 잔인하지도 무섭지도 않았다 다만 놀래킬뿐! 그리고 이런 분위기의 영화 너무 좋다. 반전은 특히 다음편을 기대하게 만들어줌! AI 외관은 왜 통일시킨건지...다르게 할것이지 헷갈리게 말야 ㅎㅎ,,,,,,,,,,,,,,,,
2697,데이빗의 정체가 진짜 개반전 ㅋ,,,,,,,,,,,,,,,,
2698,SF를 통해 창조주와 피조물과의 관계를 고찰한 에일리언 시리즈의 프리퀄 영화. 전작 프로메테우스를 보지 않으면 이해하기 힘듬. 필히 프로메테우스 관람후 감상바람. 마이클 패스빈더의 열연이 빛남,,,,,,,,,,,,,,,,
2699,역시 믿고보는 스캇옹!!!,,,,,,,,,,,,,,,,
2700,친구가 보재서 본 영화인데 잼났어용!!,,,,,,,,,,,,,,,,
2701,올해 최고의 영화!! 데이빗  순 나쁜 ㅅ ㅐㄲ ㅣ,,,,,,,,,,,,,,,,
2702,꿀잼입니다 굳굳 다음편도 나오겠죠??,,,,,,,,,,,,,,,,
2703,초반부터 몰입도 대박 ㅋㅋㅋ이상하게 재밌네,,,,,,,,,,,,,,,,
2704,어디하나 흠잡을게 없는 영화.,,,,,,,,,,,,,,,,
2705,넘넘재밋고 실감났어요 ^^ ♥,,,,,,,,,,,,,,,,
2706,찝찝하다. 근데 재밌다,,,,,,,,,,,,,,,,
2707,반전은 좀 뻔했는데 재밌어요,,,,,,,,,,,,,,,,
2708,재미있엇어용!ㅎㅎㅎ,,,,,,,,,,,,,,,,
2709,그러니깐 이상한거 만지고 다니지말자,,,,,,,,,,,,,,,,
2710,영감님..만수무강하시고 속편은 꼭 좀 내주세요..,,,,,,,,,,,,,,,,
2711,리들리스콧의 에일리언을 기대하신분들이라면 만족하실겁니다,,,,,,,,,,,,,,,,
2712,창조물이 만들어가는 미장센,,,,,,,,,,,,,,,,
2713,많이 잔인하고 틈새깜놀도 많고 무엇보다 잼있습니다!,,,,,,,,,,,,,,,,
2714,단순하던 1,,,,,,,,,,,,,,,,
2715,잼!!!! CG도 완벽하고 내용도 재밋음요!,,,,,,,,,,,,,,,,
2716,실망시키지 않는 스콧 할배! 3부가 기다려지내요,,,,,,,,,,,,,,,,
2717,제임스 프랑코는 1분도 안나오는데 왜 주연목록에... 영화 자체는 수작.,,,,,,,,,,,,,,,,
2718,영화가 첨부터 끝까지 어둡기만하지단 재밌고 긴장감있네요ㅎㅎ,,,,,,,,,,,,,,,,
2719,스토리가 충격적이였음....  에이리언의 탄생비화가 이렇다니... 프로메테우스 꼭 보고 봐야 함...,,,,,,,,,,,,,,,,
2720,리들리 스콧과 마이클 패스벤더는 사랑이지ㅠㅠ 더 업그레이드 된 패시 A.I. 연기는 정말...♡ 좋은 건 크게크게. 주말에 또 볼거임ㅠㅠ,,,,,,,,,,,,,,,,
2721,즐겁게 보고 왔답니다 중간에 몇가지가 응?하는 포인트가 있긴했지만  아쉬움없는 영화였어요^^,,,,,,,,,,,,,,,,
2722,스토리 탄탄하고 스릴 긴장감 대박!,,,,,,,,,,,,,,,,
2723,역시 믿고보는 리들리스콧! 패시 존멋탱ㅠㅠㅠㅠ,,,,,,,,,,,,,,,,
2724,에이리언 시리즈를 극장에서 다시 관람하게 될줄이야ㅎㅎ 에이리언 처음 봤을 때 충격보다 더  큰 충격이였습니다. 스릴 만점! 괜히 리들리 스콧 감독님이 아니네요.,,,,,,,,,,,,,,,,
2725,아 역시 실망시키지 않네요ㅠㅠ또 보고 싶습니다!! 다음 시리즈를 벌써 기다리게하는 영화,,,,,,,,,,,,,,,,
2726,이게 무슨 15세얏! 근데 기존에 있던 에일리언 하고는 극과 근 이구먼... 새롭다..ㅋ,,,,,,,,,,,,,,,,
2727,흡연충이 잘못했네ㅎㅎ,,,,,,,,,,,,,,,,
2728,예술과 공포의 하모니라고,,,,,,,,,,,,,,,,
2729,리들리 스콧  장수하기를.  스콧 형님 세계관은 언제나 흥미롭네요. 최고입니다.,,,,,,,,,,,,,,,,
2730,에일리언팬이라면 무조건봐라. 시고니를 대체할 여전사가 다음편에 나와주길...,,,,,,,,,,,,,,,,
2731,에이리언이 어떻게 태어났는지 드디어 연결됨 이제 엔지니어 정체만 알면됨 만수무강하세요 스콧옹,,,,,,,,,,,,,,,,
2732,재밌어요  쇼 너무 안타깝다.. ㅠㅠ,,,,,,,,,,,,,,,,
2733,에이리언의 아버지인 리들리스콧 감독의 에이리언 창조기 같은 느낌?,,,,,,,,,,,,,,,,
2734,볼거리가 많은건 확실합니다.,,,,,,,,,,,,,,,,
2735,기대하고 기다렸는데 역시나! 그 이상을 보여준 영화!!,,,,,,,,,,,,,,,,
2736,그동안 볼 영화 없었는데 오랜만에 시간가는줄 모르고 봤음 놀라는게 보다보면 즐기게됨,,,,,,,,,,,,,,,,
2737,영화 내용 자체는 기대한 만큼 흥미로웠음. 그러나 15금은 절대 아님. 눈살이 찌푸려질 만큼 잔인한 장면이 많이 나왔음.,,,,,,,,,,,,,,,,
2738,패스벤더 출연료따블받나요?,,,,,,,,,,,,,,,,
2739,시간가는줄모르고봤습니다강추요!,,,,,,,,,,,,,,,,
2740,꿀잼영호ㅏ~~ 프로메테우스 확장판 보고 가면 몇배는 더 재밌음..다음편 어서 나오거라.. 궁금하다,,,,,,,,,,,,,,,,
2741,새로운 에이리언 최고다.,,,,,,,,,,,,,,,,
2742,기대한만큼 재미있었네요!!!,,,,,,,,,,,,,,,,
2743,뒤통수가 얼얼하네.,,,,,,,,,,,,,,,,
2744,재미있구먼또보고싶군,,,,,,,,,,,,,,,,
2745,이 맛에 에일리언 본다 이기야,,,,,,,,,,,,,,,,
2746,댓 졸웃기다 생각없이 애들같이 왔는데 15세어쩌고 그냥 생각없이 인생살지 영화는 왜보고 그래??,,,,,,,,,,,,,,,,
2747,말이 필요없다. 긴장감이 넘쳐났던 영화!!!,,,,,,,,,,,,,,,,
2748,최고 고어물짱짱 애벌레짱짱,,,,,,,,,,,,,,,,
2749,솔직히 올드팬덤은 영화 만들어준거만 가지고도 10점을 줄수밖에 없다. 객관성 결여된 별 5개를 받아라.,,,,,,,,,,,,,,,,
2750,진짜 징그럽고 토 나온다.. 그만큼 소름끼쳐서 점수는 10점,,,,,,,,,,,,,,,,
2751,너무재밌다 시간가는줄도 모르고 봤다,,,,,,,,,,,,,,,,
2752,아아으 나쁘지않은 엔딩~,,,,,,,,,,,,,,,,
2753,진짜째밋고 놀랍고 여러가지로 신세계,,,,,,,,,,,,,,,,
2754,솔직히 우리나라 스타일의 엔딩은 아니다 하지만 진짜 열린결말에 연속과 떡밥투척 그리고 미술과 영화 디자인은 정말 최고였다 그리고.... 엄마한테 뒤통수 맞던 느낌 제대로 주는 영화다,,,,,,,,,,,,,,,,
2755,에일리언의 엄청난 팬이면 정말 재밌습니다.  특히 중반쯤에 나오는 '쉐이키 캠' 전법은 보는내네 저도 긴장감이 들더군요.,,,,,,,,,,,,,,,,
2756,역시 죽여주는구만. 죽인다 죽여.,,,,,,,,,,,,,,,,
2757,정말재미잇게보고왔음,,,,,,,,,,,,,,,,
2758,새로 나온 에일리언 보고 소름이 쫙끼치면서ㅋㅋ전작이랑 내용이 이어지고 나름 재밌었네요.,,,,,,,,,,,,,,,,
2759,용두사미. 프로메테우스에서 푼 떡밥을 기대치 만큼 회수하지 못해 아쉬움이 남는 작품,,,,,,,,,,,,,,,,
2760,sf장르의 신섬함과 볼거리가 있는데다가 공포도 섞여있어서 ㄹㅇ루다가 재밌게 봤네여 스토리도 신선한 충격이였음,,,,,,,,,,,,,,,,
2761,크으... 벌써 속편 기대,,,,,,,,,,,,,,,,
2762,시리즈 특유의 공포감은 지릴정도 에일리언의 잔혹성과 강력함이 잘표현됨. 하지만 스토리 진행을위해서라지만 너무나 멍청하고 작위적인 인간들이 너무 아쉬움.진정한주인공은 에일리언이 아니라 데이빗 좀 아싑다,,,,,,,,,,,,,,,,
2763,중간에 여자 상반신 안가리고 다나오고 사람 목부터 상반신 해부한게 아주잘나와서 15세맞나 했지만 졸라재밌음;,,,,,,,,,,,,,,,,
2764,징그럽고 그래픽은 감탄스럽네요 그리고 ㅋㅋㅋ 고놈 참 짜증나고 답답합니다..ㅠㅠ,,,,,,,,,,,,,,,,
2765,영화에서 리들리 스콧의 노련미가 보였다 징그럽다기 보다는 뭔가 아름다운 공포감이 잘 표현되었고 에이리언 어웨이크닝이 후속작이라 하는데 후속편 기대됨,,,,,,,,,,,,,,,,
2766,볼만했는데 기대이상은 아니였네용,,,,,,,,,,,,,,,,
2767,이번작은 페이스허거가 기원이 되어 제노모프가 탄생하는 과정이 나옵니다. 에이리언 1편의 프리퀄을 이것이 대표하는것 같네요. 제노모프 새끼가 AI와 환호하며 천상천하 유아독존 외치면서 인간을 숙주 삼아 탄생하는 독자적...,,,,,,,,,,,,,,,,
2768,리들리 스콧의 노련미와 현대 기술의 만남. 나름 이분 역작,,,,,,,,,,,,,,,,
2769,왠지 감독판이 있을꺼 같아요..,,,,,,,,,,,,,,,,
2770,다음편을 위한 애피타이저 느낌 이네요.  에어리언 시리즈를 좋아하지 않는 분들은 비추  15세  관람은 좀 ... 액션영화라기 보다는 에어리언에 탄생과정을 보여주는 연대기 정도  다음편  기대 됩니다.,,,,,,,,,,,,,,,,
2771,역시 에이리언 시리즈는 실망을주지 않네♡한순간도 놓칠수 없다!!,,,,,,,,,,,,,,,,
2772,스콧감독은 기대를 저버리지않는다,,,,,,,,,,,,,,,,
2773,에일리언 팬이라면 놀라면서 숨멎게하는  영화 뒷자리에서 미국리엑션과함께...,,,,,,,,,,,,,,,,
2774,무섭고 재미있고 스릴있고,,,,,,,,,,,,,,,,
2775,미세먼지..마스크에다 귀마개도 하고 다녀야하나..ㄷㄷ,,,,,,,,,,,,,,,,
2776,에이리언 영화중에 제일 작품성있고 재밌고 무섭고 멘탈 빠사짐,,,,,,,,,,,,,,,,
2777,작정하고 우주 호러물로 돌아온 스캇옹,,,,,,,,,,,,,,,,
2778,방금 보고 왔다. 그냥 봐라. 근데 그 X는 기대 한대로네 ㅋ,,,,,,,,,,,,,,,,
2779,프로메테우스는 보고 가야 커버넌트가 더 재미있음프로메테우스 9점이라면 커버넌트는 8.7점정도..여전히 재밌긴함..긴장감도 좋고,,,,,,,,,,,,,,,,
2780,솔직히 ㅈㄴ 재미있옸다,,,,,,,,,,,,,,,,
2781,흥미로워요 딱 기대만큼 재밌게 볼 수 있었습니다,,,,,,,,,,,,,,,,
2782,에어리언의 근본에 대해선 잘 나온듯한데...엔지니어쪽은 여전히 궁금한게 많이 남네요...언넝 어웨이크닝이 나오길 기다리는 수밖에ㅎ..,,,,,,,,,,,,,,,,
2783,데이빗 이 xxx  에이리언 진짜 긴장감있게 재밌습니다,,,,,,,,,,,,,,,,
2784,하..또 보고프다. 잼있었다.,,,,,,,,,,,,,,,,
2785,일편보다는 괜찮은듯한데,,,,,,,,,,,,,,,,
2786,돌아온 에이리언! 환영합니다!!,,,,,,,,,,,,,,,,
2787,David,,,,,,,,,,,,,,,,
2788,떡밥만 더 늘어났다쇼박사는 ?월터는?알은 누가 낳았나?그리고 불시착한거냐?,,,,,,,,,,,,,,,,
2789,걍 지립니다 새로운 에이리언 개무서움,,,,,,,,,,,,,,,,
2790,이게 얼마만에 느껴 보는 에이리언의 특유의 긴장감인지..,,,,,,,,,,,,,,,,
2791,기대가 컸는데도 실망따윈 없었음ㅋ 오랜만에 딱 내가 좋아하는 스타일의 영화라 너무 재밌게 봤음,,,,,,,,,,,,,,,,
2792,데이빗 욕하지 말라,,,,,,,,,,,,,,,,
2793,흥미진진하게 잘봤습니다..,,,,,,,,,,,,,,,,
2794,재밋더용 ~~헤헤 또 보고시퍼요,,,,,,,,,,,,,,,,
2795,시간 가는줄 모르고 푹 빠져서 봤어요!,,,,,,,,,,,,,,,,
2796,프로메테우스 이후 기대했던만큼 강렬함! 시간 가는 줄 모르고 봤다. 이후 시리즈가 너무 기다려진다!! 역시 갓들리스콧!,,,,,,,,,,,,,,,,
2797,진짜 주연이 에일리언 일줄이야...,,,,,,,,,,,,,,,,
2798,보는내내 심장 쫄기하고 보고 나서는 많은 생각을 하게 해주는..,,,,,,,,,,,,,,,,
2799,프로메테우스 보고 보시면 더 이해가 잘될듯 합니다,,,,,,,,,,,,,,,,
2800,믿고보는에일리언시리즈 굿굿,,,,,,,,,,,,,,,,
2801,잼나요...무지무지,,,,,,,,,,,,,,,,
2802,이 영화는 시리즈라는 큰숲을 보기전에 그 숲을 이루는 나무를 심고 가는 부분. 재미보단 데이빗의 일대기 중 하나라고 생각하자.,,,,,,,,,,,,,,,,
2803,오랜만에 스릴 넘치는 영화였어요 퀄리티 쩝니다,,,,,,,,,,,,,,,,
2804,긴장감 최고에일리언2 한 20번 봤는데이것도 그정도 봐야할듯.,,,,,,,,,,,,,,,,
2805,이거보려고 관심도없던 프로메테우스보고봤는데 진짜대박이다!마지막반전 소름!,,,,,,,,,,,,,,,,
2806,충격과공포 에일리언1에 공포를 완벽히 재현해냈다 리들리스콧 감독님 나이도 많으신데 이렇게 훌륭한 걸작하나 만들어주셔서 감사합니다,,,,,,,,,,,,,,,,
2807,매력적인 배우들의 연기와 감독님의 연출이 돋보였던 작품,,,,,,,,,,,,,,,,
2808,일단 보세요 깜놀합니다,,,,,,,,,,,,,,,,
2809,15세인데 비해서 수위가 높았던 작품들이 최근에 라이프,,,,,,,,,,,,,,,,
2810,압도적인 느낌과 묵직한 베이스로 탄탄하게 다진 느낌.. 분위기 자체가 장난 아니다,,,,,,,,,,,,,,,,
2811,프로메테우스후속 드뎌나왔구만,,,,,,,,,,,,,,,,
2812,우리도 에이리언 유니버스 갑시다!,,,,,,,,,,,,,,,,
2813,진짜 잘만들었네 간만에 보는 수작인듯,,,,,,,,,,,,,,,,
2814,다음편 타이틀은 뭘로 하려나?,,,,,,,,,,,,,,,,
2815,보는내내 흥미진진합니다!,,,,,,,,,,,,,,,,
2816,존잼 ㅋㅋㅋ 프로메테우스 한번 더 봐야지,,,,,,,,,,,,,,,,
2817,와 진짜... 엔딩 크레딧이 올라오는데 영화가 이대로 끝난다는 사실이 너무 아쉬워서 일어나질 못했어요. 진짜 명작&눈물 근데 영화개봉전 뿌려진 영상들중에 몇개는 본편엔 안나와요. 아마 블루레이 출시되면 나올듯요. 그...,,,,,,,,,,,,,,,,
2818,생물학적 관점에서 접근하는 종의 기원과 진화. 에이리언vs 인간이라는 단순한 소재를 시작부터 복잡하게 풀어헤치다가 남은 것은 종 우월주의,,,,,,,,,,,,,,,,
2819,기대를 너무 했는데도 불구하고 프로메테우스보다 좋더라,,,,,,,,,,,,,,,,
2820,기대 않하고봤는데도 실망. 에일리언 보는 재미라면 스토리보다 쫓기고 죽고 죽이고 심장이 쫄깃해지는맛이 있어야되는데 이도저도 어느하나에 치중되어 재밌는요소가 하나도없음. 스릴이 어쩜 1도없음. 그것도 반전이라고 만들었...,,,,,,,,,,,,,,,,
2821,주연 배우 소개 중에  주연 아닌 배우는 뭔지 모르겠네. 등장도 거의 안했는 데,,,,,,,,,,,,,,,,
2822,보통 에어리언 영화랑  크게 다른것이 없는것 같다또한  후편을 위한   여운을  남기고  있다크게  감동이나   그런것이 없다,,,,,,,,,,,,,,,,
2823,강렬한 영화.. 굉장히 인상 깊었다,,,,,,,,,,,,,,,,
2824,재밌을거란 내 느낌은 엇나가지 않았음.역시 나의 안목이란,,,,,,,,,,,,,,,,
2825,데이빗 이 나쁜시키!!,,,,,,,,,,,,,,,,
2826,프로메테우스 이후의 이야기를 그려줘서 더 좋았어요,,,,,,,,,,,,,,,,
2827,인류에 대해서 다시한번 생각해보게 된다,,,,,,,,,,,,,,,,
2828,근데 엔진니어는 누가 만드거야~,,,,,,,,,,,,,,,,
2829,작품성이 있는 영화 딱 내 스탈♥,,,,,,,,,,,,,,,,
2830,간만에 영화다운 영화를 보고 온 그런 기분이랄까,,,,,,,,,,,,,,,,
2831,마이클패스벤더..설렜음,,,,,,,,,,,,,,,,
2832,에일리언은 1,,,,,,,,,,,,,,,,
2833,이 명작을 살아생전에 영화관에서 볼 수 있을줄이야 감독님 감사합니다 ㅜㅜ,,,,,,,,,,,,,,,,
2834,명성에 걸맞는 리들리 스콧,,,,,,,,,,,,,,,,
2835,프로메테우스의 다음편으론 조금 아쉽네요,,,,,,,,,,,,,,,,
2836,지금까지 본 영화중에서 현실성에 가까웠고,,,,,,,,,,,,,,,,
2837,진짜 간만에 긴장하면서 영화봤다 명작 또탄생,,,,,,,,,,,,,,,,
2838,개인적으로 에이리언 시리즈 중 최고라고 생각한다,,,,,,,,,,,,,,,,
2839,기다리고 기대한 영화인데 기대 그 이상~,,,,,,,,,,,,,,,,
2840,우유빛깔 인조인간과 순대요정 에일리언 사이에 낀 불쌍한 인간.. 그것도 맨날 여자.. 감독 한국인이었으면 혐소리 들었을지도;;,,,,,,,,,,,,,,,,
2841,작가가 전하고자 하는 핵심이 뭔지 이해가 가지 않는다.,,,,,,,,,,,,,,,,
2842,에이리언 영화는 첫 작품인데 너무 인상 깊네요.관련 작중 프로메테우스 라는걸 선행관람 하신 뒤 보시면 더 재밌었을꺼 같았습니다,,,,,,,,,,,,,,,,
2843,굿굿 베리굿~! 잔인해서 넘넘 굿굿~,,,,,,,,,,,,,,,,
2844,전 프로메테우스보다 재밌게봤네요 ㅎㅎ,,,,,,,,,,,,,,,,
2845,신이 되려고 하는 인간의 욕망이 결국 재앙을 불러버리고 말았구나... 그리고 얻은 교훈 한 가지 더 '하지 마라는 건 좀 하지 말자.' -_-ㅋㅋㅋㅋ,,,,,,,,,,,,,,,,
2846,패씨 존잘 존멋 ㅋㅋ 에이리언 꼭 봐요 두번 봐 프로메테우스 복습하고,,,,,,,,,,,,,,,,
2847,긴장감 스릴 메시지 다 놓치지 않았다.. 리들리 스콧 감독님 만수무강하세요ㅋㅋㅋ,,,,,,,,,,,,,,,,
2848,너무 뛰어난 원작과 비교당해서 그렇지 이 작품과 떼놓고 보면 나쁘지 않음. 오리지널과 프로메테우스를 잘 연결해주는 듯,,,,,,,,,,,,,,,,
2849,기존 에이리언 시리즈의 팬으로써 큰 스크린에서 볼 수 있다는 것만으로도 너무 만족스러웠다. 물론 아쉬운 점은 어느정도 있었으나 이 정도면 에이리언 시리즈로 손색이 없다본다. 남은 1점은 후속작에서 채워지길 바란다.,,,,,,,,,,,,,,,,
2850,믿고 기다린 영화. 프로메테우스 보다 훨씬 재미있지만 떡밥 회수는 다음편에서 다룰것 같군요,,,,,,,,,,,,,,,,
2851,프로메테우스 여주 넘불쌍타 ㅜ,,,,,,,,,,,,,,,,
2852,로봇이 미처날뛰고있습니다,,,,,,,,,,,,,,,,
2853,SF 스릴러 장르를 매우 좋아하는 나로써,,,,,,,,,,,,,,,,
2854,이 시리즈는 원래 배드엔딩보는맛 아닌가ㅎㅎ,,,,,,,,,,,,,,,,
2855,꾸르잼 프로메테우스 보고가면 더 꾸르잼,,,,,,,,,,,,,,,,
2856,오랜만에 초집중 해서 본 영화!!,,,,,,,,,,,,,,,,
2857,미친거 아님?? 마이클 패스밴더 연기땜에 소름 계속 돋았네 와...,,,,,,,,,,,,,,,,
2858,월드타워 시사회 보고왔는데 기대만큼 역시 재밌습니다!,,,,,,,,,,,,,,,,
2859,크으.. 두시간 내내 긴장하고 봤다 이전의 에이리언과는 또 다른 느낌!!,,,,,,,,,,,,,,,,
2860,와 숨도 못쉬고 봤어요 ㅠㅠ 방송으로 옛날옛적 에이리언 봤던 추억이 새록새록 떠오르면서도 엄청 집중하며 봤네요!,,,,,,,,,,,,,,,,
2861,이 영화는 세 가지의 교훈이나 담겨져있다.  첫째,,,,,,,,,,,,,,,,
2862,.A.I 기술이 발전할수록 인류의 종말로 가까워진다,,,,,,,,,,,,,,,,
2863,반전 쩔고 심장 쫄깃한 영화,,,,,,,,,,,,,,,,
2864,몸이 저절로 들썩여지는 영화였따..,,,,,,,,,,,,,,,,
2865,리들리 스콧 감독 역시 실망시키지 않네요. 강추!,,,,,,,,,,,,,,,,
2866,역시 리들리스콧이네요 기다린 보람이 있어요,,,,,,,,,,,,,,,,
2867,오랜만에 진짜 제대로된 영화를 보고 옴..,,,,,,,,,,,,,,,,
2868,철할적인 SF 거장의 깊이가 느껴지네요 멋지고 훌륭해요,,,,,,,,,,,,,,,,
2869,진짜 소름.... 미쳤다  괴물까짓게 경이롭기까지 하다,,,,,,,,,,,,,,,,
2870,배우들과 감독님의 호흡이 굉장함ㅋㅋ 리들리랑 패스벤더는 정말 잘어울리는듯,,,,,,,,,,,,,,,,
2871,완전 꿀잼 짜릿하고 이런게 스릴이라는걸 보여줌ㅋ 이런건 무조건 극장사슈지!!,,,,,,,,,,,,,,,,
2872,와 에이리언 시리즈 중 역대급이다 진짜,,,,,,,,,,,,,,,,
2873,인간적으로 재밌지 않음?,,,,,,,,,,,,,,,,
2874,신들의 발할라 입장은 희망에 찬 노래가 아니게 된다.,,,,,,,,,,,,,,,,
2875,역시 리들리 스콧... 다음편도 리들리 스콧이.. 기대해봄,,,,,,,,,,,,,,,,
2876,짱재미써요ㅠㅠ 대통령도 바뀌고 영화도 재밌고ㅠㅠ 걍 오늘 너무 좋음 ㅋㅋ,,,,,,,,,,,,,,,,
2877,만족스럽게 봤네요,,,,,,,,,,,,,,,,
2878,이전  에일리언 시리즈를 많이 봤었던 사람으로써 영화가 새로울건  없고 무덤덤 하네요,,,,,,,,,,,,,,,,
2879,역시 거장의 작품 답네요.. 최고점을 줄  밖에 없을 듯 그나저나 감독이 고령인데 후속작이 나올수 있을려나 걱정됨,,,,,,,,,,,,,,,,
2880,먼저 나온 영화들 안보고 봐도 충분히 잼남 ㅎ,,,,,,,,,,,,,,,,
2881,적당히 나름 긴장하게 만듦,,,,,,,,,,,,,,,,
2882,기대에는 못미쳤지만 편하게 볼만합니다,,,,,,,,,,,,,,,,
