,content,,,,,,,,,,,,,,,,
5491,초반은 조금 지루. 생각했던것보다 덜  징그러웠다.,,,,,,,,,,,,,,,,
5492,1편이 나온지 38년이 지났는데 그래픽만 나아졌지 스토리나 구성은 나아진게 없다 완전 개 실망 리들리 스콧도 이젠 끝인가 싶다,,,,,,,,,,,,,,,,
5493,악마적인 것은 창조행위가 아닌 파괴본능이다.,,,,,,,,,,,,,,,,
5494,보는내내 긴장하며 재밌게 잘봤어요^^,,,,,,,,,,,,,,,,
5495,한국영화보다는나은데ㅡㅡ글도그냥그랬음그저그랬어요ㅡㅡ,,,,,,,,,,,,,,,,
5496,스토리도 빵빵하고 정말 재밌게 봤습니다. 그냥 어느 별에서 에이리언을 만났다가 아니라 에이리언은 이렇게 탄생했다를 볼 수 있었고 특유의 뚫고 나오는 신이 볼만 했습니다! 그리고...지구를 사랑합시다! 집 떠나면 고생...,,,,,,,,,,,,,,,,
5497,패스벤더와 리들리스콧 믿고 본 영화,,,,,,,,,,,,,,,,
5498,정글의법칙 보니까 밟거나 건드리면  포자 상태의 가루를 내뿜는 버섯이 있던데. 감독이 그거 보고  에이리언 만들었나봐 ㅋㅋ 모든 영감의 대상 자연의 위대함.,,,,,,,,,,,,,,,,
5499,리들릿 스콧 감독님은 역시 최고네요. 데이빗으로 시작해서 데이빗으로 쭈욱~~~ㅋㅋㅋ 재밌었습니다.^^,,,,,,,,,,,,,,,,
5500,감독이 꼭 만들고 싶었던 프로메테우스의 다음편으로 에이리언의 탄생 배경을 다룬 영화.,,,,,,,,,,,,,,,,
5501,왜다들 관람하시구 모르실까 에이리언의 기원은 데이빗이라는걸,,,,,,,,,,,,,,,,
5502,우와 조마조마 보는내내 긴장하고 ..,,,,,,,,,,,,,,,,
5503,ㅇ8ㅇ7ㅇ8ㅇ7ㅇ8ㅇ8ㅇ8ㅇ8ㅇ8ㅇ8ㅇ7ㅇ8ㅇ8ㅇ8ㅇ8ㅇ8ㅇ8ㅇ8ㅇ88ㅇㅇ8ㅇ8,,,,,,,,,,,,,,,,
5504,예측되는 결말이지만 잼나게 봤어요^^,,,,,,,,,,,,,,,,
5505,역시나 스콧감독이네요 ㅎㅎ,,,,,,,,,,,,,,,,
5506,음 ..15세가 맞는지 의심스러움. 진부하다,,,,,,,,,,,,,,,,
5507,댓글 보니까 프로메테우스 세계관 실종 이라는 말이 굉장히 많던데스토리 순서대로 따지면 프로메테우스 다음 스토리가 내년에 나올 에이리언:어웨이크닝이고 어웨이크닝 다음 스토리가 이번에 개봉한 커버넌트 입니다 여러분..기...,,,,,,,,,,,,,,,,
5508,데이빗 재생능력 없지않아요?  턱에  여주인공이  못박았는데 상처 마지막에  없던데  먼지모르겠네요,,,,,,,,,,,,,,,,
5509,이 영화를 보기전에 프로메테우스,,,,,,,,,,,,,,,,
5510,매우 재미있네요 프로메테우스를 보고보면 더 좋겠지만 안보고 봐도 문제는 없을것 같네요,,,,,,,,,,,,,,,,
5511,너무 기대해서 그런가 .. 재미는 있었지만 뭔가 살짝 아쉬운 느낌.. 그래도 재미는 있었어요!,,,,,,,,,,,,,,,,
5512,공포영화 전혀 못보는 28여자인데 무서워서 반은 다 눈 감고 본듯. 하지만 추천드립니다 꼭 보세요!,,,,,,,,,,,,,,,,
5513,보면서 예상되는 스토리 노잼,,,,,,,,,,,,,,,,
5514,반의 긴장감은 모든것을 상쇄시킨다고 생각한다. 데이비드 개XX,,,,,,,,,,,,,,,,
5515,에이리언의 새로운 이야기 이제 시작이구나,,,,,,,,,,,,,,,,
5516,아오 짜증나서 미치는줄,,,,,,,,,,,,,,,,
5517,프로메테우스 보고 이거 봐야하나요?,,,,,,,,,,,,,,,,
5518,연출은참좋네요 기대했던것 보다는 너무 큰 얘기를  하려한거 같아요,,,,,,,,,,,,,,,,
5519,너무너무 재밋어요!!!,,,,,,,,,,,,,,,,
5520,앞으로의 떡밥 회수가 기대됌.,,,,,,,,,,,,,,,,
5521,예상 가능한 반전 불쌍한 여주.,,,,,,,,,,,,,,,,
5522,오늘 아빠랑 보고왔는데 지루하기까지 해서 잘뻔한적있음게다가 너무 잔인하고 보기도 민망해서 눈쌀도 찌뿌릴정도였다 이거 보고온거 진짜 후회중,,,,,,,,,,,,,,,,
5523,인간의 감정을 가진 AI..정말 저렇게 될까?..,,,,,,,,,,,,,,,,
5524,조금 지루하고 너무 징그럽고  킬링타임으로는 괜찮고,,,,,,,,,,,,,,,,
5525,프로메테우스의 팬으로 이번 커버넌트를 엄청 기대하고 기다렸다 방금 보고온 결론은 예고편이 더 재밌었다,,,,,,,,,,,,,,,,
5526,긴장감 몰입도 좋음 좋은 킬링타임용,,,,,,,,,,,,,,,,
5527,그냥 그래요 좀 지루하기도 하고.,,,,,,,,,,,,,,,,
5528,오랜만에 보는 에이리언 꿀잼이었다,,,,,,,,,,,,,,,,
5529,아...  기대많이 했는데.   생각보다 별로.   프로메테우스가 훨재밌음...   실망했음...,,,,,,,,,,,,,,,,
5530,재미 있게 보고갑니다 다음편이 또 있나보네,,,,,,,,,,,,,,,,
5531,스콧 아저씨 감독 영화를 좋아하지만,,,,,,,,,,,,,,,,
5532,프로테메우스와 이어지는 이야기.. 재미따,,,,,,,,,,,,,,,,
5533,아...월터... 개척단의 운명은 어떻게 될까요? 사뭇 궁금해집니다.,,,,,,,,,,,,,,,,
5534,굉장히 재미잇네요. 간만에 시간가는줄 모르고 봤습니다,,,,,,,,,,,,,,,,
5535,미래가 어떻게 될지 상상이 안간다,,,,,,,,,,,,,,,,
5536,나쁘지 않았다 신선하고 잔인했다 전편 프로메테우스를 다시봐야겠다다음편이 기대된다,,,,,,,,,,,,,,,,
5537,여자친구랑 같이 봤는데 여자친구도 너무 재밋어하구 나도 재밋게 잘봤습니다,,,,,,,,,,,,,,,,
5538,재밌어요..AI 소재도 괜찮고..,,,,,,,,,,,,,,,,
5539,고어물만큼 무서웠지만,,,,,,,,,,,,,,,,
5540,한번쯤 생각해 볼 만한 얘기를 스크린으로 보니 신선한 충격이네요,,,,,,,,,,,,,,,,
5541,정말 올해 본 영화 중 최고다,,,,,,,,,,,,,,,,
5542,에일리언 시리즈에 대한 모욕의 연속프로메테우스 커버넌트 리들리 스콧옹의 연출력 갈수록 맘이 아프다,,,,,,,,,,,,,,,,
5543,에일리언은 나와만줘도 평타이상치는영화결말부분은 흔한 마무리를보여줘서 조금은 아쉬움,,,,,,,,,,,,,,,,
5544,처음부터 끝까지 집중하게 만드는 힘이 있어요.,,,,,,,,,,,,,,,,
5545,와 벌써 다음편이기대된다,,,,,,,,,,,,,,,,
5546,에어리언중에 재미없음,,,,,,,,,,,,,,,,
5547,볼만해요....볼만해요,,,,,,,,,,,,,,,,
5548,전편 못봐서 그런지 그저그랬음지루하지는 않음,,,,,,,,,,,,,,,,
5549,평점댓글보고 프로메테우스보다 재미없나보다 했는데 꾀 재밌었음!  프로메테우스는 인류의 창조자를 찾는 거라면 에일리언 커버넌트는 에일리언의 창조자가 누구인지 보여준 느낌? 단순히 때려부수는게 아니고 메세지도 있어서 좋...,,,,,,,,,,,,,,,,
5550,또 다음편이 나오겟군 생각보다는 허무햇음..,,,,,,,,,,,,,,,,
5551,뻔한 반전이지만 다음 편을 기대하게 만드는 점도 좋았네요,,,,,,,,,,,,,,,,
5552,음! 전작과도 연계 되는 이여기는 좋은대....,,,,,,,,,,,,,,,,
5553,원레 이런류의 공포는 별로라고 생각하는데 정말 그 긴장감을 잘 묘사해내서 재밌게 즐길 수 있었다.,,,,,,,,,,,,,,,,
5554,분위가는 참 좋았고 프로메테우스와 커버넌트 사이에 설명이 많이 부족했음. 설명도 너무 빨리 지나가고,,,,,,,,,,,,,,,,
5555,기대를 많이하고봐서 그런지 아쉬움...,,,,,,,,,,,,,,,,
5556,ㅠㅠㅠ. 잘 봤네오..!,,,,,,,,,,,,,,,,
5557,딱히 태클걸만한게 없을만큼 잘만든 영화였어요 재밌었습니다.,,,,,,,,,,,,,,,,
5558,창조물에게 멸종당하는이유는???,,,,,,,,,,,,,,,,
5559,데 ...데이빗!!!!,,,,,,,,,,,,,,,,
5560,꿀잼 :) 에일리언같이 비현실적 영화 그닥 안좋아하는데 재밋음 !! 반전 굿 !!,,,,,,,,,,,,,,,,
5561,지루하지 않고 재밌었어요,,,,,,,,,,,,,,,,
5562,앞부분이넘 지루함 스콧형님은 화이팅,,,,,,,,,,,,,,,,
5563,여전히 풀리지않은 의문 에일리언 퀸은 어떻게탄생되었는가?리들리스콧은 에일리언스 존카메론의 설정은인정하지않고 독자적인 설정으로 가는것인가그냥 단순히 시간이 지남에 따라 퀸이라는개체로 진화했거나 탄생되었을까...,,,,,,,,,,,,,,,,
5564,데이빗 연기자는 좋았는데 여주가  전작 에일리언 시리즈 리플리에 비해 여전사 느낌이 부족함. 스토리 위주라 에일리언이 대량으로 나오지는 않으니 심심한 감이 있음.,,,,,,,,,,,,,,,,
5565,약간은 진행이 느린 느낌.  맥락상 예상 가능한 스토리.  공포감은 일으키다. 여주인공의 임팩트는 약한 편.,,,,,,,,,,,,,,,,
5566,SF영화 바이블을 새로 쓴 작품,,,,,,,,,,,,,,,,
5567,어마어마한 영화였어요 ㅠ진짜 소름돋는데 눈을 못뗀ㄷㅏ고해야할까?,,,,,,,,,,,,,,,,
5568,몰입도나 스케일 뭐하나 빠지는게 없네,,,,,,,,,,,,,,,,
5569,아 역시 리들리스콧.. 흠잡을게 없다,,,,,,,,,,,,,,,,
5570,추억소환!!! 긴장. 재미가 함께~ 그런데 인간을 만든 이유가 안나와서 아쉽..  다음편에 나오겠지?,,,,,,,,,,,,,,,,
5571,영화 속 장면 하나하나 놓칠 수 없었어요,,,,,,,,,,,,,,,,
5572,우주장르좋아하면볼만하고 에일리언탄생기원이 연결되고 반전도 많네요,,,,,,,,,,,,,,,,
5573,1인 2역을 연기한 마이클 패스벤더에게 감탄을..,,,,,,,,,,,,,,,,
5574,마지막까지 긴장을 놓을수 없다.,,,,,,,,,,,,,,,,
5575,에어리언 시리즈중 최고라고 감히 말해봅니다,,,,,,,,,,,,,,,,
5576,역시 리들리 스콧답게 어마어마한 디테일 ㅋㅋ 비쥬얼 영화로 인정한다,,,,,,,,,,,,,,,,
5577,개인적으로 굉장히 좋아하는 영화라 이번에도 만족스럽네요,,,,,,,,,,,,,,,,
5578,이런건 무조건 영화관 사수일듯요,,,,,,,,,,,,,,,,
5579,엘리자베스 쇼  나올때 넘불쌍하드라 ㅠㅠ,,,,,,,,,,,,,,,,
5580,이영화는 극장에서 봐야할 영화로 강추합니다 정말ㅋ,,,,,,,,,,,,,,,,
5581,마이클 패스벤더 진짜 AI같은데? 연기 미쳤네 진짜 ㅋ,,,,,,,,,,,,,,,,
5582,내 심장을 쪼엿다 풀엇다 ㅋㅋ,,,,,,,,,,,,,,,,
5583,이 영화가 2시간 넘는지 정말 몰랐네요 시간이 이렇게 빨리가다니..,,,,,,,,,,,,,,,,
5584,음... 뭐라고 해야할까,,,,,,,,,,,,,,,,
5585,스크린으로 봐야 더 쫄깃함을 느낄 수 있습니닷 ㅋㅋ,,,,,,,,,,,,,,,,
5586,스릴러와 SF장르 좋아하는 사람들에게 추천해야겠네요,,,,,,,,,,,,,,,,
5587,마이클패스벤더 인생연기 폭발함!! 배우들 연기 지린다 정말,,,,,,,,,,,,,,,,
5588,재미ㅛㅏ요재미ㅛㅣ이ㅛ어요,,,,,,,,,,,,,,,,
5589,에이리언시리즈는 무조건 영화관에서 봐야지 ㅋㅋ,,,,,,,,,,,,,,,,
5590,이게 정말 에이리언이라고?! 이런 영화를 왜 난 처음본거야?bb,,,,,,,,,,,,,,,,
5591,에일이런이 징그럽긴한데 너무재밌네요!,,,,,,,,,,,,,,,,
5592,기대이상 너무 재미있게 봤습니다 ㅜ 후속작 꼭 나오길 ㅠㅠ,,,,,,,,,,,,,,,,
5593,SF와 스릴의 완벽한 조화.. 내용도 참신하다,,,,,,,,,,,,,,,,
5594,이거극장에서보는데 그남자가 식물 발아서 그 먼지 같은게 귀에 들어가자 사람들이 다 아~~이러더라 ㅋㅋㅋㅋ,,,,,,,,,,,,,,,,
5595,솔직히 재미는 없네요 에이리언도 거의 안나오고 액션도 없고,,,,,,,,,,,,,,,,
5596,반전의 의도는 이해하겠으나 찝찝한 여운은 결국 관객의 몫,,,,,,,,,,,,,,,,
5597,아침부터 보러간 보람이 있네요 ㅋㅋ,,,,,,,,,,,,,,,,
5598,할리우드 모션그래픽의 극을 볼 수 있습니다. cg자체의 퀄리티는 예전부터 좋았지만 이건 정말.. 실제 리얼액션같은 모션입니다. 빠르고 무서운.. 그런느낌.. 꼭 보세요..!!,,,,,,,,,,,,,,,,
5599,뻔하지않은 전개와 실감날정도로 CG인게 티안나는 영상미도 멋졌습니다. 주인공들의 연기력도 훌륭해서 10점드립니다.,,,,,,,,,,,,,,,,
5600,흥미롭고 박진감 넘치는 영화,,,,,,,,,,,,,,,,
5601,믿고 보는 에이리언 꼭 보세요,,,,,,,,,,,,,,,,
5602,그럭저럭 재밌긴한데 별루,,,,,,,,,,,,,,,,
5603,이런 영화를 볼 수 있다는 것만으로도 만족한다,,,,,,,,,,,,,,,,
5604,지금까지 내9가 봤던 SF영화와는 차원이 다르네 그동안 뭘 본건지?,,,,,,,,,,,,,,,,
5605,프로메테우스와 에일리언 시리즈를 본격적으로 연결해주는 이야기입니다. 엔지니어에 대해 좀 더 다뤄주었으면했는데 그렇진 않네요. 에일리언 시리즈보다 프로메테우스 쪽을 더 재미있게 보셨으면 이번 편 역시 재미있게 볼 것 ...,,,,,,,,,,,,,,,,
5606,재밌게 잘 봤습니다...,,,,,,,,,,,,,,,,
5607,오랜만에 영화에 몰입했다^^,,,,,,,,,,,,,,,,
5608,전작도 봐야겠어요 재밌어요,,,,,,,,,,,,,,,,
5609,리들리 스콧감독님.. 진짜 장수하셔야해요.. 에이리언 시리즈 계속이어가 주세요,,,,,,,,,,,,,,,,
5610,,,,,,,,,,,,,,,,,
5611,프로메테우스를 안봐서...,,,,,,,,,,,,,,,,
5612,38년전 기억의 저편 ~,,,,,,,,,,,,,,,,
5613,스릴러,,,,,,,,,,,,,,,,
5614,우주에서 마주친 가장 현실적인 종간의 대립.. 지구라는 행성에서 멀어져갈수록 오히려 불합리하고 비이성적으로  변해가는 대원들의 모습  최약체로 생존해야하는것의 의미.. 여러가지로 생각해볼 요소들이 많다.. 상업영화에...,,,,,,,,,,,,,,,,
5615,마이클 패스벤더 2명의 Ai연기. 이건 진짜 인생연기 폭발,,,,,,,,,,,,,,,,
5616,철학+SF의 절묘한 만남!,,,,,,,,,,,,,,,,
5617,이정도라면 역대급 에이리언 시리즈중 최고인듯,,,,,,,,,,,,,,,,
5618,이런건 극장에서 봐야할 영화 아닐까요..,,,,,,,,,,,,,,,,
5619,아마 상상 그 이상의 영화를 보게될 것입니다,,,,,,,,,,,,,,,,
5620,어릴적 아무생각없이 봤던영화가 점점 고차원적으로 들어간다,,,,,,,,,,,,,,,,
5621,에이리언 시리즈를 몇년을 기다렸는지 ㅠㅠ 역대급 시리즈 인정ㅋ,,,,,,,,,,,,,,,,
5622,기대 별로 안했는데 최고였어요 ㅎㅎ 넘나 만족함 무조건 보세요,,,,,,,,,,,,,,,,
5623,에일리언 팬으로서 이번 커버넌트는 액션면에서는 전 편들보다 내용이 적지만 스토리가 있다는 점은 괜찮았음. 보고나서 찝찝함은 관객의 몫,,,,,,,,,,,,,,,,
5624,오랜만에 만족스럽게 본 영화~,,,,,,,,,,,,,,,,
5625,졸잼까진 아니고 그럭저럭 볼만했음근데 진짜 15세 치고는 너무 잔인했다,,,,,,,,,,,,,,,,
5626,예상되는 스토리지만 나름 볼만했음,,,,,,,,,,,,,,,,
5627,최근에 본 영화들 통 틀어서 제일 재밌고 좋았어요,,,,,,,,,,,,,,,,
5628,감독판 안나오나요?! 궁금한게 너무 많은데!!!,,,,,,,,,,,,,,,,
5629,조금 진부하다해야하나...리둘리스콕 걈독을 믿고 기댜했눈데...기대가 너무 컸나봐여.,,,,,,,,,,,,,,,,
5630,갠적으로 너무나 마음에 드는ㅋㅋ 시간 가는줄 모르고 푹 빠져서 봤다,,,,,,,,,,,,,,,,
5631,오래 기다림이 헛되지는 않은듯. 저는 재미있게 보았습니다.,,,,,,,,,,,,,,,,
5632,볼수록 빠져드는 몰입도 최고ㅋ,,,,,,,,,,,,,,,,
5633,에이리언에 대해서 아무것도 모르고 봤는데도 재밌게 봤어요,,,,,,,,,,,,,,,,
5634,87년에 나온 에일리언이 최고인듯,,,,,,,,,,,,,,,,
5635,캐스팅 좋고 스토리도 좋은 리들리스콧표 영화,,,,,,,,,,,,,,,,
5636,지난번에 펼쳐놓은 떡밥 다 회수해주시네요 ㅋㅋ,,,,,,,,,,,,,,,,
5637,10점이 아깝지 않아요 ㅎㅎ,,,,,,,,,,,,,,,,
5638,몇편이 더나올라나  떡밥가득,,,,,,,,,,,,,,,,
5639,흥미로운 스토리로 재밌게 볼 수 있었당,,,,,,,,,,,,,,,,
5640,진짜 역대급 SF.. 무조건 보시길,,,,,,,,,,,,,,,,
5641,이게 얼마만에 느껴보는 SF스릴러의 느낌이냐ㅠㅠ,,,,,,,,,,,,,,,,
5642,다음편 때문인지 다 보고나서 약간의 아쉬움과 기다림을 갖게 해주네여 빨리 뒷이야기가 보고싶어요ㅠ,,,,,,,,,,,,,,,,
5643,기대했던거 만큼 만족스러운 영화였어요ㅎㅎ,,,,,,,,,,,,,,,,
5644,영화가 처음부터 끝까지 밍밍했어요...,,,,,,,,,,,,,,,,
5645,엔지니어들도 바보 승무원들도 바보 심지어 착한 인조인간도 바보. 비상식적 바보들의 집합 ㅋㅋㅋ,,,,,,,,,,,,,,,,
5646,중간 중간 무서운 내용들이 있었으나  전편과 연결이 좋앟고 화면구성  장소등 눈이 호강 했습니다,,,,,,,,,,,,,,,,
5647,넘나 잼썻움! 전편과 이어지고 차기작을 위한 떡밥도 좋앗숨다 넘 잼썻어여,,,,,,,,,,,,,,,,
5648,너무나 긴장하고봐서 영화끝나고나서 다리에힘이풀림 ㅋㅋ,,,,,,,,,,,,,,,,
5649,거장의 터치마이클 패스벤더의 연기AI에 대해 다시생각,,,,,,,,,,,,,,,,
5650,오랜만에 돈이 안아까웟네 ㅎㅎ,,,,,,,,,,,,,,,,
5651,긴장감이 흐르는 영화였어오,,,,,,,,,,,,,,,,
5652,간만에 스릴감을 제대로 느낄 수 있었던 영화,,,,,,,,,,,,,,,,
5653,다좋은데 너무 무서워여,,,,,,,,,,,,,,,,
5654,전작들 안보고 봤는데도 재밌네용 두시간 내내 손에 땀을 쥐며 봤습니당..ㅎㅎ,,,,,,,,,,,,,,,,
5655,지루할 틈 없이 잘 풀어냄ㅋ 기대 안했는데 꿀잼,,,,,,,,,,,,,,,,
5656,영화자체는 그럭저럭에일리언 시리즈의 팬들에게는 다소 아쉬울만한 영화,,,,,,,,,,,,,,,,
5657,시작은 좀 지루한 느낌이였지만뒤로 갈수록 재밌음,,,,,,,,,,,,,,,,
5658,그냥저냥 볼만해여~~~,,,,,,,,,,,,,,,,
5659,그냥그럼 일본고어물인줄 반전없는게 아쉬움.,,,,,,,,,,,,,,,,
5660,내용이 별로. 뻔한얘기네요.,,,,,,,,,,,,,,,,
5661,프로메테우스 전편작 보고 관람하면 진짜잼있어요2편나왔으면 좋겠네요,,,,,,,,,,,,,,,,
5662,심장이 쫄깃하네요  전작들 보단  스토리가 괜찮은듯,,,,,,,,,,,,,,,,
5663,데이빗은 폐기되었어요,,,,,,,,,,,,,,,,
5664,속편이너무기다려진다,,,,,,,,,,,,,,,,
5665,전편을 알아야 이해가 돼요,,,,,,,,,,,,,,,,
5666,어디서본듯한줄거리와장면들이네요.,,,,,,,,,,,,,,,,
5667,재미도 반전도 있고 굳굳굳굳,,,,,,,,,,,,,,,,
5668,반전에 반전이네요.간만에 스릴넘치게 잘봤어요,,,,,,,,,,,,,,,,
5669,패스밴더의 연기와 리들리 스콧의 연출로 옛날 에일리언1의 느낌도 잘 볼 수 있었어요~,,,,,,,,,,,,,,,,
5670,볼만합니다 한번쯤 생각해볼만한 주제!,,,,,,,,,,,,,,,,
5671,SF팬이라면 충분히 볼만함. 다만 에일리언이라는 소재가 다소 진부한면이 있어서약간 졸릴수있음. 사실 전작인 프로메테우스가 더 재밌는건 함정.  그래도 커버넌트가 못만든건아니라 8점정도는 줄만합니다. 다음 스토리가 기...,,,,,,,,,,,,,,,,
5672,피조물과 창조주에 대한 철학적인 생각,,,,,,,,,,,,,,,,
5673,으어어어으오와아아아오,,,,,,,,,,,,,,,,
5674,에이리언  1편이랑  프로메테우스 시청후 보시는거  추천해드려요전작이  명작이라  조금 못미치는거 같지만 그래도 그때보다 영화기술이  좋아져서  다른  재미가있네요,,,,,,,,,,,,,,,,
5675,엄청 재밌었어요 ~~^^ 짱!,,,,,,,,,,,,,,,,
5676,감독의 철학이 있는 것 같은데 그것까지 분석하긴 어렵고,,,,,,,,,,,,,,,,
5677,연출 굿 뭔가 로봇이 주는 경고?? 같더라,,,,,,,,,,,,,,,,
5678,뭔가 흐름이 전체적으로 루즈하고 에일리언신은 너무 급작스럽게 전개된다.. 시리즈 특유의 긴장감이 실종된듯.,,,,,,,,,,,,,,,,
5679,보면서 심장 쫄깃한 장면 많더라구요ㅠㅠ.. 영화 한 편 보고나서 진이 다 빠진 기분,,,,,,,,,,,,,,,,
5680,재미는 있으나 징글징글합니다반전은 예상 가능한 수준,,,,,,,,,,,,,,,,
5681,ㄹㅇ19센줄 알았는데 나중에 나와서 후기 보니깐 15세라 해서 놀랬다 재밌었음,,,,,,,,,,,,,,,,
5682,비주얼은 좋지만 스토리는 그닥,,,,,,,,,,,,,,,,
5683,징그러운데 재밋으ㅋㅋㅋㅋ,,,,,,,,,,,,,,,,
5684,놀래기만한듯... 그래도재미는있었어요,,,,,,,,,,,,,,,,
5685,보고 나서도 여운이 남는 그런 영화~ 영화 잘봤습니다,,,,,,,,,,,,,,,,
5686,에이리언 탄생이야기를 들을줄이야! 뜻밖의 수확 ㅋㅋ,,,,,,,,,,,,,,,,
5687,주인공 활약도에 실망..노잼입니다.,,,,,,,,,,,,,,,,
5688,에이리언 탄생의 비밀이 밝혀짐>_ㅏ<,,,,,,,,,,,,,,,,
5689,두시간 동안 쫄깃하게 즐겼으며 마지막을 보니 다음 편을 기대 안할수가 없다,,,,,,,,,,,,,,,,
5690,간만에 영화다운 영화 한편을 본 기분ㅎ,,,,,,,,,,,,,,,,
5691,내가 생각하던거와는 달랐지만 그래도 재밌었어요ㅋㅋ,,,,,,,,,,,,,,,,
5692,진짜 재밌었음ㅋㅋ 데이빗.. 월터..!!,,,,,,,,,,,,,,,,
5693,생각보다 무섭지만 재밌네 ㅋㅋ,,,,,,,,,,,,,,,,
5694,예상과는 다르게 흘러 갔지만 재밌던데,,,,,,,,,,,,,,,,
5695,굳이 극장가서 안보고 집에서 봐도 될듯.. 별 내용 전작과의 커넥션 암것도 없음,,,,,,,,,,,,,,,,
5696,와 음향효과가;; 덕분에 몰입감 긴장감은 더 업..,,,,,,,,,,,,,,,,
5697,프로메테우스와 같이 보시면 조금 더 재미 있습니다.,,,,,,,,,,,,,,,,
5698,여러가지의 재미가 다 들어가 있는듯ㅋㅋ,,,,,,,,,,,,,,,,
5699,뭔가 겁나 떼거지로 안나온거 빼믄 괜츈햇우요,,,,,,,,,,,,,,,,
5700,새로운 관점의 에이리언 영화가 아니엇나 싶습니다,,,,,,,,,,,,,,,,
5701,생각한것보다지루하지않고재밌었어요,,,,,,,,,,,,,,,,
5702,에이리언의 시초를 알게되어 기쁘다,,,,,,,,,,,,,,,,
5703,조금 지루함 .. 생각보단 별루별루..,,,,,,,,,,,,,,,,
5704,1편 같은 스토리를 바란다면 실망이지만 데이빗 잘생겼음,,,,,,,,,,,,,,,,
5705,재미있었습니다. 시간이 아주 잘갔어요.,,,,,,,,,,,,,,,,
5706,그럭저럭 볼만했음 ㅎㅎ,,,,,,,,,,,,,,,,
5707,예전 에어리언을 생각하고 보신다면 실망스런 영화일듯~~,,,,,,,,,,,,,,,,
5708,프로메테우스가 더 재밌음 프로메테우스가 심오하다면이건 걍 에이리언 오락물 ㅂㄷㅂㄷ그래도 볼만함,,,,,,,,,,,,,,,,
5709,심장이 쫄깃쫄깃하네요...,,,,,,,,,,,,,,,,
5710,숨을 쉴 수 있는 시간이 생기는건 오직 영화가 끝났을때 뿐.,,,,,,,,,,,,,,,,
5711,단순한 스릴러가 아니라 심오한 주제가 들어가있어서 더 재밌게 봤습니다 ㅎㅎ,,,,,,,,,,,,,,,,
5712,그럭저럭 볼만한 영화 ㅋ,,,,,,,,,,,,,,,,
5713,에이리언의 무서움 보다 A.I의 야망이 더 무서웠던거 나뿐인가요오..,,,,,,,,,,,,,,,,
5714,잔인함 속에 숨은 리들리 스콧의 철학이 굉장했다,,,,,,,,,,,,,,,,
5715,기대 별로 안하고 봤는데 꿀잼,,,,,,,,,,,,,,,,
5716,결국 이 미친 짓거리가 네 놈 때문에 시작된거구나,,,,,,,,,,,,,,,,
5717,청불이라도 이상하지않네요,,,,,,,,,,,,,,,,
5718,bbbb정말 재밌게봤어요 ㅎ,,,,,,,,,,,,,,,,
5719,첨부터 끝까지 지루할 틈 없이 흘러 감ㅋㅋ 간간히 깜짝깜짝 놀라기도 했고,,,,,,,,,,,,,,,,
5720,프로메테우스 간단하게 복습하고 봤더니 더 재밌는듯,,,,,,,,,,,,,,,,
5721,SF 좋하면 꼭 봐야된다 진짴ㅋㅋㅋ,,,,,,,,,,,,,,,,
5722,로봇 공포증 생길 듯,,,,,,,,,,,,,,,,
5723,kjhgfdssssrth,,,,,,,,,,,,,,,,
5724,에이리언 비중이 적다고 하던데 갠적으로 이 정도면 충분하다고 생각함ㅎㅎ,,,,,,,,,,,,,,,,
5725,에일리언 1부터 봐 온 나로썬 역시나 재밌었다,,,,,,,,,,,,,,,,
5726,전작이랑 이어져서 더 재밌었던거 같아용,,,,,,,,,,,,,,,,
5727,스토리도 좋고 스릴도 있고 잼썼음,,,,,,,,,,,,,,,,
5728,10자를 채우고 500원을 받자,,,,,,,,,,,,,,,,
5729,토요일조조로  보았는데  생각보다 조금 잔인하기도 하고 징그럽기도  했지만  영상,,,,,,,,,,,,,,,,
5730,재미 있어요 긴장감도 있고,,,,,,,,,,,,,,,,
5731,보는시간 내내 그냥 적당히 볼만한 영화였네요 그냥그랬어요,,,,,,,,,,,,,,,,
5732,역시 리들리 스콧! 거장의 영화는 다르네요 에일리언의 팬이라면 절대 후회하지 않으실 겁니다,,,,,,,,,,,,,,,,
5733,생각보다 2% 부족했지만 다음 편을 보기위해 반드시 봐야할 듯,,,,,,,,,,,,,,,,
5734,이걸 15세로 정한건 진짜 대한민국 역대급이다ㄷㄷ 청불영화라고 해도 안이상할만큼 수위높습니다 주의하세요,,,,,,,,,,,,,,,,
5735,에이리언 커버넌트 두번째 서막의 시작이군!,,,,,,,,,,,,,,,,
5736,아주 재밌네요 ㅋㅋㅋ 강추입  니다,,,,,,,,,,,,,,,,
5737,영화초반에 콜라마시고 오줌마려워서 집중이안됐는데 중반부터 오줌이 들어가버렸음 근데 마지막보고 한번에 지릴뻔,,,,,,,,,,,,,,,,
5738,으아아 재밌고 잔인하고 더럽고 찝찝하고,,,,,,,,,,,,,,,,
5739,잼있네요  깜짝깜짝 높라는,,,,,,,,,,,,,,,,
5740,풍지는 그저그랬다고했고 춘석이는 허무하다고 했고 경민이는 앞 사람때문에 힘들었고 승범이는 무서워서 오줌을 쌌다.,,,,,,,,,,,,,,,,
5741,창조주가 되고싶은 ai 결국 이런것이군,,,,,,,,,,,,,,,,
5742,대박 소름~ 심장 쫄깃~,,,,,,,,,,,,,,,,
5743,혼자다니지말고 빨리죽여 좀,,,,,,,,,,,,,,,,
5744,에이리언 좋아하는 팬르로써 재밌게 잘봤습니다,,,,,,,,,,,,,,,,
5745,영화 되게 잘만들었네요 인정합니다,,,,,,,,,,,,,,,,
5746,믿고보는 스콧형.  전작 프로메테우스 내용을 잘 이어갔으나 궁금중해결해주는데 2퍼 부족했엉.  쪼굼아쉽네?,,,,,,,,,,,,,,,,
5747,의외로 너무 재밌었던 영화. 올해 본 영화 중 제일 재밌었달까,,,,,,,,,,,,,,,,
5748,인류탄생의 비밀은 다음편에?ㅋ,,,,,,,,,,,,,,,,
5749,배우들 연기도 좋고 도입부에 패스벤더의 등장만으로도 긴장되더라,,,,,,,,,,,,,,,,
5750,진짜 현실성없는 괴물얘기인데도 무섭고 긴장감있고 빨려들어간다.. 절대 15세는아닌것같다 영화끝나고 많이기억에남는다,,,,,,,,,,,,,,,,
