,content,,,,,,,,,,,,,,,,,,,,,,,,,,,,
1,괜찮다. 굳이 조디포스터를 섭외할 이유가 있었을런지...그 제작비로 러닝타임이나 좀 더 늘렸으면 했다. 엘리시움에 대한 설명 및 영상이 너무 부족했다.,,,,,,,,,,,,,,,,,,,,,,,,,,,,
2,알바 안쓰는 베짱은 뭐고 ..한국영화 알바들이 전부 1점뿌리고 가서 평점 깍아먹는것 모르나 ...한국시장은 아예 그냥 포기한듯 .. 올해나온 영화중 최고수준였다 ..,,,,,,,,,,,,,,,,,,,,,,,,,,,,
3,전격 의료민영화 보이콧 영화ㅋㅋ,,,,,,,,,,,,,,,,,,,,,,,,,,,,
4,미국이 한국을 부러워 하는 한가지 전국민 건강보험..,,,,,,,,,,,,,,,,,,,,,,,,,,,,
5,아 아직 안보신분들한테 해드리고 싶은 말은..포스터만 보고 영화 내내 스펙타클한 액션을 기대하고보지는 마십시오.전작 디스트릭트9도 영화 마지막에서나 흥미진진한그래픽 액션이 돋보입니다. 이런 영화구성이 이 감독님의 특...,,,,,,,,,,,,,,,,,,,,,,,,,,,,
6,샬토 코플리 발음 거슬린다는넘들은 영어쓰는나라가 천조성님/영쿸 두나라 밖에 없는줄 아나봐요?,,,,,,,,,,,,,,,,,,,,,,,,,,,,
7,이정도 기술력에 방어기술도 못갖췄다고 평점깎는애는 세계관을 이해하지 못한듯.. 모든게 프로그래밍화된 엘리시움서 권한없이 무기체계를 사용못하니 인간을 이용해 지구에서부터 타격한게아니냐 그래서 의회서도 문책당한거고 조디...,,,,,,,,,,,,,,,,,,,,,,,,,,,,
8,감독 믿고 봤다  기대만큼 만족한 영화!,,,,,,,,,,,,,,,,,,,,,,,,,,,,
9,방금보고왔다 솔직히 숨바꼭질보다재미있다영화보지도 않고 평점 주는거 아니라고본다,,,,,,,,,,,,,,,,,,,,,,,,,,,,
10,최고!!! 단순 오락영화가 아니라 자본주의 비판과 의식있는 영화.. 맷데이먼같은 의식있는 배우가 주연을 곡 하고싶어한 이유가 있는 의식있는감독과 영화..추천!!,,,,,,,,,,,,,,,,,,,,,,,,,,,,
11,솔직히 설국열차보다 평점낮다는게 말이되냐?,,,,,,,,,,,,,,,,,,,,,,,,,,,,
12,계속 감독전작 디스트릭9하고 비교하는 사람들이 많은데 그영화는 외괴인을 기발하게 묘사해서 정치풍자로 주목을 받은것이지..  영화의 완성도와 기술력,,,,,,,,,,,,,,,,,,,,,,,,,,,,
13,평점이 너무 낮아서 안보려다가 봤는데.. 평점에 낚인기분?? 완전 잼있는데 평점 왜이런건지 ㅎ 간만에 본 대작!  역시 맷데이먼이었임^^,,,,,,,,,,,,,,,,,,,,,,,,,,,,
14,아직 우리나라의 영화수준은 낮구나...하...이런영화를 일점주다니...,,,,,,,,,,,,,,,,,,,,,,,,,,,,
15,그 분위기만으로도 10점 평점 테러하지 맙시다 볼만한 영화 입니다,,,,,,,,,,,,,,,,,,,,,,,,,,,,
16,이게 왜 청불인지 도대체 의문이다ㅋㅋㅋㅋㅋ재미는둘째치고서라도ㅋㅋㅋㅋㅋㅋㅋㅋㅋ속보임ㅋㅋ,,,,,,,,,,,,,,,,,,,,,,,,,,,,
17,언제부터인가 외국영화는 평점 7만넘어도 꼭 본다. 이유는 다 아시듯이 한국영화 알바들의 평점 테러. 역시 기대를 저버리지 않는 좋은 영화였음. 영화관에서 꼭 챙겨볼만한 영화. 주제. 영상미. 연기 모두 나무랄데 없이...,,,,,,,,,,,,,,,,,,,,,,,,,,,,
18,현 인류는 미래에 저럴수도 있을거같다,,,,,,,,,,,,,,,,,,,,,,,,,,,,
19,스토리,,,,,,,,,,,,,,,,,,,,,,,,,,,,
20,일단 sf류 영화 기준으로 보면 대작이며,,,,,,,,,,,,,,,,,,,,,,,,,,,,
21,전작만큼은 아니지만 긴박하고 사회비판의 흥미로운 영화,,,,,,,,,,,,,,,,,,,,,,,,,,,,
22,오늘보고왔어요 스펙터클한 전개와 그속에서 말하고자하는 이야기를 잘느낄수있었네요.. 멧데이먼의 연기 일품이고,,,,,,,,,,,,,,,,,,,,,,,,,,,,
23,아놔 젼나 재밌는데 평점 이따구야,,,,,,,,,,,,,,,,,,,,,,,,,,,,
24,정말 잘봤다. 감동도 있고.. 별반개 준 사람들은 뭐지?,,,,,,,,,,,,,,,,,,,,,,,,,,,,
25,재미있습니다 다들 뻥지고계속봤음 뭔가느낀점도있구요 넘평점이낮게 나와있어서아쉽네요 여튼다들한번보시길!,,,,,,,,,,,,,,,,,,,,,,,,,,,,
26,난  여자인데  잼나게 봤는데  왜  평론가들  평점은  이따구 ? ㅎㅎㅎㅎ 뭐  완벽이란 없으니 9점으로   하는   걸로,,,,,,,,,,,,,,,,,,,,,,,,,,,,
27,어이가없다 ㅅㅂ 게이버 평점~ 이런영화가 7점? 장난하냐? 아 그리고 아예 대놓고 은위같은 쓰레기영화 걍 9점 만들어주지그래~ ? 니들 그런쪽에서 평점조작 잘하자나,,,,,,,,,,,,,,,,,,,,,,,,,,,,
28,오늘 개봉했는데 평점 봐라.. 영화는 봤나..,,,,,,,,,,,,,,,,,,,,,,,,,,,,
29,전작이 너무 훌륭했기에 빛이 바랬다.  안타깝다.,,,,,,,,,,,,,,,,,,,,,,,,,,,,
30,샬토 코플리... 와~~ 이런면이,,,,,,,,,,,,,,,,,,,,,,,,,,,,
31,해묵은 상상력.. 영상미가 뛰어났으며 말하고자 하는 의미도 잘 알겠으나.. 중간중간 나오는 메카닉 소품들이 상당히 볼만하다.,,,,,,,,,,,,,,,,,,,,,,,,,,,,
32,등급은  정말 이해할수가 없군요영화는 재미있게 잘 봤습니다.가진자와 가지지못한자의 불평등은 먼미래에도 어쩔수가 없군요전투드로이드가 공기폭발총에 분해되는 장면은 정말 멋졌습니다 한번쯤 봐도 후회없는 영화,,,,,,,,,,,,,,,,,,,,,,,,,,,,
33,디스트릭9만큼이나  볼꺼리도 많고 재밌구만 이게 잼없단것들은 대체모지?,,,,,,,,,,,,,,,,,,,,,,,,,,,,
34,굳,,,,,,,,,,,,,,,,,,,,,,,,,,,,
35,설국열차보다 딱 10배 재밌다,,,,,,,,,,,,,,,,,,,,,,,,,,,,
36,정말 대박 ㅎㅎ꼭 보세요^^,,,,,,,,,,,,,,,,,,,,,,,,,,,,
37,기대에 부응했다,,,,,,,,,,,,,,,,,,,,,,,,,,,,
38,디스트릭트9과 대조되는 이유는 디스트릭트9이 워낙 명작이었기 때문이겠죠. 이 영화다음으로 디스트릭트9이 나왔다면 어떻게 나왔을지가 기대되게 만드는 영화네요. 큰 충격은 없었지만 거의 최상급의 질을 자랑하는 CG와 액...,,,,,,,,,,,,,,,,,,,,,,,,,,,,
39,스케일이 큰 액션은 없으나 멍때릴 시간조차 허락 하지 않는 영화 였다 라는 생각이 든다. 영화 참 잘만들었다.,,,,,,,,,,,,,,,,,,,,,,,,,,,,
40,초중반은 흥미 진진한대 갈수록 진부해짐 .. 마지막 전투씬에 벛꽃 날리는거 넘 이해 안됨,,,,,,,,,,,,,,,,,,,,,,,,,,,,
41,전 너무너무 재밌게봤어요,,,,,,,,,,,,,,,,,,,,,,,,,,,,
42,샬토코프리 악역이 돋보였음 꼭들 보세요~ 네이버 평점 개나줘버려!,,,,,,,,,,,,,,,,,,,,,,,,,,,,
43,이 영화의 주인공은 사람이 아닌 엘리시움이다.,,,,,,,,,,,,,,,,,,,,,,,,,,,,
44,디스토피아와 유토피아 .그것은 철저히  자본주의 관점에서 나누어진다.돈이 있는 1%들만 갈수있는 엘리시움.그리고 그곳을 받쳐주기위해 끊임없이 생산해야만하는  부품같은 99%의 인간들.중후반에 너무 의료쪽에 치중 한거...,,,,,,,,,,,,,,,,,,,,,,,,,,,,
45,우주가 등장한다는 점을 제하면 디스트릭트9은 전혀 생각이 안나네요. 샬토 코플리가 나오긴 하지만... 여튼 후대에 실제로 일어날 수도 있는 일처럼 보였고 표현도 잘 되어 있어 현실감이 있었으며 블롬캄프 감독 특유의 ...,,,,,,,,,,,,,,,,,,,,,,,,,,,,
46,간만에 시간가는줄모르고 본영화... 잔인한거때문에 평점 9점줍니다~,,,,,,,,,,,,,,,,,,,,,,,,,,,,
47,끝이 좀 뻔한 아메리칸 영웅 영화로 변질되긴 했지만 충분히 흥미로운 영화,,,,,,,,,,,,,,,,,,,,,,,,,,,,
48,본격적인 싸움의 과정이 아쉽지만 단순한 영웅적 SF가 아닌 개인의 욕망과 투쟁,,,,,,,,,,,,,,,,,,,,,,,,,,,,
49,올해 개봉영화중 최고였음.. 미래를 그리는 sf영화지만 엄청 현실감 있는 그래픽과 내용들... 처음부터 탄탄하게 기획한 영화인듯.. 중반이후에 좀 긴박하게 전개되면서 좀 산만한게 단점하지만 좋았음,,,,,,,,,,,,,,,,,,,,,,,,,,,,
50,올해 나온 영화 중에 대박입니다 한국영화 새끼들 알바좀 그만써라ㅋㅋㅋㅋ,,,,,,,,,,,,,,,,,,,,,,,,,,,,
51,나중에 진짜 이런 것이 현실이 될가? 기대된다.질병치료의료기기가 만들어지면 지금 동네 의사들은 이제 전방부대로 보내야 하나 ?스토리야 뻔하지만 세세한소품과 인물등은 흥미롭게 전개된다.장관이 너무 일찍 죽어서 좀 아쉽...,,,,,,,,,,,,,,,,,,,,,,,,,,,,
52,오호홋!!! 올해 내가 본 영화 중 TOP 3안에 드는 영화로 간택!,,,,,,,,,,,,,,,,,,,,,,,,,,,,
53,평점이 낫네요?....저는 올해 본영화중에 가장 좋았어요. 닐 감독 스타일이 너무 좋아요. 또보고 싶네요. 설국보다 훨씬 재미있네요...모든 면에서...,,,,,,,,,,,,,,,,,,,,,,,,,,,,
54,왜 이게 이렇게 평점이 낮은지 모르겠네요. 전 시간가는 줄도 모르고 몰입해서 재밌게 봤습니다. 맷 데이먼을 본시리즈 의외에 또 다른 영화에서 볼 수 있어서 좋았고요. 현실성 없긴 하지만 미래에 가면 저런 게 생길수도...,,,,,,,,,,,,,,,,,,,,,,,,,,,,
55,인간의 존엄성은 그의 존재 자체가 아닌 돈에 의해 결정되는가? 이러한 문제의식을 담은 영화들이 줄지어 개봉하고 있다. 현재의 시대의식은 이미 한 방향으로 흘러가고 있는듯하다,,,,,,,,,,,,,,,,,,,,,,,,,,,,
56,연기자들의연기력도훌륭하고스토리구성도괜찮고 연출도좋습니다 평점이왜이렇게낮은건지 이해가안되는군요..,,,,,,,,,,,,,,,,,,,,,,,,,,,,
57,재밌기만 하더만ㅋㅋ설국열차 보다는 훨씬 재밌었다 솔직히,,,,,,,,,,,,,,,,,,,,,,,,,,,,
58,최근본영화중 최고입니다.배우캐스팅부터 스토리도탄탄했구요.막판리부팅이좀허무했어요,,,,,,,,,,,,,,,,,,,,,,,,,,,,
59,평점이 생각보다 낮네요. 액션씬도 볼만 했고 스토리도 나쁘지 않았는데. 나름 재밌게 보았습니다.  개인적으로 평점 8.0은 되는 영화라고 생각 합니다.,,,,,,,,,,,,,,,,,,,,,,,,,,,,
60,리얼 아이언맨. 과장이 없이 투박한 아이언맨. 아이언맨과 설국열차,,,,,,,,,,,,,,,,,,,,,,,,,,,,
61,디스트릭트9 보다는 못하다는것을 부정할수는  없지만 ..이민국문제나 제약회사의 제3세계에서의 폭리를 다루었고 또한  독창적인 우울한SF를 선사한다는점에서 높이 살만한 영화...디스트릭트9 2편을 아직 기다리는 1인,,,,,,,,,,,,,,,,,,,,,,,,,,,,
62,잼잇든데 평점이 왜 낫지?사십대주부 조조로 잘봤습니다.,,,,,,,,,,,,,,,,,,,,,,,,,,,,
63,사람터져죽으니 잔인하니까 19세이상인거고 ..  그리고 볼만함 안봤으면 말을하지마세요!,,,,,,,,,,,,,,,,,,,,,,,,,,,,
64,괜찮은데.. 굿!!!,,,,,,,,,,,,,,,,,,,,,,,,,,,,
65,전작처럼 사지가 펑펑 터지는데 청불이라고 징징대는것들은 뭐지?,,,,,,,,,,,,,,,,,,,,,,,,,,,,
66,완전 재밌게 보고왔는데 평점이 낮아서 당황....8점 정도가 딱일듯,,,,,,,,,,,,,,,,,,,,,,,,,,,,
67,참나 재미도 있고 나름 감동도 있고 상상력 좋구만ㅋ그래두 앞에 디스트릭트랑 겹치는게 좀 있어서 별 빼려다가 1점 준 사람들때문에 10점,,,,,,,,,,,,,,,,,,,,,,,,,,,,
68,네이버평점 맞추려 로긴했구 오랫만에 댓글달지만 8.3이면 몰라도 솔직히 평점 7.3은 아니다... SF 장르로 이야기하자면 올해 아이언맨3 와 견줄수 있는 유일한 영화다.. 형말믿고 관심있음 가서 봐라.. 돈아깝단 ...,,,,,,,,,,,,,,,,,,,,,,,,,,,,
69,ㅇㅇ재닛음,,,,,,,,,,,,,,,,,,,,,,,,,,,,
70,엘리시움 이 작품은 물론 볼거리? 스토리? 중요한건 디스트릭트9 감독이 전하고자 하는 메세지가 분명 존재하는영화! 디9작품에서 보여줫던 색감 씨지 표현기법 아주 내 스타일~~디9 2편대신 엘리시움을 선물한듯~!,,,,,,,,,,,,,,,,,,,,,,,,,,,,
71,시각적으로든 줄거리든 충분히 즐거웠다. 역시 믿고보는 멧데이먼 !!♥,,,,,,,,,,,,,,,,,,,,,,,,,,,,
72,올해가장인상깊은영화,,,,,,,,,,,,,,,,,,,,,,,,,,,,
73,배경은 디스트릭스와 비슷하지만 내용은 다르다 그리고 감동도 있다 흉측한 장면이 있기때문에 19세관람인가보다 간만에 잼있게보고 또한 미국에 시민권 없는 사람들을 대변해주는 영화이다,,,,,,,,,,,,,,,,,,,,,,,,,,,,
74,모든 영화가 반전이 있어야 할 필요는 없다! 액션,,,,,,,,,,,,,,,,,,,,,,,,,,,,
75,봐도 후회 없을것 같네요,,,,,,,,,,,,,,,,,,,,,,,,,,,,
76,전작도 지금작품도 좋았음. 엘리시움을 좀더보여주시지 그 의료기기는 정말...b 좀 덜 잔인했으면 좋았을법한영화,,,,,,,,,,,,,,,,,,,,,,,,,,,,
77,한국영화보다 잼있기만하구만..대체 왜 한국영화는 평점이 모조리다 좋은거지..... 역시 국뽕,,,,,,,,,,,,,,,,,,,,,,,,,,,,
78,최고 .평점 머냐 ㅋㅋㅋㅋ 장난 까냐?  한국 영화 알바생들 .거기다가 청소년 관람불가 해놓고 ????? 한국영화 밀어주기 식으로 이런 대작을 하 -_- 어이없네,,,,,,,,,,,,,,,,,,,,,,,,,,,,
79,올만에 만난 대작영화~ 뒷부분 스토리가 쫌 아쉽지만... 또보고싶다^^,,,,,,,,,,,,,,,,,,,,,,,,,,,,
80,영화 퀄리티에 비해 평점이 낮네요...,,,,,,,,,,,,,,,,,,,,,,,,,,,,
81,최고다,,,,,,,,,,,,,,,,,,,,,,,,,,,,
82,역시 감독은 실망인시키네 디스트릭9에나온 주인공 연기 너무  찰지게 잘함 평점 너무 낮음 알바안쓰니,,,,,,,,,,,,,,,,,,,,,,,,,,,,
83,어제 보고 바로10점 최근 설국,,,,,,,,,,,,,,,,,,,,,,,,,,,,
84,영화가 끝나기전까지 흥미진진하다. 지루하지않고 어떤 SF영화와 비교해도 밀리지 않을만한 볼거리를 제공한다. 하지만 끝이 약간 아쉬운데 2편이 나왔음한다.,,,,,,,,,,,,,,,,,,,,,,,,,,,,
85,볼거리가 쏠쏠 ㅇㅇ,,,,,,,,,,,,,,,,,,,,,,,,,,,,
86,최고임...인터넷 보고서 진짜 망설여졌었는데 와 .....진짜 ...최고 꼭봐야함 두번봐야함,,,,,,,,,,,,,,,,,,,,,,,,,,,,
87,역시 샬코연기가 참좋네요 ㅎ  암튼 저는 전나게 재밌게봄  한번더보고싶을정도네요,,,,,,,,,,,,,,,,,,,,,,,,,,,,
88,백혈병을 스캔만으로 완치할 수 있는 의료기술이  탈모는 왜 때문에 완치할 수 없는 것일까,,,,,,,,,,,,,,,,,,,,,,,,,,,,
89,아무리 그래도 7점대의 영화는 아니다. 8.5전후라고 생각하지만,,,,,,,,,,,,,,,,,,,,,,,,,,,,
90,46남_2번관람_처음 보았을때는 멍했는데 두번째 보니까 메세지가 보이네요_간절함,,,,,,,,,,,,,,,,,,,,,,,,,,,,
91,샬토 코플리의 미칠듯한 연기력에 다시한번 놀랐다. 엄청난 연기ㄷㄷㄷ 아쉬움이 있다면 벌려놓은 배경상황에 비해서 일이 술술풀리고 결론이 좀 쉽게 나버리는듯한.....그래도 추천!,,,,,,,,,,,,,,,,,,,,,,,,,,,,
92,디스트릭트 9의 소프트 버전이랄까? 볼 만 했습니다.,,,,,,,,,,,,,,,,,,,,,,,,,,,,
93,잘 봤습니다.. 근래 봤던 영화중 최고.,,,,,,,,,,,,,,,,,,,,,,,,,,,,
94,평점 처음써보는데 영화에비해 평점이 너무 낮은거갖아서..그만큼 소재도 신선하고재미있게봤당~~,,,,,,,,,,,,,,,,,,,,,,,,,,,,
95,개인적으로 설국열차보다 재밋고 짜임새잇는 영화엿음,,,,,,,,,,,,,,,,,,,,,,,,,,,,
96,영화등급이 아쉽다. 잔인한거 몇 장면 지우고 15세로 낮추면 더 흥행 할 수 있었는뎃..;;  그리고 비현실적이긴 하지만 우리 관객들은 영화를 통해 현실과 다른 상황에 즐거워하고 영화니까 상상하는 즐거움을 직접 표현...,,,,,,,,,,,,,,,,,,,,,,,,,,,,
97,아니 생각보다 평점이 낮네ㅋㅋㅋ 참나 어제 보고왔는데 재밋기만하더구만 샬토 코플리 연기도 쩔고 무엇보다도 맷 데이먼 항상기대되는 배우인만큼 영화 잘풀어나갔고ㅋㅋㅋ 어디서 알바들이 설쳐대 참나ㅋㅋㅋ,,,,,,,,,,,,,,,,,,,,,,,,,,,,
98,진짜 최고의 영화다 집중도 잘되고 스토리가 탄탄하다. 솔직히 설국열차의 3배는 재미잇던듯.규모가 너무 크다. 전투씬도 색다르고. 회복되는거 보여주는거랑. 미래의 하이테크를 다보여준듯하다,,,,,,,,,,,,,,,,,,,,,,,,,,,,
99,감독의 상상력에 감탄하고 CG에 감탄하고...간만에 나의 지적갈증을 해소해준 영화.,,,,,,,,,,,,,,,,,,,,,,,,,,,,
100,재 미있다,,,,,,,,,,,,,,,,,,,,,,,,,,,,
101,사회주의사상으로 몰아가는 일부 사람들이 있지만.. 영화평점자체가 잘못된듯합니다.. 디스트릭트9 처럼 날카로왔습니다,,,,,,,,,,,,,,,,,,,,,,,,,,,,
102,탄탄하게 잘 만들었다고 생각한다. District 9 에 비해 흥행을 염두에 둔 설정들이 좀 있지만 그래도 감독이 말하려는 이야기도 전달할 수 있고,,,,,,,,,,,,,,,,,,,,,,,,,,,,
103,맷데이먼 너무 좋음 ㅎㅎ 스토리 좀  아쉽긴 하지만 액션이랑 비주얼너무 좋았음. 닐 블롬캠프 감독진짜 대단한가 같음,,,,,,,,,,,,,,,,,,,,,,,,,,,,
104,정말 상상력 짱. SF 영화다운 영화. 편하게 재미있게 본영화.,,,,,,,,,,,,,,,,,,,,,,,,,,,,
105,화려하게 부수고 죽이는건 아니지만 괜찮은 구성이였던듯. 내용도 괜찮고...그치만 디스트릭트9을 떠올리면서 본다면 조금 아쉬울 수 있음,,,,,,,,,,,,,,,,,,,,,,,,,,,,
106,메시지는 이렇게 담아야 한다.,,,,,,,,,,,,,,,,,,,,,,,,,,,,
107,감독의 전작작품과 비교할 수는 없지만.. 나름 재미와 상상력을 자극하는 괜찮은 영화임은 분명하다.. 그럼에도 네이버평점은 개판이네..,,,,,,,,,,,,,,,,,,,,,,,,,,,,
108,굉장히 재밌다추천한다 꼭봐라돈안아깝다,,,,,,,,,,,,,,,,,,,,,,,,,,,,
109,디스트릭트9보다는 못하긴하네요 메세지도그렇고 액션영화로는괜찬습니다 점수가너무낮아서 좀더줍니다,,,,,,,,,,,,,,,,,,,,,,,,,,,,
110,샬토 코플리의 호연만으로도 충분히 빛난 영화,,,,,,,,,,,,,,,,,,,,,,,,,,,,
111,저는 정말 재미있게 봤네요! ㅎㅎ,,,,,,,,,,,,,,,,,,,,,,,,,,,,
112,ㅋㅋ 재밌음 ㅋ 마지막에 좀 뭉클하고 좋았음 ㅋㅋ 근데 왜 청소년 관람불가냐고 하는사람들;; 이거 좀 잔인한부분이 있음;; 그래서 그런거일듯;; 아마 ;; 나도 보다 깜놀;;;수류탄에 얼굴날아가고;;으;; 잔인한장면...,,,,,,,,,,,,,,,,,,,,,,,,,,,,
113,반드시 재평가받아야될 걸작이다.. 이영화만큼 인류의 미래를 이토록 리얼하게 그린 sf영화는 본적이 없다..시간이 더흐른다면 이영화의 무시무시한 표현력에 감탄할날이 올거다.. 큐브릭의 2001스페이스오디세이 정도의 지...,,,,,,,,,,,,,,,,,,,,,,,,,,,,
114,"감독의 디스트릭트9 보다 보기에 덜 불편하다. 이 영화에 누군가가 ""상상력부재"" 라는 평을 한다면",,,,,,,,,,,,,,,,,,,,,,,,,,,,
115,(스포있음)맷 데이먼이라 믿고 봤고 볼만은 했지만 결말은 찜찜하다. 사람들은 죽지 않고 인구는 계속 늘어날것이며 지구의 오염은 더욱 심각해질 것이다. 영웅의 숭고한 희생을 보여주려 했겠지만 나는 그 뒤가 더 문제라는...,,,,,,,,,,,,,,,,,,,,,,,,,,,,
116,8점은넘어도되는데..평점올리려고10점드립니다8점짜리영화!볼만해요,,,,,,,,,,,,,,,,,,,,,,,,,,,,
117,전작보단 못하지만 충분히 재밌었다,,,,,,,,,,,,,,,,,,,,,,,,,,,,
118,개인적으로는 재밌게 봤습니다.........볼만합니다.,,,,,,,,,,,,,,,,,,,,,,,,,,,,
119,재미있었다 나름 감동과 재미도 있었고  소장하고 다시 보고 싶은 영화이다,,,,,,,,,,,,,,,,,,,,,,,,,,,,
120,짱 ㅋㅋ  숨ㅂ꼭질이랑 설국열차보다 훨 낫다.ㅋ 더테러라이브랑 앨리시움 재밌다.,,,,,,,,,,,,,,,,,,,,,,,,,,,,
121,요새 나온 영화들 중에 가장 재밌어요 :-),,,,,,,,,,,,,,,,,,,,,,,,,,,,
122,깡패나오는 코믹영화에 평점9점주는 한국인들의 근성으로는 이 영화 이해할수 있으려나? 미국의 현재 문제점을 보여주었는데 말이다. 디스트릭트9 다음으로 기대했다. 이 영화를 단순 오락영화로만 볼거면 보지마라.,,,,,,,,,,,,,,,,,,,,,,,,,,,,
123,이게 왜 평점이 7점인지 모르겟네... 재밌었다. 초반이 약간 난잡하긴하지만 커버가되고 엘리시움의 CG가 매우 뛰어났다. 특히 OST가 무척좋다. 하지만 SF요소가 많이 떨어지는건 아쉬운부분...그리고 이게 왜 18...,,,,,,,,,,,,,,,,,,,,,,,,,,,,
124,와... 진짜 올해 본 영화중에 최고!!! 보세요. 보고 말해~,,,,,,,,,,,,,,,,,,,,,,,,,,,,
125,추석연휴동안 우리나라 영화를 위협할 수 있는 유일한 외화지만 닐은 우리나라의 얄팍한 영화시장 점유율로 인해 흥행은 실패할지도 모른다 청불설정에 평점알바에 연타맞고 넉아웃 그래도 영화 좀 볼줄 아는 사람은 닐의 두번째...,,,,,,,,,,,,,,,,,,,,,,,,,,,,
126,최근 본 영화중 최고였네요,,,,,,,,,,,,,,,,,,,,,,,,,,,,
127,더 뭘 바라나 ?  스토리 화면 다좋은데 하여튼 알바들 때문에 평점을 믿을 수가 없다니깐!,,,,,,,,,,,,,,,,,,,,,,,,,,,,
128,10점이지 모든 면에서.!!!,,,,,,,,,,,,,,,,,,,,,,,,,,,,
129,모든면에서 최고아닌가..,,,,,,,,,,,,,,,,,,,,,,,,,,,,
130,재밌는데뭘.ㅋ,,,,,,,,,,,,,,,,,,,,,,,,,,,,
131,잼나게,,,,,,,,,,,,,,,,,,,,,,,,,,,,
132,전작에서는 보잘것 없는 한 남자가 대박을 한번 치는 구성이다 보니,,,,,,,,,,,,,,,,,,,,,,,,,,,,
133,스토리의 기승전결 확실했고,,,,,,,,,,,,,,,,,,,,,,,,,,,,
134,알바안써서 이렇게 안타까운적은 처음이네~이 영화가 빛을 못보구 있어서 안타깝습니다.게다가 청불이라니..ㅠㅠ오랫만에 빠져들어서 본 영화입니다. 설국열차와 전체적인 줄거리에서 비슷한면이 있는데 엘리시움은 완전몰입해서 봤...,,,,,,,,,,,,,,,,,,,,,,,,,,,,
135,엘리시움 덕분에 앞으로 네이버 평점은 절대 신뢰하지 않기로 했다. 고맙다.,,,,,,,,,,,,,,,,,,,,,,,,,,,,
136,현실감있는 감독의 영화.,,,,,,,,,,,,,,,,,,,,,,,,,,,,
137,역시 믿고보는 닐블롬캠프 . 디스트릭트9만큼의 신선함과 여운은 적었지만 재미있었음 올해sf영화중 단연최고인듯,,,,,,,,,,,,,,,,,,,,,,,,,,,,
138,전작 운운하는데.. 왜 이걸 자꾸 전작과 이어 붙혀서 생각하지.. 엘리시움은 그 자체만으로도 충분한 흥미와 재미,,,,,,,,,,,,,,,,,,,,,,,,,,,,
139,아이디 찍어서 평점남긴것이 엘리시움 뿐이라면 알바일가능성 95프로 이상이다. 난 진짜 재밌게봤다.,,,,,,,,,,,,,,,,,,,,,,,,,,,,
140,일단 재미있음! 영화 속 의미까지 더해서 더 좋음 그리고 맷데이먼 멋있다 아쉬운게 있다면 러닝타임이 짧음..,,,,,,,,,,,,,,,,,,,,,,,,,,,,
141,존나 재밌어,,,,,,,,,,,,,,,,,,,,,,,,,,,,
142,왜 이게 7점대냐! 내가 평균점수를올려주지. 닐블룸켐프 굿,,,,,,,,,,,,,,,,,,,,,,,,,,,,
143,엘리시움 줄거리 쓴사람은 진자 무에서 유를 창조하는 능력을 가진 사람이네.,,,,,,,,,,,,,,,,,,,,,,,,,,,,
144,기득권층이 리셋되는 쾌감,,,,,,,,,,,,,,,,,,,,,,,,,,,,
145,눈도 즐겁고 스릴도있고 마지막엔 엄청 감동크리..,,,,,,,,,,,,,,,,,,,,,,,,,,,,
146,초반 중반은 흥미로운데 마무리가 엉성합디다. 그리고 디스트릭트의 세계관에서 못 벗어난다는 점이 재미를 반감시켰고 이게 왜 19금인지도 이해가 안되지만 그덕에 초딩들 소음걱정은 없어서 다행이라면 다행일까. 여러면에서 ...,,,,,,,,,,,,,,,,,,,,,,,,,,,,
147,앨리시움 영상 정말 초현실미래,,,,,,,,,,,,,,,,,,,,,,,,,,,,
148,재밌어요,,,,,,,,,,,,,,,,,,,,,,,,,,,,
149,2013최고의 SF영화,,,,,,,,,,,,,,,,,,,,,,,,,,,,
150,재밌더라. SF요소도 잘 들어가있고  속도감이 있어서 쉴틈없이 뛰는 느낌이야. 다만 아쉬운건 엘리시움 보안이 너무 허접하게 뚫린데다가(쿠데타가 젤 쉬웠어요) 보안처리된 코드를 보고 개나소나 다 보자마자 해석해버리는 ...,,,,,,,,,,,,,,,,,,,,,,,,,,,,
151,난 마지막이 약간 별로였지만 역시 맷 형님은 날 실망 시키는 사람이 아니야,,,,,,,,,,,,,,,,,,,,,,,,,,,,
152,볼까말까하다 봤는데 .. 보길 잘했다는 생각이..재밌게 봤습니다~,,,,,,,,,,,,,,,,,,,,,,,,,,,,
153,구성이 깔끔하다 올해들어 본영화중 기승전결이 가장 확실해서 재밌었다,,,,,,,,,,,,,,,,,,,,,,,,,,,,
154,맷데이먼 수난기...ㅋㅋ 근래 SF 영화들 다소 뻔했는데 영상적으로 참신하고 화려했다.,,,,,,,,,,,,,,,,,,,,,,,,,,,,
155,예상보다 훨 잼있었고. . 배우들 명연기. . 신기한미래무기와 배경들~~!! 넘 잼있었슴,,,,,,,,,,,,,,,,,,,,,,,,,,,,
156,이영화 제작사가 평점알바를 안썻구나 생각하고 등급심사받을때 뇌물을 안줫구나 생각한다,,,,,,,,,,,,,,,,,,,,,,,,,,,,
157,클리셰적인 요소와 주제를 최고의 연출로 엄청난 감동을 끌어낸다. 솔직히 말해 SF 적 재미를 바란다면 실망이 적잖을 듯. 하지만 나는 올 하반기 관람한 영화 중 가장 최고의 영화라고 단언할 수 있다. 평점이 이런 이...,,,,,,,,,,,,,,,,,,,,,,,,,,,,
158,줄거리는 뻔히 보이지만,,,,,,,,,,,,,,,,,,,,,,,,,,,,
159,평점이 너무 낮네요,,,,,,,,,,,,,,,,,,,,,,,,,,,,
160,평점은믿을께못된다와이프랑 재미있게봄 외국영화가 역시 스케일이큼,,,,,,,,,,,,,,,,,,,,,,,,,,,,
161,재밌네요! 매튜는 상당히 매력적인 배우인듯,,,,,,,,,,,,,,,,,,,,,,,,,,,,
162,정말 2013년에 나온 영화중 몇개 별로안봤지만 개인적으로 정말 올해 최고의 영화가아닐까 싶네요 정말 재미가돋보입니다~^^,,,,,,,,,,,,,,,,,,,,,,,,,,,,
