,content,,,,,,,,,,,,,,,,,,,,,,,,,,,,
1847,킬링타임용으로 괜찮습니다.,,,,,,,,,,,,,,,,,,,,,,,,,,,,
1848,액션이 떨어지지만 역시나 메시지가 강한영화다. 현실세계를 잘반영한 씁쓸함이 느껴지는 영화.,,,,,,,,,,,,,,,,,,,,,,,,,,,,
1849,재밌는데요 .. 평이너무 낮습니다 빈부격차도 잘 표현했구요,,,,,,,,,,,,,,,,,,,,,,,,,,,,
1850,디스트릭트9은 9점 이건 8점! 볼만함,,,,,,,,,,,,,,,,,,,,,,,,,,,,
1851,뻔한 미국식 영웅 이야기,,,,,,,,,,,,,,,,,,,,,,,,,,,,
1852,보면서 총몽 생각이 나던데,,,,,,,,,,,,,,,,,,,,,,,,,,,,
1853,디스트릭트9 때문에 기대가 너무 높았나... 이번엔 그저 그렇다,,,,,,,,,,,,,,,,,,,,,,,,,,,,
1854,배경보다 이야기를 크게 만들지 못했지만 세계관은 훌륭하다.,,,,,,,,,,,,,,,,,,,,,,,,,,,,
1855,주인공의 희생에도 지루한 결말...  좋은 아이디어로 시작하였으나 허무한 전개..,,,,,,,,,,,,,,,,,,,,,,,,,,,,
1856,스릴 넘치는 액션을 기대했지만 별다른 재미없이 무난한 헐리우드식 액션씬만 보여준 영화. 그래도 예상 가능한 스토리 안에서 할건 다 했다. 조디 포스터의 카리스마있는 연기는 좋았으나 굳이 이 역할이 꼭 조디 포스터여야...,,,,,,,,,,,,,,,,,,,,,,,,,,,,
1857,소재가 좋은데 그걸 잘 살리지 못했단 느낌이 팍들었음... 그래도 마지막엔 훈훈하고 감독적이였음 7점준다.,,,,,,,,,,,,,,,,,,,,,,,,,,,,
1858,특별했던 초반부,,,,,,,,,,,,,,,,,,,,,,,,,,,,
1859,의료민영화하면 이렇게 되는거다... 가진자들만이 누리는 의료혜택,,,,,,,,,,,,,,,,,,,,,,,,,,,,
1860,상상력은 기발하네..,,,,,,,,,,,,,,,,,,,,,,,,,,,,
1861,가진자들  그들만의 세상과 병들고 아픈 지구라는 곳에 사는 사람들... 여러모로인상깊었고 영화의 후반부에 아이에게말해주는  수녀님의  말이 마음에 와닿아 마음이 짠했다.,,,,,,,,,,,,,,,,,,,,,,,,,,,,
1862,잉 슬퍼. 재밌었다. 아무 생각없이 봤는데 ....,,,,,,,,,,,,,,,,,,,,,,,,,,,,
1863,딱히 할 말이 없는 영화...,,,,,,,,,,,,,,,,,,,,,,,,,,,,
1864,8점8점8점8점8점,,,,,,,,,,,,,,,,,,,,,,,,,,,,
1865,맷데이먼...이니까..,,,,,,,,,,,,,,,,,,,,,,,,,,,,
1866,엔딩이 너무 허무...그리고...저런날이 언젠가 올거 같은 느낌???ㅋ,,,,,,,,,,,,,,,,,,,,,,,,,,,,
1867,주제가 의마하는 바가 크네요~,,,,,,,,,,,,,,,,,,,,,,,,,,,,
1868,그만의 창의적 세계관. 주연배우들. 화려한 볼거리 모든 게 각 좋었지만 하나로 완성되지는 않았던 것 같다. 과장된 액션과 스케일에 비해 한정적인 배역들... 오히려 몰입감을 떨어뜨렸다. 허지만 그것만으로도 좋았다.,,,,,,,,,,,,,,,,,,,,,,,,,,,,
1869,좋은펜으로 글을 쓴다고 좋은글이 써지는건 아니다,,,,,,,,,,,,,,,,,,,,,,,,,,,,
1870,역시.. 재밌구만요^^~ 괜춚은 영화임,,,,,,,,,,,,,,,,,,,,,,,,,,,,
1871,솔직히 이거 볼만하지 않냐?,,,,,,,,,,,,,,,,,,,,,,,,,,,,
1872,보는 내내 재미는 있다. 하지만,,,,,,,,,,,,,,,,,,,,,,,,,,,,
1873,저곳과 이곳 다른점을 찾을 수 없다,,,,,,,,,,,,,,,,,,,,,,,,,,,,
1874,돈 처들인 졸작. 뭐 하나 내세울게 없는 영화. 스토리 한심,,,,,,,,,,,,,,,,,,,,,,,,,,,,
1875,쥔장은 SF영화를 그다지 좋아하지는 않는편이라 즐겨보거나 찾아보지는 않는데 이런 영화땜에 내가SF영화에 흥미를 붙이지 못하는듯 하다. 처음에는 두개의 지구를 넘나들며 흥미로운 영상을 제공하더만중후반으로 갈수록 집중력...,,,,,,,,,,,,,,,,,,,,,,,,,,,,
1876,디스트릭9같은 영화는 다신 못볼줄 알았는데한남자의 고독한 사투와 화려한 무기및 영상미가 맘에든다 자신만의 색깔이 있는 감독임을 보여줬다,,,,,,,,,,,,,,,,,,,,,,,,,,,,
1877,나쁘지 않았다. 하지만 좋지도 않았다.,,,,,,,,,,,,,,,,,,,,,,,,,,,,
1878,소주 한잔이 달콤한 이유,,,,,,,,,,,,,,,,,,,,,,,,,,,,
1879,절망 속에서 희망을 보다..,,,,,,,,,,,,,,,,,,,,,,,,,,,,
1880,긴장감넘치는 스토리가 좋았으나 결말이좀...파괴가 인간의 본능이라면 엘리시움도 오래가진 못할듯...디스트릭트도 그랬지만 결국은 이영화도 인간이 악으로 나오네요,,,,,,,,,,,,,,,,,,,,,,,,,,,,
1881,^^생각보다 좋았어요 추천,,,,,,,,,,,,,,,,,,,,,,,,,,,,
1882,처음에는 뭔가 대단한게 나올줄 알았는데 끝으로 갈 수록 아쉬움이 많이 남는 영화.. 신선함도 아니고 이도 저도 아님..,,,,,,,,,,,,,,,,,,,,,,,,,,,,
1883,맷 데이먼 믿고봤는데 이런영화를 평점 조작해서 설국열차나 관상보다 평점아래로만든 네이버에박수를 한국영화안보는 이유가다있다,,,,,,,,,,,,,,,,,,,,,,,,,,,,
1884,의도하는 바가 비슷하고 같은 민주주의되 설국열차가 횡적 전진이라면 엘리시움은 종적 오름이더라. 엘리시움이 전복을 통한 평등구현이라면,,,,,,,,,,,,,,,,,,,,,,,,,,,,
1885,가까운 미래에 이런 영화같은 일이 있을 것만 같아서..,,,,,,,,,,,,,,,,,,,,,,,,,,,,
1886,아아 닐감독 디스트릭트때의 액션 스토리 연출의 기막힌 3박자는 어디에? 비슷한 느낌의 영화로 인타임을 볼수있겠네만?둘다똑같이 헛웃음 나오는 무미건조한 영화라는것도 비슷한게 문제 ..이번은 슬럼프라고치고 다시한번디스트...,,,,,,,,,,,,,,,,,,,,,,,,,,,,
1887,한마디만 쓴ㄷㅏ 굿..,,,,,,,,,,,,,,,,,,,,,,,,,,,,
1888,재미있게봤네요 정부에 대한 비판 및 상류층들의 이기심 등 많은 것들 볼 수있네요,,,,,,,,,,,,,,,,,,,,,,,,,,,,
1889,주인공이 희생하여 모든사람들을 구한다.난 이게 제일 안타까움..,,,,,,,,,,,,,,,,,,,,,,,,,,,,
1890,감독믿고 무조건 봤어요 기대만큼 훌륭했구요 올만에 넘 몰입해서 본 영화,,,,,,,,,,,,,,,,,,,,,,,,,,,,
1891,소재의 50% 정도만 살린듯..  임팩트가 아쉽다.,,,,,,,,,,,,,,,,,,,,,,,,,,,,
1892,생각보단 훨씬 별로. 뭔가 씬간이 뚝뚝 끊기는 부자연스러움이 느껴졌다. 감독이 말하고자하는 바는 알겠으나 그게 너무 지나치게 강조된 나머지 영화 맛이 안느껴진다. 마치 조미료가 강한느낌. 원래 감독이 말하고자하는바와...,,,,,,,,,,,,,,,,,,,,,,,,,,,,
1893,재미있게 봤음...ㅇㅇㅇ,,,,,,,,,,,,,,,,,,,,,,,,,,,,
1894,영화 전반의 주제에는 공감하나 재미는 그다지.,,,,,,,,,,,,,,,,,,,,,,,,,,,,
1895,그냥볼만했네요 잘만들수도있을텐데하는 아쉬움은 있습니다,,,,,,,,,,,,,,,,,,,,,,,,,,,,
1896,가진 자들의 욕망을 보여준 영화,,,,,,,,,,,,,,,,,,,,,,,,,,,,
1897,무난하게 본 영화다. 킬링타임용.,,,,,,,,,,,,,,,,,,,,,,,,,,,,
1898,쉽게 공감가지 않는 캐릭터들... 두서없는 스토리라인. 닐 블롬캄프 감독 실망입니다.,,,,,,,,,,,,,,,,,,,,,,,,,,,,
1899,화려해진 스케일에 비해 내러티브가 부족하다.,,,,,,,,,,,,,,,,,,,,,,,,,,,,
1900,중간중간 뜬금포만 잘풀어갔다면 9점이 되었을텐데,,,,,,,,,,,,,,,,,,,,,,,,,,,,
1901,디스트리트9 감독이 맷데이먼,,,,,,,,,,,,,,,,,,,,,,,,,,,,
1902,분명 나쁜영화는 아님. 전달하려는 의미도 명확했고 연기,,,,,,,,,,,,,,,,,,,,,,,,,,,,
1903,긴박함과 흥미는  디스트릭트9 못지않지만,,,,,,,,,,,,,,,,,,,,,,,,,,,,
1904,좋아하는 장르,,,,,,,,,,,,,,,,,,,,,,,,,,,,
1905,그냥뻔한영화 굳이볼필요없음,,,,,,,,,,,,,,,,,,,,,,,,,,,,
1906,5점이상 못주겠다.. 감독은 총살해라,,,,,,,,,,,,,,,,,,,,,,,,,,,,
1907,재밌기만하구만.  미래 사회상을 상당히 잘 그려냈다.,,,,,,,,,,,,,,,,,,,,,,,,,,,,
1908,누군가가 포스터만 보고 낚이지 말라고 했는데,,,,,,,,,,,,,,,,,,,,,,,,,,,,
1909,엘리시움을 기대했는데 폐허가 된 지구의 황무지만 나오네. 제작비 좀 굳히셨나요?,,,,,,,,,,,,,,,,,,,,,,,,,,,,
1910,화려하진 않지만 액션과 감동으로 멋지게 만들어낸 영화 !,,,,,,,,,,,,,,,,,,,,,,,,,,,,
1911,시나리오가 너무 엉성하다.. 쩝..,,,,,,,,,,,,,,,,,,,,,,,,,,,,
1912,솔직히 스토리:크게 인상적이진 않음,,,,,,,,,,,,,,,,,,,,,,,,,,,,
1913,맷 데이먼이 주연이라 무조건 보는 영화. 전체적으로 약간씩 아쉽게 만드는 영화.,,,,,,,,,,,,,,,,,,,,,,,,,,,,
1914,재밌음. 디스트릭트9 확장판 버전으로 봐도 괜찮을듯. 단순한 소재를 완성도있게 풀어 쉽게 잘 풀어낸 영화.,,,,,,,,,,,,,,,,,,,,,,,,,,,,
1915,수작은 아니라도 가작의점수를주는데 반론의여지가없을듯 명작인 다크나이트와 비교할순없지만 영화에서 시사하는 메시지는 있는듯 추천합니다,,,,,,,,,,,,,,,,,,,,,,,,,,,,
1916,디스트릭트9보다는 못하지만,,,,,,,,,,,,,,,,,,,,,,,,,,,,
1917,베리칩홍보작품. (손목에 새긴 시민증으로 첨단의료혜택을 받는다)고 대중을 세뇌하는 게 목적. 그러나 그 시민증이 시민통제를 목적으로 사용된다면 어쩔건데?,,,,,,,,,,,,,,,,,,,,,,,,,,,,
1918,현실감 돋는 CG처리,,,,,,,,,,,,,,,,,,,,,,,,,,,,
1919,좀 더 정교하고 탄탄하게 만들었더라면 하는 아쉬움이 남는 영화!,,,,,,,,,,,,,,,,,,,,,,,,,,,,
1920,잼있게 잘봤네요 //역시 댓글과 평점차이는 극과극이군요 전 충분히 볼만한영화라 생각합니다,,,,,,,,,,,,,,,,,,,,,,,,,,,,
1921,엘리시움을 만들어놓곤 그 이후의 SF적 상상력이 없다. 총질좀 하다가 격투좀 하다가 주인공의 희생으로 모두를 구하는 전형적인 이야기. 엔딩을 보니 굳이 돈들여 SF로 만들 필요가 있었을까 싶다.,,,,,,,,,,,,,,,,,,,,,,,,,,,,
1922,진격 건강보험을위해 달자~~!! 의료보험 민영화하면 클나~~!!,,,,,,,,,,,,,,,,,,,,,,,,,,,,
1923,전작에 비해 색다른 맛은 없지만 액션은 더 발전한 듯,,,,,,,,,,,,,,,,,,,,,,,,,,,,
1924,주인공이 너무약해서 통쾌한 맛이없다 만능의료기  저건갖고 싶네,,,,,,,,,,,,,,,,,,,,,,,,,,,,
1925,140년 후 라기엔 배경이 더 먼 미래같은데?,,,,,,,,,,,,,,,,,,,,,,,,,,,,
1926,내가 볼땐 빈부격차 그딴 걸 비판하는 영화가 아니라 걍 기독교영화 같은데,,,,,,,,,,,,,,,,,,,,,,,,,,,,
1927,재미없다길래 그냥 봤는데 저는 재미있게 봤습니다.우리 사회를 정확하게 보여주는 내용이네요.  빈익빈 부익부사회..,,,,,,,,,,,,,,,,,,,,,,,,,,,,
1928,정신 차리자. 정신 못 차리면 이건 영화로 끝날 일이 아니다.,,,,,,,,,,,,,,,,,,,,,,,,,,,,
1929,기대에는 못미치지만 재밋다,,,,,,,,,,,,,,,,,,,,,,,,,,,,
1930,제약 회사의 만행,,,,,,,,,,,,,,,,,,,,,,,,,,,,
1931,재미있게 봤음! 별로 기대안하고봤는데ㅋㅋㅋ맥스의 역할이 아주 돋보임!,,,,,,,,,,,,,,,,,,,,,,,,,,,,
1932,재밌습니다 평점맞추기위한10점 8점정도 주고싶네요,,,,,,,,,,,,,,,,,,,,,,,,,,,,
1933,아름다운 액션영화란? 이런 영화가 아닐지....!!,,,,,,,,,,,,,,,,,,,,,,,,,,,,
1934,재밌는 영화임 평점은 7.5가 적당함,,,,,,,,,,,,,,,,,,,,,,,,,,,,
1935,재밌다. 그나저나 의료보험이 참...,,,,,,,,,,,,,,,,,,,,,,,,,,,,
1936,의료보험의 중요성을 느끼게 해줌.ㅋㅋ,,,,,,,,,,,,,,,,,,,,,,,,,,,,
1937,흐지부지~~틀에박힌 상업영화,,,,,,,,,,,,,,,,,,,,,,,,,,,,
1938,알바 평점에 치가 떨린다...,,,,,,,,,,,,,,,,,,,,,,,,,,,,
1939,맷데이먼의 변발이 생뚱맞아 기대 안했는데 예상보다 잼있게 봤음요.,,,,,,,,,,,,,,,,,,,,,,,,,,,,
1940,개실망 개실망 개실망 개실망,,,,,,,,,,,,,,,,,,,,,,,,,,,,
1941,세계관이 너무나...적나라하게 펼쳐진...영화...난 이런영화가 좋더라,,,,,,,,,,,,,,,,,,,,,,,,,,,,
1942,디스트릭트9에 비해 좀 실망이다,,,,,,,,,,,,,,,,,,,,,,,,,,,,
1943,디스트릭트9 보다는 미흡하다는 생각이 들지만....그런대로 볼만은 하다...살짝 아쉬운게 있다면....의료기기의 엄청난 부각....@@;;;;,,,,,,,,,,,,,,,,,,,,,,,,,,,,
1944,이거 왜 이리 평점이 낮지..  내가 좋아하는 요소는 다 갖춘영화.,,,,,,,,,,,,,,,,,,,,,,,,,,,,
1945,말도 안되는 쓰레기 같은 스토리의 연속,,,,,,,,,,,,,,,,,,,,,,,,,,,,
1946,사람 터지는거는 보기좋았다 ,,,,,,,,,,,,,,,,,,,,,,,,,,,,
1947,내용은 좋은데 사실적인 영상에 비해 좀 억지스러운 허구가 많군요,,,,,,,,,,,,,,,,,,,,,,,,,,,,
1948,나에겐 안성맞춤 하이테크 액션!!,,,,,,,,,,,,,,,,,,,,,,,,,,,,
1949,내가 본 sf 영화중 처음으로 눈물을 흘리게 만들었다.  마이클 무어 감독이 권력과 가진자들의 횡포를 보이는 그대로 까발렸다면 닐 블롬캠프는 엄청난 스토리를 통해 모든것은 까발린다,,,,,,,,,,,,,,,,,,,,,,,,,,,,
1950,아쉽다 디스트릭9 만든 감독이라 너무 기대했던걸까 ㅠㅠ,,,,,,,,,,,,,,,,,,,,,,,,,,,,
1951,연출상의 허술함을 연기로 커버한다!,,,,,,,,,,,,,,,,,,,,,,,,,,,,
1952,솔직히 별로다 디스트릭트9 후속이나 만들지 이게 머야,,,,,,,,,,,,,,,,,,,,,,,,,,,,
1953,재밌다 재밌다 재밌다 재밌다,,,,,,,,,,,,,,,,,,,,,,,,,,,,
1954,나원래 이런 영화 좋아하는대.. 진짜 너무기대햇나보다..ㅠㅠ,,,,,,,,,,,,,,,,,,,,,,,,,,,,
1955,영상은 재밋는데 내용이 왜이럼? 보는즐거움밖에없는듯 내용이 너무허술해요 뇌는 놔두고 보셔야할듯또한 만능치료해주는기계에 여자아이가 누웠을때 아무자료없이 누가누군지 어떻게알지? 그리고엘리시움엔 로봇 몇 ㅍ개곤 군사가없음...,,,,,,,,,,,,,,,,,,,,,,,,,,,,
1956,살짝 늘어지는 전개가 아쉬움은 있지만 이런 투박한 리얼리티가 살아있는 SF는 정말 감탄에 감탄을 할 수 밖에 없었다,,,,,,,,,,,,,,,,,,,,,,,,,,,,
1957,머리에 있는걸 뺴내면 죽는다는 과한 설정에 짜임새 없는 그냥 액션영화.,,,,,,,,,,,,,,,,,,,,,,,,,,,,
1958,100년 후 미래에서 현실을 보는 듯한 영화. 괜찮음.,,,,,,,,,,,,,,,,,,,,,,,,,,,,
1959,괜찮은디요 8점정도ㅋ,,,,,,,,,,,,,,,,,,,,,,,,,,,,
1960,맷의 연기는 참 좋다. 강한듯 슬프고 여린. 조디의 연기 참 그리웠다. 그렇게 죽었다는 게 아쉬울 정도.흔히들 SF영화에서 보여주는 스토리의 전개,,,,,,,,,,,,,,,,,,,,,,,,,,,,
1961,파운데이션+ 총몽+ 애플시드+ 공각기동대! But,,,,,,,,,,,,,,,,,,,,,,,,,,,,
1962,주변 평들이 별로 안좋아 걱정했는데 저는 나름 괜찮았어요! 원래 이런 류의 영화를 좋아해서 그런지.. 그리고 디스트릭트 9과 분위기가 비슷하더군요 같은 감독이라 그런지,,,,,,,,,,,,,,,,,,,,,,,,,,,,
1963,마지막에 눈물이 나더라 1프로만의 특권 .. 결국은 모두에게 돌아갈것을 결국 1프로도 영원히 살수없는 나약한 인간일 뿐인데 왜이렇게욕심이 많은걸까  엘리시움 수작이다,,,,,,,,,,,,,,,,,,,,,,,,,,,,
1964,엄청난 액션은 없었지만 (주인공이 대단한 캐릭터로 나올줄 알았는데 아님)미래를 상상하며 보게된 영화,,,,,,,,,,,,,,,,,,,,,,,,,,,,
1965,맷데이먼이 전부 본 일순 없지뭐 이정도면 킬링으론 충분하지 아니한가 ? ㅋ,,,,,,,,,,,,,,,,,,,,,,,,,,,,
1966,미쿡 공화당 보고 있냐?,,,,,,,,,,,,,,,,,,,,,,,,,,,,
1967,의료기구 하나땜시 저 야단법석 을 떨어야 겠냐 이구 1% 선택받은 세상이 곧 지구로 파견할 의료기구 센터 였다니 잘받냐 망할영화,,,,,,,,,,,,,,,,,,,,,,,,,,,,
1968,일단 대략 8점은 되는데요. 평점이 좀 낮은 것 같아서 9점입니다. 액션이 적다고 하는 분들도 계시는데,,,,,,,,,,,,,,,,,,,,,,,,,,,,
1969,이감독 영화는 믿고 봐도 된다.,,,,,,,,,,,,,,,,,,,,,,,,,,,,
1970,기대안하고봐서 그런지 너무 재밌게봤어용 ~,,,,,,,,,,,,,,,,,,,,,,,,,,,,
1971,헐리우드에서 볼수없는 비극적 혹은열린결말..닐 블롬캠프 감독만의결말이 가장마음에 들엇음 하지만 결말을 너무 열어둬서 똥싸다 끊긴기분....,,,,,,,,,,,,,,,,,,,,,,,,,,,,
1972,디스트릭트 9 같은 충격은 못 받았지만 그래도 볼만했음!! 멋진 감독의 멋진 작품,,,,,,,,,,,,,,,,,,,,,,,,,,,,
1973,처음부터 끝까지 주인공 맥스가 너무 불쌍하다.. 고통이란 고통은 다 받고 죽음까지 당하니.. 아무리 영웅이 됐다지만 그의 인생이 너무 쓸쓸해.,,,,,,,,,,,,,,,,,,,,,,,,,,,,
1974,좀 아쉬움이 많이 남는 영화지만 한국영화 알바들 꼴보기 싫어서 10점 줍니다 나 같아도 수명이 5일남으면 그냥 죽기살기로 엘리시움에 가려고 하겠구만 그거 갖고 뭐라하는 사람들은 대체 뭔지 모르겠다,,,,,,,,,,,,,,,,,,,,,,,,,,,,
1975,맷 데이먼 연기짱 ㅠ 감동~Sf영화지만 아날로그적 느낌있다.절대 촌스럽지않고 액션이며 스토리며흡인력있고 멋진작품이다! 베리 굿!!,,,,,,,,,,,,,,,,,,,,,,,,,,,,
1976,뭐야! 완전 재밌잖아. 평점 보고 볼까 말까 했는데,,,,,,,,,,,,,,,,,,,,,,,,,,,,
1977,이게7점이라고???은밀하게보다 100배 재밌다,,,,,,,,,,,,,,,,,,,,,,,,,,,,
1978,단순한 액션영화가아닌 수작입니다 추천~,,,,,,,,,,,,,,,,,,,,,,,,,,,,
1979,굿  좋네요  평점 왜리 낮음?,,,,,,,,,,,,,,,,,,,,,,,,,,,,
1980,자본주의는 스스로 생존하기위해 저임금 근로자를 생산해 낼 수밖에 없다. 내가 당신들을 나락으로 떨어뜨려야 나는 지금의 삶을 유지할 수 있듯이.-조지포스터-,,,,,,,,,,,,,,,,,,,,,,,,,,,,
1981,다시한번 네이버평점만으로 영화를 판단해서는 안되겠다 다짐하게 하는 영화! 영화평점알바들과 영화볼줄 모르는 초딩놈들이 여기서 또 판치네 ㅋㅋ,,,,,,,,,,,,,,,,,,,,,,,,,,,,
1982,오바마케어...ㅋㅋㅋ,,,,,,,,,,,,,,,,,,,,,,,,,,,,
1983,이게 왜 평점이 이리 낮냐? 내용이 뻔할 순 있지만 주제나 배우들의 연기,,,,,,,,,,,,,,,,,,,,,,,,,,,,
1984,누군 얼굴앞면 날아가도 살아나고 누군 가슴에 총맞고 죽고....,,,,,,,,,,,,,,,,,,,,,,,,,,,,
1985,뭔가 엉성함 액션이든 스토리든 뭔가 하나씩 부족함,,,,,,,,,,,,,,,,,,,,,,,,,,,,
1986,맥스는 지구의 영웅이다,,,,,,,,,,,,,,,,,,,,,,,,,,,,
1987,아무 생각없이 보면 재밌고 통쾌한 영화... 근데 생각이라는 걸 해보면... 엘리시움이 모두에게 개방되는 순간 그건 더이상 엘리시움이 아님;; 결국 똑같이 지구처럼 망할 운명이라는 거...,,,,,,,,,,,,,,,,,,,,,,,,,,,,
1988,완전재밋구만ㅋㅋㅋㅋ,,,,,,,,,,,,,,,,,,,,,,,,,,,,
1989,감동이 있었기 때문에 추천! 미국의 의료시스템에 대한 문제가 세련되게 반영된 영화라고 볼 수 있겠네요. 100% clear 딱 나올때 마음까지 속 시원함 마지막에 지구에 치료셔틀 보내주고 많은 사람들이 치료되는 모습...,,,,,,,,,,,,,,,,,,,,,,,,,,,,
1990,미국이 현재 겪고있는 의료 빈부격차 이민자문제에 더 중점을 두고 만든것 같다.,,,,,,,,,,,,,,,,,,,,,,,,,,,,
1991,SF물이면 환장하고 보는 나이지만 식상하다. 기대치가 너무 높았던 것일 수도 있겠지만,,,,,,,,,,,,,,,,,,,,,,,,,,,,
1992,액션도 부족하고 너무 허겁지겁 깊이가 없이 끝나는...,,,,,,,,,,,,,,,,,,,,,,,,,,,,
1993,대한민국 사람들이 순순히 복종하고,,,,,,,,,,,,,,,,,,,,,,,,,,,,
1994,식코의 SF액션 버젼인가... 현실과의 갭일까,,,,,,,,,,,,,,,,,,,,,,,,,,,,
1995,멧과 조디의 케스팅은 혹 제작사측의 압력일까? 둘의 케스팅 비용을 아껴서 영화를 더 다듬을 수 있었다. 전체적인 편집도 맘에 안들고 디9 때의 그 센세이션이 전혀 보이지 않았다. 닐 감독은 이번 고가 메이져 제작으로...,,,,,,,,,,,,,,,,,,,,,,,,,,,,
1996,주제가 너무 단순해서 단순한 액션 영화로 밖에 안보인다.근데 왜 19금인가?,,,,,,,,,,,,,,,,,,,,,,,,,,,,
1997,난  꽤 재밌게봤는데;;,,,,,,,,,,,,,,,,,,,,,,,,,,,,
1998,7점. 후반으로 갈수록 영화의 질이 떨어진다.,,,,,,,,,,,,,,,,,,,,,,,,,,,,
1999,재밌습니다만  얼굴이 날라간 크루거가 뇌가 살아있는 설정이아쉽 ㅠ,,,,,,,,,,,,,,,,,,,,,,,,,,,,
2000,전달하고자 하는 메시지를 보면 그냥 액션영화로 취급하기에는 무리가 있다. 우울하고 불편한 진실에 관한 영화.,,,,,,,,,,,,,,,,,,,,,,,,,,,,
2001,정말...아무생각없이 봐야하는 영화였다.그리고 막판에 엘리시움에서 싸우는 모습이 꼭 꽃나무에다가 칼 챙챙 휘두르는 점으로 보아 일본 닌자 패러디....미친다 진짜 저런 좋은 출연진 데리고 닌자거북이 찍는건지?...후...,,,,,,,,,,,,,,,,,,,,,,,,,,,,
2002,그다지 재미지는 않음 ㅎ 본시리즈4나 만들자 ㅎㅎ,,,,,,,,,,,,,,,,,,,,,,,,,,,,
2003,재미있네ㅎ  아근데짜증나게왜10자이상쓰라는거야,,,,,,,,,,,,,,,,,,,,,,,,,,,,
2004,평점란달려니까너무하다 이거..ㅅㅂ...더이상말안한다...원래는 딱.8.5정도다...알바새.끼들 때문에 더준다.,,,,,,,,,,,,,,,,,,,,,,,,,,,,
2005,아이온 엘리시움???,,,,,,,,,,,,,,,,,,,,,,,,,,,,
2006,서정적 감정으로 대다수 서민의 감성을 자극하고 SF적 웅장함도 선사한다. 다만 영화 후반부에선 뻔한 액션과 어설픈 전개로 허탈함을 준다. 10%부족한 안타까운 영화다.,,,,,,,,,,,,,,,,,,,,,,,,,,,,
2007,OO 졸라 재밌구만 뭔 헛소리야 ㅄ들아,,,,,,,,,,,,,,,,,,,,,,,,,,,,
2008,기대 안하고 봤는데 생각보다 재밌음,,,,,,,,,,,,,,,,,,,,,,,,,,,,
2009,재밌어 왜 평점이 낮아?,,,,,,,,,,,,,,,,,,,,,,,,,,,,
2010,디스트릭트9에 이은 또 한번의 신선한 SF수작,,,,,,,,,,,,,,,,,,,,,,,,,,,,
2011,킬링타임용... 이상도 이하도 아님...,,,,,,,,,,,,,,,,,,,,,,,,,,,,
2012,살짝 2% 부족한 영화..,,,,,,,,,,,,,,,,,,,,,,,,,,,,
2013,인간으로 태어났다면.. 꼭 한번 볼만한 영화~,,,,,,,,,,,,,,,,,,,,,,,,,,,,
2014,디스트릭트9처럼 내용이 꽤 기발한 거 같은뎀.,,,,,,,,,,,,,,,,,,,,,,,,,,,,
2015,1962년생 조디 포스터가 이렇게 이쁠줄이야.. 나이를 거꾸로 먹는군.개인적으로 시간이 아깝다는 생각은 안들었구요. 재미나게 보았습니다.화려한 SF 액션일줄 알고 보았는데 그건 아니였기에 -1점,,,,,,,,,,,,,,,,,,,,,,,,,,,,
2016,런닝타임 짧은게 단점이었지 전체적으로 재미있고 상징성을 많이 부여한 영화라고 생각합니다.,,,,,,,,,,,,,,,,,,,,,,,,,,,,
2017,엘리시움 좋은 영화입니다.,,,,,,,,,,,,,,,,,,,,,,,,,,,,
2018,볼만하긴 한데.. 좀 밋밋하네,,,,,,,,,,,,,,,,,,,,,,,,,,,,
2019,처음은 사람 본연의 이기적임을 비추었으나 사랑으로 말미암아 그 끝은 희생의 아름다움으로..^^,,,,,,,,,,,,,,,,,,,,,,,,,,,,
2020,영화 그래픽이나 연출은 매우 화려하다. 다만 좀 유치하다.,,,,,,,,,,,,,,,,,,,,,,,,,,,,
2021,적십자 국경없는의사회 등등 협찬 영화냐.,,,,,,,,,,,,,,,,,,,,,,,,,,,,
2022,예고편을 보고 상상한 SF와 본영화의 SF는 전혀 달랐다,,,,,,,,,,,,,,,,,,,,,,,,,,,,
2023,재미있고  여운이 남는다.,,,,,,,,,,,,,,,,,,,,,,,,,,,,
2024,엘리시움에 화려함이 보고싶어서 기대햇는데 별루 안나오네요.그리고 끝판에 감동이 좀 모자른듯.,,,,,,,,,,,,,,,,,,,,,,,,,,,,
2025,8점은 된다 재미있네요,,,,,,,,,,,,,,,,,,,,,,,,,,,,
2026,단순 오락영화가 아니라 자본주의 비판과 의식있는 영화?? 이런 조잡한 영화가?? 우리나라 사람들은 외국 영화에 참 점수 후한것 같다. 그냥 킬링타임 정도의 영화일뿐 큰기대 마시길~ 기존 단순 액션 깨부수는거 좋아하는...,,,,,,,,,,,,,,,,,,,,,,,,,,,,
2027,완전 대박 꼭 보십시오. 왜 19세인지 모르겟군,,,,,,,,,,,,,,,,,,,,,,,,,,,,
2028,1) 네러티브가 허술하고 2) 액션이 통쾌하기보다 잔인하고 3) 결말까지 불행하다. 극의 전체를 이끌어가는 모티브 - 맷 데이먼이 생체실험을 자처하면서까지 엘리시움에 가려고 하는 동기가 약하다. 엘리시움에 대한 설명...,,,,,,,,,,,,,,,,,,,,,,,,,,,,
2029,난 솔직히 닐블롬캠프라 기대 많이 했다. 하지만 기대이하였다. 확실히 디스트릭트9을 비교안할 수 없다. 그래서6점,,,,,,,,,,,,,,,,,,,,,,,,,,,,
2030,닐불룸캠프 디스트릭트 9에서 계속 영화찍을거면 디스트릭트 후속편 내놔!,,,,,,,,,,,,,,,,,,,,,,,,,,,,
2031,영화 코드명 j 기억남... 공장에서 매일찍어내는 로봇들은 진정 싸움씬에선 어디를 간 것인지.. 나름s.f적인 요소들이 충분하지만 뭔지 모를 부족함은 내용에 짜임새가...그럼에도 7점을 후하게 준건 감독이 말하고싶은...,,,,,,,,,,,,,,,,,,,,,,,,,,,,
2032,SF액션영화를 기대하고 본다면 큰 실망할듯... 관전포인트는 역시 [의료민영화]인가요?! ;;;,,,,,,,,,,,,,,,,,,,,,,,,,,,,
2033,이 영화는 왜 청소년 관람 불가일가요,,,,,,,,,,,,,,,,,,,,,,,,,,,,
2034,sf물로 이정도까지 말아먹긴 힘들텐데... 흐름이 뚝뚝 끊기는 느낌이 강하고 굳이 맷 데이먼까지 쓸 필요가 있을까 의구심이 든다. 데이터베이스 초기화에 관해 제대로 설명도 없고 요원 하나가 갑자기 짱 먹는다는게 너무...,,,,,,,,,,,,,,,,,,,,,,,,,,,,
2035,기대이하. 북미와 한국을 비롯한 전세계적으로 흥행에 실패할만하네. 뭔가 붕떠있는 어설픈느낌. 맷데이먼 조디포스터 엘리트배우들 데리고 영화는 영저능아같이 만들었네. 남자악역은 왜그리 바보같이 보이던지.,,,,,,,,,,,,,,,,,,,,,,,,,,,,
2036,미래에 대한 상상력의 부족,,,,,,,,,,,,,,,,,,,,,,,,,,,,
2037,기득권 수구꼴통즐 저렇게 쳐부숴야하는데...,,,,,,,,,,,,,,,,,,,,,,,,,,,,
