,content,,,,,,,,,,,,,,,,,,,,,,,,,,,,
2589,진심 별로네요그래도 먼가있겠지하고 보다가 중후반부터는 k팝스타에서 심사위원들 답답하고 짜증난 듯한 그 표정지으며 봤음... 이걸 그냥 꺼 말어;;;,,,,,,,,,,,,,,,,,,,,,,,,,,,,
2590,솔직히 이런 영화에 평점 2점 이런 점수 주는 사람들은 취향이 안맞거나 영화 볼 줄 모르는 사람 아닌가요? 영화는 영화일뿐 무슨 현대 의학과 비교를 하며..  참 한심스럽네요 현실성 따질거면 영화,,,,,,,,,,,,,,,,,,,,,,,,,,,,
2591,의료기 하나만 지구에 보내주면 다살릴수 있겟네 백혈병 말기,,,,,,,,,,,,,,,,,,,,,,,,,,,,
2592,참 어이없는 내용이다...만병통치약 하나 만들어놓고 이게 머하는 건지?? 개연성이 너무 없다...,,,,,,,,,,,,,,,,,,,,,,,,,,,,
2593,특정인만을 위한 부자만을 위한 돈을 벌기 위한 정책이 아닌...모두가 행복하게 살수 있는 그런나라를 꿈 꿔 봅니다.,,,,,,,,,,,,,,,,,,,,,,,,,,,,
2594,조디포스터는 죽을때도 폼나게 죽네요. 그냥저냥 볼만했어요,,,,,,,,,,,,,,,,,,,,,,,,,,,,
2595,굳잼 평점 꼬라지봐라~,,,,,,,,,,,,,,,,,,,,,,,,,,,,
2596,오바마건강보험 홍보 영화(THE OBAMACARE PROMOTION MOVIE),,,,,,,,,,,,,,,,,,,,,,,,,,,,
2597,이정도면 볼만한 영화다. 그런데 왜 청소년 관람불가지?,,,,,,,,,,,,,,,,,,,,,,,,,,,,
2598,엘리시움 정보가 너무 없네요 1%들이 산다는곳인데 좀 좋은 저택에 의료셔틀 있는게 다인듯...  이 아쉬운점 빼곤 볼만한 영화라 생각됩니다.,,,,,,,,,,,,,,,,,,,,,,,,,,,,
2599,조디 포스터 비중 너무 없네 차라리 크루거에 악역이나 제대로 캐스팅하지 너무 허약해보이잖아,,,,,,,,,,,,,,,,,,,,,,,,,,,,
2600,그 일본 만화 명작,,,,,,,,,,,,,,,,,,,,,,,,,,,,
2601,역시 블롬캠프!! 이 영화가 무엇을 풍자하는지만 알아도 이 영화는 버릴데 없는 수작이 된다! 의료보험 만세!!ㅋㅋ,,,,,,,,,,,,,,,,,,,,,,,,,,,,
2602,재미만 있구만 니들이 뭐 영화 볼 줄안다고 ㅉㅉ 한국 김치종자 냄비근성들은 너도 나도 영화전문가랑께...ㅋ니들이 모르는 분야가 뭐임ㅋ,,,,,,,,,,,,,,,,,,,,,,,,,,,,
2603,한 마디로 재미가 없음,,,,,,,,,,,,,,,,,,,,,,,,,,,,
2604,미국에서 온 18세 등급의 영화라기엔 너무 표현과,,,,,,,,,,,,,,,,,,,,,,,,,,,,
2605,어쩜 이렇게 열심히 재미없게 만드셨을까...,,,,,,,,,,,,,,,,,,,,,,,,,,,,
2606,오랜만에 보는 맷데이몬의 액션연기를 볼수 잇어 좋았다~영웅주의 결말이 그렇긴 하지만...나름 사실적인 SF영화라 신선햇다,,,,,,,,,,,,,,,,,,,,,,,,,,,,
2607,헐리웃 상업화에에 물들었나??  디스트릭트9의 감동은 찾을 수가 없구나...,,,,,,,,,,,,,,,,,,,,,,,,,,,,
2608,에잉 봤는데 너무 김샌다예,,,,,,,,,,,,,,,,,,,,,,,,,,,,
2609,피 나는 장면 마니 있어요!ㅠㅜ,,,,,,,,,,,,,,,,,,,,,,,,,,,,
2610,디스트릭트9보고난뒤 본거라서 실망많이함 ㅠ 근데재밌긴했음 넘기대하지말고보면 꿀잼,,,,,,,,,,,,,,,,,,,,,,,,,,,,
2611,일단 7점 주마.,,,,,,,,,,,,,,,,,,,,,,,,,,,,
2612,끝이 너무 뻔한 내용이였으나,,,,,,,,,,,,,,,,,,,,,,,,,,,,
2613,맷데이먼 기대하고 봤는데...어설픈 액션과 유치한 스토리,,,,,,,,,,,,,,,,,,,,,,,,,,,,
2614,디스트릭트 때문인지는 몰라도 조금은 실망한 영화,,,,,,,,,,,,,,,,,,,,,,,,,,,,
2615,기대 이하 ~ 배경은 잘만들었는데 내용이 부실함 ~ 액션도 약하고,,,,,,,,,,,,,,,,,,,,,,,,,,,,
2616,기대가 너무 컸나..공간이 너무 한정되있어서 좀 심심한 느낌,,,,,,,,,,,,,,,,,,,,,,,,,,,,
2617,어떤 영화를 보고 이영화를 봐서 그런지 뭔가 엄청나게 식상한 느낌이….,,,,,,,,,,,,,,,,,,,,,,,,,,,,
2618,6.9점  7점에는 제기준에 7점에는 못미치는 치료장비는 매력있는듯,,,,,,,,,,,,,,,,,,,,,,,,,,,,
2619,글쎄...아쉬운 마음?,,,,,,,,,,,,,,,,,,,,,,,,,,,,
2620,내가 본 올해 최악의 블록 버스터? 세부설정면에서 납득히 불편한? 오류가 있었더라도 먼미래에... 파괴된 환경을 생각한다면 영화설정상 볼 수 있었으나,,,,,,,,,,,,,,,,,,,,,,,,,,,,
2621,줄거리를 보고 굉장히 기대하고 있었는데,,,,,,,,,,,,,,,,,,,,,,,,,,,,
2622,아일랜드와 같은 꿈의 도시에 대한 열망..개인의 열망으로 떠난게 인류의 열망으로 탈바꿈.헐리웃 영화의 검증된 배우 출연작 답게 재미를 보장한다!적어도 알바들의 평점테러로 속아 봤던 요즘 몇몇 한국영화를 생각한다면 별...,,,,,,,,,,,,,,,,,,,,,,,,,,,,
2623,아 미친 저기 평론가리뷰보는데 스포햇어,,,,,,,,,,,,,,,,,,,,,,,,,,,,
2624,한 번 볼만한 B급 킬링타임용 영화다.  SF내용이 단순할수록 주인공의 어려운 과정을 잘 살려야 영화가 사는데,,,,,,,,,,,,,,,,,,,,,,,,,,,,
2625,이야기는 단순 무식하게 전개되지만,,,,,,,,,,,,,,,,,,,,,,,,,,,,
2626,아 질떨어져 진짜. 무슨 중간중간에 뜬금없는 반전들 ㅎㅎ차라리 마지막에 악역 이랑 주인공이랑 어려서 헤어진 형제라고 하지 왜 ㅋㅋㅋ 어이없는 영화,,,,,,,,,,,,,,,,,,,,,,,,,,,,
2627,뭔가 대단할것 같이 포장해놓고 막상 풀어보니 유치하기 짝이없다.예를 들면 데이타 를 빼왔는데 그게 엘리시움 전체를 흔드는 열쇠가 있다는둥.갑자기 끼워 맞추기식 의 무슨 코믹 시트콤 보는지 알았다.,,,,,,,,,,,,,,,,,,,,,,,,,,,,
2628,조디 포스터의 역할을 보니 설국열차의 틸다 스윈튼이 떠오르는 이유.. 강한 여성이 세상을 지배하는 느낌. 남성은 숭고한 희생의 역할로 아이콘이 바뀌어 가는 느낌.,,,,,,,,,,,,,,,,,,,,,,,,,,,,
2629,디스9과 비슷한 색깔을 띈다. 하지만 소재나 스토리는 식상하다. 디스9 후편이나 만들었으면 좋겠다.,,,,,,,,,,,,,,,,,,,,,,,,,,,,
2630,재밌으면서도 어디선가 본듯한.. <오블리비언>이 떠오르기도 하고.. <설국열차>가 떠오르기도 하고.. 병 치료하는 장면에서는 <프로메테우스>가 떠오르기도..,,,,,,,,,,,,,,,,,,,,,,,,,,,,
2631,디스트릭트9에 비해선 뭔가 부족한 것은 어쩔 수 없다.,,,,,,,,,,,,,,,,,,,,,,,,,,,,
2632,좀 지루하기도 했고.. 그렇게 재밌지도 않았어요..,,,,,,,,,,,,,,,,,,,,,,,,,,,,
2633,중반까진 잘 풀어냈으나 결말에 이르러 감독의 한계를 드러냄,,,,,,,,,,,,,,,,,,,,,,,,,,,,
2634,아 진짜 별로 재미없다.. 중반부부터 잠와서 영화관에서 나오고싶었고 아마겟돈 타워에서 보던 그런 마지막 내용대사까지 아  알바알바하는데 진짜 알바가아니고 재미없다 영화관 돈아까워서 평남긴다  투자한 제작비가 아까울듯...,,,,,,,,,,,,,,,,,,,,,,,,,,,,
2635,솔직히보다가졸았는데 내가이상한거임? 가면갈수록 내용도이상해지고 참. . .,,,,,,,,,,,,,,,,,,,,,,,,,,,,
2636,그렇게 화려하지도 않은 특수효과,,,,,,,,,,,,,,,,,,,,,,,,,,,,
2637,진부하더라... 액션이 눈돌아 가는것도 아니고... 예고편 수트착용이ㅅ전부,,,,,,,,,,,,,,,,,,,,,,,,,,,,
2638,그나마 돈많이썼으니깐4점준다,,,,,,,,,,,,,,,,,,,,,,,,,,,,
2639,스토리는 차치하고서도 영상이 상당히 별로임;;; 아맥도 아맥안같고.. 돌이켜보니 오블리비언이 나름 괜찮은 영화였던 것 같음 개봉당시에는 엄청 욕했었눈데,,,,,,,,,,,,,,,,,,,,,,,,,,,,
2640,불법체류자들의정신승리영화,,,,,,,,,,,,,,,,,,,,,,,,,,,,
2641,보는내내 맘이 불편했음.  잔인하다고 해야하나. 영화 끝나고도 찝찝함이 오래갔던...,,,,,,,,,,,,,,,,,,,,,,,,,,,,
2642,조디 포스터는 왜? 역시 멧 데이먼,,,,,,,,,,,,,,,,,,,,,,,,,,,,
2643,볼만 하긴 한데... 엄청나게 재밌다 하진 않았음..,,,,,,,,,,,,,,,,,,,,,,,,,,,,
2644,나름 감동도 재미도 있었습니다.,,,,,,,,,,,,,,,,,,,,,,,,,,,,
2645,전작만큼의 여운은 없었지만.. 나름 잘 만들어진 영화.  좀더 길게 시리즈 물로 다듬어졌으면 어땠을까 하는 생각이.. 여러이야기를 앞다퉈 내비취기만 하고.. 마구잡이로 끝맺음 하는게 좀 ;;,,,,,,,,,,,,,,,,,,,,,,,,,,,,
2646,님들아 궁금한게 있는데 .. 사장녀석이 대통령 리셋시키는거 타자두둘길때,,,,,,,,,,,,,,,,,,,,,,,,,,,,
2647,치료용 배드를 서민들이 못썻던거는....엄청난 자원이 들어서 일터인데...그냥 뚝딱 요술 방맹이처럼 해낫네....,,,,,,,,,,,,,,,,,,,,,,,,,,,,
2648,재밌게 봤음!,,,,,,,,,,,,,,,,,,,,,,,,,,,,
2649,본전은 하는 영화,,,,,,,,,,,,,,,,,,,,,,,,,,,,
2650,영화 괜찮드만. 그나저나 엘리시움에 있는 가정용 의료기 진짜 탐나더라.,,,,,,,,,,,,,,,,,,,,,,,,,,,,
2651,그냥 sf 액션 영화...무난한다....,,,,,,,,,,,,,,,,,,,,,,,,,,,,
2652,너무나도 충실하고 치열했던 그의 삶,,,,,,,,,,,,,,,,,,,,,,,,,,,,
2653,디스트릭 생각하고 보면 낭패.. 실망이 큼,,,,,,,,,,,,,,,,,,,,,,,,,,,,
2654,친구들 4명이서 봤는데 보고 난후에도 기분이 별로 안좋은 영화 액션영화라고해서 기대했는데 화려한 액션도 교훈도 없는 정말 다들 모두 싸이코패스로만 보임. 멀쩡한 사람은 딸한명정도 다들 재정신이 아니다. 한국영화봅시다...,,,,,,,,,,,,,,,,,,,,,,,,,,,,
2655,기대가 컸는데 별로임,,,,,,,,,,,,,,,,,,,,,,,,,,,,
2656,괜찮았던 SF영화였지만.. 질병치료기계가 너무 어이없어서 몰입도가 떨어짐. 마틸다가 남자주인공 딸인줄 알았음ㅋㅋㅋ DOLBY ATMOS관에서 봤는데 사운드의 방향성과 음장은 확실히 좋은데,,,,,,,,,,,,,,,,,,,,,,,,,,,,
2657,디스트릭트9 비슷하면서도 다른 시나리오 이 감독만의 톡특한 영상!!!,,,,,,,,,,,,,,,,,,,,,,,,,,,,
2658,볼거리는 풍부해요. CG 아주 잘 되어 있고 연기도 좋고. 그런데 스토리가 좀 진부한 영웅스토리이고... 피가 많이 나와서 보기에 좀 잔인해서 불편할 때가 있어요. 그 외엔 무난하고 볼만해요,,,,,,,,,,,,,,,,,,,,,,,,,,,,
2659,그냥 머리비우고 보면 확실히 재미있는 영화.,,,,,,,,,,,,,,,,,,,,,,,,,,,,
2660,내용은 그저 그렇다 ... 약간 잔인한 SF인듯... 액션의 영상미는 볼만했던거 같다.,,,,,,,,,,,,,,,,,,,,,,,,,,,,
2661,평점그냥그래서 불안한 맘을 가지고 봤는데 그냥저냥 볼만했다 확실한건 숨바꼭질이나 마술사기단보다는 훨씬낫다는거 디스트릭트9급으로 기대하고보면 안된다는거,,,,,,,,,,,,,,,,,,,,,,,,,,,,
2662,너무 허술하다. 사장만 잡으면 다 만사 오케이구만.. 그리고 이게 어떻게 18세냐; 많이 봐줘봐야 15세. 디스트릭트9을 기대하고 보는 사람이면 많이 아쉬울듯하다.,,,,,,,,,,,,,,,,,,,,,,,,,,,,
2663,의료 제도에 대한 미국인들의 작은 소망을 그린 이 영화가 왜 19금인지 모르겠음.6시 반에 해주는 어린이 만화 본 느낌. 재미는 있었는데 마지막에 보니 정보를 OOO에 저장하네? 첨부터 OO에 저장 안해도 되지 않음...,,,,,,,,,,,,,,,,,,,,,,,,,,,,
2664,조디 포스터의 등장은 반갑다. 영화 마지막이 조금 아쉽지만 전체적으로 오락영화로는 괜찮다. 리얼한 로봇이나 미래의 도시인 엘리시움 보는 재미는 쏠쏠했다. 초반의 흥미진진한 도입부가 뒤로 갈수록 단순한 액션으로 그치는...,,,,,,,,,,,,,,,,,,,,,,,,,,,,
2665,자꾸 맷데이먼보면 리신이생각이났음... 훈훈한 마무리ㅋㅋㅋ,,,,,,,,,,,,,,,,,,,,,,,,,,,,
2666,그냥 볼만한 영화,,,,,,,,,,,,,,,,,,,,,,,,,,,,
2667,여러모로 아쉽지만 안을 수밖에 없다...,,,,,,,,,,,,,,,,,,,,,,,,,,,,
2668,전 잡스보고 이영화는 다음날 봤는데... 잡스가 더 좋았어요. 시사하려는 바가 뭔지는 알겠는데...그걸 잘 표현못한 영화... 크루거...이 싸이코같은 나쁜넘이 영화를 짜증나게 했다고나 할까... 맷데이먼은 몸쓰는것...,,,,,,,,,,,,,,,,,,,,,,,,,,,,
2669,설정이 아쉽다.,,,,,,,,,,,,,,,,,,,,,,,,,,,,
2670,전작을 빼고보면 준수한 영화이나 기대감이 큰걸 무시할순없고...오글거리는 엔딩씬은 제작사의 간섭이 들어갔구나 하는 생각이...ㅋㅋㅋ,,,,,,,,,,,,,,,,,,,,,,,,,,,,
2671,말하지말구 싸우라,,,,,,,,,,,,,,,,,,,,,,,,,,,,
2672,아쉽다...ㅠ,,,,,,,,,,,,,,,,,,,,,,,,,,,,
2673,디스트릭트9 때문에 봤다면 글쎄..,,,,,,,,,,,,,,,,,,,,,,,,,,,,
2674,CG,,,,,,,,,,,,,,,,,,,,,,,,,,,,
2675,기대가넘컸다ㅠ 내용전개 액션 쬐금아숩,,,,,,,,,,,,,,,,,,,,,,,,,,,,
2676,소재가 좋아서 이걸 어떻게 웅장하게 풀어나가고 어떤교훈을 줄까 기대했는데 의외로 심플했다 결론도 아쉽고 대책없이 돌파하고,,,,,,,,,,,,,,,,,,,,,,,,,,,,
2677,화려한 그래픽,,,,,,,,,,,,,,,,,,,,,,,,,,,,
2678,긴장감을 있었지만  늦은전개,,,,,,,,,,,,,,,,,,,,,,,,,,,,
2679,주인공 죽음..그리고 자유시민....그래픽 효과 너무강한 영화~,,,,,,,,,,,,,,,,,,,,,,,,,,,,
2680,역시 메카닉 디자인은 최고임. 그런데 내용이 너무 뻔하고 흐름이 억지가 좀 보임. 또한 내용 자체가 한국이랑 안 맞음. 미국 이야기임. 그래서 7점.,,,,,,,,,,,,,,,,,,,,,,,,,,,,
2681,엘리시움~ 불법다운로더의 최후,,,,,,,,,,,,,,,,,,,,,,,,,,,,
2682,인타임 보는줄알았다. 그리고 감독이  샬토 코플리덕후인증을 제대로 한 작품광활한 세계관과 독특한 디자인이 인상적이였는데 이걸 제대로 활용못하는 스토리가 아쉽  역시 설국열차가 더 재밌었다.  마지막 그 꽃 연출은 O...,,,,,,,,,,,,,,,,,,,,,,,,,,,,
2683,너무 기대를 했나? 최고의 배우 맷데이먼으로 이정도밖에 못그리나? 예측된 결말이 진부하게 느껴졌다.,,,,,,,,,,,,,,,,,,,,,,,,,,,,
2684,실망,,,,,,,,,,,,,,,,,,,,,,,,,,,,
2685,좀.. 밋밋한 느낌이 드는건 어쩔수 없나 봅니다.,,,,,,,,,,,,,,,,,,,,,,,,,,,,
2686,많이 아쉽습니다..,,,,,,,,,,,,,,,,,,,,,,,,,,,,
2687,화려한  SF 액션 영화일 줄 알았는데 생각과 만히 달랐던 영화.. 등급이 왜 청불인지 이해가 다소 안되는 영화.  그래도 볼만한 편.,,,,,,,,,,,,,,,,,,,,,,,,,,,,
2688,군데군데 드러나는 스토리상의 허점들과 주인공이 무슨 엄청난 대의를 짊어지고 싸운다는 식으로 비춰진다는 건 정말 마음에 안든다.. 하지만 배우들의 연기와 cg는 볼만하지,,,,,,,,,,,,,,,,,,,,,,,,,,,,
2689,흠.. 말하고자하는내용은알겠다만 기본적으로영화가재미가없음,,,,,,,,,,,,,,,,,,,,,,,,,,,,
2690,토탈리콜이 낫다,,,,,,,,,,,,,,,,,,,,,,,,,,,,
2691,이거 보려고 했는데 왜 평점이 이렇게 낮음... 재미없나?..,,,,,,,,,,,,,,,,,,,,,,,,,,,,
2692,최곤데... 왜다들 비하하시는지ㅡㅡ스케일도크고 스토리도 좋습니다~~,,,,,,,,,,,,,,,,,,,,,,,,,,,,
2693,이런영화가 설국열처보다 쩌리 취급 받다니;; 스토리 짜임세도 좋았고 그래픽도 훌륭하고 액션신도 웅장하게 잘표현했다 물론10점짜리의 엄청난스토리는 아니지만 재미요소는 괜찮았다고 본다 8.9점정도 주고싶지만 영화평점이 ...,,,,,,,,,,,,,,,,,,,,,,,,,,,,
2694,완전 기대하고 봤는데 기대이하.. 스토리가 너무 늘어지고 지루해 죽을 뻔,,,,,,,,,,,,,,,,,,,,,,,,,,,,
2695,잔인함과 과도한 액션때문에 사회비판적인 시각이 흐려진 느낌은 있는듯 하나 화려한 특수효과로 볼거리는 짱! 생각없이 보면 재미있음,,,,,,,,,,,,,,,,,,,,,,,,,,,,
2696,멧 데이먼의 액션을 펼치지 못한거 같아 너무 안타깝다... 슈트입은 맥스가 드루이드 무쌍하는 장면을 기대했는데 드로이드와의 전투씬은 얼마 나오지도 않고,,,,,,,,,,,,,,,,,,,,,,,,,,,,
2697,디스트릭9에서 보여주었던 감독의 개성과 이야기를 이끌어가는 힘,,,,,,,,,,,,,,,,,,,,,,,,,,,,
2698,평점이 높다,,,,,,,,,,,,,,,,,,,,,,,,,,,,
2699,처음 글써보는데 올해영화중 최고였다는거... 저믿어보세요^^,,,,,,,,,,,,,,,,,,,,,,,,,,,,
2700,알바존나많네 ㅡㅡ 이런대작이어딨냐 더테러,,,,,,,,,,,,,,,,,,,,,,,,,,,,
2701,이영화가 왜 재미가 없다고 했는지...애해가 안간다. 한국영화 평점알바들이 평점 다 깍아먹고...참 대단하다.디스트릭트9를 재밌게 본사람이라면 정말 즐겁게 볼수 있는 영화다.지금 극장에서 상영하는 영화중에 제일 재미...,,,,,,,,,,,,,,,,,,,,,,,,,,,,
2702,7.1점? 주관적으로  8.5점  생각보다 재밌게봤음 확실한건 마술기사단보다 훨씬 났다,,,,,,,,,,,,,,,,,,,,,,,,,,,,
2703,설국열차와 같이 구상만 독특할뿐,,,,,,,,,,,,,,,,,,,,,,,,,,,,
2704,SF의 새로운 거장이 출현하다.,,,,,,,,,,,,,,,,,,,,,,,,,,,,
2705,재미가 없다. 뻔히 예상되는 스토리...,,,,,,,,,,,,,,,,,,,,,,,,,,,,
2706,미국의 현재진행 문제점을 극대화한 영화,,,,,,,,,,,,,,,,,,,,,,,,,,,,
2707,디스트릭트나인의 거칠고 먼지날리는 미래사회와 신기한무기들,,,,,,,,,,,,,,,,,,,,,,,,,,,,
2708,12000원이 아까웠다..,,,,,,,,,,,,,,,,,,,,,,,,,,,,
2709,"안졸고 재밌게 볼 수 있는 영화는 드물다"" 오늘 안졸고 자막 하나 안놓치고 봤네 ..  영상도 그린거지만 멋있고 갈수록 뛰어나다.  맷 데이먼 본 시리즈에 나오면 안되겠니?? ..... 마지막에 죽어서 넘 맘...",,,,,,,,,,,,,,,,,,,,,,,,,,,,
2710,기대보다 좀 아쉽다.. 근데 7점은 아니지..,,,,,,,,,,,,,,,,,,,,,,,,,,,,
2711,말하고자하는 내용이 정확하고 꽤나 다양한 볼거리가있다. 10점을 주기에는 약간 내용에 빈틈이 있는 것 같지만 역시 믿고 보는 배우들과 감독이 함께 만든 영화다웠음,,,,,,,,,,,,,,,,,,,,,,,,,,,,
2712,사건의 구성이 너무 빈약했다,,,,,,,,,,,,,,,,,,,,,,,,,,,,
2713,재밌었는데 평이 이러나???? 나만 재밌었던건지? -_- 뭔가 독특하고도 멋진 엘리시움을 보면서 감탄을 느꼈다 그리고 많은 교훈을 준듯 부자의 욕심때문에 가난한사람들이 그렇게 ..살기 힘든..,,,,,,,,,,,,,,,,,,,,,,,,,,,,
2714,평점이 왜 이러징? 10점은 아니지만 잼있게 봤음,,,,,,,,,,,,,,,,,,,,,,,,,,,,
2715,SF팬이라면 무조건 강추! 사실적 영상이 느껴진다. 액션 맷형의 연기가 쩐다.,,,,,,,,,,,,,,,,,,,,,,,,,,,,
2716,암이 치료되었습니다    이장면에 낚인거 같다,,,,,,,,,,,,,,,,,,,,,,,,,,,,
2717,기득권 층의 붕괴,,,,,,,,,,,,,,,,,,,,,,,,,,,,
2718,화려한 상상력 따분한 줄거리,,,,,,,,,,,,,,,,,,,,,,,,,,,,
2719,내용이 설국열차와 별로 다를게 없음. 부자와 가난한자의 이야기. 설국열차는 기차로,,,,,,,,,,,,,,,,,,,,,,,,,,,,
2720,설국열차 보고난 후의 느낌 ~~느낌아시겠죠~??^^,,,,,,,,,,,,,,,,,,,,,,,,,,,,
2721,다소 억지스러운 부분전계가 이루어짐(그많은 기계들이 정작 엘리시움 방어할땐 없음,,,,,,,,,,,,,,,,,,,,,,,,,,,,
2722,재미는 있는데,,,,,,,,,,,,,,,,,,,,,,,,,,,,
2723,지구에서 사람손으로 잡을수 있는 정도의 크기인 미사일이 우주까지 날아간다거나 완전망가진 얼굴이 아무런 재료도없이 빛만으로 재생된다는건 너무 말도안되는 설정이라고 생각하지만 그래도 작품자체는 좋았다 적어도 북극곰 엔딩...,,,,,,,,,,,,,,,,,,,,,,,,,,,,
2724,뭐 그럭저럭 볼만하더군요...,,,,,,,,,,,,,,,,,,,,,,,,,,,,
2725,신선한 소재,,,,,,,,,,,,,,,,,,,,,,,,,,,,
2726,애매하네.... 영화가... 주인공도 애매하고 김쉰명숙도 애매함,,,,,,,,,,,,,,,,,,,,,,,,,,,,
2727,아.. 예고편봤을 때 기대했는데... 스토리재미가 ...약간 지루 ㄷㄷ 5일이 왜 5일인가 했드만.. 얼마나 개판이면 쿠데타가 손쉽게 이뤄지는지.. 보면서 제일 짜증났던건 지구거주민들 대하는거..,,,,,,,,,,,,,,,,,,,,,,,,,,,,
2728,중반이후 스토리 전개가 구린 느낌~,,,,,,,,,,,,,,,,,,,,,,,,,,,,
2729,개봉일 용산CGV로 기대만빵 관람을 갔지만.이정도 제작비와 출연배우로 이렇게 지루한 영화를 만들 수 있다는게 놀라움.맷 데이먼 찌질,,,,,,,,,,,,,,,,,,,,,,,,,,,,
2730,상상 가능했던 의료체계 이외....SF??,,,,,,,,,,,,,,,,,,,,,,,,,,,,
2731,설국열차와 같은 모티브 허나 이유가 있고 훨씬 맛이 강하고 재미가 있다.,,,,,,,,,,,,,,,,,,,,,,,,,,,,
2732,삶의 끈을 놓치지 않기 위해 최선을 다하는 빈민들의 이야기,,,,,,,,,,,,,,,,,,,,,,,,,,,,
2733,너무 잼있어요 굿~~,,,,,,,,,,,,,,,,,,,,,,,,,,,,
2734,이 영화에서도 공기를 폭파시키는 총알이라던지 상상력이 참 대단하다 왠지 모르겠는데 빈부의 경계를 없애려고 노력하고 결국 해내는 그런 주인공의 카타르시스에 눈물났다. 지극히 현실적이며 지극히 sf적이다. 디스트릭트 만...,,,,,,,,,,,,,,,,,,,,,,,,,,,,
2735,전작에 스케일좀 뿔리고 외계인만 뺌,,,,,,,,,,,,,,,,,,,,,,,,,,,,
2736,오늘보고왔는데 정말좋았어요!,,,,,,,,,,,,,,,,,,,,,,,,,,,,
2737,대만족..정말오랜만에 영화같은영화를봤다고생각됨 이감독의 전작은 보지못했지만 아 간만에 영화를봤다생각이들었음 ..! 꼭보셈 볼만함,,,,,,,,,,,,,,,,,,,,,,,,,,,,
2738,디스트릭트9 후편이라는 느낌을 받았습니다.전작에서는 주인공이 주류사회에서에서 비주류사회로의 유입되는 것에 전개방식이었다면,,,,,,,,,,,,,,,,,,,,,,,,,,,,
2739,100년 후에 충분히 가능성 있을법한 스토리와화려한 액션장면들.. 디스트릭트9 보다 몰입감은 떨어지지만 이영화 나름대로 재밌습니다.근데 5점 밑으로 점수주는 인간들은 영화로 부터 뭘 바라길래 말도안되는 점수를 줬는지...,,,,,,,,,,,,,,,,,,,,,,,,,,,,
2740,특별히 재미있지도 재미없지도 않았다.,,,,,,,,,,,,,,,,,,,,,,,,,,,,
2741,엘리시움이라는 공간을 잘살리지 못한 영화 지구와 상반된 엘리시움의자연과 건물을 이용한 액션이였다면 올해 가장핫한 영화도 가능했을텐데,,,,,,,,,,,,,,,,,,,,,,,,,,,,
2742,"처음에 ""우와"" 하다가 중후반갈수록 디스트릭트9 감독이 맞는지 ;;;너무 전형적인 스토리랄까... 전작 디스트릭트9 만큼의 기대를 하고 보면 많이 아쉽겠지만",,,,,,,,,,,,,,,,,,,,,,,,,,,,
2743,약간 빠른감이 없지 않았던 전개가 아쉬웠던 영화,,,,,,,,,,,,,,,,,,,,,,,,,,,,
2744,연출진짜 개답답 등장인물들 성격도 답답하고 보는데 고구마 오진다연출 진짜 못한듯 보다 화남,,,,,,,,,,,,,,,,,,,,,,,,,,,,
2745,스토리,,,,,,,,,,,,,,,,,,,,,,,,,,,,
2746,잼따바라바라 잼따 진짜잼남 ㅎㅎ,,,,,,,,,,,,,,,,,,,,,,,,,,,,
2747, 이제 엘리시움의 주인이 누구게??? ',,,,,,,,,,,,,,,,,,,,,,,,,,,,
2748,특수효과도 그렇고 전하는 메세지도 묵직하고 정말 요즘 헐리우드 영화는 정말 넘사라는 말이 딱이다,,,,,,,,,,,,,,,,,,,,,,,,,,,,
2749,모처럼 끊기지 앓는 몰입감을경험했다이렇게 재밌는 영화가 7점대라니 8.8이 맞는데보이콧이네 이거,,,,,,,,,,,,,,,,,,,,,,,,,,,,
2750,단점을 찾기가 힘든 훌륭한 근미래 SF.개연성에 관한 지적은 다른 SF보다 훨씬 개연성있어 보인다는 점에서 하지 않아도 될 것 같다.,,,,,,,,,,,,,,,,,,,,,,,,,,,,
2751,책 에이트 보고 생각난 영화 다시보니 멀지 않은 미래 같다 근데 평점 7점은 아닌듯...,,,,,,,,,,,,,,,,,,,,,,,,,,,,
2752,Good good!! 넘 좋아! 몰입해서 시간순삭,,,,,,,,,,,,,,,,,,,,,,,,,,,,
2753,역시 기대를 저버리지 않네요 굿,,,,,,,,,,,,,,,,,,,,,,,,,,,,
2754,2013년 영화가 올해의 영화 기생충과 조커를 함축하는 스토리+ 전 지구적 불평등이 야기할 멀지 않은 미래 세상을 샘플링해서 보여주고 있음에 놀랐다. 불평등과 미개한 욕망이 이토록 무서운 자멸을 재촉함을 알아야 한다...,,,,,,,,,,,,,,,,,,,,,,,,,,,,
2755,이건 절대로 1점이 아니다. 상위1%에 들지 못하는 나의 인생에 대한 절규다.,,,,,,,,,,,,,,,,,,,,,,,,,,,,
2756,흥미로운 소재,,,,,,,,,,,,,,,,,,,,,,,,,,,,
2757,어쩌면 먼 미래의 이야기일수도 있겟다는 생각이듬,,,,,,,,,,,,,,,,,,,,,,,,,,,,
2758,잼있던데,,,,,,,,,,,,,,,,,,,,,,,,,,,,
2759,개잼인데ㅎㅎㅎ 와 씨지도 내용도 다잘만ㄴ듬,,,,,,,,,,,,,,,,,,,,,,,,,,,,
2760,이런 소름끼치는 작품에다가 평점 테러 하는 놈들은 그냥 조폭 형사 살인범 나오는 영화나 보길 바란다!!,,,,,,,,,,,,,,,,,,,,,,,,,,,,
2761,평점보고 안봤었는데;; 평점은믿을게못되는구나느낀영화,,,,,,,,,,,,,,,,,,,,,,,,,,,,
2762,충분히 현실성있는 내용 + 그래픽. 무작정 1점테러 주는 애들은 정말 재미없고 현실성 떨어지는 영화를 못보았는가?,,,,,,,,,,,,,,,,,,,,,,,,,,,,
2763,네이버 평점이 너무 낮아요. 재미있습니다.,,,,,,,,,,,,,,,,,,,,,,,,,,,,
2764,재밌게 잘 봤습니다. 주인공의 희생으로 끝난 결말이 안타까웠습니다,,,,,,,,,,,,,,,,,,,,,,,,,,,,
2765,그래픽 빼면 80년대 영화. 갈등구조가 단순. 해결도 단순. 능동적인 해결이 아니라 처음부터 끝까지 사건에 끌려다닌다. 감정이입할 대상도 없고 해결의 카타르시스도 없다.,,,,,,,,,,,,,,,,,,,,,,,,,,,,
2766,개막장 한국드라마만 보는놈들 1점주겠지.. 이런영화를 1점주다니;,,,,,,,,,,,,,,,,,,,,,,,,,,,,
