,content,,,,,,,,,,,,,,,,,,,,,,,,,,,,
867,평점이 낮아서 기대안했는데 정말 최고였던 영화 !!!!!  미래의 지구가 정말 이렇게 될것같다 여운이 남는 멋진 영화 ~,,,,,,,,,,,,,,,,,,,,,,,,,,,,
868,몰입도 최고~! 개인적으로 결말도 맘에 들었음,,,,,,,,,,,,,,,,,,,,,,,,,,,,
869,영화는 역시 감독이다. 꼭봐라 두번봐라,,,,,,,,,,,,,,,,,,,,,,,,,,,,
870,잼있어요 . ㅎㅎ,,,,,,,,,,,,,,,,,,,,,,,,,,,,
871,평점이 왜 7점대야,,,,,,,,,,,,,,,,,,,,,,,,,,,,
872,굿,,,,,,,,,,,,,,,,,,,,,,,,,,,,
873,9점인 것 같으나 평점이 좀 잘못된 것 같아서 10점 줍니다.ㅎ,,,,,,,,,,,,,,,,,,,,,,,,,,,,
874,10대들아 너희들은 여기서 뭐하냐? 이거 청소년관람불가다.,,,,,,,,,,,,,,,,,,,,,,,,,,,,
875,빌더버그 클럽 미래 버전이다~!!!,,,,,,,,,,,,,,,,,,,,,,,,,,,,
876,잼납니당~,,,,,,,,,,,,,,,,,,,,,,,,,,,,
877,볼만했음,,,,,,,,,,,,,,,,,,,,,,,,,,,,
878,이 영화가 왜 평점이 이정도 밖에 안되는 건지 모르겠다 우리나라 영화 알바들 진짜 반성해라 적어도 올해 개봉한 영화 중엔 제일 좋았다고 생각한다,,,,,,,,,,,,,,,,,,,,,,,,,,,,
879,과소평가된 영화...,,,,,,,,,,,,,,,,,,,,,,,,,,,,
880,평점 신경안쓰고 그냥 가서 봤네요... 후회는 안해요! 잼 있어요!,,,,,,,,,,,,,,,,,,,,,,,,,,,,
881,설국 열차와 비슷한 장르였지만 설국열차보단 잘나면잘났지 못했다고는 생각되지 않는 영화네요 빈부격차에서 상류층들과 하층간의 대립 그리고 상류층들간의 권력다툼과 군부의 쿠데타 담고있는것도 많은 영화인듯 합니다 어지러운전...,,,,,,,,,,,,,,,,,,,,,,,,,,,,
882,퐝퐝~ 액션 좋은영화~ 우리나라는 못만드는영화 괜찮음 볼만함 진지하게 영화를 평가하면서 보는것들은 못봄.... 월래그런것들은 작품성따지지 ㅋㅋ 그냥이런영화는 ~ 마음편하게 보는게 좋은듯,,,,,,,,,,,,,,,,,,,,,,,,,,,,
883,조조로 보고왔는데 재미있게 보고왔습니다 ^^,,,,,,,,,,,,,,,,,,,,,,,,,,,,
884,갠적으로 감독과 맷데이먼을 좋아하기땀시! 별5개 투척!ㅋㅋ,,,,,,,,,,,,,,,,,,,,,,,,,,,,
885,시원한 액션 기대하고 갔다가 감동받고 온 영화. 최고다!,,,,,,,,,,,,,,,,,,,,,,,,,,,,
886,헐리웃 영화 특유의 히어로 만들기,,,,,,,,,,,,,,,,,,,,,,,,,,,,
887,현재 네이버평점 7.23점. 그정도로 쓰레기 아님.  볼만한 영화이고 미래예측에 관심있는 사람이라면 9점도 넘게 줄 수 있다고 봄.  네이버평점은 외국영화언 너무 짬,,,,,,,,,,,,,,,,,,,,,,,,,,,,
888,좋은 소재를 망친 계단식 복선과 우연들....큰배경에 주인공과 특수요와과의 소소한 인형놀이........,,,,,,,,,,,,,,,,,,,,,,,,,,,,
889,생각보다 별루네요 스토리가 별로 공감도안가고 억지감동에..,,,,,,,,,,,,,,,,,,,,,,,,,,,,
890,기발하진 않았지만 재미있었다,,,,,,,,,,,,,,,,,,,,,,,,,,,,
891,졸리다,,,,,,,,,,,,,,,,,,,,,,,,,,,,
892,예고편만 스케일이 크고 실제로는 남자 둘이 주먹질만 하는 영화,,,,,,,,,,,,,,,,,,,,,,,,,,,,
893,생각보다 재미없네..ㅡㅡ,,,,,,,,,,,,,,,,,,,,,,,,,,,,
894,또한번 느낍니다. 네이버 평점사기꾼들. 작품에 흠집내지말고 진정 영화로 승부하세요. 한국영화 다시는 안볼랍니다.,,,,,,,,,,,,,,,,,,,,,,,,,,,,
895,최고의 영화라 말하고싶네요  기대에 배신하지않은 영화예요,,,,,,,,,,,,,,,,,,,,,,,,,,,,
896,솔직히 한국영화에  비하면 돈 아깝지 않을 정도입니다보세요!!!!다들!^^보는내내 종교개혁시대가 교차됐습니다.,,,,,,,,,,,,,,,,,,,,,,,,,,,,
897,그렇게 욕먹을 용화는 아닌듯...물론 재미는 보통,,,,,,,,,,,,,,,,,,,,,,,,,,,,
898,네이버 평점 믿지는 않지만 자꾸 보게 되는데 이번에는 개봉 첫날이라 그냥 생각없이 가서 봤는데 SF좋아하는 나에게는 최고!  기대없이 보시면 최고에요~ 기대를 한다면 별로일수도..,,,,,,,,,,,,,,,,,,,,,,,,,,,,
899,이 영화는 재미나 액션으로 평가받기엔 아쉽다.인물들의 내면 갈등과 생존,,,,,,,,,,,,,,,,,,,,,,,,,,,,
900,맷 데이먼과 조디 포스터 최고다,,,,,,,,,,,,,,,,,,,,,,,,,,,,
901,디스트릭9의 천재적 발상의 그 신선한 충격을실망시키지 않은 엘리시움!다음 작품도 기대~  ^^,,,,,,,,,,,,,,,,,,,,,,,,,,,,
902,그럭저럭 볼만하고,,,,,,,,,,,,,,,,,,,,,,,,,,,,
903,기대했는데 정말 실망이다.. 시간이아깝다 평점 4점정도로 내려가야함,,,,,,,,,,,,,,,,,,,,,,,,,,,,
904,돈만쳐바른영ㅇ솨 스토리없음,,,,,,,,,,,,,,,,,,,,,,,,,,,,
905,진짜 쓰레기인데 평점 7점대 인게 놀라울 따름이다 배우들이ㅅ정말 아까운 영화,,,,,,,,,,,,,,,,,,,,,,,,,,,,
906,여자친구랑 보면서 느낀건.. 길다는거..다들 재미있다고 찍었는데..재미..는 모르겠더라.. 멧데이먼때문에 봤다가 낭패..,,,,,,,,,,,,,,,,,,,,,,,,,,,,
907,납득불가,,,,,,,,,,,,,,,,,,,,,,,,,,,,
908,감독에게 크게 실망했다ㅡ개연성도 감독의 특징도 교훈도 재미도 못잡은 올해 기대 이하의 영화중 하나,,,,,,,,,,,,,,,,,,,,,,,,,,,,
909,7점대 초중반이 적당한 수준의 영화,,,,,,,,,,,,,,,,,,,,,,,,,,,,
910,다른영화알바들 정말 무섭다. 이영화가 7점이라니.. 엘리시움 관계자님들 네이버의 힘이 얼마나 강력한데 평점 이지경 되도록 내버려두나요. 나우유씨미따위의 영화는 네이버 완벽하게 구워삶아서 높은평점 유지하는데ㅠ 아진짜 ...,,,,,,,,,,,,,,,,,,,,,,,,,,,,
911,완죤대박~ good,,,,,,,,,,,,,,,,,,,,,,,,,,,,
912,흥미,,,,,,,,,,,,,,,,,,,,,,,,,,,,
913,충분히 볼만한 영화!,,,,,,,,,,,,,,,,,,,,,,,,,,,,
914,기대이상은 아니지만 돈 아깝지 않은데..^^,,,,,,,,,,,,,,,,,,,,,,,,,,,,
915,최고!,,,,,,,,,,,,,,,,,,,,,,,,,,,,
916,닐 블롬캠프 감독 역시 실망시키지 않았다!!!,,,,,,,,,,,,,,,,,,,,,,,,,,,,
917,멧데이먼 연기가 최고!!,,,,,,,,,,,,,,,,,,,,,,,,,,,,
918,역시 잼있네요~!!,,,,,,,,,,,,,,,,,,,,,,,,,,,,
919,전체적인 내용이 어설퍼... 누구따라한다고 카메라 졸라 흔들어 눈아프고... 니맛도 내맛도 아닌... 곧 간판 내릴녀석 감독이 누구야 대체!!!!,,,,,,,,,,,,,,,,,,,,,,,,,,,,
920,평가자체가 아깝다..이걸영화라고...감동도 없고 스토리도 없고...오직 배우만 있을뿐...근데   솔까 5점이상은 이해불가... 사실 3점도 주기싫다...에이 1점만주자..5점이상은  오버다..,,,,,,,,,,,,,,,,,,,,,,,,,,,,
921,내용도 없고 메세지도 없는 영화.,,,,,,,,,,,,,,,,,,,,,,,,,,,,
922,디스트릭트9이 10점이라면 8-8.5점 정도 줄수있겠네요멧데이먼 빡빡이가 그닥 안어울리고,,,,,,,,,,,,,,,,,,,,,,,,,,,,
923,영화 재미 없게 본적이 거의 없는데 이건 너무 재미 없었어요..,,,,,,,,,,,,,,,,,,,,,,,,,,,,
924,이 평점은 아닌듯 국내영화만 독식하는 극장 ㅡㅡ,,,,,,,,,,,,,,,,,,,,,,,,,,,,
925,너무 실망적이다,,,,,,,,,,,,,,,,,,,,,,,,,,,,
926,재미없다,,,,,,,,,,,,,,,,,,,,,,,,,,,,
927,역시!!! 명불허전!!! 눈으로 봐야함.,,,,,,,,,,,,,,,,,,,,,,,,,,,,
928,확실히 디스트릭트9에 비해 못미치지만,,,,,,,,,,,,,,,,,,,,,,,,,,,,
929,새로운 SF의 시작!,,,,,,,,,,,,,,,,,,,,,,,,,,,,
930,별 반개도 아깝다.......헐리우드에서 디스트릭트9을 망쳤다....시간아깝고 돈아깝고 내생에 이렇게 지루하고 신경질나는 영화는 처음...!!,,,,,,,,,,,,,,,,,,,,,,,,,,,,
931,맷 데이먼과 샬토 코플리,,,,,,,,,,,,,,,,,,,,,,,,,,,,
932,개연성 지적하신분들이 많은데 관객을 바보로 아나 싶을정도로 말안되는 설정에 혀를 찼다. 서론만 길고 엘리시움 진입후 아무런 보안이 없어 짧은 시간내에 전부 뚫리고 바로 끝난다. 딱한명과 단 몇분간의 싸움에 끝나는 난...,,,,,,,,,,,,,,,,,,,,,,,,,,,,
933,정말 살다살다 이런 개망작은 처음이다..충분히 잼있게 가져갈수있는 스토리를 이딴식으로 망치나?,,,,,,,,,,,,,,,,,,,,,,,,,,,,
934,영화 초반,,,,,,,,,,,,,,,,,,,,,,,,,,,,
935,정말 재미없다 스토리의 개연성 없고 액션도 그닥 좋은 편도 아니고 영화를 보고 날 로그인하게 만들었다,,,,,,,,,,,,,,,,,,,,,,,,,,,,
936,등장인물이 아까운 영화,,,,,,,,,,,,,,,,,,,,,,,,,,,,
937,어디서 본 영화 같다 싶었더니.. 디스트릭트9,,,,,,,,,,,,,,,,,,,,,,,,,,,,
938,초반 엘리시움 보여줄 때만 흥미롭고나머지는 평범,,,,,,,,,,,,,,,,,,,,,,,,,,,,
939,개인적으로 재밌게 봄. 영화관서 보면 좋았을듯.,,,,,,,,,,,,,,,,,,,,,,,,,,,,
940,재밌음.잘못된정치가인류파멸의길로..쿠루거 재생되고 넘잘생김ㅋ근데목소리는좋게재생안되는지여전히이상함.발음보다목소리가웃낌.,,,,,,,,,,,,,,,,,,,,,,,,,,,,
941,지금 다시 봐도 요즘 영화 못지 않게 쩌네 영화를 영화로 봐야지 꼭 테넷 같은거 봐도 쥐뿔도 모르는 것들이 꼭 따지긴 따져요,,,,,,,,,,,,,,,,,,,,,,,,,,,,
942,디스토피아적 배경에 유토피아적 전개.,,,,,,,,,,,,,,,,,,,,,,,,,,,,
943,재밌네 굿!이런스타일 좋다,,,,,,,,,,,,,,,,,,,,,,,,,,,,
944,최고  최고 쵝오  맷데이먼 최고  감동,,,,,,,,,,,,,,,,,,,,,,,,,,,,
945,,,,,,,,,,,,,,,,,,,,,,,,,,,,,
946,닐 감독의 혁명적 력량에 경의를 표하오!    엘리시움은 바로 사회주의락원을 말하는것입니다 여러부운~!!!,,,,,,,,,,,,,,,,,,,,,,,,,,,,
947,진심영화보는내내초집중모드였는데!!너무너무재미있는내용이랑영상미연기력모두퍼펙트였다,,,,,,,,,,,,,,,,,,,,,,,,,,,,
948,내가 찾던 영화가 아니야!,,,,,,,,,,,,,,,,,,,,,,,,,,,,
949,너무나도 무궁무진한 세계관이 짧게 나와서 아쉬웠습니다....,,,,,,,,,,,,,,,,,,,,,,,,,,,,
950,일단 안봤는데요 디스트릭트9보고 왔는데요 디스트릭트 스토리 신박함 외계인들귀여움전개과정 등 정말정말자밌어서 돌려봤습니다이영화도 그러길 바라며 10점 미리주고갑니다. 보러.,,,,,,,,,,,,,,,,,,,,,,,,,,,,
951,급급한 전개와 복잡한 서브플롯,,,,,,,,,,,,,,,,,,,,,,,,,,,,
952,영리병원 폐지하라 !!,,,,,,,,,,,,,,,,,,,,,,,,,,,,
953,급하게 밀어붙이느라 개연성이 떨어지는 후반부 연출이 아쉽다.,,,,,,,,,,,,,,,,,,,,,,,,,,,,
954,생각보다 재밋었고 극장에서 봤으면 하는 아쉬움,,,,,,,,,,,,,,,,,,,,,,,,,,,,
955,역시 맷데이먼..평점 보고 기대 안하고 봤는데 너무 재밌고 우리 사회에 대해 한번 더 생각해볼수 있는 의식있는 영화였음,,,,,,,,,,,,,,,,,,,,,,,,,,,,
956,늘 그렇지만 볼거리와 생각할 거리를 같이 제공하는 닐 감독,,,,,,,,,,,,,,,,,,,,,,,,,,,,
957,재미있음. 중간까지는 말이죠.,,,,,,,,,,,,,,,,,,,,,,,,,,,,
958,스토리가 너무 막장인거같다 그냥 딱 킬링타임용,,,,,,,,,,,,,,,,,,,,,,,,,,,,
959,need little more drama,,,,,,,,,,,,,,,,,,,,,,,,,,,,
960,설정이나 작은 디테일들에 구멍이 숭숭 뚫려있긴한데 그냥 영화가 설명에 인색해서라고 이해하고 억지로 끼워맞추면된다. 적당히 시간 때우는데 부족함은 없는 영화,,,,,,,,,,,,,,,,,,,,,,,,,,,,
961,노잼도 아니고 꿀잼도 아님,,,,,,,,,,,,,,,,,,,,,,,,,,,,
962,너무재밋다정말로 최고야 늘 재밋어,,,,,,,,,,,,,,,,,,,,,,,,,,,,
963,상류층이 모여사는 우주정거장 엘리시움. 소재는 참신했으나 전개가 매끄럽지못하고 군데군데 의문점이 드는게 한두가지가 아니다..,,,,,,,,,,,,,,,,,,,,,,,,,,,,
964,뭔가가 조금 아쉬운건 기분탓이겠지,,,,,,,,,,,,,,,,,,,,,,,,,,,,
965,스토리는 좀 별로였는데 컨셉아트만은 정말 박수받을 만한 영화. 진짜 설정 세세하게 잡아서 그렸음. 미래식 디자인 공부하는 사람들에게 정말 좋을 영화임.근데 아 카타나는... 좀... 별로..ㅠ 할리우드의 전형적 일뽕...,,,,,,,,,,,,,,,,,,,,,,,,,,,,
966,세계관.. 소재 다 좋았는데 표현이나 개연성이 좀 엉성하다 아쉽다..,,,,,,,,,,,,,,,,,,,,,,,,,,,,
967,소재가 흥미로웠고 재미있었지만 웬지 약간 산만한 느낌.,,,,,,,,,,,,,,,,,,,,,,,,,,,,
968,몰입도는 괜찮았는데 어째 만들다 만 영화 느낌이 나냐,,,,,,,,,,,,,,,,,,,,,,,,,,,,
969,암울한 미래의 B급 영화 전문,,,,,,,,,,,,,,,,,,,,,,,,,,,,
970,아쉬운 부분도 있었지만 재밌게봤고 좋은영화,,,,,,,,,,,,,,,,,,,,,,,,,,,,
971,좋은 영화입니다. 화려하고 다 때려부수는 액션을 기대했다면 실망할수 있지만. ..  이 영화의 세계관내에서 정말 잘만든 영화임,,,,,,,,,,,,,,,,,,,,,,,,,,,,
972,주인공이결말이넘나슬프다 ㅠㅠ그리살려고했는뎅 ㅠㅠ,,,,,,,,,,,,,,,,,,,,,,,,,,,,
973,역순행적 구성과 군더더기 없는 깔끔한 진행,,,,,,,,,,,,,,,,,,,,,,,,,,,,
974,용두사미..갈수록 허술해 짐ㅠㅠ,,,,,,,,,,,,,,,,,,,,,,,,,,,,
975,완전 굿인 영화.  맷데이먼 주연인 거보고봤는데~내용도 있고  재미남,,,,,,,,,,,,,,,,,,,,,,,,,,,,
976,평점이 너무 낮아서 8점 주려다 10점해요 기발하고 잼있던데,,,,,,,,,,,,,,,,,,,,,,,,,,,,
977,개존잼 ~ 평점 테러준 색끼들 양심이 있어라,,,,,,,,,,,,,,,,,,,,,,,,,,,,
978,두번봐도 최고 근데 평점왜이래,,,,,,,,,,,,,,,,,,,,,,,,,,,,
979,악역 크루거 배우 안 어울려 뭔가 선해 보여,,,,,,,,,,,,,,,,,,,,,,,,,,,,
980,멧데이먼 나오면 다 재밌네..,,,,,,,,,,,,,,,,,,,,,,,,,,,,
981,의식있는 감독과 배우... 의료민영화에 대한 섬뜩한 경고!최고의 영화입니다.역시 믿고 보는 맷입니다,,,,,,,,,,,,,,,,,,,,,,,,,,,,
982,볼만하던데 괜찮더구만,,,,,,,,,,,,,,,,,,,,,,,,,,,,
983,닐 블롬캠프스러운 영화입니다. SF와 패키지 게임,,,,,,,,,,,,,,,,,,,,,,,,,,,,
984,철학적이거나 어렵지 않아 좋다.초딩아들과 같이봐도 잼있을 영화,,,,,,,,,,,,,,,,,,,,,,,,,,,,
985,미국의 사회적 문제를 투영하는 SF 액션물. 감독의 전작 탓에 기대가 너무 컸다.,,,,,,,,,,,,,,,,,,,,,,,,,,,,
986,멋진영화 재미와 함께 진지한 질문을 던지고 생각을 하게 하다니 이만한 영화가 있을까,,,,,,,,,,,,,,,,,,,,,,,,,,,,
987,하도 별로라고 해서 기대를 안 했는데,,,,,,,,,,,,,,,,,,,,,,,,,,,,
988,이게왜 7점대임. 8점이상은 나와줘야지,,,,,,,,,,,,,,,,,,,,,,,,,,,,
989,큰 기대안했는데 역시나. 맷데이먼의 연기는 훌륭했지만 중간중간 어이없을정도로 잘풀리는 전개가 짜증날만큼 황당하다. 전반적으로는 나름 교훈있긴한데 글쎄 재미는 그닥,,,,,,,,,,,,,,,,,,,,,,,,,,,,
990,주제의식은 좋으나.. 너무 신파다..,,,,,,,,,,,,,,,,,,,,,,,,,,,,
991,재밌네. 볼만해. 그렇다.,,,,,,,,,,,,,,,,,,,,,,,,,,,,
992,괜찮네요. 중간에 모순되는 이야기는 있지만 머리만지키면 된다했는데 누군되고 누군 안되는정도?ㅎ그거 . 이외에는 메시지도 있고 볼만한 영화,,,,,,,,,,,,,,,,,,,,,,,,,,,,
993,제목에서 느껴지듯이 결말은 이상적 사회주의의 완성. 하지만 현실에선 이윤을 위한 자본주의와 경제적구조가 애초에 존재하지 않았다면 AI와 같은 과학의 발전은 고사하고 만병을 치료할 수 있는 치료기조차 나오지 않았겠지,,,,,,,,,,,,,,,,,,,,,,,,,,,,
994,이게 왜19세얔ㅋ 12세짘,,,,,,,,,,,,,,,,,,,,,,,,,,,,
995,디스트릭트 9때문에 너무 기대해서인지 실망감이 컸다. 어이없는 전개에 몰입감도 떨어졌고 조디포스터의 비중이나 역할이 매우 아쉬웠다.,,,,,,,,,,,,,,,,,,,,,,,,,,,,
996,포장은 그럴듯 했으나 액션은 비급 사무라이 영화에 의사라는 여자가 할 줄 아는건 애 안고 뛰거나 죽어가는 주인공한테 도와달라고 외치는 것 뿐이라니... 두번째 보니 최악이네.,,,,,,,,,,,,,,,,,,,,,,,,,,,,
997,창의적인소재가스토리에부합하지못했다.,,,,,,,,,,,,,,,,,,,,,,,,,,,,
998,맷데이먼 믿으니까. 궁금한 엘리시움을 좀 더 표현했으면..,,,,,,,,,,,,,,,,,,,,,,,,,,,,
999,로보캅도 그렇고 이 영화도 그렇고 이제 네이버 평점은 안 믿을랍니다. 싸구려 한국 영화들 보다 재밌고 작품성도 뛰어난데 자기 취향 아니라고 1점 주는 사람들과 알바생들 때문에 점수는 믿을게 못 되네요.,,,,,,,,,,,,,,,,,,,,,,,,,,,,
1000,중간중간 좀 지루해서 별두개뺌.  그렇게 좋은 의료기기 좀 나눠서 쓰자 이기적인것들아,,,,,,,,,,,,,,,,,,,,,,,,,,,,
1001,알바들 평점깎기에 놀아나지 마세요외국영화 7점이상은 필히봐야될 영화로 생각하게된 계기가 됨,,,,,,,,,,,,,,,,,,,,,,,,,,,,
1002,8점대는 되야지~~! 영상미 볼만합니딘,,,,,,,,,,,,,,,,,,,,,,,,,,,,
1003,딱...영화관에서  안보길 잘한영화...dvd  용  으로 보면 그냥 그렇게 볼만함,,,,,,,,,,,,,,,,,,,,,,,,,,,,
1004,왜 19금인지 모르겠다. 뻔한 스토리에,,,,,,,,,,,,,,,,,,,,,,,,,,,,
1005,내용 소재는 좋은데 109분이라는 시간에 표현하기엔 좀 벅찬느낌,,,,,,,,,,,,,,,,,,,,,,,,,,,,
1006,제3의 SF을 개척하는 블룸캠프,,,,,,,,,,,,,,,,,,,,,,,,,,,,
1007,깊이있는 SF스토리를 원한다면 기대말기를. 액션의 화려함은 있으나 원대한 세계관에 비하면 지나치게 좁게 영화를 이끈다. 이 설정을 가지고 왜 고작 이런 얘기밖에 못했을까. 더 확장하고 시스템을 파고들었다면 SF적 상...,,,,,,,,,,,,,,,,,,,,,,,,,,,,
1008,같은 감독의 디스트릭트9에서 보여줬던 훌륭한 균형감각을 잃어버린 영화 그래도 볼만하긴하다,,,,,,,,,,,,,,,,,,,,,,,,,,,,
1009,디스토피아적인 미래 상황도 안타깝지만  무엇보다 영화 자체가 안타깝다...,,,,,,,,,,,,,,,,,,,,,,,,,,,,
1010,하나...맷데이먼 진짜 영화보는눈없다...어쩌다 이런영화에; 진짜 코웃음나오는 영화. 중간중간 뜬금포 작렬해주시고,,,,,,,,,,,,,,,,,,,,,,,,,,,,
1011,참... 별루고 재미없고 멋대가리없고 별거없다. 맷데이먼 조디포스터가 나올 영화는 아니다.,,,,,,,,,,,,,,,,,,,,,,,,,,,,
1012,스토리 탄탄하고 충분히 재미있음.,,,,,,,,,,,,,,,,,,,,,,,,,,,,
1013,빈익빈부익부 . . 영화의 설정이 내내 불쾌하군..,,,,,,,,,,,,,,,,,,,,,,,,,,,,
1014,보는내내 이걸 내가왜볼까 라고 생각하게하는영화 연출수준은 c급 주인공도 찌질하고 내용도엉성하고 이게 평점이왜 이렇괴높지??,,,,,,,,,,,,,,,,,,,,,,,,,,,,
1015,걍 뭔가 아쉽다.. 맷 데이먼 가지고 성에 안차는 영화,,,,,,,,,,,,,,,,,,,,,,,,,,,,
1016,평점이 너무 낮네. 8점 이상은 충분히 되는데.,,,,,,,,,,,,,,,,,,,,,,,,,,,,
1017,어서 프런과 인간의 우주전쟁을 보여주세요 현기증 난단 말이에요,,,,,,,,,,,,,,,,,,,,,,,,,,,,
1018,진짜 보면 느끼는게 많아요.  한번보세요,,,,,,,,,,,,,,,,,,,,,,,,,,,,
1019,엘리시움 정말 살기 좋을것 같다. 아름다워,,,,,,,,,,,,,,,,,,,,,,,,,,,,
1020,디스트릭트9에서 보여준 닐블롬캠프의 천재성은 SF마니아의 축적된 후천적 역량이었던 듯. SF블럭버스터를 책임지기엔 아직 내공이 부족하다. 사회풍자를 즐기는 조디포스터의 출연은 당연지사지만,,,,,,,,,,,,,,,,,,,,,,,,,,,,
1021,엘리시움 재밌게 잘봤네요^^,,,,,,,,,,,,,,,,,,,,,,,,,,,,
1022,중간중간 뜬금없는 장면이 좀 보인다. 이리저리 난도질당한거같은데 편집만 제대로 해놨어도 더 괜찮았을텐데 안타깝다. 지금 버전으로 봐도 괜찮긴 함.,,,,,,,,,,,,,,,,,,,,,,,,,,,,
1023,평점이 왜이모양이지? 정말재밌게봤는데스토리 액션 영상 다 훌륭함,,,,,,,,,,,,,,,,,,,,,,,,,,,,
1024,프레이 송지효 닮앗음 ㅋㅋ,,,,,,,,,,,,,,,,,,,,,,,,,,,,
1025,뭔가 초반엔 흥미진진한데 갈수록 쫌 애매합니다잉,,,,,,,,,,,,,,,,,,,,,,,,,,,,
1026,뭔가 생각하게 해주는 영화!!!,,,,,,,,,,,,,,,,,,,,,,,,,,,,
1027,제작비 잡아먹은 조디포스터 캐스팅과 왜색짙은 연출.,,,,,,,,,,,,,,,,,,,,,,,,,,,,
1028,5점도 후하다 조디포스터 실망이다 맷데이먼 빼고 다 실망 오랜만에 영화보면서 짜증이,,,,,,,,,,,,,,,,,,,,,,,,,,,,
1029,디스트릭트 9을 뛰어넘지 못했다,,,,,,,,,,,,,,,,,,,,,,,,,,,,
1030,하고자 하는 말은 알겠지만,,,,,,,,,,,,,,,,,,,,,,,,,,,,
1031,맷데이먼을 믿고 봤는데 스토리가 영.. 거시기하넹.. 액션의 시원한맛도.. SF의 신선함도 없고 유치하게만 보이는 내용..,,,,,,,,,,,,,,,,,,,,,,,,,,,,
1032,아 너무 뻔해 ㅠㅠ 이정도로 스토리텔링이 구린 감독이 아닌데....이번 작품은 실패...각 씬의 구성도 상당히 실망스러웠어요...그래도 블롬캠프니까 다음 작품 기대해봅니다!,,,,,,,,,,,,,,,,,,,,,,,,,,,,
1033,그냥 SF니까 봅니다요~~,,,,,,,,,,,,,,,,,,,,,,,,,,,,
1034,이걸 예를 들자면 불법체류자 동남아시아인들이 한국에서 의료혜택 다 받아먹는거와 똑같다. 의료보험 적자는 당연 한국국민들이 부담하고 ^_^,,,,,,,,,,,,,,,,,,,,,,,,,,,,
1035,좋은 배우와 소재를 전혀 살리지 못한 영화. 디테일과 완성도마저 떨어지는 걸 보면 뭔가 제작에 문제가 있었던 듯 하다. 엉성하고 엉성하다.. 멧데이먼은 뭔 죄야 ...ㅜ,,,,,,,,,,,,,,,,,,,,,,,,,,,,
1036,아이템은 좋았으나 완성도가 쓰레기인 영화,,,,,,,,,,,,,,,,,,,,,,,,,,,,
1037,작가의 작품은 명작인데,,,,,,,,,,,,,,,,,,,,,,,,,,,,
1038,활용못한 소재가 너무 많고 허술하다. 아트웍도 신경을 안쓴듯.,,,,,,,,,,,,,,,,,,,,,,,,,,,,
1039,대충 처음부터 끝까지 예상되는 뻔한 내용이었음. 스토리는 없고 액션 조금 보태는 영화,,,,,,,,,,,,,,,,,,,,,,,,,,,,
1040,맷 데이먼,,,,,,,,,,,,,,,,,,,,,,,,,,,,
1041,괜찮은 설정....말도 안되는 연출,,,,,,,,,,,,,,,,,,,,,,,,,,,,
1042,ㅈ문가들이시네 다들 ㅉㅉ 평점 올리고감,,,,,,,,,,,,,,,,,,,,,,,,,,,,
1043,기술력의 모순. 어떤 병이든 고칠 과학은 있는데 지들 본진 제대로 방어할 체계는 갖추지 못한 모순이 넘치는 영화,,,,,,,,,,,,,,,,,,,,,,,,,,,,
1044,논리적으로안맞고도뻔한스토리라인 그리고 보면서 이런생각이들었다. 일부러 희귀성을 만들어 가치를 높이려는 이기적인시장경제를 비판 그리고 공산주의를 신봉시킬려고 만든듯한는낌을 받았는데 감독이 어떤의도로만들었는지 궁금하다....,,,,,,,,,,,,,,,,,,,,,,,,,,,,
1045,내용은 조금 허술할 수 있다..하지만 그 안에 있는 메세지는 무시하지 말자.병든 자 모두가 차별되지 않게 치료받고 행복할 권리가 있다고 본다.,,,,,,,,,,,,,,,,,,,,,,,,,,,,
1046,어설픈 미래 세팅,,,,,,,,,,,,,,,,,,,,,,,,,,,,
1047,멧 데이먼 때문에 6점 준다. sf 매니아인데 극장에서 봤다면 욕했을 영화,,,,,,,,,,,,,,,,,,,,,,,,,,,,
1048,그냥 집에서 다운받아볼 만한 정도.,,,,,,,,,,,,,,,,,,,,,,,,,,,,
1049,그냥 멧데이먼 땜 봄과연 생각 어뵤이보면 재미있음 ㅋ,,,,,,,,,,,,,,,,,,,,,,,,,,,,
1050,구슬이 서말이나 꿰다 만 상태로 던져진 영화,,,,,,,,,,,,,,,,,,,,,,,,,,,,
1051,의료보험료 올라가는 소리가 들리는 영화 ㅎㅎㅎ,,,,,,,,,,,,,,,,,,,,,,,,,,,,
1052,마지막이 조금 마음 애리네,,,,,,,,,,,,,,,,,,,,,,,,,,,,
1053,누구를 위한 권력이고 평화인지 생각해 볼 수 있는 영화,,,,,,,,,,,,,,,,,,,,,,,,,,,,
1054,초반은 그럴싸 했지만 갈수록 평범한 영화임..스토리도 뻔하고 엘리시움 도시를 더 묘사를 잘했으면 멋졌을듯..,,,,,,,,,,,,,,,,,,,,,,,,,,,,
1055,조잡스러운 스토리허접한 액션,,,,,,,,,,,,,,,,,,,,,,,,,,,,
1056,엘리시움이 뭐 저리 허접할까,,,,,,,,,,,,,,,,,,,,,,,,,,,,
1057,딱 예고편인 영화 그 이상도 이하도 없다. 내용도 ~ 애초부터 의료기계 하나 내려주면 우리모두 해피해피 했을꺼 같은데 괜희 죽이고 싸우는 어처구니 없는 ~,,,,,,,,,,,,,,,,,,,,,,,,,,,,
1058,평점보고 안봤으면 후회할뻔..평점보고 좋은 영화 놓치는 우를 범하지 말기를..^^,,,,,,,,,,,,,,,,,,,,,,,,,,,,
1059,나는 생각보다 재밌게 봤고,,,,,,,,,,,,,,,,,,,,,,,,,,,,
1060,디스트릭트9감독이라서봤더니역시굿!,,,,,,,,,,,,,,,,,,,,,,,,,,,,
1061,개연성이 너무 떨어지고 현실성이 너무 떨어짐. 처음구성한 틀만 흥미로움. 고등학생이 생각할수 있는 정도의 수준으로 만든영화. 이영화 글쓴작가랑 연출한감독들 너무 실망했음.,,,,,,,,,,,,,,,,,,,,,,,,,,,,
1062,나는 이 세상에서 본영화중에 최고임 아픈사람은 이해할거임 진정한 휴머니즘 아닐가여 가난하고 병든자가 지배하는세상 착한세상임,,,,,,,,,,,,,,,,,,,,,,,,,,,,
1063,10점 짜리는 아닌데  평점이 너무 낮아서 10점. 평점 안좋아서 다운 받아봤는데 영화관에서 볼 걸 후회된다. 현실적인 디스토피아와 전체적인 배경 스토리가 참신했음.주인공의 세부적인 개연성들이 좀 떨어지나 근래 SF...,,,,,,,,,,,,,,,,,,,,,,,,,,,,
1064,생각보다는 그저 그랬던 SF영화. 후반으로 갈수록 떨어지는 몰입도와 액션신의 만회를 위해서는 오블리비언처럼 무언가 더 강력한 엮임이 필요했다.,,,,,,,,,,,,,,,,,,,,,,,,,,,,
1065,요새 이런 영화들이 자주 나오는걸 보면 빈부격차 문제가 심각하긴 한모양인 듯. 중반까지는 참 좋았으나 중반이후부터 평범한 액션 영화로 변한게 아쉽다,,,,,,,,,,,,,,,,,,,,,,,,,,,,
