,content,,,,,,,
2011,2번봤다. 지루한 플롯으로 느껴질수도 있지만 주인공의 내면으로 이입하게 된다면 깊은 울림을 공감할 수 있다. 영화를 보실 분들은 케릭터에 빙의해서 보시길.,,,,,,,
2012,심야로 봤는데 꿈나라가다가 로켓소리에 돌아왔구요.마지막 20분은 나갈지 말지 생각하다보니 끝났네요.별점 3점도 아주아주 후하게 준겁니다!!!,,,,,,,
2013,보다가 재미가 드릅게 없어서 중간에 나왔다,,,,,,,
2014,마션,,,,,,,
2015,돈 아깝고 시간 아깝고... 올해 본 영화중에 최악.이럴거면 그냥 다큐멘터리로 제작해서 보는게 나았을듯.사전 정보없이 영화로만 생각하고 갔다가 피봤음.특히 피곤한 상태라면 무조건 꿈나라로 가게 될 것임...,,,,,,,
2016,보다가 꿀잠잤네 긴박감도없고 집중도안되고,,,,,,,
2017,닐 암스트롱의 일기장을 보고싶다거나 본인이 요새 불면증에 시달린다면 추천드립니다,,,,,,,
2018,라이언고슬링의 인생영화입니다. 우주에 대해 알지 못하셨던 분,,,,,,,
2019,생각보다 지루함 진실이 아닐수도잇는내용을,,,,,,,
2020,리얼 후기 알바 아님.대ㅡ만족해서 1점입니다. 보실분들... 잘생각보세요ㅎㅎ.... 뭔가 사람들이 너무 가식적인느낌? 아는척하는 느낌이 강하네요. 그냥 재미없으면 재미없다고해도 되는데.. 돈쓴게 아까워서 합리화하는것...,,,,,,,
2021,개인적으로 닐 암스트롱에 대해 관심 있는 분만 보세요 태어나서 처음으로 영화관에서 잠들었습니다 있어보이는 척 하면서 높은 점수 준 댓글 보고 속았네요,,,,,,,
2022,그냥쓰렉임...집에서자는게나음,,,,,,,
2023,진짜 양심도 없냐 이걸 10점 주게 일반 다큐멘터리가 더 재밌다,,,,,,,
2024,너무 지루하고 졸렸습니다,,,,,,,
2025,그럴듯하게 만들려고 했다만 이걸 돈주고 가서 볼만한 영화인가?1년만 지나면 여기저기서 보여주는 흔하디 흔한 영화인것을..도대체 한참 지나간달착륙에 지나치게들 미화하고 지금시대에 이슈라도 되는양 난리를 치고 영화로 만...,,,,,,,
2026,덩케르트를 재밌게 본 사람이라면,,,,,,,
2027,암스트롱이 달 간거 아는사람들  안봐도 됨  개졸다큐,,,,,,,
2028,쿨...쿨....zzzZZZZ...,,,,,,,
2029,보다가 잠깨려고 화장실 왔어요. 그래비티나 인터스텔라급 명장 생각하고오면 후회함; 영화관에서 졸다가 잠깨려고 나온적은 처음이네요;,,,,,,,
2030,인터스텔라처럼 우주 이야기가 아니라  말그대로 퍼스트'맨'! 그 분에 대한 이야기더군요. 의미는 있으나 흥미는 별로였어요. 그래도 우주여행 한 번을 위한 과정을 알 수 있어서 유익했네요. 그래서그런지 ...,,,,,,,
2031,재미없네요 긴장감도 없고 지루하고..,,,,,,,
2032,겁나 지루.. 앞으로 음악영화만 만들자...,,,,,,,
2033,이게 먼 9~10점이야 겁내 지루한대,,,,,,,
2034,영화관에서 혼자 전세내고 봤습니다..진짜잼있어요 다른분들도 꼭보세요~돈내고 보셔야됩니다 꼭..,,,,,,,
2035,영화적으론 꽝~~~~!,,,,,,,
2036,진짜 재미없고 지루함 인터스텔라이후 최고의 우주영화라고 사기광고해서 봤다가 시간낭비함일단 딸의 죽음으로 인해 스트레스를 많이 받고 있는데  영화에서 딸과의 교감이라던가 이런게 전혀없어서 감정적으로 몰입하기 힘들었음 ...,,,,,,,
2037,덩케르크 컨택트도 재미있게 본 나도 이건 힘들었다... 졸지 않았다라고 말하고 싶지만 솔직히 졸았다.. 그리고 20OOO에 달착륙? 크게 감흥없다. 웜홀을 다루는 영화가 나오는 시대에.. 옆동네 탐험은 큰 감동이 오...,,,,,,,
2038,8천원짜리 꿀잠자고 왔네 쩝,,,,,,,
2039,이건 History이자 His story,,,,,,,
2040,USA 조올라 빠는 영화 공짜라 봤다,,,,,,,
2041,한국 사람들이 지루하다고 하면 대부분 명작임,,,,,,,
2042,여자친구와 860일동안 같이 본 영화중에 제일 지루하고 재미없고 시각적표현도 많이부족하고 의미를 중점으로 둔 장면도 몇개없고 전개도 너무 자연스럽지 못하고..인생중 최악의 영화알바들 열일하네^^,,,,,,,
2043,주인공은 '달'을 향해 가장 높이,,,,,,,
2044,IMAX로 관람했는데,,,,,,,
2045,박평식이 점수높게주면 무슨 대단한처럼 그러는지...그사람이 영화보는 수준이 낮은거아님?ㅋㅋ엄청기대했는데...영...돈아까움..인터스텔라 반도 못따라감,,,,,,,
2046,망설이다가 왜 이제야 봤을까,,,,,,,
2047,"인류의 첫걸음을 내딛을 ""작은""  인간의 이야기.",,,,,,,
2048,애들에겐 다소 철학적이라 힘들듯.하지만 어른이라면 상당히 몰입하게 볼수 있는 명작.,,,,,,,
2049,,,,,,,,
2050,First'란 수식어 뒤에 가려진 수많은 시행착오와 가족의 희생. 달에서의 장면들은 정말 황홀할 지경.,,,,,,,
2051,아이맥스에서 본 달에서의 장면은 잊을 수가 없다. 좋은 OST도 그렇고,,,,,,,
2052,결과를 얻기위한 과정과 두려움~ 항상 도전은 아름답다.,,,,,,,
2053,찬란한 도전 그곳으로 가는 고독한 길,,,,,,,
2054,그저 그럼  무료 나오면 보삼,,,,,,,
2055,연기는 참 잘한다. 우주를 가는 내용의 드라마라서 다소 지루하다,,,,,,,
2056,엄청 몰입해서 감동깊게 봤습니다.실패시의 성명발표문구,,,,,,,
2057,당연하지만 달에 첫번째로 간 닐 암스트롱 영화인데 그걸 잘 풀어냈다 이 영화를 보고 지루하다고 한 사람들은 우리나라의 자극적인 전쟁역사영화나 보길,,,,,,,
2058,달에 처음 발을 디딘 인류의 이야기.. 스펙타클하진 않지만 감동을 준다.,,,,,,,
2059,게임에도 영화에도 닐 암스트롱이 달에 가는거 보고 너무 대단합니다,,,,,,,
2060,퍼스트맨의 일화를 다룬 드라마 내지는 위인전? 정도.  액션,,,,,,,
2061,달에 첫착륙하던 역사적 사건을 그당시를 살아가던  헌 사람의 시점으로 바라본 영화 역사적으로 대단한 위인들은 역시 그들의 가정에는 소홀할수 밖에 없는거같다,,,,,,,
2062,다시 봐도 명작이라는 걸 알 수 있다...,,,,,,,
2063,SF영화에 외계인이 안 나오면 재미가 없는건 사실임,,,,,,,
2064,달에 착륙한 후 문을 열었을때 나오는 그 정적은 진짜 말로 표현할수가 없다. 빠른 전개와 팡팡 터지는 오락영화를 좋아하는 한국인들의 정서에는 안맞을수 있으니 참고하고 봐라,,,,,,,
2065,한글 제목 다는 시키들 띄어쓰기를 안하네. 맞춤법 모르는 무식한 젊은 애들도 많던데 띄어쓰기까지 안해.,,,,,,,
2066,문과들은 이해못할 감동적인 실화.,,,,,,,
2067,영상내 흘러나오는 음악은 표현할수 없을정도록 묘했다 초반부가 약간은 지루하긴했으나 후반부 넘어갈 수록보는 내가 다 숨이막혔다 특히 빙빙 도는장면의 심적 두려움은 압도감 자체였다,,,,,,,
2068,이 영화는 다소 지루할수있습니다. 하지만인류최초의 달착륙이 무엇을 의미하는지를아시고보시면 감동은 배가됩니다.과거600만년전 오스트랄로부터 시작해서 네안데르탈인 호모사피엔스까지 인류가 지구안에서만 투닥거리고 살았지요....,,,,,,,
2069,1등만 기억되는 세상!버즈 올드린을 기억하는 사람은 몇이나 될까??이 과정을 올드린의 시점에서 그렸다면 훨씬 유니크 했을텐데,,,,,,,
2070,크리스토퍼 애봇 헬로 케이티를 보고 간만에 내 마음에 들어온 배우,,,,,,,
2071,졸려죽겠지만 졸지 않고 본다면 마지막에 온몸에 소름이돋는 영화,,,,,,,
2072,재미'있으려고 영화 보는사람은 보지마세요 '재미'없습니다..ㅎㅎ 그것 빼고는 최고입니다. 보면서 울었습니다,,,,,,,
2073,깡패  지겹다. 깡패는 이런늠  없다,,,,,,,
2074,이 영화 재미 없다고 하는 사람들이랑말 섞기 싫다,,,,,,,
2075,ost가 정말 좋았다 연기는 물론 말할 필요도 없이 좋았다 천문학을 좋아하는 사람으로 써 닐 암스트롱의 삶을 알수 있어 좋았고 도킹 장면에서 울뻔 했다ㅋㅋ 퍼스트맨 원작 소설도 주문해서 읽어볼 생각이다 우주 관련 영...,,,,,,,
2076,평론가의 말 중에 '찬란한 빛의 반대편에 있는 짙은 그림자'라는 말이 참 와닿는다. 영화적인 흥미나 스토리의 밀도는 떨어지는 게 아쉽기도 하지만,,,,,,,
2077,고요의 바다를 보고 감격했다.,,,,,,,
2078,이런 영화가 재미없다면 그건 당신이 과학에 문외한인 증거.. 과학에 관심 많으면 10점 가깝게 줄거고,,,,,,,
2079,가장 먼 곳에서 아픔을 묻다. 우주 영화를 가장한 상실에 대한 영화.,,,,,,,
2080,스토리도 너무 주인공 중심이 아니어서 좋았고 함께 한 동료들의 얘기들도 나와서 좋았어요!!!,,,,,,,
2081,달착륙의 경이로운 뮤트 만으로도 극장에서 볼만한 가치가 만프로.,,,,,,,
2082,우리는 ‘아폴로 11호’와 ‘닐 암스트롱’만을 기억하지만... 모든 역사가 그렇듯 결실을 맺기까지의 과정에서 비롯된 숭고한 희생과 피나는 노력을 잊어서는 안 된다.,,,,,,,
2083,처음이자 마지막으로 영화보다가 잤음,,,,,,,
2084,감동적이고 과장되지 않은 연출이 좋았다.,,,,,,,
2085,낮게 평가될 수준의 영화는 아님스릴 넘치는 걸 원하는 사람은 지루 할수도전반적으로 잔잔하게 잘 그려냄,,,,,,,
2086,슬프고 맥 빠지는 이야기는 이제 그만.,,,,,,,
2087,지루하다해서 긴장하고봤는데 하나도 안지루하고 재밌었음,,,,,,,
2088,이해는 한다..SF 영화의 뻔함을 기대하고 온다면 실망이 클 수 밖에. 그러나 이건 지금까지 없었던 전혀 다른 영화다.  SF를 배경으로 한 가족영화. 그동안 고난과 역경을 겪고 있는 주인공의 아내와 가족들은 언제나...,,,,,,,
2089,상실에도 불구하고 나아가는 삶,,,,,,,
2090,클린트 이스트우드를 떠올리게 만드는 성숙한 시선의 영화 그런데 만들었을 때의 감독의 나이가 30대 초반이라는게 반전,,,,,,,
2091,영화의 가치를 아는 사람들에게는 뜻 깊은 작품,,,,,,,
2092,거의 다큐필. 한국은 50년 지나도 달에 갈 여력도 기술도 돈도 없다는게 슬프다,,,,,,,
2093,너무나 인간적이려고 강조한게 오히려 독이 된 듯...,,,,,,,
2094,인간의 의지와 가족에 대한 영화.,,,,,,,
2095,,,,,,,,
2096,,,,,,,,
2097,ㅋㅋ 아 네이버 평점 댓글이 난 재밌음 다들 어찌 이리 표현력들이 좋은지,,,,,,,
2098,화성은 인류의 목표였고 한 아버지에게는 안식처였다.,,,,,,,
2099,너무 루즈하고 몰입이 힘들다. 인물의 심리도 그렇고 내용의 흥미도 그렇고 확 매력을 끌지 못한거 같다. 차라리 다큐멘터리를 보는게 더 재밌을뻔 했다. 멋진 실화를 바탕으로 했지만 영화적인 재미는 잘 뽑아내지 못한거 ...,,,,,,,
2100,영화와 연기,,,,,,,
2101,닐이 달에 도착하고 처음 본 것은 10m 앞에서 플랜카드를 들고 환영해주고 있는 옥냥이였다,,,,,,,
2102,연기야 뭐 말할 것도 없을 것이고,,,,,,,
2103,끝없는 우주라는 세계를 통해서야 비로소 가장 작다고 생각한 인간 내면의 세계를 들여다 보게 되다.,,,,,,,
2104,죽기 전에 꼭 가보고 싶은 그 곳 우주... 이 영화를 영화관에서 보지 못 한 것이 너무 아쉽뮤...,,,,,,,
2105,인류가 달을 다녀온지도 50년이 지난 지금  우리에겐 우리만의 달이 있을까  가기로 정했다면 '왜'라고 더 이상 스스로를 의심하지 말고 마침내 도착할 수 있기를하지만 그곳에 도착한들 안한들 사실 큰 차...,,,,,,,
2106,전지적 닐 암스트롱 시점이란게 장점이자 단점이 될 수 있지만,,,,,,,
2107,달에가기까지의 엄청난 노력과 한사람의 고뇌가 잘 드러난 영화였네요,,,,,,,
2108,다 알고 있는 결론을 가지고 있는 스토리를 큰 각색 없이  굉장히 차분하게 이끌어나가는 영화. 그래서 표면적으론 굉장히 지루하게 전개 되지만,,,,,,,
2109,그의 발걸음 하나가 얼마나 위대한가,,,,,,,
2110,불면증으로 고생했는데 이 영화로 40분도 안 돼 잠들었다. 훌륭하다!!,,,,,,,
2111,딸을 향한 아빠의 끝나지 않는 사랑 그리고 긴장감,,,,,,,
2112,감동적인 순간을 담담하게 그려내어 더 사실적입니다,,,,,,,
2113,최초로 달에 다녀온 사람은 우리 같은 평범한 사람이더라. 그리고 그 영광 뒤에는 희생과 아픔,,,,,,,
2114,잔잔하지만 깊게 스며든다.,,,,,,,
2115,온전한 정신으로 보지 못한게 아쉬울정도,,,,,,,
2116,마지막 20분의 몰입감은 정말..그래도 영화 내내 지루한 느낌은 어쩔수없네..,,,,,,,
2117,지루한 영화라 도중에 졸거나 나간게 아니라,,,,,,,
2118,깔끔하게 잘만들었고만..약간 지루한건 있었지만 재밌게봤다.,,,,,,,
2119,어느 누군가의 퍼스트맨에 대하여,,,,,,,
2120,역사적 사실을 재현한  영화이기보다는 다큐에 가깝다. 단점은 꽤 지루함.,,,,,,,
2121,그레비티나 인터스텔라같은 우주에 대한 이야기가 아니라 한 사람에 대한 다큐같은 영화입니다^^,,,,,,,
2122,과학의 진보 뒤엔 막대한 자금,,,,,,,
2123,과정을 충실히 보여주는 영화로서의 의미는 있다고 본다,,,,,,,
2124,자식은 가슴에 묻는다. 우주비행 역사공부에 좋다.,,,,,,,
2125,뛰어난 구성과 연출을 따라가지 못하는 소재와 의도의 미스매치,,,,,,,
2126,달 탐사라는 큰 주제를담담하게 지켜볼 수 있는 영화였습니다.,,,,,,,
2127,역사적이고 대단한 일이지만 그뿐,,,,,,,
2128,감동적인 역사의 순간을 함께해서 좋았습니다.,,,,,,,
2129,은근히 볼만했다. 화재사고 참.ㅠ,,,,,,,
2130,암스트롱이랑 캐릭터랑 매치가 ㅇㆍㄴ됨,,,,,,,
2131,모두의 허상이었던 달에 내 딛은 첫 발은,,,,,,,
2132,저걸 타고 달나라에 갔다고? 그래비티 이후의 대기권 밖 영화는 늘 아쉽다.,,,,,,,
2133,기적과도 같은 드라마 안에는 수많은 사람들의 희생이 있었음을... 첫 발을 내딛은 닐 암스트롱 뿐만 아니라 마이클 콜드윈과 버즈 올드린이 있었기에 가능했음을 기억해야 한다.,,,,,,,
2134,잘만든 한 편의 다큐멘터리,,,,,,,
2135,행성 괴도를 우주비행사가 셔틀안에서 노트와 필기구로 계산하고 있는것을 보고 실소를 자아냈다. 컴퓨터와 자동기계가 아닌 숙련과 운에 맞기는 달탐사는 우주비행사들의 희생의 결과였다,,,,,,,
2136,기대이하엿지만 그래도 좋은 영화엿다,,,,,,,
2137,[2018-10-29/20:30](IMAX) 여러 시각에서 보는 인류의 작은 발걸음,,,,,,,
2138,그래비티,,,,,,,
2139,재밌긴한데 전작들만큼의 흥미는 없어진 듯,,,,,,,
2140,최초로 달에 간 사람,,,,,,,
2141,손에 땀을 쥐는 초반을 지나 미국만세를 외쳐야되는 중후반부에 이르기까지 제 삼세계관객을 위한 배려가 아주 좋다. 닐 암스트롱의 내면의 불안감을 계속해서 잡아낸 연출이 마음에든다.,,,,,,,
2142,지루하고 재미가 없네요 그래비티나 인터스텔라랑 완전틀림!,,,,,,,
2143,호불호가 많이 갈릴 영화다. 한편으론 지루했었는데 또 한편으론 달에 한번 갔다오기가 그렇게 힘들었는지 이영화를 통해 알게됬다.전에는 달에 소풍 다녀오듯이 편하게 갔다온줄 알았는데 사고도 끊임없이 발생하고 죽을 확률도...,,,,,,,
2144,달 표면에 도착했을 때 아무것도 들리지 않는 그 고요한 느낌. 실제로 어땠을까.,,,,,,,
2145,위 플래쉬에서 큰 충격으로 영화가 끝난 후에도 한동안 나를 관람석에서 못 일어나게 한 데미언 셔젤이 이 영화에서는 담담한 템포로 닐 암스트롱이 미션을 수행해 나가는 과정에 그의 가정 생활과 고뇌를 배합하여 전개시킨다...,,,,,,,
2146,첫번째 달착륙 우주인으로서 보다 더 무거웠을 가장으로서의 한 인간. 목숨을 건 여정이었으니 그 어떤 픽션보다 감동적,,,,,,,
2147,보다가 잤는데... 끝까지 잤습니다,,,,,,,
2148,애잔하다.. 스펙타클한 전쟁영화인줄 알고 봤던.. 덩케르크 느낌 조금난다.,,,,,,,
2149,멀미나서 보기 싫었다..,,,,,,,
2150,스토리면은 재미잇으나 스크린은 별로..,,,,,,,
2151,그냥저녕 볼만햇네욯ㅎ,,,,,,,
2152,아는형이랑 갔는데 안졸려고 눈에 힘주면서 보는모습이 인상깊었슴 ㅇㅇ,,,,,,,
2153,인간  닐 암스트롱에 대한 영화...  가족들의 이야기가 주를 이루는 기존 재난 극복 영화나 영웅기와는 조금 결을 달리한다. 온전히 그 자체가 주를 이룬다...,,,,,,,
2154,드라마는 뛰어나지만 텔링 방식이  갠적으로 너무 지루했음..,,,,,,,
2155,꿈을 위해 달리는 이들의 잔인한 현실,,,,,,,
2156,신과함께 좋아하는 한국인들은 못 볼 듯,,,,,,,
2157,재미로만 평가하자면 현 평가 점수가 넘 높다..그래서 1점 줌..,,,,,,,
2158,닐 암스트롱의 고뇌와 우여곡절을 잘 표현한 영화,,,,,,,
2159,앞 10분만 보고 바로 건너뛰고 마지막 40분만 보면 된다  중간에 두어번 졸려서 끌뻔 했다,,,,,,,
2160,닐 암스트롱의 심리를 꽤 잘 표현한 영화. 근데 진짜 갔다오긴 한건가?,,,,,,,
2161,말도 안되는 그래비티 보다는 훨씬 나은듯..,,,,,,,
2162,위대한 역사적인 순간1,,,,,,,
2163,마지막 15분이 전부다.전반부가 너무 처지고 지루하다.,,,,,,,
2164,다큐로 보면 9점이지만 이건 영화니까...,,,,,,,
2165,늦었지만 재미있게 봤어요,,,,,,,
2166,기억에 오래남을 좋은 영화,,,,,,,
2167,두려움을 극복하는 내면 묘사가 인상적,,,,,,,
2168,우주인 내면의 갈등과 고뇌 그리고 역시 인간은 강하다는 것을 보여줌,,,,,,,
2169,난 이런영화가 좋다안지루한데?,,,,,,,
2170,영화볼때 진짜 잔적 한번도 없는데 이거보고 옆테이블 2개 칸막이 열어놓고 누워서잣어요..,,,,,,,
2171,배우들 연기가 젤 좋았음,,,,,,,
2172,졸립다는 평이 많은데 저는 재밌게 봤어요,,,,,,,
2173,달나라 가기까지의 과정을 실화기반으로 표현해서 오히려 생동감 있던데..재미있는 다큐??..^&^,,,,,,,
2174,우주나 다큐 안 좋아하는 사람은 비추천,,,,,,,
2175,생각보다 너무 괜찮아요 재밌게 봤어요,,,,,,,
2176,안졸리나 졸리나 졸린다,,,,,,,
2177,닐 암스트롱의 단순 업적이 아닌 행보를 보여줘서 여러모로 집중해 볼 수 있었던 영화가 아닌가 생각한다. 단순히 인터스텔라급으로 생각하고 보면 졸릴 수 밖에 없고...,,,,,,,
2178,데이미언셰젤은 이제 크리스토퍼 놀란급으로 성장했다.,,,,,,,
2179,제목처럼 인류의 거대한 첫걸음을 내 딛은 한 인간에 집중한다.,,,,,,,
2180,국가/이념이 아닌,,,,,,,
2181,최고의 연출을 보았다. 달나라가는 씬은 압권,,,,,,,
2182,wdawdqwrwqr,,,,,,,
2183,지루한 감이 없지않아 있었지만라이언 고슬링의 완벽한 연기 덕분에 재밌게봤다특히 표정연기가 훌륭했다,,,,,,,
2184,달착륙이 조작이란걸 이 영화를 통해서 새삼 재확인,,,,,,,
2185,섬세하고 침착하게,,,,,,,
2186,모든것이 적당하다. 더한것도,,,,,,,
2187,우주,,,,,,,
2188,신동엽 박미선씨 부부 연기 잘 봤습니다^^ 근데 겁나 지루하네요 ㅋ,,,,,,,
2189,데이미언 셔젤 X 스티븐 스필버그수면폭탄 콜라보,,,,,,,
2190,전 생각보다 재밋었어요!!,,,,,,,
2191,몰입감과 지루함도 그리고 감동도 주는 멋진 영화,,,,,,,
2192,라이언 고슬링 연기가 빛난다,,,,,,,
2193,담고 있는 내용은 좋았으나 지루함은 어쩔 수 없음.  구라를 바탕으로 또 구라를... 아폴로 11호 얘기였으면 안봤을텐데...,,,,,,,
2194,영화 자체는 나쁘지 않았지만...글쎄,,,,,,,
2195,난 괜찮았음.영화자체보다는 난 저 시대에 과연 도킹을  정말 했을까?? 라는 생각이 들었는데....,,,,,,,
2196,전쟁영화에 덩케르크우주영화엔 퍼스트맨인간과 삶과 가족에 대한 고뇌...,,,,,,,
2197,모든 사건과 관계,,,,,,,
2198,익히 알던 사건의 이면을 볼 수 있었다. 인간,,,,,,,
2199,인류의 가슴을 두근거리게 했던 도전,,,,,,,
2200,좀지루할수도있는데ㅡ남편은초반에보다자러들어감ㅋㅡ달착륙의결과만이아닌 과정중에 희생과고충 노력등을알수있었음 남주인공연기잘하네요 근데저렇게희생을하면서까지 꼭해야할일이였을까?,,,,,,,
2201,지루하다는 평이 많은데 기대 안하고 봐서 그런가. 2시간 20분 이라는 긴 런닝터임에도 재미있게보았다. 중간 중간 나오는 위기나 사건도 잘 연출 되어서 몰입감 있었다,,,,,,,
2202,적립금 때문에 남기는 평점,,,,,,,
2203,그냥 단순히 말해서 물리학이나 천문학 관심있는 사람들은 잼남 그거에 관심없는 사람들은 그냥 노잼이지 ㅋㅋ,,,,,,,
2204,기대하고 봤는데 굉장히 지루함..,,,,,,,
2205,달로의 여정이 아닌,,,,,,,
2206,비전문적이라 재미가 덜했다,,,,,,,
2207,근데 왜 성조기 펄럭이면서 꼿는건 왜 연출을 안했을까?  공기없는 달에서 말이지..ㅎㅎ,,,,,,,
2208,조금 전개가 지루한 느낌은 받았는데 그리 나쁘진 않음,,,,,,,
2209,한 인간이 괴로운 현실에서 회피하고자하는 장소를 달로 정한것이다.  그곳에서는 그 괴로움이 사라질거라는 기대속에..하지만 달라진것은 없었다.,,,,,,,
2210,역시 달착륙은 영화였어 ㅎㅎㅎ,,,,,,,
2211,평점이 낮아서 기대안했는데 꽤 괜찮았음. 심리 묘사가 뛰어나고 연출력이 훌륭해 시간가는줄 모르고 봤음. 추천함,,,,,,,
2212,시간이갈수록 긴장감이떨어지는 뒷심이부족한 영화,,,,,,,
2213,집떠나면 개고생  지구떠나면 개고생,,,,,,,
2214,영화로 본다면 3점,,,,,,,
2215,이건영화라기보단 그냥 다큐멘터리 재미는없음,,,,,,,
2216,에휴~~~~내가 이걸 왜 봐야지!,,,,,,,
2217,흥행을 못한 이유는  달착륙이 거짓이기 때문에 이입될수가 없다.,,,,,,,
2218,고슬링의 절제된 감정표현이 역설적으로 암스트롱의 감정을 드러내 주었다...,,,,,,,
2219,내면을 많이 표현했고... 영화적 재미는 적다.,,,,,,,
2220,실증적 다큐와 체험적 영화 사이의 불완전한 랜딩,,,,,,,
2221,달에 처음 도전한 캡틴의  심리를 다룬 다큐멘터리 같은 영화.,,,,,,,
2222,제이미 8호 이륙 씨퀀스가 이미 너무 몽환적이라 그 이후는 쭉 꿈속을 헤메는듯한 몽롱함,,,,,,,
2223,죽음을 두려워 하면서도 계속 도전하고  다시 가보고 싶다고  말하는 이런 사람들이 인류를 발전시키고  미래를 만드는 사람들이죠. 두려움과 용기를 선을 줄타기 하는 내면묘사가 감명깊었습니다.,,,,,,,
2224,우주다큐보다 지루하고 진부하다 관심없는 가정사 신파는 보너스  우주영상이 보고싶었는데 흔들리는 내부장면만 보여주네,,,,,,,
2225,우주를 가려는 인간의 무모했던 과정이 오롯이 담겼다.,,,,,,,
2226,차젤레 감독의 특징: 디테일이 월등하다. 그 디테일을 분위기와 엮는 스킬이 정말 눈에 띄게 압도적이다. 덕분에 우리는 입체적인 스토리를 상상해가며 볼 수 있음. 외부사건의 흐름과 내적인 스토리가 너무 매력적으로 섞임...,,,,,,,
2227,We need to fail.,,,,,,,
2228,몰입감장난아니네요 저까지 긴장하게됨감정선도 좋았어요 근데 지루한장면이 기네욤재미는있었어요 달에서 지구바라볼때 기분이 이상해지네요,,,,,,,
2229,이걸 끝 까지 본 내 자신이 스스로 대견 합니다.,,,,,,,
2230,생각보다 감동이 없다.실사도 살짝 나오고달 착륙은 조작이다,,,,,,,
2231,다큐인지 픽션이니 구분이 안되서 혼란스럽네요. 닐암스트롱을 위인으로 만들기위한 아메리카의 큰그림같기도하고...,,,,,,,
2232,솔직히 이게 재밌냐 씹자완성,,,,,,,
2233,초반에재미가있었는데 갈수록 지루해짐,,,,,,,
2234,“시인이 달에 갔었다면 돌아오지 못했을 것이다.”란 말을 공감할 수 있었던 영화. CG기술이 이렇게까지 발전한 것에 감사할  따름이다. 그냥 내가 달에 갔다왔다.,,,,,,,
2235,재밌게 잘 봤습니다. 또 볼지는..,,,,,,,
2236,좀 지루하죠. 1969년  MBC 개국한지 얼마 안돼서 중계하던 걸 본 기억으로 버텨봤다.,,,,,,,
2237,달에 가려는 인간의 감정에 중심을 둔 영화....이런 세련된 연출과 감정표현...그리고 음악까지 너무 샘날 정도로 멋지다.,,,,,,,
2238,루틴한 전개. 러닝타임 140분이 지루했다.,,,,,,,
2239,지금도 잠들기전 이거보면서 자요^^최고의 자장가 ㅋㅋㅋ,,,,,,,
2240,내면으로 봐야하는 영화. 눈으로만 보고 하품한 사람들도 많은 것 같은 영화,,,,,,,
2241,별두개도 너무 많이준듯,,,,,,,
