,content,,,,,,,
889,되게 잔잔한 감동을 주는 영화였어요 근데 러닝타임이 길어서 정말 컨디션 좋을때 가시길..,,,,,,,
890,리얼리티에 감동하고 휴머니즘에 눈물맺혔다.,,,,,,,
891,재미잇음재미잇음재미,,,,,,,
892,Gravity 생각하고 기대하며 봐서...좀 아쉬웠어요...닐 암스트롱의 심리에 초점을 두고 만든 영화라서,,,,,,,
893,무엇보다 음향이 소름돋게 잘 어우러져 있는 영화였다.,,,,,,,
894,영화 진짜 재미있네옇ㅎ,,,,,,,
895,나는 사실적이어서 더 좋았음 감동받고 왔다ㅠㅠㅠ,,,,,,,
896,잊고 있었다...닐 암스트롱...그도 누군가의 아버지이면 누군가의 남편이고 한 가정의 가장이라는것을...고인의 명복을 빕니다...,,,,,,,
897,내 취향 완전 인생영화였다. 콘택트가 생각났음,,,,,,,
898,지구에서 달로 가는 장면이 기억에 남는다.,,,,,,,
899,확실히 흥미 위주의 영화는 아닙니다. 다른 댓글들처럼 다큐성이 짙은 영화인게 맞지만,,,,,,,
900,‘상실’을 잘 표현 해낸 영화. 영화가 잔잔하긴 하지만 재미가 없는 건 아님. 일반 대중들이 자극적이고 통쾌한 진행을 더 원할 뿐. 놓칠 장면 하나 없는 건 사실이고 자극적이진 않지만 우리에게 하여금 상실감을 담백하...,,,,,,,
901,인터스텔라 같은 영화를 기대했지만 다큐도 나름 재밌네요,,,,,,,
902,자극적이지 않아서 편하게 봤어요! 큰 스크린으로 지구를 볼 수 있는 것도 매력!,,,,,,,
903,공대생이 본 시각으로 60년대 초 삼성티비가 좀 걸렸고 생략된 탑승 발사과정이 아쉽다. 지나친 흔들림과 소음도,,,,,,,
904,걍 라이언고슬링 잘생김,,,,,,,
905,실화를 바탕이 되어서 사실감이 좋았지만 스토리 전개가 약간 지루했음,,,,,,,
906,재미는 있는것같은데 왜 자꾸만 졸린지 이유를 알려주세요,,,,,,,
907,분량은 적지만,,,,,,,
908,사실 모두가 알고있는 닐 암스트롱 얘기라 그런지 지루한감이 있다. 영화라기 보다 닐 암스트롱의 일대기를 다큐로 표현한  영화다. 절대 인터스텔라 ,,,,,,,
909,인터스텔라&그래비티급 sf영화를 기대한다면 실망. 한 남자의 달착륙 일대기를 다룬 다큐멘터리.. 실화를 바탕으로 한 영화라,,,,,,,
910,오래도록 기억남을 영화,,,,,,,
911,갠적으론 러닝타임이 좀 짧았다면 더 좋았을거 같음... 감정이입을 하려해도 주인공의 이야기가 너무 반복적으로 되풀이되는 느낌이라 보다 지쳤음. 발사되는 우주선 안에서 느끼는 감정 묘사는 대단,,,,,,,
912,리얼다큐임인터스텔라 그래비티랑은 다른정말 우주인되는과정동료애가 절절느껴지는 영화사실 음악많이기대했는데이번영화는 최대한 기교를없애고촬영한것같음 호불호예상됨,,,,,,,
913,여자친구는 몰입해서 봤고 전 초중반에서는 피곤해서인지 푹 잤어요.,,,,,,,
914,잘 만든 영화인건 분명한데 졸려요..,,,,,,,
915,조조로 보실분들은 전날 충분한 수면을 하셔야합니다. 지루하고 잔잔한 영화 좋아하시는분들에게 강추합니다.,,,,,,,
916,스토리구성은 좋았으나 흐름이 루즈하고 영상미가 매우 아쉬웠다. 두가지 부분만 좋았다면 재밌을텐데.,,,,,,,
917,미국의 신동엽 라이언이다,,,,,,,
918,어.. 음 라라랜드랑 위플래쉬 생각하고 들어갔는데 다큐보고 나온 느낌.. 다만 닐의 개인적 고뇌나 딸의 상실에 완벽하게 공감하지는 못한 부분이 있어서 10점은 못줄 것 같아요!! 그래도 잔잔하니 괜찮았음~~,,,,,,,
919,동료를 잃은 슬픔,,,,,,,
920,최신 기술을 총동원해 극한의 아날로그를 추구하다. 광대한 스펙터클 대신 인간 개인의 관점으로 좁힌 시선에 실망할 수 있지만 극적 효과는 훨씬 높아졌다. 아마 같은 이유로 돈은 많이 못 벌겠지만....,,,,,,,
921,너무 질질 끈다 쪼금  줄이지,,,,,,,
922,스토리에 조금 집중된 우주영화...믿고보는 우주영화엿으나 스토리가 살짝 아쉽고,,,,,,,
923,닐 암스트롱의 심경변화를 완벽히 소화한 라이언고슬링!!!영화가 아니라 실제상황을 보는듯하다.남주 여주의 섬세현 심리묘사,,,,,,,
924,인터스텔라,,,,,,,
925,‘닐 암스트롱’을 다룬 영화. 그 자체로 여운이 남았다.마지막에 아폴로 미션에 참가한 우주비행사에게 전하는 메시지가 있을 것을 예상했지만,,,,,,,
926,호불호가 갈릴 수는 있어도 감독의 다른 작품에 꿇리지 않을 작품임은 확실하다.,,,,,,,
927,내용에 지렸고 연출에 한 번 더 지렸다 우주의 정적이 흐를때에는 그 어느소리도 안나더라,,,,,,,
928,아주 잘 만든 슬픈 다큐 같은 영화,,,,,,,
929,전반적으로 고요해서 빠른 전개나 액션좋아하시는 분들은 지루할수도 있을꺼 같아요~하지만 감정이입 잘 하시는 분들은 볼만하실꺼예요 보고나면 생각은 계속 납니다,,,,,,,
930,140자로 표현못할 그 무언가,,,,,,,
931,솔직히 좀많이졸려요 다큐어두운데서보는기분임,,,,,,,
932,졸릴때는 보지 마세요ㅎ,,,,,,,
933,전체적으로 연출 연기 좋았으나 다소 지루하다고 느껴지는 부분도 있음,,,,,,,
934,좀 지루한 감이 있긴 하지만 닐 암스토롱의 내면 심리와 고뇌를 잘 보여준 작품인것은 확실하다 몇명은 중간에 나가더만 보기에 좀 힘들긴 했다,,,,,,,
935,뭔가 그렇게 재미없지는 않은 거 같은데 잠이 왜 이렇게 쏟아질까   본 영화중에 하품을 가장 많이 한 영화,,,,,,,
936,가족애는 그만 좀 했음.,,,,,,,
937,재미만 놓고보면 별로..연출은 좋았음 딱7점,,,,,,,
938,그래비티 ,,,,,,,
939,진짜 지루하고 노잼 입니다,,,,,,,
940,머리로는 이해는 다하고 감독이 무슨 표현을 하겠는지 알겠다만 그냥 지루함,,,,,,,
941,지루해서 졸았네요 ㅠㅠ,,,,,,,
942,달에 진짜로 갔을까?안 갔으면 실화 아님.,,,,,,,
943,예상했던 것 보다는 좀 지루했다,,,,,,,
944,나는 정말좋았다 잔잔하고 광할한 우주 음악영화,,,,,,,
945,달에 도착할 때 그 환희를 잊질 못하고 있음,,,,,,,
946,영상의 건조함도 달 표면만큼이나,,,,,,,
947,거대한 역사의 이면에 감춰진 닐 암스트롱의 시선에서 바라보는 인간사적 드라마. 침묵속에서 느껴지는 감동과 사랑을 느낄 수 있는 사람이라면 재밋게 볼 것이고,,,,,,,
948,영웅스토리가 아닌 한 개인의 지극히 사적인 이야기몽환적인 ost가 극의 감정을 더욱 끌어올린다,,,,,,,
949,초딩같이 액션을 기대하면 실망하겠지만 작품성이 너무 좋다,,,,,,,
950,너무 몰입한 나머지 내가 어지러움을 느낌 조용하고 광활한 우주,,,,,,,
951,평점 왜이래 이거 진짜 괜찮은 영화임,,,,,,,
952,이런 명작을 재미없다고 치부하는것들은 정말 ... 단순히 어릴때부터 아~ 미국이,,,,,,,
953,도전에 대한 의문'에 정면으로 대답하는 영화. 가족,,,,,,,
954,진짜 잘만든 영환데 지루하다고 이렇게 찬밥신세 받는구나 너넨 떡밥만 던지고 돈에 눈이 먼 신비한 동물사전2나 보고 와라,,,,,,,
955,우주 속 고요함을 느끼기에는 이보다 더한 영화는 없다. 다만 너무나 고요하고 조용한 탓에 쉽게 피로해지고 지루해져 몰입감이 떨어지는 부분이 종종있다.,,,,,,,
956,이영화는 아이맥스로 봐야 진짜입니다 특히 마지막 달착륙장면에서 아이맥스 화면을 여백없이 채우는 장면이 인상깊었습니다 호불호가 많이 갈리는 영화지만 개인적으론 재미있게 본영화입니다닐 암스트롱의 감정을 잘 표현 한것같습...,,,,,,,
957,인생띵작.IMAX로감상.인터스텔라 그래비티 다봤어요. 현실감있는 연출에 압도. 내가 우주선 탄줄. 대부분 우주영화는 아름다움을 찬양하지만 이영화는 현실감이 넘치고 보고나면 계속 여러가지 자문하게하는 영홥니다. 후반부...,,,,,,,
958,안보면 후회각!!!~,,,,,,,
959,그 중압감...상실감...공포를 다 이겨낸닐 암스트롱.다른 우주영화들은 보여주지 않은...우주여행사들과 그 가족들의 아픔...,,,,,,,
960,화려한 주변 상황이 아닌 인물 자체의 감정을 다룬 좋은 작품입니다.,,,,,,,
961,4살 딸아이가 떠올랐고,,,,,,,
962,난 이때까지 우주 탐험의 역사를 읽을때 우주 비행사 개인의 감정과 그들이 겪는 고충은 생각하지 않았다. 그러나 이 영화는 그들이 얼마나 위대했는지,,,,,,,
963,멋지고 감동적인 영화였어요 덕분에 달도 봤고 우주의 역사 다시 배우게 되었습니다 마지막에 음악 너무 좋았어요,,,,,,,
964,미국이라는 멋진나라..자유가있는그곳,,,,,,,
965,라이언고슬링 클레어포이 최고의 연기력에감동했습니다내면  연기에 넋을 잃고 보았습니다아쉬운 점이 있다면 데이미언 셔젤 감독이 영화 어딘가에 인류는 달에 가지 않았다라는메세지를 남겨주길 바랬습니다,,,,,,,
966,달에 내디딘 첫 발.. 인류에게는 이상적인 의미를 가지지만 국가와 한 개인에겐 현실적이고 또 감정적인 의미를 가진다,,,,,,,
967,가족,,,,,,,
968,La La Land.ing.,,,,,,,
969,예능이나 퀴즈 프로그램에서 흔히 나오는 문제의 그 주인공. 이 역사적인 사건에서 닐 암스트롱이 감당해야만 했던 무게를 담담하게 그려낸 영화.,,,,,,,
970,다큐라고 생각하시고 보는게 제일 나을듯요ㅋㅋㅋ,,,,,,,
971,취향 맞으면 재밌음,,,,,,,
972,고요함에서 오는 집중감.무게감과 무감각의 사이를 느낄 수 있는 영화,,,,,,,
973,아주 흥미진진하진 않지만 네러티브의 전개와 연기에 압도되는 영화입니다 추천드려요 :),,,,,,,
974,또 하나의 문을 열기 위해서 열려있는 문을 닫아야되는 그 시간들의 혹독함.,,,,,,,
975,과하게 감성적으로 연출해서 그런지 엄청 지루함. 처음부터 끝까지 잔잔함.,,,,,,,
976,퍼스트 그렇지 별 한 개..도 아깝다.,,,,,,,
977,졸음그자체 인터스텔라처럼 너무길다,,,,,,,
978,보다가 잤음...공짜라서 봄.,,,,,,,
979,맑은정신으로 들어갔다가 숙면취하고 나왔어요,,,,,,,
980,감독은.닐 암스트롱을 달나라에 보냈고나를 꿈나라로 보냈다.,,,,,,,
981,볼만한 다큐멘터리  잠은 옵니다,,,,,,,
982,0.5까지는.아니지만 평균 평점을 낮추기위함. 솔찍히 보다가 졸리는 고비가 좀 있음 ㅠ 우주영화 아니고 감성영화임 그것만 알고가도... 마음의준비에.도움이됨,,,,,,,
983,감독과 같은 시대를 살아갈 수 있어서 기쁘다,,,,,,,
984,인간 닐 암스트롱의 이야기,,,,,,,
985,베스트 평점에 2점주고  1점준사람 닉네임 클릭해서 들어가보셈 디워에10점주고 한국영화 투가이즈에 10점준 진짜 알바  안타깝다.  창궐에 밀릴 영화가 아닌데..,,,,,,,
986,처음과 중간은 지루했지만 마지막에 인간이 최초로 달에 발을밟았다라는것에 전율이 흘렀네요 ㅎ 우주에대해서 관심이없는분이면 재미없겠지만 저처럼 우주에 관심이높은분 추천드립니다.영화라기보다는 암스트롱에 다큐멘터리같은 느낌...,,,,,,,
987,달에간 인물을 다큐로 만들었다.,,,,,,,
988,어이없는 연출에 감정을 강요하는 모든씬의 핸드헬드.,,,,,,,
989,다큐멘터리 간접체험영화인가? 난생 첨으로 극장에서 영화보다 졸았다. 내가 졸았다!! 정말로...;;;; 더군다나 콜라마시고 오줌마려운거 참다가 도저히 안되서 나갔다왔는데 달착륙쯤인가 그랬는데 안궁금하다;;;; 그리고...,,,,,,,
990,달에 놓고 온 걸 볼 때,,,,,,,
991,영화를 음악처럼 다루는 감독,,,,,,,
992,지루하지만 볼 가치가 있는 영화,,,,,,,
993,OOO 지루하다.. 진짜 돈이아까운게아니라 그시간이아까움 ㅈㄴ졸리고,,,,,,,
994,덕중에 덕은 양덕이라더니...이걸 50년전에 했다고?? 아폴로11호가 이륙하기 전까지는 지루했지만 역시 그 뒤는 대박!! 몰랐던 팔튼튼형님의 가족사와 고민이 느껴짐...,,,,,,,
995,몰입해서 보게되는 영화  중간중가  그 공백이 멋진영화,,,,,,,
996,샤젤의 다른 영화에 비해 차분하게 풀어내는 갈등 등 위플래쉬나 라라랜드를 기대하고 왔으면 졸다가 가는게 뻔하다. 오히려 이러한 요소가 보는이의 마음을 집중하게 해주어서 50년전 달에 간 인류에 대해 경외감이들게 만든...,,,,,,,
997,빈속에 관람 금지.. 촬영 수타일 때문에 일반 극장에서도 멀미가 나서 혼났음..ㅜㅠ,,,,,,,
998,보는 내내 긴장되고 빠져들게 되는 영화,,,,,,,
999,끝없이 도전하는 인류를 보며 현재의 나를 다시 보게 됨,,,,,,,
1000,ㅠㅅㅠ만든다고 고생하셨는데 넘 재미없네여..,,,,,,,
1001,기대 이상의 영화였습니다,,,,,,,
1002,저를 비롯한 주위 많은 사람들이 재미있게 봤는데 자기가 재미없게 봤다고 재밌게 본 사람들을 알바취급하는 태도는 무척 보기 불편하네요,,,,,,,
1003,호불호가 갈리겠지만 개인적으로는 재밌게 본 영화입니다.,,,,,,,
1004,가족 사랑 치유에 관한 이야기,,,,,,,
1005,아이맥스로 보는데도 졸린영화임,,,,,,,
1006,들어가시기 전에 팝콘 5통 사가세요~,,,,,,,
1007,글쎄요.. 상업영화보단 닐암스트롱 다큐멘터리 본 느낌 잔잔한 감동은 있지만 재미는 썩ㅠ,,,,,,,
1008,지구에서 달까지. 내가 너를 보낼 수 있을 때까지,,,,,,,
1009,보는내내 달착륙 주작썰이 생각나서 집중이 안되네요 ㅠㅠ,,,,,,,
1010,장르를 드라마(Only)로 고치지 않으면 누적관객 100만 넘기기 힘들겁니다.,,,,,,,
1011,무엇보다 라이언 고슬링의 섬세한 내면 연기에 감탄할 수 밖에 없다.,,,,,,,
1012,달착륙을 믿지않는 사람으로써 이 영화를 관람하는건 역시 무리가 있군...,,,,,,,
1013,푹자고나온 영화는이게처음..,,,,,,,
1014,불면증 있는 사람이라면 꼭 볼영화눈뜨니 달에 착륙했고 또 눈뜨니 영화가 끝났다,,,,,,,
1015,영화는 지루한건 예상하고봐서 그냥 볼만했는데 옆에노인네가 전화벨소리도 안꺼두고  전화오니까 상영관에서 통화를함 ㅁㅊ 내앞에 커플은 빡쳐서나가고 안들어오더라이영화볼거면 평일조조로보는게 났다 괜히 주말오후에 봤다가 ㅁㅊ...,,,,,,,
1016,닐 암스트롱의 인간적인 부분에 초점을 맞춘것 같은데 그 심리들이 그다지 공감되지 않는다. 이 영화를 보고나니 더욱 왜 이 사람을 영웅으로 만든건지 이해가 안된다.,,,,,,,
1017,재밌습니다 편안하고재미가넘쳐나네요,,,,,,,
1018,한사람의 인생에 대한 영화,,,,,,,
1019,인터스텔라,,,,,,,
1020,스티븐 스필버그의 기획력이 감독 머리속의 의도를 끄내려했지만,,,,,,,
1021,고요하게 자다깨고 싶으면 완전 추천합니다~!,,,,,,,
1022,기대에 못밑쳤지만 69년도우리새마을삽질할때 달착륙은 천조국의 위대함은 인정한다,,,,,,,
1023,지루해서 미치는줄~평점주기도 아까운 영화,,,,,,,
1024,같이 보러 간 모든 사람이 졸린 거 참느라 죽을뻔한 영화.... ㅠㅠ 그냥 너무 졸렸어요... 나만 그런가 했더니 다 졸고 있던..근데 호평도 많네요?? 호불호가 좀 갈리는 것 같아요ㅠ 막 때려부시고 웃기고 그런 영...,,,,,,,
1025,우선 콜라가 아니라 커피를 들고가야하는 것은 맞는 것 같다.,,,,,,,
1026,이 영화를 통해 여느 오락영화처럼 재미를 찾을 목적이라면 비추입니다. 암스트롱의 내면적 갈등을 그렸고 인터스텔라가 상상이 가미된 우주영화라면 퍼스트맨은 보다 현실적인 우주영화입니다. 우주영화는 보통 호불호가 크게 나...,,,,,,,
1027,지루하다. 지루하다. 또 지루하다.,,,,,,,
1028,솔직히 재미와 흥행을 논할 영화는 아닌거 같네요. 보는내내 다큐를 보는듯했음. 감독의 이전작에 대한 명성으로 보긴했는데,,,,,,,
1029,배우 말할 것도 없도 감독님도 사랑해여,,,,,,,
1030,닐 암스트롱 이라는 개인에 집중하는 영화였는데,,,,,,,
1031,지루하다는 사람들이 있는데,,,,,,,
1032,기대이상!! 역시 라라랜드 감독은 대단하다,,,,,,,
1033,우주영화 아니라,,,,,,,
1034,진짜 너어어어어무 지루합니다 영화자체도 잔잔,,,,,,,
1035,그냥 영화티켓값으로  맛있는거 사드세요. 극장에서 코 하도 싶지 않으면...,,,,,,,
1036,라라랜드 감독이 우주영화를 음악영화로 만들어놨네ㅎㅎ 눈과 귀가 호강ㅎㅎ,,,,,,,
1037,그래비티 보다 더 감동적이게 본 것 같아요..,,,,,,,
1038,인터스텔라나 마션 그래비티 그런거 기대하는사람은 보지마세요 이건 다큐입니다. 솔직히 좀많이 지루하긴해요. 20분 사라짐 ㅠㅜ,,,,,,,
1039,평점안좋은 사람들은 단언컨대 영화를 오락거리로만 생각하고 보거나 아직 생각이 어리다,,,,,,,
1040,달나라를 내가 먼저 도착했다. 드르렁 드르렁,,,,,,,
1041,달에 가기 위해 희생되었던 수많은 동료와 항상 상처로 남은 딸을 달에 두고오며 눈물  흘리던 주인공의 모습을 잊을 수가 없다.  닐의 마음을 나는 알 것 같다. 너무 좋은 영화~~,,,,,,,
1042,졸리다는 평이 많아 보기전에 망설였는데 닐 암스트롱의 심리에 초점을 둔 달 탐사 우주비행사를 느낄수 있었다. 그래비티같은 화려한 대작은 아니지만 심리묘사가 훌륭함,,,,,,,
1043,데미언 샤젤 이름 믿고 봤는데 통수맞았다. 연출이랑 감정연기에 신경쓴건 좋은데,,,,,,,
1044,이 영화는 '애들은 가라~' 영화다. ㅋㅋㅋ 내가 영화 보는 수준이 '애'라면 걸러보시길.,,,,,,,
1045,전혀 지루하지 않고 재밌습니다추천!!!,,,,,,,
1046,스토리 중요하게 생각하시는 분들은 보지 마세요 전 덩케르크도 잘 봐서 재밋었숩니당..,,,,,,,
1047,엄청난 몰입감과 라이언 고슬링의 미친 연기력,,,,,,,
1048,조미료들어가지않은 정말담백한영화,,,,,,,
1049,아주 지루하다는 평을 듣고 잘까봐 긴장을 풀지 않았는데 결국 영화연출력덕분에 내내 긴장하며 보았음. 달착륙의 기쁨보다는 살아돌아올까 가슴졸이는 가족들과  닐의 심리에 마음이 먹먹해지는 영화였다,,,,,,,
1050,쩝이건아니잖어돈아까비,,,,,,,
1051,썸네일 밑에 평점은  믿을게 못됨 댓글을 꼭 읽어보고 가야함 ㅜ.ㅜ,,,,,,,
1052,이맥스로 봐서 볼만 했는데,,,,,,,
1053,어떤 놈은 게임하더라! 매우 화가 나지만한편으로는 이해가 됨. 집에서 봤다면끝까지 보기 힘든 영화!,,,,,,,
1054,역사를 만드는 끈임없는 위대한 도전에 찬사를 보낸다.,,,,,,,
1055,엄청난 연출과 스토리와 연기. 삼위일체,,,,,,,
1056,혼자보러갔는데 극장직원이 깨워줘서 나옴,,,,,,,
1057,수면제 먹을 필요없어요. 태어나서 영화관에서 처음 자봤네...,,,,,,,
1058,애초에 잘못판단하고 본 내 잘못임. 우주SF,,,,,,,
1059,2점도 아깝다 진짜 졸립다,,,,,,,
1060,인물의 감정 묘사와 일인칭 시점에서의 관객과 주인공간의 감정 교류가 뛰어났다 역시 보길 잘한듯하다. 여운이 남는 영화~,,,,,,,
1061,이건 확실히 인생영화다! 몇마디 안되는 멜로디로 영화전체를 이렇게 다양하게 표현해내고 랜딩씬에서 거의 미친 긴장감과신비로운 멜로디를 토해내다 게이트가 열리는 순간 화면은 아이맥스로 달표면을 똭! 그리고 이어지는 적막...,,,,,,,
1062,정말 기대 이상이다 아이맥스에서 보는거 추천!!,,,,,,,
1063,영화 다보고 집에 왔는데,,,,,,,
1064,잘봤어요 라이언 고슬링 개짱이네요,,,,,,,
1065,영화는 평점과 후기로 보는 것이 아니라는걸 깨달았다,,,,,,,
1066,영웅의 인간적인 내면의 모습을 담은 가슴을 울리는 뜨거운 영화다. 최고다,,,,,,,
1067,관람객입니다. 인터스텔라를 못봐서 표현성은 어떤지 모르겠고... 공대생은 좋아할수도 있을거 같습니다. 하지만 전 졸았습니다.,,,,,,,
1068,냉전시대 국가이기주의가 만든 거대한 쇼!! 시간이 지날수록 명분없는 희생자들의 증가와 국민들의 분노는 커져가지만 성공 그 후의 반응을 보니 슬픔이...전체적으로 약간 지루하긴 합니다..,,,,,,,
1069,지루합니다.. 매우.. 많이.. 알바 아님,,,,,,,
1070,재미있는 영화 아닙니다.아름다운 영화 입니다.영화의 의미를 느끼면 보는분들에게좋은영화 입니다.,,,,,,,
1071,1인칭 시점의 전개가 큰 몰입감을 가져다 준다. 영웅이 아닌 사람을 보여주는 것에 더 큰 현실감을 느끼고,,,,,,,
1072,너무나 지루했습니다 영화 잘 본다고 자신했는데 ㅠ,,,,,,,
1073,한8점 주고 싶은데 한국영화알바들 평점 테러가 심해서 10점 줍니다.,,,,,,,
1074,아이가 있는 가족이 더 깊이있게 느낄영화네요장면장면 너무 섬세하구요~이영화는 달 착륙 영화이지만 지금의 나를 돌아보게도 하네요~,,,,,,,
1075,올해최고의 영화라고 꼽고싶네요.,,,,,,,
1076,위해한 한 발자국을 위해 많은희생을 하여,,,,,,,
1077,노래는 필요이상으로 너무 크고 전개는 지루하고 러닝타임 내내 중간중간에 정신놓고 보게 된다.우주분야는 재미있어하는데 이건 너무 재미가없다. 아마 역사에서 이미 닐 암스트롱이 달을 처음으로 갔음을 스포당해서 그런걸지도...,,,,,,,
1078,인터스텔라 같은거 생각 하고 가니깐 처 지루하다하지 영알못 쉐리덜 근데 아들은 자식아니냐??어?!,,,,,,,
1079,약간 지루하긴 하지만 무난해요,,,,,,,
1080,영화를 일욜날 보고  자지는 않았지만 왜 잠이오는 걸까 곰곰히 생각해본 결과 첫번째로 아름다운 달모습을 상상하고 갔는데 달에 갈때까지의 전개과정 에피소드가 좀 길었다고 생각되고 두번째로는 좋은 음악이 잔잔하게 반복되...,,,,,,,
1081,닐에게 달은 무덤이었고 그는 그곳으로 향했다,,,,,,,
1082,내평점셔젤만의 연출력에 몰입하고,,,,,,,
1083,정말 돌려 죽는줄 알았다 보지마라 좋은 배우 그리고 스티븐 스필버그  제작이래도 이건 정말 아니다,,,,,,,
1084,닐 암스트롱이 아니라 닐 멘탈스트롱인듯...나라면 저 상황 못 버팀.절대.,,,,,,,
1085,저녁 6:30분 영화 왜 6명만 있는지 알았다,,,,,,,
1086,글쎄..참 답답했다.평점을 믿는건 위험하다,,,,,,,
1087,보면서 잠옴 소리안날때 asmr인줄,,,,,,,
1088,보다 깜빡졸앗네요 1시간동안 여기까지 쓰겟습니다 .,,,,,,,
1089,오랬만에  잤습니다  푹잠,,,,,,,
1090,잠이 부족한 현대인들에게 좋은 영화,,,,,,,
1091,이걸 영화화해? 구라 아니었어?그때 기술로 달 착륙이 가능?,,,,,,,
1092,작품은 뛰어나나,,,,,,,
1093,그래비티 인터스텔라를 잇는 우주영화라는 소개 듣고 갔는데 일단 낚였구요. 평소에 다큐많이보고 좋아하는데 그냥 다큐가 더 재밌는거같음.,,,,,,,
1094,우주로가기위한과정이너무어지러웠어요,,,,,,,
1095,건방진 셔젤감독. 자신의 생각에 지나치게 몰입하면 이런 결과물이 나온다.,,,,,,,
1096,역시 달나라 가는 영화라써 관람객80%가 다듵  달나라 가는 영화 그래픽은 최고등급 %꿈동산가는 평점****%어지러움증 평점****%영화반값6천원에 봐서 괜찮음,,,,,,,
1097,우주영화인줄 알았는데 사람영화였다,,,,,,,
1098,현실적인  영화? 보는 관점에 따라 지루할수도 있음,,,,,,,
1099,흥미도가 높지 않지만 볼만한 작품으로 판단이...,,,,,,,
1100,달까지의 리얼한 여정을 체험하러 가서 닐의 심리적 압박까지 체험하고 돌아왔다.,,,,,,,
1101,잠자기딱좋은 영화인것같아요 돈내고 주무실분 추천해드려요. 소음은주의하시길,,,,,,,
1102,인터스텔라보다 웅장하다면서 웅장함은 1도 못따라갔음 지루한장면도 너무많았고 끝에 달가는부분 빼고는 잠오던영화,,,,,,,
1103,화려함 뒤에 숨은 슬픔과 적막..,,,,,,,
1104,인상깊게 봤어요 긴장감 있고 어렵고 복잡하고 그러지도 않고ㅎㅎ,,,,,,,
1105,어렵기 때문에 도전하는 것이다....,,,,,,,
1106,낭만이 웅장함을 만났을때,,,,,,,
1107,어린시절 중학교때 스피커로 명상의 시간을 기억하는사람이라면 이영화 추천 ~,,,,,,,
1108,인터스텔라를 기대해서 당황했지만 닐의 인생에 빠져들고  아내,,,,,,,
1109,영상미가 다했다. 시각적인것 청각적인것 모두 절정을 보여줬다. 달착륙씬은 경이로움을 넘어 눈물이 찔끔 날 지경,,,,,,,
1110,이런건 확실히 영화관에서 볼만하죠,,,,,,,
1111,어제 보다가 잠잘뻔...지루함...특별히 감동가는 장면도 없고 스토리만 쭉 전개됨 역사책 읽는 느낌,,,,,,,
