,content,,,,,,,
1,주인공은 달나라 가는데 사투를 벌이고 나는 꿈나라 갈까봐 사투를 벌인다,,,,,,,
2,퍼스트'맨을 생각하고 갔다가 퍼스트'맨'을 만나고 왔다. 그의 삶이 잔잔히 계속 맴돈다.,,,,,,,
3,상처 입은 한 인간이 가장 먼 곳까지 가서 아픔을 묻고 오는 이야기다.,,,,,,,
4,달착륙에 성공하고 환희 하는,,,,,,,
5,우주는 거들 뿐 상실에 대한 영화다,,,,,,,
6,와이프가 보자고해서갔는데 와이프 코고는소리가 극장에 울려퍼짐,,,,,,,
7,달처럼 생긴 지구가 기억에 남는다,,,,,,,
8,조조로 혼자 가서 보세요 소리 다 꺼지는 씬에서 제 숨소리만 들림 ㅋㅋ,,,,,,,
9,인터스텔라처럼 볼거리 및 미스테리나  에일리언  처럼 스릴있는 그런 영화 아님. 다큐멘터리 보는 시각으로 보셈,,,,,,,
10,인터스텔라나 마션처럼 흥미진진한 우주영화 기대하고 가면 지루할 수 있습니다,,,,,,,
11,라이언 고슬링 이번영화로 다시봤다..,,,,,,,
12,우주영화라기 보단 우주비행사의 내면에 관한 영화입니다. 그 점에 집중하셔서 보시면 더 좋을 거 같습니다.,,,,,,,
13,퍼스트에 의미가 누가 먼저 극장을 나가는 첫발을 디디느냐 뜻,,,,,,,
14,만오천원 내고 달나라 다녀옴 득템>ㅂ<,,,,,,,
15,많이.. 지루해요. 영화적 가치는 인정하지만.,,,,,,,
16,가지 못한 길에 대한 공포와 두려움을,,,,,,,
17,자고싶은사람 무조건보세요 잠 잘옵니당,,,,,,,
18,닐 암스트롱의 인생을 들여본 기분이다,,,,,,,
19,숨이 막혀온다... 꼭 아맥으로 봐라,,,,,,,
20,보고 나서 인터넷강의가 재밌다는 걸 느꼈습니다...,,,,,,,
21,그냥 대충 평 남기지말고 직접 본사람으로써 인터스텔라,,,,,,,
22,나만 잠온게 아니구나...ㅎ,,,,,,,
23,옆 옆에서 주무시던 아저씨 두고 온게 영 마음에 걸린다,,,,,,,
24,생각보다 훨씬 지루합니다 영화보면서 웬만하면 안자는데 중간중간 잘뻔했습니다 평점보고 봤다가 크게 후회했어요.. 거의대부분이 닐의 심리와 상황에 대해 보여주는데 솔직히 머리로는 이해되는데 마음은 전혀 와닿지않아요 근래...,,,,,,,
25,내 앞에 가장 빨리 나간 사람... 당신이 진정한 퍼스트맨입니다.,,,,,,,
26,음악영화의 거장이 sf영화의 거장으로,,,,,,,
27,군더더기 없는,,,,,,,
28,오랜만에 정말 괜찮은 영화.,,,,,,,
29,너무 지루하다. 푹 자고 맨정신으로 보고 왔는데도 지루하다. 그나마 마음에 들었던 건 라이언 고슬링과 클레어 포이의 연기 합...,,,,,,,
30,처음으로 영화보다 잠.  졸리고 지루하고. 물론 어려움이 있을때 상황을 잘표현한 부분은 인정할만 하지만 그래비티에서 이미 많이 나와서. 그닥 신선하지 못함.어거지로 감정부분을 끼워 맞추는데. 걍 별로임.,,,,,,,
31,졸음과 싸울분에게 추천함,,,,,,,
32,아....돈 주고 본 영화중에 최악이었다.와이프랑 같이 낮잠을 잤다. 진짜 별 내용없는 영화.근데 평점 왜이럼??,,,,,,,
33,기대보단...별루였다,,,,,,,
34,우주선 탑승부터 달 착륙하는 순간까지 벅차오르는 감동ㅠㅠㅠ,,,,,,,
35,졸림...그냥 그저그럼,,,,,,,
36,잤어요.. 재미를 기대하시면 안됨,,,,,,,
37,우주의 경이로움,,,,,,,
38,제발 작품성있는영화=졸리고 지루한 영화라는 무언의 공식이 깨졌으면 좋겠다 잘만들고 작품성도 있으면서 지루하지 않은 영화도 너무 많기에 굳이 바뿐시간 쪼개서 이 긴 지루함을 참아낸뒤 그 지루함을 참아낸 뿌듯함때문에 좋...,,,,,,,
39,상업영화 맞냐??핵 노 잼... 조조영화로 봤는데 5명 탈주하더라.. 갈때없어서 그냥 봤다,,,,,,,
40,인터스텔라,,,,,,,
41,중간에 나간 사람 세 명 졸다 코 골은 사람 한 명 하이라이트에 팝콘 소리내서 쳐먹는 새끼 한 명 중간에 안나간 거 후회하는 사람 한 명,,,,,,,
42,30년인생 영화보면서 처음으로 졸았다... 마션 인터스텔라를보고 기대하고 오셨다면 돌아가셔도 좋습니다. 덩케르크도 재밌게 본 1인입니다.,,,,,,,
43,ebs 다큐를 봐도 이거보단 재밌을듯. 감동도 없고 공감도 없고 우주가 전혀 느껴지지도 않고... 내 인생 최악의 영화였다.,,,,,,,
44,벅차오르는 감동을 어찌할 꼬,,,,,,,
45,개노잼 개노잼 개노잼 개노잼,,,,,,,
46,이거 보고나서 그래비티랑 인터스텔라가 걸작인걸 한번 더 깨달았습니다ㅜㅜ,,,,,,,
47,졸린거 참다가참다가 남자친구한테 달도착하면 깨워달라고하고 푹잤어요,,,,,,,
48,영화보다가 달나라가 아닌 꿈나라 4번 다녀왔습니다. 잠에서 깼다고 생각했는데 어느순간 또 자고있는 내 자신을 발견할수 있었습니다 ㅋㅋㅋㅋ,,,,,,,
49,불면증이 나았어요^^ 꿀잠영화b,,,,,,,
50,예사롭지 않을거라고 생각했지만 딱 맞아 떨어짐. 진심 최고의 영화,,,,,,,
51,딸죽어서 화나고 동료죽어서 화나다가 달에 발짜국 찍는 영화. 내가 눈이 낮아서 왠만한 영화는 재미있게 보는데 이건 진짜 돈내고 고문 당하러 가는 영화다,,,,,,,
52,방금 부천소풍 아이맥스로 보고 나왔다 완전 속았다 뭔가 엄첨스펙타클 한 장면이 나올줄 알았는데 ㅠㅠ..돈주고 보지들마라 나중에 케이블에서 해주면 보든지 ..안봐도 된다 시간 아깝다,,,,,,,
53,우끼네. 정말 졸린영화 지루한영화 한마디로 노잼,,,,,,,
54,지루해서 죽다 살아남.,,,,,,,
55,지금 보고있는데 너무 ~~~~지루하다... 영화가 아니라 다큐야 다큐,,,,,,,
56,아이맥스로 아주 기대가됩니다. 김종현 소개팅화이팅!,,,,,,,
57,아니...아무리 지루한 영화라도..중간에 농담을 넣어서 영화가 지루하지 않게 느끼게 해주는데..이건 진심 웃음기 싹 빼고 '난 다큐를 만들거다' 하고 작정한 영화임...농담따먹는거 1도 없고 그냥 진짜...,,,,,,,
58,진짜 숨막히네요 이 영화가 재밌나요?,,,,,,,
59,내생전 보다잔영화처음이다,,,,,,,
60,잘잤습니다. 평점 믿지말것.,,,,,,,
61,두손모으고 봤던 영화... 제발 끝나게 해달라고 ㅜㅜ 왠만한 지구과학 수업이 20배는 흥미로울것 같습니다... 지루함 그자체,,,,,,,
62,근데 기대안해도 재미 없어요.엔딩크래딧이 제일 꿀잼,,,,,,,
63,와.. 달에 가는 흥미진진한 일을 이렇게 지루하게 만들어주다니.. 실시간 생중계보다 더 재미없다ㄷㄷ,,,,,,,
64,불면증 치료에는 퍼스트맨!! 그래비티나 인터스텔라 기대하고 단체관람갔다가 반이상이 단체숙면!!,,,,,,,
65,제발 보지마세요 1점도 주고싶지 않습니다.. 지금 보는중인데 나가고싶어요 괴롭습니다... 시끄러워요... 살려주세요 제발,,,,,,,
66,인터스텔라 마션 같은 영화 기대하고 봤다가. . . ㅠㅠ 백조의 호수인줄. . . 왜이케 잔잔해 영화가. . .,,,,,,,
67,오랜만에 댓글 남긴다!이 영화의 평점을 보고나니 뉴스에서나 들은거같은 댓글 알바의 존재를 실감 했다.영화를 끝까지 본 내 인내심에 경의를표한다.,,,,,,,
68,젠장. 1점이 최저 점수 맞냐 ㅜ,,,,,,,
69,호불호가 심한 영화라 기대 안함댓글 알바 좀 적당히 좀해라,,,,,,,
70,조미료를 과하게 친 얄팍한 맛이 나서 오히려 대중들의 환호를 받았던 데미언 셔젤의 전작들 위플래쉬 라라랜드를 훌쩍 넘어서는 수준급 작품. 반대로 보면 라라랜드 위플래쉬에서 꽂혀서 이 영화를 찾았다면 분명 실망할 것....,,,,,,,
71,뭔 엄청난 sf눈뽕 영화를 기대하고 간 사람들이 평점 낮게주는거지...스토리가 1960년대 인류가 우주에 도전하고 달착륙 하는 그런 스토리인데 왜 그런곳에서 화려하고 뭔가 엄청난걸 찾으려고들 난리인지 모르겠네 재미있...,,,,,,,
72,아침부터 독서실에 가지 않고 영화를 보러간 제 자신을 원망했습니다.,,,,,,,
73,차라리 인터스텔라를 두번 보는게 개이득임,,,,,,,
74,4dx로봤어요흔들어서깨우지않았다면 많이 잤을거같아요넘기대가 컸나? 솔직히 재미없었어요...감독 팬이라 개봉날달려가서봤는디..,,,,,,,
75,지루했어요. 퍼스트맨이 아니라 딸을 잃은 아빠 이야기,,,,,,,
76,역사는 결과를 스포하였지만 그 속의 감정은 스포하지않았다,,,,,,,
77,세상에 이 영화가 지루하다고? 어이가 없네. 그래비티보다 훨 낫다. 지루하다는 사람들은 우주나 우주선에 대한 로망이 거의 없거나.. 중력,,,,,,,
78,계속 같은 내용이여서 재미가 없었음,,,,,,,
79,댓글이 다들,,,,,,,
80,꿀잠잤네요 쿨쿨~~~,,,,,,,
81,하ㅠㅠㅠㅠ전 그냥 일반인입니다 그냥 재미없어요 그냥 재미가없어요,,,,,,,
82,Xx노잼,,,,,,,
83,영화보고나서 차라리 돈을 땅바닥에 던지는게 더 재밌다고 한사람들이 웃기려고 그러는 건줄 알았는데 그 심정을 이해하게 됐다.,,,,,,,
84,차라리 책으로 보는게 훨씬 재밌을듯,,,,,,,
85,야이 알바시끼들아 졸려 죽을뻔했자나,,,,,,,
86,불면중인데 2시간 21분 꿀잠 잤습니다,,,,,,,
87,뻔히 아는 내용을 2시간 20분동안 졸음을 참으며 지켜봤다. 영화줄거리 설명도 교묘하게 달착륙 내용을 빼버렸고 평점알바한테까지 속아서 돈과 시간을 낭비했다. 비추함.,,,,,,,
88,감동,,,,,,,
89,돈 아까워서 잠을 안자려고 자신과의 사투를 펼쳐야 했던,,,,,,,
90,존나 재미없네요 이게 왜 박스오피스 1위인지 모르겠어요 뒤에서 1위인건가...,,,,,,,
91,이딴게 재밌다는 놈들은 똥 보고도 예술이라고할 정신병자들 뿐이다,,,,,,,
92,영화가 착륙은 안하고 계속 그 주변만 뱅뱅 돕니다,,,,,,,
93,존나졸리네 후..간만에 졸았네ㅋㅋㅋㅋ,,,,,,,
94,인생처음으로 영화보다잠,,,,,,,
95,뭔가 스펙타클을 기대했는데 휴먼드라마네요. 보면서 시계를 여러번 봤네요. 그냥저냥...,,,,,,,
96,아 잘잤다~ 고요하고 잠잘왔어요,,,,,,,
97,보지마세요보다가 자기도 모르게 잠이 드는걸 느끼게될꺼에요 ㅠㅠ (돈아까워;;),,,,,,,
98,잤어요. 지루하고 재미없어요.,,,,,,,
99,너무 재미 없었어요. 외국 영화에도 신파가 있네요....인터스텔라 인생영화라 기대했는데,,,,,,,
100,별하나두 아깝다 지루해서 그냥잤다,,,,,,,
101,인터스텔라를 이어?ㅋㅋ어이가 없네 진짜 ㅋㅋ,,,,,,,
102,영화가 참 지루해요 ㅠㅠ 넘 다큐에 치중한게 아쉬워요.,,,,,,,
103,정말 힘든 2시간 애들은 참지못하고... 어른들도 다들 ㅠ,,,,,,,
104,sf물 기대하시면 안됩니다닐암르트롱이 달에 가는 과정에서의 갈등 고뇌 가족애를 다룬영화 입니다달에 딸을 놔주는 장면에서 눈물났네요..딸바보 닐..,,,,,,,
105,재미없게 본 사람뒤에 재밌게 본 사람이 있다,,,,,,,
106,개인적으로 감독이랑 배우 다 너무 기대를 해서 그런가..용산imax에서 보고 나오는데 그냥 그래서 밍밍했다고 해야 하나(?)  막 황홀하고 그런 느낌은 없었네요,,,,,,,
107,낚였다...간만에 영화보다 졸았다..뻔한 전개..,,,,,,,
108,사람마다 영화보는 관점이 다르기에 영화평점 같은거 처음 써보는데 불면증이 있거나 두시간 푹 주무실분들은 꼭 보세요~숙면에 도움을 줄겁니다~,,,,,,,
109,그렇다.  '인간'이 있기에 '인류의 진보'도 있는 것이다.,,,,,,,
110,이 영화를 폄하하는 사람들은 한 사람의 인생을 조용히 지켜봐줄 여유도 없으며 인간 내면의 본질적인 탐구심와 깊은 심연도 이해 못 하는 사람들이다.,,,,,,,
111,우주 영화가 아니라 휴먼 드라마인데 홍보가 잘못된듯. 잘 만든 영화임에는 틀림없지만,,,,,,,
112,이런 류의 영화 이젠 좀 지겹다. 잠만 오고~,,,,,,,
113,영화 는 정말 잘만들었음. 근데 지루함 노잼. 다큐멘터리 좋아하시는분 추천!,,,,,,,
114,음 제가 무지한건지 몰라도 지루했습니다첫번째 발사때가 제일 흥미롭고 그다음 부터는 나만 지루한가?? 했습니다 하하,,,,,,,
115,분화구를 바라보며 던지는 장면. 그리고 유리를 사이에 둔 말 없는 엔딩씬...  데미언 감독은 천재가 맞다. 요즘 한국영화들 보면서 다 졸았는데. 오히려 퍼스트맨 지루할 줄 알았는데 1도 졸리지 않았다.,,,,,,,
116,진짜 영화 댓글은 처음인데끝나고 집 갈 생각으로 버텼어요이젠 제발 끝나라고 빌었던 적음 처음이다,,,,,,,
117,네이버 .... 이제... 다시보겟다...나믿고 같이 본 사람들에게 너무 미안했던 영화다,,,,,,,
118,어떤 관점에서도 그닥 용서가 않되는.. 온가족이 다자는데 그래도 뭐 한방은 있겠지하며 끝까지 남아본 내가 한심해진 영화.. 지루의 끝판왕,,,,,,,
119,암스트롱을 제대로 그린것도 아니고 우주항공의 전문성으로 승부한것도 아니고 그마저 최초 인류 달착륙이라는 소재로 미제 영웅주의로 그린것도 아닌.. 정말 이도저도 아닌 글 그냥 소재만 좋아서 기대감만 생기게했던 영화,,,,,,,
120,끝나기 10분전에 달에서 깡총뛰는 장면이 제일재밌었다,,,,,,,
121,그냥 다큐멘터리 보세요,,,,,,,
122,졸린영화.... 평점높게주는 사람들은 지루함을 즐기는 듯...,,,,,,,
123,영화 배경이 60년대라고 영화까지 60년대로 만들 필요는 없잖어... 카메라 진짜 앵글 돌아버리겠고 필름 화질 구리 가고 진짜 루즈하고 잠은 오고 인터스텔라랑 비교조차 안됨,,,,,,,
124,주인공의 심정에 너무 동화된 나머지 내가 다 피곤하고 고통스러움 중간에 탈주할 뻔.,,,,,,,
125,아 내가 이걸왜보는 중인지 모르겠다.1위라서 친구가 보자고 하조졸라서 봤더니차라리 베놈볼껄 ㅡㅡ딸죽고 동료죽어서 지혼자 화나서 돌아버리는 주인공이 가족한테 대하는 태도가 쓰레기라서 보기싫다.아내랑 자식들은 뭔죄??,,,,,,,
126,꿀잠 잤습니다. 오랫만에 숙면,,,,,,,
127,너무 재미없어요.ㅠㅠ,,,,,,,
128,내 인생에 수도없이 많은 영화를 봐왔지만 단연 최고로 지루했음. 공포영화를 봐도 재밌고 코미디,,,,,,,
129,너무 지루했음..총 50명쯤 3명 보다나감 ㅡㅡ,,,,,,,
130,너무지루해요 한시간짜리면딱맞을거같은데 너무러닝타임이길어요 이거보느니 우주유투브보는게낳아요 평점왤케높냐,,,,,,,
131,호불호가 심하게 갈리네요..왠만하면 재밋게보는데 ..이건 정말 잠오ㅏ요..,,,,,,,
132,2시간동안 잘잤다ㅋㅋㅋ,,,,,,,
133,지루함의 극치... 뻔한내용을 뻔하지않게 만들려고 노력했으나 더 지루해짐,,,,,,,
134,개노잼 조종사 기절할때 같이 몇분 기절해서  코고심 ㅅㄱ,,,,,,,
135,아아 좋은 수면제다....,,,,,,,
136,너(퍼스트맨)를 보면 나는 잠이와 /참 이상하다 그치 /잠이 오면 나는 잠을 자/참 이상하다 그치 /자면서 나는 생각을 해 / 영화보러온 내가 미친놈이지.  심야영화가 끝났다.그런데 같이 영화보던 사람들이 보이지 않...,,,,,,,
137,영화 아니고 다큐다.. 개노잼에..그냥 수면제임... 피곤한데 2시간만 딱 자고 싶은사람 추천합니다..,,,,,,,
138,중간에 나왔습니다 근데 너무많이 잤나? 꿀피부ㅋ최악의 영화,,,,,,,
139,영화의 초반5분과 끝의5분을 빼면 지루하다ㅈ긴장감이 부족하며 혼자영화를보면 10초 스킵하고싶은장면이너무많다 그레비티와 비교할수없는 지루함...2시간20분동안..힘들어할수도..,,,,,,,
140,실패한 상업영화,,,,,,,
141,용가리이후로 처음으로 졸면서보네요 최악,,,,,,,
142,지루함 그자체인 영화 코고는 소리들리고 중간에 나가는사람도 봄,,,,,,,
143,우주선 계기판 보니 덩케르크 비행기가 떠올랐다,,,,,,,
144,이 조합을 또 볼 수 있다는 것에 감격하면서 들어가서 영화에 감동하면서 나왔다.  감성,,,,,,,
145,라라랜드 감독이라 그런가 음악까지 완벽해!+_+,,,,,,,
146,수 많은 사람들의 인생작이 될 듯 하다,,,,,,,
147,아플로11호에 탑승한 고슬링이 달을 쳐다보는 눈빛을 잊을 수 없다.,,,,,,,
148,지루하기도 했지만 대체적으로 정말 좋은 영화입니다~,,,,,,,
149,첨단 하이테크널로지 이면에 있는  검증안된 미개척 분야에 대한 불안  공포를   로켓의 콕핏안에서 담아냈다  압력 과 팽창 때문에 덜컥거리고 나는 나사의 이음매  소리와 가스의 불안한 소음이 귓가에 생생하다,,,,,,,
150,와 졸린거 겨우참았다 휴,,,,,,,
151,호불호 크게 갈릴 듯. 다큐 좋아하는 분들에겐 강추 . 난 푹 잤음.,,,,,,,
152,우주영화를 기대하고 갔는데샌드위치먹고 팝콘먹고 사이다마시고는 꿀잠자다 나왔어요우주영화 생각하고 가면 개빡침....,,,,,,,
153,평이 호불호가 많길래 친구가보자하는거 끝까지 안볼라다가 결국 따라갔다. 끝나고 극장에서 박수칠뻔했다..,,,,,,,
154,이미알고있는사실을 이렇게까지 극적요소 하나없이 극장에서 보게될줄이야,,,,,,,
155,아무리 경외적인 주제를 가지고 만들었다고 별로인 영화가 예술인건 아니다 그냥 재미없다 다큐로 봐도 그냥 그렇다 그렇게 다큐를 원하면 내셔널 지오그래픽을 봐라 그게 더 재밌다,,,,,,,
156,애매한 내용.. 초점이 이도 저도 아닌 느낌이었음.닐 암스트롱에 집중하려는 건 알겠는데 잘 안느껴짐. 그럴바엔 차라리 국뽕 얘길 하던가.. 보다가 탈출하는 사람 많고 소리 없을 때 울려퍼진 누군가의 코고는 소리가 이...,,,,,,,
157,X같은 알바새끼들한테 속아서   돈버리고옴  이영화볼바에 암스트롱 책을산다,,,,,,,
158,점수로표현하면 인터스텔라가10이면 퍼스트맨은4정도 입니다.,,,,,,,
159,영화보다 3번 잠듬진짜 두고두고 기억에 남을영화다,,,,,,,
160,심야영화로는 절대 보지마세요,,,,,,,
161,상영중에 가장 먼저 나가는 혜안을 가진 자가 “퍼스트맨”. ㄹㅇ개노잼. 내돈 ㅡㅡ,,,,,,,
162,지루하다 지루하다 지루하다 지루하다,,,,,,,
163,영화보다 잔 적 한번도 없는데 완전 졸았음 우주영화 좋아해서 예고편 뜨자마자 보러가야된다면서 기대했는데 실망.. 스토리가 없고 한 사람에 대한 얘기라 그런가 지루함,,,,,,,
164,감독의 방향성은 좋다고 생각한다. 뻔한 우주의 감동이 아닌 암스트롱의 고뇌,,,,,,,
165,정말 지루하고 매우 졸리다,,,,,,,
166,꿀잠자고 싶으면 보세요,,,,,,,
167,이런영화를 인터스텔라에 비교하다니....넌센스다...음악은 서정적 라라랜드가생각나게만들고 닐의 철저한 그시대에 가부장적인 캐릭터가 부각됐다...미국 국뽕영화...,,,,,,,
168,드럽게 길고 재미없고 그냥 다큐멘타리같은 영화 다큐멘타리를 티브이에서도 안보는데 비싼돈 주고 영화관에서 하품하면서 봤다,,,,,,,
169,저의 불면증을 낫게 해줬습니다. 건강 챙겨주는 영화입니다!!,,,,,,,
170,진짜 지루하다 이건 ebs다큐보다도 심각함. 재밌다하는애들 성격짐작감. 십자수가 취미일듯,,,,,,,
171,라이언 고슬링은 닐 암스트롱의 스토아적 성격을 잘 연기한 겁니다. 원작이 암스트롱 본인과 가족,,,,,,,
172,후 영화보는내내 고구마 백개먹은 기분으로 토하러 달려가고싶었어요ㅠㅠ잔잔한게 아니라 미동조차없던데요ㅋㅋ기승전결,,,,,,,
173,재미보단 달에 첫발을 딛기까지 관련 인물들의 희생과 감동의 과정을 우주만큼 고요하게 잘 담아냈다고 생각한다. 이영화는 재미로보면 안된다고 생각합니다~,,,,,,,
174,내가 영화를 잘알진못하지만 영화에 대한 접근은 두가지부류로나뉜다고생각한다. 소파에 누워서 편히봐도 괜찮은 영화와 감정,,,,,,,
175,이게 어떻게 지루하냐 역시 네티즌 평가는 믿고 거른다. 전문가 평점만 보면 됨,,,,,,,
176,숨 죽이면서 봤어요. 동료들이 떠날 때 눈물이 났습니다.,,,,,,,
177,진정항 모헙과 모험정신을 가진 인간모습을 담은  멋진 영화입니다.  나이를 먹을 수록 이런 영화가 더 가슴에 와닿습니다.   영화를 사랑하는 사람들에게 강추합니다.,,,,,,,
178,지루했음. 다큐멘터리에 가까운 영화. 그래비티나 인터스텔라를 기대해서 더 실망했던 것 같다,,,,,,,
179,감성이 이성을 덮어버린 영화. 많이 졸았다..,,,,,,,
180,심야로 보시면 코고는 소리가 많이 들립니다,,,,,,,
181,도대체 다들 뭘 본거지. 전혀 지루하지않다. 우주에 대한 이야기가 아니다. 이별에 대한 이야기다.  아버지의 이야기이다. 아이를 가진 부모라면  이 영화가 지루할 수 없다.,,,,,,,
182,영화내용 자체는 흥미있었지만 너무 재미를 뺀 일생을 그린 다큐같은 느낌이 강한 영화,,,,,,,
183,4D로 봤는데도... 잘잤다...,,,,,,,
184,제 2의 인터스텔라를 기대하고 갔다... 결과는 참혹했다... 거북이보다 느린 전개와 ASMR을 실현하게 하는 정적... 빨리 끝나길 원할정도의 지루함... 몸이 간지러울 정도였다...,,,,,,,
185,개노잼 중간에 나가고 싶은 영화는 처음..우주영화도 아니고 뭣도 아닌것같은,,,,,,,
186,중간에 나가는 사람도 몇몇있었고 너무 지루했다,,,,,,,
187,정말 흥미도없고 보고 현타옴.,,,,,,,
188,졸립니다 처음부터끝까지 계속 어두운영화느낌 재밌다는건 잘모르겠네요,,,,,,,
189,인터스텔라꿈꾸며 기대하고 아이맥스로 봤는데 ㅠㅠ그냥 다큐멘터리같은...언제끝나는지만을 기다렸네요..긴여정의 지루함~달도착 첫발딛음 ~뭉클~끝,,,,,,,
190,커피 마시고 오후 영화 봤는대 3-40분 자기는 했습니다 인터스텔라 생각했다가 그냥 전기영화구나 했습니다,,,,,,,
191,호불호가 극명히 갈릴거란 생각에 일점 뺌. 흥미나 액션감을 선호하는 분께는 비추. 갠적으론 상영시간 내내 긴장감 때문에 몸에 힘이 잔뜩 들어갔다.,,,,,,,
192,겁나 지루하고 졸리고 재미없어요.,,,,,,,
193,내용이 많이 지루 했습니다. 달착륙시 신기함을 전달한거 빼고는 딱히 괜찮은것이 없는거같습니다,,,,,,,
194,주인공 달나라 가기전에 내가 먼저 꿈나라갔어요~,,,,,,,
195,SF라고 쓰인 장르에 낚였다. 영화에 대한 정보 없이 들어갔다가 닐이라는 이름 듣고 설마했는데. 너무도 잔잔한 다큐멘터리 영화ㅠㅠ,,,,,,,
196,영화가 너무 감명 깊은 나머지 저 또한 퍼스트맨이 되었습니다. 영화관에서 제일 먼저 잠들었던거 같아요.,,,,,,,
197,이런 좋은 소재를 가지고 지루함과 루즈의 극치달리며  연출도 지루했습니다.,,,,,,,
198,완전 지루하고 졸리는영화,,,,,,,
199,역시 한국 대중은 아직 다방면의 문화를 향유하기엔 이르다. 졸리다 지루하다 난리부르스네. 늘 해오던 것,,,,,,,
200,달 도착할때 사운드 갑자기커져서 깸 ㅋㅋ,,,,,,,
201,인터스텔라급 웃기시네..광고 과대포장... 미국판 염병 미국뽕이 느껴지는 영화다..지루함이 지나치다..이것보다 호밀밭의 반항아가 더 현실적이고 얻는게 더 많다..,,,,,,,
202,이상한건 아닌데 내 스탈은 아니다.. 졸려,,,,,,,
203,40평생 극장에서 잔건 처음인것 같네요지루하고~~~ 지루하고~~ 잠오고공짜 티켓이였으니 망정이지 돈 아까울뻔~,,,,,,,
204,자다가 깸 ㅡㅡ 완전 지루해요,,,,,,,
205,핵노잼이다이다이다이,,,,,,,
206,하....그냥 보지마...,,,,,,,
207,시간가는줄알고봤습니다,,,,,,,
208,두시간반동안 정말 괴로웠다,,,,,,,
209,오늘 용산아맥에서 여친이랑 4시꺼 봤어요..여친도 졸고 저도 졸고..내용은 장례식 많이 치른거밖에 기억이 안나네요..,,,,,,,
210,너무나 졸린 영화.그래비티를 기대하고 간 내가 바보,,,,,,,
211,쓰레기영화 영화광인데 태어나서졸기는 처음,,,,,,,
212,너무 끈다. 지루했음. 난 불호쪽.,,,,,,,
213,절대 후회하는 영화.불면증있는분만 보세요.시간. 돈 모두 아까운 령화,,,,,,,
214,형 한마디만 한다..  진짜 처음으로 평점적는데2시간동안 꿀잠 잘려면 봐라!!  과학수업시간인줄 알았다..   우주선발사할때 한번 인났다,,,,,,,
215,이런 게 바로 '시간 가는 줄 알고 봤다' 는 영화로구만 ㅎㅎ,,,,,,,
216,이거 보고 졸은 새키들은 학력이 어떨지 대충 짐작 간다,,,,,,,
217,이 영화를 안자고 끝가지 본 당신이 승리자입니다.,,,,,,,
218,척'하기 좋아하는 개한민국 수준에 딱!,,,,,,,
219,심심하네 조금 지루한영화 인것 같다,,,,,,,
220,오늘 충분히 자고 일어나자마자 보러 갔는데 또 잠들었다긴장감이 없다,,,,,,,
