,content,,,,,,,
3201,팝콘 산거 열개 먹음 ㅋㅋ 몰입도 최고! 그냥 믿고 보세요! 아이맥스로 꼭~~~,,,,,,,
3202,아 자꾸 생각나ㅠㅠㅠ1,,,,,,,
3203,10점은 다 얼마인가요,,,,,,,
3204,데미안 세졜과 의리로 봤다.닐이 모의훈련때 잠시 혼절하듯이 나도 정신을 잠시 놓은적도 있었다.그래도 역시 세졜 마지막 한칼은 있음.그래비티 전에 나왔음 좀더 신선했을터인데..컴배배치ㅡ주연 이미테이션게임 정도의 오락성...,,,,,,,
3205,날로 먹을려다가 진짜 망한다 한마디로 지루하다,,,,,,,
3206,스토리 들어간 미국뽕 다큐,,,,,,,
3207,호불호가 갈리겠지만 나한테는 호!,,,,,,,
3208,조용한 장면에서 부스럭거리고 돌아다니고 팝콘 처먹는 것들 개짜증,,,,,,,
3209,마치 달에 도달하는 위대한 업적을 닐과 함께하는것 같았다,,,,,,,
3210,재미재미재미재미재미재,,,,,,,
3211,중간에 살짝지루닐암스트롱의 당시 생각과 고민들이 실감나게 와닿습니다.볼만함 ^오^,,,,,,,
3212,모든 신이 군더더기없이 깔끔했습니다.,,,,,,,
3213,어지러움  생가보단 셜루,,,,,,,
3214,다큐와 sf를 잘섞어놈 취향타는 영화 스타일 음악은 황홀.고슬링 연기 볼만함,,,,,,,
3215,내가 직접 달나라 다녀온 체험...최고다!,,,,,,,
3216,데미언 셔젤 감독은 우주에서도 왈츠를 보는 듯한 느낌을 가지게 만든다!,,,,,,,
3217,2시간 반동안 시간가는줄 몰랐다인터스텔라와는 또다른 맛,,,,,,,
3218,마지막 하이라이트 부분은 잊을 수가 없다.,,,,,,,
3219,닐의 사실적인 달착륙 역경 가족사 끝자고싶은분들에겐 갠춘,,,,,,,
3220,아폴로 11호 달 착륙 성공까지 인간의 노력이 얼마나 위대하고 대단했는지를 이 영화를 통해 알수 있게 되었다,,,,,,,
3221,그래도 명작 오브 명작.,,,,,,,
3222,영화를 보고 나니 '숭고한'이라는 단어가 떠올랐다.,,,,,,,
3223,그냥 일단 보세요 후회 안하니까,,,,,,,
3224,라이언 고슬링이 달 착륙했을때.. 보지 않으면 모른다,,,,,,,
3225,확실히 팝콘영화는 아니다. 하지만 긴장과 몰입도는최고. 라이언고슬링의 감정 연기와 무게감있는 연출 그리고 영화 ost가 압권. 우주영화이긴 하지만 초점이 달 착륙이 아닌 닐 암스트롱이라는 인간의 감정에 중점적으로 맞...,,,,,,,
3226,닐 암스트롱이 이렇게 대단한 사람이었다니...그래도 영화는 지루한 부분이 있네요,,,,,,,
3227,에스에프 영화가 아닙니다 감정선의 표현 후륭하고요,,,,,,,
3228,인터스텔라와 그래비티까지는,,,,,,,
3229,잼 있긴하지만  지루한감도 있습니다,,,,,,,
3230,화려한 영웅담이 아닌 한 사건과 그 속의 한 남자에게 집중한 영화,,,,,,,
3231,음악.연출.연기 나무랄때없다 단지 지루함을견딜수있다면,,,,,,,
3232,퍼스트맨 퍼스트시네마!!!,,,,,,,
3233,아폴로 13호 영화 이후로 최고의 몰입감과 긴장감을 선사해준 영화 입니다.정말 잘 봤습니다,,,,,,,
3234,모험을 떠나는 우주인의 심정을 너무나도 잘 표현한 영화. 특히 소리가 압권.,,,,,,,
3235,셔젤의 사운드 컨트롤과 카메라 활용,,,,,,,
3236,닐 암스트롱의 인간적 모습과 우주 탐사의 실상을 두루 볼 수 있는 영화. 공상영화인 인터스텔라나 그래비티랑 달리,,,,,,,
3237,38세직장인입니다. 전지적시점영화가 아니라 1인칭이고,,,,,,,
3238,초콜릿크림푸라푸치노,,,,,,,
3239,멋진 우주 비행사라는 것은 묵묵히 커다랑 철통 안에서 버텨내는 것이 어쩌면 전부아니었을까..,,,,,,,
3240,역쉬나 기자평론가 점수 높은건 보는게 아녀 아놔  OOO,,,,,,,
3241,차라리 다큐를 보는게 낫지 이도저도 아닌 흥미없는 영화..,,,,,,,
3242,이게 어떻게 재밋지? 미국 미화좀 그만시켰으면,,,,,,,
3243,달에안갔기 때문에 1점준다,,,,,,,
3244,이건 영화가 아니다..다큐다..잤다 잤어,,,,,,,
3245,라라랜드 감독이랑 진짜 안맞는다 라라랜드볼때도 자고 이거볼떄도 잤다 퍼스트맨은 거의 고문수준 .. 지루해 죽겠다...ㅠ.,,,,,,,
3246,영화를보러간건지 다큐를 보러간건지 그냥 닐암스트롱에대한 교육용 자료를 본듯했다,,,,,,,
3247,연출,,,,,,,
3248,역시 대배우 라이언 고슬립..,,,,,,,
3249,상실의아픔 그걸 치유하는 방법....개인적으로는 만족할만하게 봤습니다,,,,,,,
3250,댓글들에 빵터지네요 재치있는 분들이 많으시네요 분명 심하게 잠오고 나가고 싶지만 계속 보게 된 그무엇(?)-무엇인지 모를 그 분위기- 때문에 그리고 평점이 너무 낮아서 8점 쾅 하고 가요 ㅎㅎ,,,,,,,
3251,하나의 목표로 나아가는 한 인간의 내면을 깊이 있게 보여준다.,,,,,,,
3252,라이언 고슬링의 내면연기 좋구만!,,,,,,,
3253,이거 보면서 잔다고하는사람들  싸구려감성팔이 영화나 좋아할상 ㅋㅋ,,,,,,,
3254,영화보다는 다큐로..극적인 요소가 부족하여 다소 지루할수도.. 근데 주인공은 왜? 달에 가고싶었던 걸까?,,,,,,,
3255,긴장감과 마지막의 깊은 여운.. 너무 재밌음. 고슬링의 눈빛은 항상 아련,,,,,,,
3256,영화관을 나온뒤에야 영화속 이야기가 머릿속에서 다시 플레이돠는 영화,,,,,,,
3257,약간 지루한 감이 있기는 했으나,,,,,,,
3258,진짜 1분도 안졸고 개 흥미진진하게 봤는데 닐암스트롱이 그냥 달에 간사람으로만 알지 그 뒤에 비하인드스토리는 모르고보다보니 스포도 없었고 글고 ost가 진짜 개오짐 감동그자체 뻔한 신파극 김치영화 클리셰같은거 전혀없...,,,,,,,
3259,진짜 ㄹㅇ 이거 재미있었다 역시 IMAX로 봐야,,,,,,,
3260,영어 못하시는 분은 지루할수도있는데 엄청 웰메이드에요,,,,,,,
3261,9점줄려했는데 평점이 낮은거같아서 10점줌. 초반부의 루즈함 빼고는 너무나 훌륭한 영화임,,,,,,,
3262,우주라는 소재를 좋아하고 관심있는 분께 추천. 그렇지 않다면 글쎄...인 영화.개인적으로 긴장감 최고였음.우주선 출발전 대기상황,,,,,,,
3263,2시간동안 닐이 된 기분이었다. 중간중간 지루하다고 하는 사람이 많을 수 있겠지만,,,,,,,
3264,나만죽을수없다 자가즈아,,,,,,,
3265,달에 착륙하기 직전에 달의 표면만 잡아주는 장면에서 bgm 크게 해주면서 전율을 느끼게 해주고싶었던거같은데 약간 인위적이고 인터스텔라에 비하면 그렇게 큰 대작의 영화는 아닌거같다 절정의 장면을 그리 좋게 표현하지 못...,,,,,,,
3266,위대한 일에는 사람이 있고,,,,,,,
3267,위플래쉬,,,,,,,
3268,최고의 영화~! 인생작.,,,,,,,
3269,호불호가 갈리지만,,,,,,,
3270,역사물을 감성있게 만든. 조금은 무거운 분위기이지만,,,,,,,
3271,우주 탐사의 역사를 볼 수 있는영화 우주덕이라면 추천!,,,,,,,
3272,사람없는 시간에 조용히 봐야함,,,,,,,
3273,넓고 웅장한 우주의 모습을 기대하고 봤지만 그런 장면은 없었다 아쉽긴 하지만 달로 가기전 가족들과 나눈 이야기. 달에서 반지 남기는 장면 등등 마지막 인상 깊어서 6점,,,,,,,
3274,불확실한 미래에 대한 두려움과 그걸 지켜보는 가족의  불안함 우리가 목표로 하는 일에 목숨까지 걸 수 있을까?,,,,,,,
3275,인터스텔라와 같은 영화를 기대하고 가면 큰코다침. 다큐를 보러 간다고 생각하면 맘편함,,,,,,,
3276,잠 아주잘옵니다 굿굿굿,,,,,,,
3277,노잼.... 별 0개 주고싶은데 없어서 못 줌... 진짜 보지마세요,,,,,,,
3278,병원에서 좋아할 만한 영화 수면제가 필요가 없네,,,,,,,
3279,20대 남자입니다. 잘 봤습니다. 닐 암스트롱과 아폴로 계획 관련 상식에 대해 미리 알고 있는 사람이면 더 재미있을 것 같습니다.,,,,,,,
3280,떠나기 전날 닐이 겪었을 고뇌를 고스란히 느꼈습니다. 특히 아들에게 다가서기 어려움은 아빠들의 공통된 심정일 것입니다,,,,,,,
3281,사실적인 묘사와 시점을 위주로한 현장감이 무시무시함,,,,,,,
3282,천천히 고요하고 생각하게,,,,,,,
3283,나오자마자 달부터 찾게되는영화,,,,,,,
3284,아메리카식 조크가 조금 더 있었더라면,,,,,,,
3285,그의 입장에서 바라본 달 탐사 계획,,,,,,,
3286,우주에 일어나는 일을 생각하고 본다면 지루하고,,,,,,,
3287,배우들간의 심리적 대립이 눈에 들어오기전에 자고 있었어요,,,,,,,
3288,인류역사상 최고가 된 그의또다른 슬픈 가족사..사랑하는 가족을 잃은 슬픔과 희생..그리고 사명감... 인류애. 모든걸 생각하게 되는 영화..우주영화보단 암스트롱내면에 포커스가 맞춰진 영화..,,,,,,,
3289,영화보면서 지루해 죽을 뻔한 최초의 영화,,,,,,,
3290,ㅇ ㅔ 바 쌈치 ㅇ ㅔ 바 쌈치ㅍ,,,,,,,
3291,다소 어둡고 잔잔한 영화 분위기에 지루함을 느낄 수도 있지만 오히려 더 몰입되고 집중되는 부분이 있다 개인적으로 셔젤... 천재 감독 맞다고 본다,,,,,,,
3292,18일에 용아맥에서 봤습니다. 닐이 달로 향하는 마지막 순간,,,,,,,
3293,우주인으로서가 아니라 우주인이 직업인 인간 닐암스트롱의 이야기. 과학자로서의 열정,,,,,,,
3294,달의 노래,,,,,,,
3295,배우들의 연기는 좋았으나 많이 졸렸습니다 ㅠㅠ,,,,,,,
3296,매우 감명깊게 봤습니다. 달로가는 여러가지 일들을 자세하게 그려낸게 좋았어요. 그래도 지루하다고 하시는 분들이 이해안 가는건 아니지만,,,,,,,
3297,달착륙을 보기 위해  졸아야만 했다,,,,,,,
3298,진짜 최근 6개월중 제일 꿈잠 잠. 불면증 있으시면 꼭 보러 가세요.,,,,,,,
3299,미쓰백두번 볼 걸 그랬다....하아...,,,,,,,
3300,지루했어요~! 그래도 달착륙하는 건 실감나고 좋네요,,,,,,,
3301,닐의 심리에 기대서 같이 달을 갔다온 느낌,,,,,,,
3302,암스트롱의 휴먼끝판왕 드라마,,,,,,,
3303,"슬픔에 관한 영화로 보았습니다. 우린 서로 각자의 슬픔을 알지만 감히 말할 수 없고 그래서 더욱 어렵지만 그럼에도 불구하고 함께 앞으로 나아갈 미래가 있다고. 라이언 고슬링의 ""그 눈eyes""이 반드시...",,,,,,,
3304,가대만큼은 아니지만 높은 밀도 영화!,,,,,,,
3305,화려하고 긴박감넘치는 장면은 없으나 감독의 연출과 배우의 연기가 돋보이는 영화였어요. 무엇보다 라이언고슬링이 참 매력적인 배우구나라는걸 새삼 깨닫게됐네요.,,,,,,,
3306,하이라이트 장면을 아이맥스로 보니 좋았어요.,,,,,,,
3307,국민학교 때 흑백 티비 앞에서 동네 사람 모두 모여 보던 아폴로11호의 달 착륙 장면을 다시 보다니. 닐 암스트롱은 하나의 대명사처럼 불렸는데 인간으로서의 그를 볼 수 있었다. 미국민을 자부심으로 뭉치게 할 것 같은...,,,,,,,
3308,성취의 환호의 이면에 그렇게 큰 희생과 고뇌가 있었음을 알게 되었고 닐암스트롱의 인생을 들여다본 느낌이다.,,,,,,,
3309,달에 올라가고픈 욕망 vs 뒤로하고 온 존재들에 대한 그리움.,,,,,,,
3310,닐 암스트롱의 마음속은...,,,,,,,
3311,닐 암스트롱이 달에 갈 수 있었던 것은 여러 명의 노력의 결과다,,,,,,,
3312,짱이다 ㅋㅋㅋ 최공 ㅋㅋ,,,,,,,
3313,마치 내가 달에 다다른것 같았다.음악은 돌아오는 차 안에서도 먹먹하게 소리냈다.,,,,,,,
3314,그 기술로 달에 어떻게 갔을까? 음모론을 확신하게 하는 영화,,,,,,,
3315,감명깊은 달착륙 이야기엿음 다들 꼭보길,,,,,,,
3316,사건보다는 개인의 심리를 조명한 영화. 취향이 맞지 않는다면 지루 할 수도,,,,,,,
3317,하나의 성공을 위해 얼마나 많은 사람의 희생이 있었는지..,,,,,,,
3318,인류의 영광보다는 고요함 속의 압박감,,,,,,,
3319,기대를 많이 했던 탓일까,,,,,,,
3320,2시간간반? 대략~ ㅎㅎㅎ굳,,,,,,,
3321,시작은 쉬우나 마무리는 어렵다,,,,,,,
3322,호불호가 갈릴 영화임이 틀림없지만 7점대의 영화는 분명 아니며 덩게르크를 재밌게 본 나로서는 영화 한장면 한장면 너무 황홀했다. 이 감독의 전작인 라라랜드를 보고 오면 더욱 그 매력에 빠져들것이라 조심스럽게 생각해본...,,,,,,,
3323,닐암스트롱과 그의 가족,,,,,,,
3324,sf영화라 홍보하던데.sf영화는 science fiction film 즉 공상과학영화란 뜻.퍼스트맨은 논픽션 전기영화.마션,,,,,,,
3325,덩케르크를 높게 평가하면 본작도 그렇게 평가하지 않을까라는 말에 보러 갔는데 역시 덩케르크가 더좋음 어쨋든 이 영화도 좋ㄷㅏ,,,,,,,
3326,그래비티,,,,,,,
3327,12세 관람가니깐 12세 이하는 보지마라 재미없다고 징징거린다,,,,,,,
3328,1시간은 잔것같지 노잼;,,,,,,,
3329,인간 닐 암스트롱을 만날수 있는 시간!그리고 우리가 알지 못했던 뒷이야기들...드라마장르라는걸 염두에 두길,,,,,,,
3330,good. 생각보다 지루하긴 했으나 약간 슬픔.,,,,,,,
3331,이건 아이맥스로 두번은 꼭 봐야하는 작품! 몰입도부터 배우들의 연기까지 최근 본 영화들 중 최고,,,,,,,
3332,달 착륙 실화 다큐 감동드라마,,,,,,,
3333,우주를 예술로 풀어낸 영화.,,,,,,,
3334,달 착륙 전 인물 안나오고 달과 우주 검은 하늘만 비출때 너무 좋았다.,,,,,,,
3335,스페이스호러물...,,,,,,,
3336,영화 끝나고나니 '내용이 뻔해서 재미없었어' 라는 여자 있더라 ㅋㅋㅋ,,,,,,,
3337,정말이건... 명작이다 !!달에 가기까지 이렇게 희생과 노력이 있었기떄문에 가능했다 라는 모든걸 담은 명작!,,,,,,,
3338,재미있게봣습니다....,,,,,,,
3339,아 내용자체는 괜찮았는데 피곤할때 숙면취하기도 좋은 영화 강추,,,,,,,
3340,다큐..;;많이 지루합니다~~,,,,,,,
3341,과묵하며 고독한 울림속,,,,,,,
3342,달에 왜 갔는지.. 좀 더 답변을..,,,,,,,
3343,숨막히는 긴장감. 영광에 가려졌던 희생과 고뇌를 비춘다. 위대한 첫걸음에 찬사를,,,,,,,
3344,4dx 관람은 재미에 재미를 더해요..,,,,,,,
3345,잔잔하게 긴장되는 그런영환거같네요. 개인적으론 시간대별로 어떤일이있었나 딱딱나눠서 상영되는데 이렇게 나눠진부분이 좀되서 맥이 좀 끊기는 느낌도들고 그에관한 많은부분을 한영화에 부분부분넣으려하니 지루해진 경향이 좀 있...,,,,,,,
3346,최고의 영화... 눈을 뗄 수 없었다..,,,,,,,
3347,달은 닐에게 캐런 그 이상이었다.. 많은 사람들의 희생과 노력 끊임없는 집념이 만늘어 낸 인류의 걸작품,,,,,,,
3348,우주탐사보다는,,,,,,,
3349,역할극에 얽매여있는 전개가 아니라 한 인간의 인생흐름에 맡겨진 영화라서 좋았습니다. 등산하다 죽은 사람들 ‘절대’ 이해 못한다고 하던데 모든 인간이 그 생각으로 살았다면 인류는 천년 이천년이 지나도 ‘절대’ 못가지 ...,,,,,,,
3350,지금 영화보고 나와서 달 보이는데이미 닐암스트롱이랑 달에 갔다온 느낌우주의 경이로움보다 인간에 경이로움 위대함이 더 크게 와닿는 영화인듯..우주에서 달의노래 ost 나오는 순간라라랜드 장면 떠올랐다 최고다 진짜ㅜㅜ,,,,,,,
3351,이거 1점 주면 그냥 액션영화나 만화 봐라 평이 갈려서 걱정하면서 봤는데 역시나 미친 영화였다,,,,,,,
3352,불면증 치료로 딱이다 보다 나가는 사람도 있더라,,,,,,,
3353,닐 암스트롱이 달 최초 착륙하기끼지의 과정을 길게 심리묘사로 끌어놓은 영화인데,,,,,,,
3354,기대 ,,,,,,,
3355,인간이_허구를_역사적사실로_믿게_만드는_방법_feat.북한주민... 은 구라고 노잼이라는 혹평이 많은데 데미언셔젤은 실패하지않았다. 단지 범상한 감독은 하지않는,,,,,,,
3356,최고의 영화 달에가는 영화를 기대했는데 시작한지 5분만에 나를 꿈에서 달나라여행보내줌,,,,,,,
3357,사실 우주영화의 특성상 잔잔한 편이라 지루한게 없진않았지만 뻔한 픽션이 아닌 닐 암스트롱을 다룬 이야기라 굉장히 볼만하고 눈이 즐거웠다. 졸릴 정도는  절대 아님..,,,,,,,
3358,아 잘잤다. 내 돈 어찌하오니오,,,,,,,
3359,덩케르크도 퍼스트맨도,,,,,,,
3360,난 왜 안봤는데 벌써 졸리냐,,,,,,,
3361,더 깊이 들여다보고 몰입하게 되는 영화!,,,,,,,
3362,인상깊게 봣지만,,,,,,,
3363,라이언 고슬링 연기 쩔었다 ㅠㅠ,,,,,,,
3364,구구슥ㆍ슥ㆍ숙굿굿굿ㄱ,,,,,,,
3365,딸있는 아빠들  눈물콧물 다 빼고올듯  하~~  인간적인 우주유영이었음  그래비티인터스텔라퍼스트맨 굿굿,,,,,,,
3366,진짜 달에 집중한 영화라 좋았습니다.,,,,,,,
3367,이야기가 너무 뻔해;;;;,,,,,,,
3368,우주영화가 아니라 그냥 한사람의 이야기. 진부함,,,,,,,
3369,박평식이 7점 준거면 말다했다.,,,,,,,
3370,대사가 없어도 표정 장면으로 모든 것을 다 설명한다,,,,,,,
3371,그의 꿈은 마냥 ‘달달’하지 않았을지도,,,,,,,
3372,최고의 영화 Imax로 보기잘한듯,,,,,,,
3373,이렇게 좋은 소재거리인데 ㅋㅋ영화가 참..지루하고 허무하네요,,,,,,,
3374,영화가 넘 단조로웠어요,,,,,,,
3375,보통 타이타닉같은 세기의 띵작일 경우 네티즌과 평론가의 의견이 일치하는데 이 영화는 전적으로 평론가들 말만 들으면 된다. 치고박고 싸우고 공상과학내용만 들어가면 흥분하고 최소 5점은 주고가는 한국 네티즌의견은 안봐도...,,,,,,,
3376,심하게  졸림 미국인이 달에 갔다가 영화내용의 끝임.,,,,,,,
3377,평을 볼걸 그랬어요..,,,,,,,
3378,sf 팬으로써는 볼만했지만,,,,,,,
3379,정말 꿀잠을 자게 해줘서 고마워요~퍼스트맨~,,,,,,,
3380,러닝타임 내내 시간가는줄모르고 봤습니다 아무생각없이 보러 갔다가 인생영화됨,,,,,,,
3381,인류의 진보는 그냥 이루어지지 않는다.,,,,,,,
3382,아무리 좋아도 지루하면 끝이다.,,,,,,,
3383,죽어가는 딸에게 아무것도 해줄수 없었던 아버지 Quarantine 의 절절한 음악을 듣게되니  깊은곳 ... 저려온다 .. 달에 도착후  딸아이를 놓아줄때.. 이제껏 아픈 감정을 숨기며 살아왔을....사람으로 살아가...,,,,,,,
3384,라이언 고슬링의 연기와 아이맥스 화면에 푹 빠지는 영화,,,,,,,
3385,감동 그자체인데 재미없다고 하는사람은 뭐지ㅠ난 후기때문에 더 재밌게 봤어요 하도 기대를안해서 감사해여 ㅋㅋㅋ,,,,,,,
3386,정말 좋은 영화:) 정말 멋있다,,,,,,,
3387,제발좀 줄거리읽고 홍보영상좀 보고 예매해라,,,,,,,
3388,여운이 많이 남는 영화.,,,,,,,
3389,처음에 박진감 넘치다가 아기부분에서  지루했는데 이게 내용이 지나감에 따라 주인공이 아기를 그리워하는 그 감정이 그 장면과 같이 떠오르면서 계속 음미하게댐 또 우주비행하는데애 어려움 그걸 화면으로 현실적으로 잘 표현...,,,,,,,
3390,재미만있구만! 안봤으면 후회할뻔,,,,,,,
3391,이 영화가 지루하고 재미없다고 한 사람들을 이해하지 못할 정도로 나는 재밌게 봤다. 전혀 지루하지 않았고 개인적으로 덩케르크보다 더 재밌었다,,,,,,,
3392,간만에 영화관에서 꿀잠 잤어요! 고마워요 퍼스트맨!,,,,,,,
3393,잘 만든 영화다. 연출이 뛰어나다.,,,,,,,
3394,쌍팔년도 미국 우월주의 영화...우주에 대한 지식이나 영상은 없고 닐 암스트롱 자서전... 영화...사견으로 미국은 절대 달에간적 없다고 본다...,,,,,,,
3395,하품도 아까운 영화극장에서 본 영화중 제일 지루했다,,,,,,,
3396,이 영화를  꿈이있는 모든 남자들에게 바칩니다...,,,,,,,
3397,이런 고귀한 영화에서 재미를 찾는다니 참 알수가 없군요,,,,,,,
3398,필요이상으로 고평가 받는 영화,,,,,,,
3399,음악하고 영상 좋았어요,,,,,,,
3400,아주아주아주아주  지루합니다 영화관에서 잔건 진짜 처음인네..,,,,,,,
3401,에라이 이걸 영화라고 내가 x추로 만들어도 더 잘 만들겠다..어휴,,,,,,,
3402,딱 1995년에 나왔으면 잼나게 봤을듯,,,,,,,
3403,모두가 아는 한 인간의 이야기를 하지만.. 익숙하지 않은 시각.. 많은 생각거리를 던져주는 영화,,,,,,,
3404,개인의 고뇌와 가족들의 이야기를 담은 휴먼 다큐멘터리같은 영화 다만,,,,,,,
3405,우주 영화인줄 알고 갔는데,,,,,,,
3406,좋았던점은 너무 지루하다는 얘기가 있어 기대안하고 본 것 치곤 좋았다는 것이고,,,,,,,
3407,스타이즈본도 많이 봐주세요,,,,,,,
3408,전기영화로 참 충실했고 극사실주의 영화는 더 큰 감명을 주니 좋았다. 음악,,,,,,,
3409,재밌던데 ㅋㅋㅋ내가 다  멀미나고  기절할것같앗음ㅋㅋㅋ,,,,,,,
3410,내가 행악자의 집회를 미워하오니 악한 자와 같이 앉지 아니하리이다 (시편 26:5),,,,,,,
3411,우주선을 타고 달에 가는 체험을 경험한 영화평점 8점 정도 주고 싶었으나 네티즌 평점이 너무 낮은 듯한 느낌이 들어 10점 줍니다.,,,,,,,
3412,닐 암스트롱이 달 창륙에 성공했다는 내용.다큐보는 줄....  지루해 죽는 줄 알았다.,,,,,,,
3413,평점 왜이러지... 난 달에 첫 발 내딛는 순간이랑 딸래미 팔찌 달에 두는 장면에서 그냥 눈물나던데,,,,,,,
3414,우주영화 좋아하면 추천,,,,,,,
3415,집에 돌아오는 길에 달을 10번도 넘게 봤습니다. 그가 묻고 온 것을 생각 하며,,,,,,,
3416,평점 낮추려는 알바들이 판을 치는구만 닐 암스트롱이란 사람의 삶을 조용히 관망하는 영화,,,,,,,
3417,자다나옴 하...너무한거 아니냐,,,,,,,
3418,마지막 7분 용아맥으로 꽉찬 스크린으로 본 달 착륙의 순간은 닐 암스트롱의 지난날 삶의 환희를 보여준 최고의 여운과 감동의 순간이었다!,,,,,,,
3419,잼게봤습니다. 어지럽긴한대 ㅠ,,,,,,,
3420,삶의 아픔에서 멀어지고싶어 멀어져보니 삶의아픔이더선명해지는 영화였음,,,,,,,
3421,내면 심리가 고스란히 전해지는 먹먹한 휴먼 드라마로 요즘 영화 보면서 깜빡 깜빡 조는 일이 많은데 ㅠ 평들을 보고 걱정했더니 오히려  이 영화는 계속 몰입해서 흥미롭게 봤다.,,,,,,,
3422,영화 끝나고 달을 보니 다녀 온 느낌,,,,,,,
3423,우주선에 탑승하는 주인공의 관점에서 가족과의 갈등,,,,,,,
3424,마침내 달에 도착하는 순간,,,,,,,
3425,소련과의 경쟁이 가장 큰 동기였겠지만 아폴로11호의 여정은 감동 그자체인거 같다. 잔잔하면서도 마음이 저릿해진다.,,,,,,,
3426,이거 지루하단 애들은 그냥 달마야가자 이런거 보고 인생평점 다는 애들이네,,,,,,,
3427,라이브톡보고 용아맥 N차 갑니다~^^,,,,,,,
3428,수면제가 따로없네요..정말 졸려죽는줄...우주를 느끼기는 했지만..그걸 나타내기위해 억지로 이야기를 짜넣은 느낌..너무 어둡고 가라앉은 분위기가 마지막을 더 화려하게 보이기 위한 거란건 느끼지만..이건 숫제 다큐예요...,,,,,,,
3429,딸을 위해 아니 상실에 대한 슬픔을 이겨내기 위해 달에 첫 발을 내딛다.,,,,,,,
3430,분위기,,,,,,,
3431,로켓이 관으로 보인 우주탐사영화,,,,,,,
3432,이거는 우주나 로켓에 관심 있고 아폴로 미션에 대해 아는 사람들이 보면 엄청 재미있는 영화고 아니면 그냥 엄청 지루한 영화나는 우주나 로켓에 미쳐있던 인간이라 10점,,,,,,,
3433,조용하고 과묵한 연출이 좋네요.오랜만에 좋은 영화가 나온거 같습니다.,,,,,,,
3434,아이맥스 영화아님...좀 시끄럽고 그냥저냥봄,,,,,,,
3435,기대했던 영환데 역시나ㅋㅋ 라이언 고슬링 더 좋아짐ㅋㅋ,,,,,,,
3436,다큐애 가까워요. 미국인들은 매우 흥미롭게 볼 수 있겠네요.,,,,,,,
3437,명작입니다 꼭보세요. 말로표현 할 수가 없네요. 영화에 빠져들어 감상하시길 바랍니다.,,,,,,,
3438,마스터피스. 너무나도 잘 만든 영화.,,,,,,,
3439,좋아...음...ㅎㅎㅎ,,,,,,,
3440,억지로 감동을 짜내려고 했는데 너무 어슬프다. 정말 돈 아까움. 중간에 나오고싶은 맘 굴뚝같았는데 좌석이 가운데라 꾹 참았다...,,,,,,,
3441,너무 기대를한탓인가 실망스러웠다.,,,,,,,
3442,4D로 보다가 속이 안 좋아졌다....,,,,,,,
3443,제기됐던 음모론에 엿을 알리기,,,,,,,
3444,닐암스트롱 개인의 감정선 뿐 아니라,,,,,,,
3445,마션 그래비티 인터스텔라 생각하고 박진감 넘치는 우주영화 기대한다면 별로일거예요. 닐 암스트롱의 일대기를 그린 다큐멘터리 같은 영화입니다. 늘어지는 장면이 많지만 볼만한 가치는 분명 있습니다.,,,,,,,
3446,우주영화중에는 최하,,,,,,,
3447,삶을돌아보게 해주는 영화,,,,,,,
